ticker,date,headline,sentiment_score
ADANIGREEN,2026-04-03,"adani power capacity 18 15 gw india: Latest News & Videos, Photos about adani power capacity 18 15 gw india - The Economic Times",-0.9400926828384399
ADANIGREEN,2026-04-02,"Adani Green adds over 5 GW renewable capacity in FY26, operational portfolio rises to 19.3 GW - ET EnergyWorld",0.9472629427909851
ADANIGREEN,2026-04-02,"New challengers emerge in solar market, but established players hold their ground: Mercom India report - ET EnergyWorld",0.5285824537277222
ADANIGREEN,2026-04-02,India to increase penalties on wind and solar generators for deviating from supply pledges - Reuters,-0.7030861377716064
ADANIGREEN,2026-04-03,Informal sector steps up coal stocking over price concerns - The Economic Times,-0.4943094849586487
ADANIGREEN,2026-04-03,Bank CASA ratio falls to two-year low of 37.9% in December quarter: RBI Data - The Economic Times,-0.9520525336265564
ADANIGREEN,2026-04-04,"Plastic, glass crunch from West Asia conflict pricks packaged goods companies - The Economic Times",-0.849394679069519
ADANIGREEN,2026-04-04,"ETtech Deals Digest: Startups raise $187 million this week, down 28% on-year - The Economic Times",-0.9733304977416992
ADANIGREEN,2026-04-04,"itc hotels ltd q2 results: Latest News & Videos, Photos about itc hotels ltd q2 results - The Economic Times",-0.9364808797836304
ADANIGREEN,2026-04-04,ITR changes from April 2026: 5 key updates for Tax Year 2026–27 explained - The Economic Times,-0.9162776470184326
ADANIGREEN,2026-04-04,Who are Delve founders Karun Kaushik and Selin Kocalar? - The Economic Times,-0.9348270893096924
ADANIGREEN,2026-04-04,Artemis II mission: NASA shares first images of Earth by astronauts aboard - The Economic Times Video | ET Tv - The Economic Times,-0.910578727722168
ADANIGREEN,2026-04-04,RBI revises rules for Floating Rate Savings Bonds 2020: Key changes investors should know - The Economic Times,-0.9300522208213806
ADANIGREEN,2026-04-04,"budget 2026 middle class impact: Latest News & Videos, Photos about budget 2026 middle class impact - The Economic Times",-0.920911431312561
ADANIGREEN,2026-04-04,"24k gold prices: Latest News & Videos, Photos about 24k gold prices - The Economic Times",-0.9361081123352051
ADANIGREEN,2026-04-04,"oscars 2026 kpop demon hunters: Latest News & Videos, Photos about oscars 2026 kpop demon hunters - The Economic Times",-0.9352432489395142
ADANIGREEN,2026-04-04,LIVE KERALA LOTTERY RESULT BHAGYATHARA BT 46 - The Economic Times,-0.9168386459350586
ADANIGREEN,2026-04-04,"aquarius love horoscope april 2026: Latest News & Videos, Photos about aquarius love horoscope april 2026 - The Economic Times",-0.9349830150604248
ADANIGREEN,2026-04-04,Kotak Multi Asset Active FoF Regular-IDCW - The Economic Times,-0.9110361933708191
ADANIGREEN,2026-04-04,"oil price march 24: Latest News & Videos, Photos about oil price march 24 - The Economic Times",-0.9361136555671692
ADANIGREEN,2026-04-04,'LDF will be out of power': PM Modi says corruption is a key obstacle to Kerala's growth - The Economic Times,-0.6702951192855835
ADANIGREEN,2026-04-04,EASY HOMEMADE CHOCOLATES FOR CHOCOLATE DAY 2026 - The Economic Times,-0.9211908578872681
ADANIGREEN,2026-04-04,"operation cyber hawk 3 0: Latest News & Videos, Photos about operation cyber hawk 3 0 - The Economic Times",-0.9341831803321838
ADANIGREEN,2026-04-04,"rcb tickets 2026: Latest News & Videos, Photos about rcb tickets 2026 - The Economic Times",-0.9385147094726562
ADANIGREEN,2026-04-04,"astrology february 2026: Latest News & Videos, Photos about astrology february 2026 - The Economic Times",-0.937063992023468
ADANIGREEN,2026-04-04,"India’s crude oil supply fully secured, no payment hurdle for Iranian imports: Petroleum Ministry - The Economic Times",-0.900404155254364
ADANIGREEN,2026-04-04,'Iran’s nuke threat imminent?’: Democrats GRILL Tulsi Gabbard over Trump’s war - The Economic Times,-0.7101824879646301
ADANIGREEN,2017-03-24,"Adani Power Share Price Today, Adani Power Stock Price Live NSE/BSE Updates - The Economic Times",-0.9416555166244507
ADANIGREEN,2023-02-07,India's Adani Green posts surge in quarterly profit on higher power supply - Reuters,0.9341625571250916
ADANIGREEN,2018-06-19,ADANIGR: Adani Green Energy Ltd Stock Price Quote - Natl India - Bloomberg - Bloomberg.com,-0.9489078521728516
ADANIGREEN,2023-08-07,QIA likely picks up shares worth $500 mln in India's Adani Green - report - Reuters,-0.8433716297149658
ADANIGREEN,2021-06-19,Adani Green Energy Ltd - Reuters,-0.9439666867256165
ADANIGREEN,2026-01-23,India's Adani Green quarterly profit slumps on higher finance costs - Reuters,-0.9669331312179565
ADANIGREEN,2025-10-28,India's Adani Green Energy posts higher quarterly profit on strong power sales - Reuters,0.9469828605651855
ADANIGREEN,2025-07-28,India's Adani Green Energy posts quarterly profit jump on strong power sales - Reuters,0.9193356037139893
ADANIGREEN,2018-06-14,"Adani Green Share Price Today, Adani Green Stock Price Live NSE/BSE Updates - The Economic Times",-0.9406358003616333
ADANIGREEN,2025-10-29,Adani Green Energy shares zoom over 11% as upbeat Q2 results lift investor sentiment - ET EnergyWorld,0.9456369280815125
ADANIGREEN,2026-01-23,Adani Green Energy net profit falls 99% to ₹5 cr in Q3 - ET EnergyWorld,-0.9736322164535522
ADANIGREEN,2024-07-25,India's Adani Green Energy Q1 profit surges on strong power sales - Reuters,0.9195438623428345
ADANIGREEN,2022-06-07,About Adani Green Energy Ltd (ADNA.NS) - Reuters,-0.9482454657554626
ADANIGREEN,2024-11-25,Adani Green plunges 11% after TotalEnergies says it will make no new financial contribution to Adani Group investments - Reuters,-0.73743736743927
ADANIGREEN,2024-11-29,Adani Green soars 19% as group stocks recover sharply amid ongoing U.S. legal challenges - CNBC,0.5282217860221863
ADANIGREEN,2024-05-30,Billionaire Adani’s Green Targets Questioned in Snowcap Analysis - Bloomberg.com,-0.9375571608543396
ADANIGREEN,2021-01-18,Check out Adani Green Energy Ltd's stock price (ADANIGREEN-IN) in real time - CNBC,-0.9484137892723083
ADANIGREEN,2025-08-01,India's Adani Power posts quarterly profit fall amid tepid power demand - Reuters,-0.9716620445251465
ADANIGREEN,2023-08-07,"adani green energy stock fall: Latest News & Videos, Photos about adani green energy stock fall - The Economic Times",-0.6418015360832214
ADANIGREEN,2023-07-26,Check out Adani Green Energy Ltd's stock price (ADANIGREEN-IN&__SOURCE=OTS) in real time - CNBC,-0.9462799429893494
ADANIGREEN,2021-01-11,"Stocks in news: Tata Power, IndiGo, Maruti Suzuki, Indian Oil, Adani Green - The Economic Times",-0.9259483814239502
ADANIGREEN,2020-01-04,"khavda: Latest News & Videos, Photos about khavda - The Economic Times",-0.9365033507347107
ADANIGREEN,2023-02-22,Sri Lanka investment board approves $442 mln Adani Green wind power plants - Reuters,-0.5231411457061768
ADANIGREEN,2022-11-10,Adani Green Profit Jumps as Power Demand Boosts Solar Generation - Bloomberg.com,0.6265367865562439
ADANIGREEN,2025-10-06,Adani Green Gets $250 Million in First Offshore Loan Since Probe - Bloomberg.com,-0.8275979161262512
ADANIGREEN,2025-02-12,"MSCI adds Hyundai Motor India to key global index, removes Adani Green Energy - Reuters",-0.8019522428512573
ADANIGREEN,2021-10-29,"Adani Green's operational capacity increased by 93% to 5,410 MW - ET EnergyWorld",0.9545725584030151
ADANIGREEN,2024-11-14,"NTPC Green Energy Share Price Today, NTPC Green Energy Stock Price Live NSE/BSE Updates - The Economic Times",-0.9423392415046692
ADANIGREEN,2021-09-20,"adani solar: Latest News & Videos, Photos about adani solar - The Economic Times",-0.9370227456092834
ADANIGREEN,2024-10-08,"India's Adani Green units plan to raise up to $1 billion in dollar bonds, bankers say - Reuters",0.5473213195800781
ADANIGREEN,2017-10-16,"Adani green energy ltd - Latest adani green energy ltd , Information & Updates - Energy - ET EnergyWorld",-0.9483484625816345
ADANIGREEN,2024-09-03,TotalEnergies deepens ties with India's Adani Green with $444 mln JV - Reuters,0.9257925152778625
ADANIGREEN,2025-03-02,India's Adani Green raises $1.06 billion for debt refinance - Reuters,-0.7509959936141968
ADANIGREEN,2023-08-07,"QIA Said to Invest $500 Million in Adani Green, ET Reports - Bloomberg.com",-0.9352841973304749
ADANIGREEN,2023-09-20,TotalEnergies to invest $300 million in joint venture with Adani Green Energy - Reuters,-0.8229653835296631
ADANIGREEN,2023-12-04,India's Adani Green secures additional $1.36 bln loan - Reuters,0.6909578442573547
ADANIGREEN,2024-10-15,"India's Adani Green calls off planned dollar bond sale, sources say - Reuters",-0.7232824563980103
ADANIGREEN,2023-12-26,Adani Green Founders to Invest $1.12 Billion Via Share Warrants - Bloomberg.com,-0.927370548248291
ADANIGREEN,2026-01-27,"Adani Green plans over 7 GWh battery storage at Khavda; lines up ₹40,000 crore capex - ET EnergyWorld",0.8695201873779297
ADANIGREEN,2025-09-29,"TotalEnergies May Sell Part of Adani Green Stake, CEO Says - Bloomberg.com",-0.9524637460708618
ADANIGREEN,2025-10-07,Adani Green gets $250 million in first offshore loan since probe - ET EnergyWorld,0.5558531880378723
ADANIGREEN,2023-07-06,Adani Green Plans to Raise $1.5 Billion to Fund Expansion - Bloomberg.com,-0.8545694947242737
ADANIGREEN,2023-03-08,"More Stock in Adani Group Firms Pledged to Lenders, Trustee Says - Bloomberg.com",-0.8788133859634399
ADANIGREEN,2024-02-27,India's Adani Green Energy to raise $409 mln via dollar bonds - Reuters,0.534353494644165
ADANIGREEN,2025-04-28,Adani Green Profit Jumps 53% Aided By Record Capacity Addition - Bloomberg.com,0.9291371703147888
ADANIGREEN,2024-11-25,Adani Green Slumps as Total Halts Investment Amid US Probe - Bloomberg.com,-0.8982003331184387
ADANIGREEN,2024-11-25,Adani Green Energy says no talks on new financial commitment with TotalEnergies - Reuters,-0.9282774925231934
ADANIGREEN,2022-08-24,"Adani Green’s 2,021% Debt-Equity Ratio Is Second-Worst in Asia - Bloomberg.com",-0.9675906896591187
ADANIGREEN,2023-12-05,Adani Green Raises $1.4 Billion Loan for Largest Renewables Park - Bloomberg.com,-0.5521383881568909
ADANIGREEN,2025-12-01,"Sterling and Wilson Renewable Energy wins ₹1,381 cr orders from Adani Green Energy - ET EnergyWorld",0.9317711591720581
ADANIGREEN,2021-03-08,Adani Green commissions 100-MW wind power project in Gujarat - ET EnergyWorld,-0.8438877463340759
ADANIGREEN,2024-05-06,Sri Lanka inks 20-year power purchase deal with India's Adani Green - Reuters,0.7372391819953918
ADANIGREEN,2025-04-28,India's Adani Green says independent review on US indictment found no irregularities - Reuters,-0.8341696262359619
ADANIGREEN,2024-11-27,Explainer: 'The Corrupt Solar Project': Adani embroiled in US findings of bribery scheme - Reuters,-0.5260403752326965
ADANIGREEN,2021-08-04,Adani Green Energy net zooms 10-fold to Rs 219 cr in June quarter - ET EnergyWorld,0.9199003577232361
ADANIGREEN,2024-10-22,Adani Green Profit Jumps 38% Amid Growing Clean Energy Demand - Bloomberg.com,0.9145551323890686
ADANIGREEN,2024-12-01,India's Adani Green Energy recoups losses related to US indictment - Reuters,-0.5576039552688599
ADANIGREEN,2026-01-23,Adani group stocks plunge as U.S. SEC looks to question founder over fraud charges - CNBC,-0.8197080492973328
ADANIGREEN,2025-12-31,Adani Green Energy operationalises 307.4 MW renewable energy projects - ET EnergyWorld,-0.8813198804855347
ADANIGREEN,2025-07-28,Adani Green’s Profit Jumps as Plant Installations Accelerate - Bloomberg.com,-0.5840678811073303
ADANIGREEN,2025-03-03,India’s Power Finance Shoulders $1 Billion Adani Green Refi - Bloomberg.com,-0.9363957047462463
ADANIGREEN,2025-04-29,"US Indictment: Independent review found no irregularities, says Adani Green - ETLegalWorld.com",-0.8942751884460449
ADANIGREEN,2025-10-28,Adani Green Profit Doubles as Clean Power Sales Gather Momentum - Bloomberg.com,-0.613088846206665
ADANIGREEN,2022-04-21,"KPI Global Infra Share Price Today, KPI Global Infra Stock Price Live NSE/BSE Updates - The Economic Times",-0.9388945698738098
ADANIGREEN,2023-02-11,Adani group firms pledge additional shares for key lender - Reuters,-0.6185675859451294
ADANIGREEN,2024-09-14,Adani Green Energy names Saurabh Shah as new CFO - Reuters,-0.9383705854415894
ADANIGREEN,2025-03-03,Adani Green Energy refinances $1.06 bn maiden construction facility with long-term financing - ET EnergyWorld,-0.5121895670890808
ADANIGREEN,2017-04-10,"Ravindra Energy Share Price Today, Ravindra Energy Stock Price Live NSE/BSE Updates - The Economic Times",-0.9409723877906799
ADANIGREEN,2025-01-23,India's Adani Green appoints independent law firms to review US indictment - Reuters,-0.9202789068222046
ADANIGREEN,2021-10-04,Adani Green acquires SB Energy India for $3.5 billion - ET EnergyWorld,-0.9027308821678162
ADANIGREEN,2025-11-14,Adani Group to invest $7.17 bln in power projects in India's Assam state - Reuters,-0.8999814391136169
ADANIGREEN,2025-10-01,"Adani Green Energy operational capacity reaches 16,598.6 MW - ET EnergyWorld",0.5333216190338135
ADANIGREEN,2021-01-20,Adani Green’s subsidiary commissions 150-MW solar plant in Gujarat - ET EnergyWorld,-0.8643584847450256
