ticker,date,headline,sentiment_score
ADANIENSOL,2023-08-25,Check out Adani Energy Solutions Ltd's stock price (ADANIENSOL-IN) in real time - CNBC,-0.9487349390983582
ADANIENSOL,2023-07-28,"Adani Transmission Share Price Today, Adani Transmission Stock Price Live NSE/BSE Updates - The Economic Times",-0.9422188401222229
ADANIENSOL,2026-03-18,Adani Energy Solutions Ltd. - The Economic Times,-0.926325261592865
ADANIENSOL,2023-07-27,"adani energy solutions: Latest News & Videos, Photos about adani energy solutions - The Economic Times",-0.937673807144165
ADANIENSOL,2023-08-24,ADANIENS: Adani Energy Solutions Ltd Stock Price Quote - Natl India - Bloomberg.com,-0.9484665393829346
ADANIENSOL,2016-10-31,ADANIT: Adani Energy Solutions Ltd Stock Price Quote - - Bloomberg - Bloomberg.com,-0.9480035901069641
ADANIENSOL,2017-03-27,The Economic Times - The Economic Times,-0.9159992933273315
