ticker,date,headline,sentiment_score
AMBUJACEM,2026-03-20,"Half Yearly Results, Half yearly Earnings for Dar Credit & Capital - The Economic Times",-0.918088436126709
AMBUJACEM,2026-03-19,"Titagarh Rail Systems, BHEL form JV to maintain Vande Bharat trains - ET Infra",-0.9134194850921631
AMBUJACEM,2026-03-20,India 10-year yield posts biggest weekly jump in 15 weeks on oil shock - The Economic Times,0.5372693538665771
AMBUJACEM,2026-03-19,"Maxvolt Energy Indus Cash Flow, Financial Statements - The Economic Times",-0.9269565343856812
AMBUJACEM,2026-03-22,Wealth whisperings: Quiet luxury finds voice among India’s new elite - The Economic Times,-0.8154088258743286
AMBUJACEM,2017-03-24,"Tata Power Share Price Today, Tata Power Stock Price Live NSE/BSE Updates - The Economic Times",-0.9378738403320312
AMBUJACEM,2017-04-10,"M&M Share Price Today, M&M Stock Price Live NSE/BSE Updates - The Economic Times",-0.9348949790000916
AMBUJACEM,2017-03-24,"NTPC Share Price Today, NTPC Stock Price Live NSE/BSE Updates - The Economic Times",-0.9381704330444336
AMBUJACEM,2018-03-09,"HAL Share Price Today, HAL Stock Price Live NSE/BSE Updates - The Economic Times",-0.9387754201889038
AMBUJACEM,2017-03-25,"Ambuja Cements Share Price Today, Ambuja Cements Stock Price Live NSE/BSE Updates - The Economic Times",-0.93860924243927
AMBUJACEM,2026-03-20,Ambuja Cements Ltd. - The Economic Times,-0.9170867204666138
AMBUJACEM,2017-08-06,Check out Ambuja Cements Ltd's stock price (AMBUJACEM-IN) in real time - CNBC,-0.9465849995613098
AMBUJACEM,2021-12-20,BHEL Q3 Results: Profit more than triples to Rs 382 crore; revenue jumps 16% YoY - The Economic Times,0.9454144835472107
AMBUJACEM,2017-03-23,"BHEL Share Price Today, BHEL Stock Price Live NSE/BSE Updates - The Economic Times",-0.9364915490150452
AMBUJACEM,2017-03-23,"Coal India Ltd Share Price Today, Coal India Ltd Stock Price Live NSE/BSE Updates - The Economic Times",-0.9378774762153625
AMBUJACEM,2020-10-05,BHEL Q1 Results: Consolidated net loss widens to Rs 455 crore - The Economic Times,-0.5500402450561523
AMBUJACEM,2017-04-13,Cotton - The Economic Times,-0.9135113954544067
AMBUJACEM,2017-03-23,"UltraTech Cem. Share Price Today, UltraTech Cem. Stock Price Live NSE/BSE Updates - The Economic Times",-0.9403532147407532
AMBUJACEM,2026-03-20,Bharat Heavy Electricals Ltd. - The Economic Times,-0.9180510640144348
AMBUJACEM,2026-01-21,BHEL shares tumble over 4% as margin concerns weigh on sentiment - ET Infra,-0.9670094847679138
AMBUJACEM,2025-08-06,"India's BHEL posts wider quarterly loss on weak power demand, higher expenses - Reuters",-0.9706668853759766
AMBUJACEM,2024-07-31,India's BHEL posts slightly bigger quarterly loss as expenses spike - Reuters,-0.9634005427360535
AMBUJACEM,2017-07-22,"Trans & Rectif Share Price Today, Trans & Rectif Stock Price Live NSE/BSE Updates - The Economic Times",-0.9396512508392334
AMBUJACEM,2017-03-24,"Varun Beverages Share Price Today, Varun Beverages Stock Price Live NSE/BSE Updates - The Economic Times",-0.9400414824485779
AMBUJACEM,2024-02-13,BHEL Q3 Results: Loss rises to Rs 163 crore on soaring costs - ET EnergyWorld,-0.8058348894119263
AMBUJACEM,2020-09-12,BHEL Q1 results: Loss widens to Rs 893.14 crore as lockdown adversely impacts operations - ET EnergyWorld,-0.9609469175338745
AMBUJACEM,2025-08-03,"JSW Cement Share Price Today, JSW Cement Stock Price Live NSE/BSE Updates - The Economic Times",-0.937767744064331
AMBUJACEM,2025-10-29,BHEL's Q2 FY26 net profit more than triples to ₹375 crore - ET EnergyWorld,0.9374332427978516
AMBUJACEM,2017-03-24,"Orient Cement Share Price Today, Orient Cement Stock Price Live NSE/BSE Updates - The Economic Times",-0.9396398067474365
AMBUJACEM,2017-04-10,"Shree Cements Share Price Today, Shree Cements Stock Price Live NSE/BSE Updates - The Economic Times",-0.9368888139724731
AMBUJACEM,2024-10-28,India's BHEL posts Q2 profit on higher power equipment sales - Reuters,0.8336703777313232
AMBUJACEM,2019-09-20,"bhel order: Latest News & Videos, Photos about bhel order - The Economic Times",-0.9316446185112
AMBUJACEM,2022-06-06,ABUJ.NS - Reuters,-0.9304355978965759
AMBUJACEM,2024-05-28,Autopsy report says BHEL HR executive died due to hanging - ETHRWorld.com,-0.49311280250549316
AMBUJACEM,2020-07-09,BHEL commissions world’s first solar PV plant for rail traction system - ET EnergyWorld,0.497263640165329
AMBUJACEM,2017-03-27,India Cements Ltd. - The Economic Times,-0.9154254198074341
AMBUJACEM,2026-01-19,BHEL profit nearly triples to ₹390 crore in Q3 FY26 - ET EnergyWorld,0.9253141283988953
AMBUJACEM,2009-03-31,KAMLA BHEL AND CO PVT LTD - The Economic Times,-0.9138927459716797
AMBUJACEM,2017-03-24,"BEL Share Price Today, BEL Stock Price Live NSE/BSE Updates - The Economic Times",-0.9399408102035522
AMBUJACEM,2019-12-27,BHEL commissions first renovated unit of 180 MW Baira Siul Hydro Project - ET EnergyWorld,-0.7226690053939819
AMBUJACEM,2017-03-31,"BHEL Target Share Price, BHEL Share Price Forecast - The Economic Times",-0.9348328709602356
AMBUJACEM,2017-08-05,Check out Bharat Heavy Electricals Ltd's stock price (BHEL-IN) in real time - CNBC,-0.9430366158485413
AMBUJACEM,2026-03-15,BHEL.NS - | Stock Price & Latest News - Reuters,-0.9255772233009338
AMBUJACEM,2017-11-07,BHEL second quarter profit rises 5.9 per cent at Rs 115.42 crore - ET EnergyWorld,0.9132466316223145
AMBUJACEM,2026-03-20,"Motilal Oswal Share Price Today, Motilal Oswal Stock Price Live NSE/BSE Updates - The Economic Times",-0.9346283078193665
AMBUJACEM,2017-04-20,"Steel Strips Share Price Today, Steel Strips Stock Price Live NSE/BSE Updates - The Economic Times",-0.9348920583724976
AMBUJACEM,2026-03-20,"ACC Share Price Today, ACC Stock Price Live NSE/BSE Updates - The Economic Times",-0.9396827220916748
AMBUJACEM,2019-05-27,BHEL records 50 per cent jump in net profit for 2018-19 - ET EnergyWorld,0.9472314715385437
AMBUJACEM,2024-02-29,CIL and BHEL sign joint venture for ammonium nitrate plant using coal gasification - ET EnergyWorld,0.5884885191917419
AMBUJACEM,2026-01-19,India's BHEL third-quarter revenue rises 16% on sustained power products demand - Reuters,0.9462424516677856
AMBUJACEM,2023-08-21,"Jio Financial Services Share Price Today, Jio Financial Services Stock Price Live NSE/BSE Updates - The Economic Times",-0.93930983543396
AMBUJACEM,2019-03-27,"RVNL Share Price Today, RVNL Stock Price Live NSE/BSE Updates - The Economic Times",-0.9382209181785583
AMBUJACEM,2022-09-19,"Canara Bank Hyderabad Bhel Branch IFSC Code, MICR Code, Address & Phone Number - The Economic Times",-0.9408889412879944
AMBUJACEM,2017-05-08,"Tilaknagar Ind Share Price Today, Tilaknagar Ind Stock Price Live NSE/BSE Updates - The Economic Times",-0.9396061301231384
AMBUJACEM,2026-03-20,"Jyoti Ltd Share Price Today, Jyoti Ltd Stock Price Live NSE/BSE Updates - The Economic Times",-0.9352490901947021
AMBUJACEM,2017-10-14,"Aditya Birla Cap. Share Price Today, Aditya Birla Cap. Stock Price Live NSE/BSE Updates - The Economic Times",-0.9301982522010803
AMBUJACEM,2017-11-06,"HUDCO Share Price Today, HUDCO Stock Price Live NSE/BSE Updates - The Economic Times",-0.9376680254936218
AMBUJACEM,2023-06-15,"Titagarh Wagons Share Price Today, Titagarh Wagons Stock Price Live NSE/BSE Updates - The Economic Times",-0.9360946416854858
AMBUJACEM,2017-03-24,"Power Grid Share Price Today, Power Grid Stock Price Live NSE/BSE Updates - The Economic Times",-0.9385402798652649
AMBUJACEM,2026-03-20,"Ashok Leyland Share Price Today, Ashok Leyland Stock Price Live NSE/BSE Updates - The Economic Times",-0.9382628798484802
AMBUJACEM,2017-03-23,"LIC Housing Share Price Today, LIC Housing Stock Price Live NSE/BSE Updates - The Economic Times",-0.9372599720954895
AMBUJACEM,2025-10-03,"Hindustan Motor Share Price Today, Hindustan Motor Stock Price Live NSE/BSE Updates - The Economic Times",-0.9400960803031921
AMBUJACEM,2021-08-04,"Nuvoco Vistas Corp Cash Flow, Financial Statements - The Economic Times",-0.9255410432815552
AMBUJACEM,2017-03-24,"Vardhman Hold Share Price Today, Vardhman Hold Stock Price Live NSE/BSE Updates - The Economic Times",-0.9411536455154419
AMBUJACEM,2020-05-05,"BHEL may sell, offer manufacturing units to global players - ET EnergyWorld",-0.8688603043556213
AMBUJACEM,2026-03-20,The Economic Times - The Economic Times,-0.9159992933273315
AMBUJACEM,2017-03-24,"B L Kashyap Share Price Today, B L Kashyap Stock Price Live NSE/BSE Updates - The Economic Times",-0.9408904910087585
AMBUJACEM,2025-01-28,"ITC Hotels Share Price Today, ITC Hotels Stock Price Live NSE/BSE Updates - The Economic Times",-0.9395599961280823
AMBUJACEM,2022-09-16,"Indian Bank Bhel Branch Branch IFSC Code, MICR Code, Address & Phone Number - The Economic Times",-0.9394816160202026
AMBUJACEM,2026-03-20,"Welspun Specialty Share Price Today, Welspun Specialty Stock Price Live NSE/BSE Updates - The Economic Times",-0.940177321434021
AMBUJACEM,2017-10-18,"Allahabad Bank Bhel Branch Hardwar Branch IFSC Code, MICR Code, Address & Phone Number - The Economic Times",-0.9373918175697327
AMBUJACEM,2017-03-24,"Reliance Infra Share Price Today, Reliance Infra Stock Price Live NSE/BSE Updates - The Economic Times",-0.9378727674484253
AMBUJACEM,2017-03-24,"ITC Share Price Today, ITC Stock Price Live NSE/BSE Updates - The Economic Times",-0.9370895028114319
AMBUJACEM,2022-12-19,"Shriram Finance Share Price Today, Shriram Finance Stock Price Live NSE/BSE Updates - The Economic Times",-0.940354585647583
AMBUJACEM,2026-03-20,"NMDC Share Price Today, NMDC Stock Price Live NSE/BSE Updates - The Economic Times",-0.9366443157196045
AMBUJACEM,2019-02-08,BHEL develops regenerative system for Indian Railways indigenously - ET EnergyWorld,-0.8205171823501587
AMBUJACEM,2020-03-16,BHEL wins order for supply of electric buses to Uttar Pradesh - ET EnergyWorld,0.8977559208869934
AMBUJACEM,2019-02-12,"Birlasoft Share Price Today, Birlasoft Stock Price Live NSE/BSE Updates - The Economic Times",-0.9392262101173401
AMBUJACEM,2017-07-19,"SAIL Share Price Today, SAIL Stock Price Live NSE/BSE Updates - The Economic Times",-0.94205641746521
AMBUJACEM,2026-03-20,"BEML Land Assets Share Price Today, BEML Land Assets Stock Price Live NSE/BSE Updates - The Economic Times",-0.9411991834640503
AMBUJACEM,2017-03-24,"InterGlobe Share Price Today, InterGlobe Stock Price Live NSE/BSE Updates - The Economic Times",-0.9362064003944397
AMBUJACEM,2024-10-16,"Waaree Energies Share Price Today, Waaree Energies Stock Price Live NSE/BSE Updates - The Economic Times",-0.9393309950828552
AMBUJACEM,2023-10-24,"Cello World Share Price Today, Cello World Stock Price Live NSE/BSE Updates - The Economic Times",-0.9350137710571289
AMBUJACEM,2026-03-20,"AK Spintex Share Price Today, AK Spintex Stock Price Live NSE/BSE Updates - The Economic Times",-0.9426657557487488
AMBUJACEM,2018-04-19,"BHEL appoints Subodh Gupta as Director, Finance - ET EnergyWorld",-0.9415184259414673
AMBUJACEM,2017-03-29,"Ambuja Cements Cash Flow, Financial Statements - The Economic Times",-0.9054596424102783
AMBUJACEM,2024-10-30,"Swiggy Share Price Today, Swiggy Stock Price Live NSE/BSE Updates - The Economic Times",-0.9357741475105286
AMBUJACEM,2024-12-07,"Sai Life Science Share Price Today, Sai Life Science Stock Price Live NSE/BSE Updates - The Economic Times",-0.9413884282112122
AMBUJACEM,2021-11-29,"ABB Power Share Price Today, ABB Power Stock Price Live NSE/BSE Updates - The Economic Times",-0.9380207657814026
AMBUJACEM,2026-03-20,"NBCC Share Price Today, NBCC Stock Price Live NSE/BSE Updates - The Economic Times",-0.9386751055717468
AMBUJACEM,2017-03-24,"Adani Power Share Price Today, Adani Power Stock Price Live NSE/BSE Updates - The Economic Times",-0.9416555166244507
AMBUJACEM,2026-01-15,BHEL begins supply of traction transformers for Vande Bharat Sleeper trains - ET Infra,-0.8027844429016113
AMBUJACEM,2019-08-30,BHEL sets up 5 charging stations on Delhi-Chandigarh highway - ET Auto,-0.8178327083587646
AMBUJACEM,2017-03-24,"CESC Share Price Today, CESC Stock Price Live NSE/BSE Updates - The Economic Times",-0.9394652247428894
AMBUJACEM,2019-11-04,BHEL bags Rs 200 crore order from UJVNL - ET EnergyWorld,0.7375724911689758
AMBUJACEM,2021-05-05,"Astral Poly Tech Share Price Today, Astral Poly Tech Stock Price Live NSE/BSE Updates - The Economic Times",-0.9417389035224915
AMBUJACEM,2026-03-09,Announcement - The Economic Times,-0.9166386723518372
AMBUJACEM,2026-02-18,"BHEL bags ₹1,200–1,500 crore captive power plant order from SAIL - ET EnergyWorld",0.7142152190208435
AMBUJACEM,2026-03-20,Welspun Specialty Solutions Ltd. - The Economic Times,-0.9163690209388733
AMBUJACEM,2019-11-04,BHEL bags Rs 200 crore order to upgrade Chilla hydro project - ETGovernment.com,-0.5808616876602173
