ticker,date,headline,sentiment_score
AXISBANK,2026-04-03,"axis bank insurance stake: Latest News & Videos, Photos about axis bank insurance stake - The Economic Times",-0.938234269618988
AXISBANK,2024-04-15,Moving Averages Updates: Axis Bank Stock Slips Below 20-Day EMA at Rs 1063.1 with -0.96% Daily Change - The Economic Times,-0.9705819487571716
AXISBANK,2026-04-03,Axis Bank to deepen insurance bet with Rs 389 crore infusion in Axis Max Life; stake seen at 19.99% - BFSI News,0.8563381433486938
AXISBANK,2026-04-03,Axis Bank to deepen insurance bet with Rs 389 crore infusion in Axis Max Life; stake seen at 19.99% - The Economic Times,0.8130292296409607
AXISBANK,2026-04-03,"Q4 impact: Bank stocks slump up to 32% in 3 months, but brokerages bet on SBI, HDFC Bank, 6 more stocks. Che.. - BFSI News",-0.9593794941902161
AXISBANK,2026-03-30,"RBI caps net open positions: ICICI Bank Rs 57K cr, StanChart Rs 45K cr, Axis Rs 26K cr lead forex exposures - BFSI News",-0.8522277474403381
AXISBANK,2026-04-03,Bank CASA ratio falls to two-year low of 37.9% in December quarter: RBI Data - The Economic Times,-0.9520525336265564
AXISBANK,2026-04-03,Informal sector steps up coal stocking over price concerns - The Economic Times,-0.4943094849586487
AXISBANK,2026-04-04,"Plastic, glass crunch from West Asia conflict pricks packaged goods companies - The Economic Times",-0.849394679069519
AXISBANK,2026-04-04,RBI revises rules for Floating Rate Savings Bonds 2020: Key changes investors should know - The Economic Times,-0.9300522208213806
AXISBANK,2026-04-04,Who are Delve founders Karun Kaushik and Selin Kocalar? - The Economic Times,-0.9348270893096924
AXISBANK,2026-04-04,ITR changes from April 2026: 5 key updates for Tax Year 2026–27 explained - The Economic Times,-0.9162776470184326
AXISBANK,2026-04-04,"ETtech Deals Digest: Startups raise $187 million this week, down 28% on-year - The Economic Times",-0.9733304977416992
AXISBANK,2026-04-04,"India’s crude oil supply fully secured, no payment hurdle for Iranian imports: Petroleum Ministry - The Economic Times",-0.900404155254364
AXISBANK,2026-04-01,Axis Bank rolls out Aadhaar Face Authentication for mobile number updates - BFSI News,-0.9399059414863586
AXISBANK,2026-03-18,"Axis Bank shares rise 2% as lender set to invest Rs 1,500 crore into NBFC arm Axis Finance - BFSI News",0.632236897945404
AXISBANK,2026-01-26,India's Axis Bank posts surprise rise in quarterly profit on healthy loan growth - Reuters,0.9387066960334778
AXISBANK,2025-10-15,India's Axis Bank profit drops more than expected on trading income hit - Reuters,-0.968606173992157
AXISBANK,2021-06-25,Axis Bank Ltd - Reuters,-0.9416042566299438
AXISBANK,2024-01-23,Axis Bank reports 3.7% rise in Q3 profit - BFSI News,0.9060767292976379
AXISBANK,2024-07-25,"Indian shares end flat as L&T counters Axis Bank, Nestle results - Reuters",-0.8953437209129333
AXISBANK,2022-01-28,"Q3 Results: Brokerages positive on Axis Bank, lender to continue focus on retail segment - BFSI News",0.8314086198806763
AXISBANK,2025-07-17,"Axis Bank Shares Tumble as Provisions Climb, Profit Disappoints - Bloomberg.com",-0.926979660987854
AXISBANK,2025-01-17,"India's Axis Bank tumbles on profit miss, asset quality woes - Reuters",-0.9625676870346069
AXISBANK,2026-01-26,India's Axis Bank hits 18-month high on surprise profit rise from strong loan growth - Reuters,0.9287556409835815
AXISBANK,2025-07-17,"India's Axis Bank tumbles on disappointing June quarter, asset quality woes - Reuters",-0.9622359871864319
AXISBANK,2025-04-24,"India's Axis Bank beats quarterly profit view, sees improved retail loan growth in FY26 - Reuters",0.9481524229049683
AXISBANK,2025-10-15,"India's Axis Bank climbs on improved asset quality, lower credit costs in second quarter - Reuters",0.9495276808738708
AXISBANK,2023-12-30,"Page 2 - Axis bank - Latest axis bank , Information & Updates - BFSI -ET BFSI - BFSI News",-0.9504163861274719
AXISBANK,2021-12-25,"Axis Bank Q3 results: Net profit rises 3% YoY to Rs 6,490 crore, NII grows 5% - The Economic Times",0.9468939304351807
AXISBANK,2024-07-25,India's Axis Bank falls 5% after Q1 profit miss - Reuters,-0.9570654630661011
AXISBANK,2017-03-23,"Axis Bank Share Price Today, Axis Bank Stock Price Live NSE/BSE Updates - The Economic Times",-0.9381366968154907
AXISBANK,2026-01-26,Axis Bank reduces over 950 employees in Q3 as technology investments start to pay off - BFSI News,-0.9731675386428833
AXISBANK,2024-07-25,India's Axis Bank misses Q1 profit view on higher provisions - Reuters,-0.8860414624214172
AXISBANK,2022-06-07,About Axis Bank Ltd (AXBK.NS) - Reuters,-0.9466656446456909
AXISBANK,2022-10-20,"Axis Bank net profit rises 70% to Rs. 5,329.8 Cr; No plans to raise capital, says Amitabh Chaudhry - BFSI News",0.9337603449821472
AXISBANK,2014-03-15,AXSB: Axis Bank Ltd Stock Price Quote - Natl India - Bloomberg - Bloomberg.com,-0.9479803442955017
AXISBANK,2025-07-17,"Axis Bank Q1 FY26: What is the ‘Technical Impact’ that led to NPA spike, profit decline? - BFSI News",-0.857640266418457
AXISBANK,2025-10-15,"RBI advisory prompts Axis Bank’s Rs 1,231 crore standard asset provision on farm loans; expects reversal b.. - BFSI News",-0.5296958684921265
AXISBANK,2022-07-26,"Axis bank ltd - Latest axis bank ltd , Information & Updates - BFSI -ET BFSI - BFSI News",-0.9461014866828918
AXISBANK,2025-04-24,Axis Bank to Raise $6.4 Billion Through Debt and Equity - Bloomberg.com,-0.8460043668746948
AXISBANK,2017-03-23,Axis Bank Profit and Loss Reports - The Economic Times,-0.6959308385848999
AXISBANK,2025-07-21,What next for Axis Bank after tepid Q1 results? - BFSI News,-0.7053282856941223
AXISBANK,2025-10-15,"Axis Bank’s corporate loan book rises 20% YoY led by mid-corporates, pricing discipline, relationship lend.. - BFSI News",0.948982298374176
AXISBANK,2017-08-02,Check out Axis Bank Ltd's stock price (AXISBANK-IN) in real time - CNBC,-0.9441182613372803
AXISBANK,2025-07-17,India's Axis Bank posts surprise profit drop as bad loans surge after benchmarking exercise - Reuters,-0.9665148854255676
AXISBANK,2025-10-17,"Axis Bank sees SME, corporate lending driving growth; retail segment gains momentum - BFSI News",0.930049479007721
AXISBANK,2025-07-17,Axis Bank to appoint an Executive Director as DMD Rajiv Anand retires - BFSI News,-0.9171082973480225
AXISBANK,2017-03-23,Axis Bank Ltd. - The Economic Times,-0.9236648678779602
AXISBANK,2024-06-12,FIU imposes over Rs 1.66 cr fine on Axis Bank for failing to detect fraud NSG account - ETLegalWorld.com,-0.7372756004333496
AXISBANK,2025-11-28,Axis Bank economist pegs India's fiscal year 2026 growth rate at 7.2% - CNBC,-0.8768727779388428
AXISBANK,2024-06-19,India's Axis Bank raises stake in Max Life Insurance for $4.3 mln - Reuters,-0.8088729381561279
AXISBANK,2025-07-17,"Axis Bank Q1 profit down 4 pc to Rs 5,806 cr - BFSI News",-0.9705731272697449
AXISBANK,2025-03-27,"India's Axis Bank, J.P. Morgan roll out anytime dollar payments for clients - Reuters",-0.9253827929496765
AXISBANK,2025-07-18,Indian Markets May Continue Weekly Loss as Key Earnings Fall Short - Bloomberg.com,-0.9532214403152466
AXISBANK,2025-10-16,"Earnings, rate cut hopes boost India's stock benchmarks to 3-month highs - Reuters",0.8744770288467407
AXISBANK,2023-11-16,RBI imposes ₹90.92-lakh penalty on Axis Bank for violating several norms - BFSI News,-0.9000839591026306
AXISBANK,2024-07-25,Axis investing in tech and cybersecurity for a future-ready Bank: Amitabh Chaudhry - BFSI News,-0.7749560475349426
AXISBANK,2017-10-17,Axis Bank Has Uncovered a Second Porky Pie of Bad Loans - Bloomberg.com,-0.6353695392608643
AXISBANK,2020-10-05,"Axis Bank Q1 Results: Standalone PAT falls 4% YoY to Rs 5,806 crore, NII remains flat - The Economic Times",-0.9565236568450928
AXISBANK,2025-12-16,Indian shares fall for second session; Axis Bank among top laggards - Reuters,-0.9498212933540344
AXISBANK,2014-01-16,Axis Bank's profit may beat estimates - StarMine - Reuters,-0.5248279571533203
AXISBANK,2020-07-03,Axis Bank shutters UK ops; to surrender license by April 2021 - BFSI News,-0.6095578074455261
AXISBANK,2022-11-10,Indian government To Sell 1.55% Stake In Axis Bank - Reuters,-0.926139235496521
AXISBANK,2022-07-16,"Axis Bank Q2 Results: PAT surges 18% YoY to Rs 6,918 crore, NII jumps 9% - The Economic Times",0.9035422205924988
AXISBANK,2017-12-07,"Axis Bank Bareilly Uttar Pradesh Branch IFSC Code, MICR Code, Address & Phone Number - The Economic Times",-0.938860297203064
AXISBANK,2022-10-20,India's Axis Bank beats profit estimates as provisions slide - Reuters,-0.7949837446212769
AXISBANK,2022-09-08,"Axis Bank Trade Finance Centre Tfc Branch IFSC Code, MICR Code, Address & Phone Number - The Economic Times",-0.9415277242660522
AXISBANK,2024-04-09,"Bain Capital exits Axis Bank, raises $429 mln in stake sale - Reuters",-0.9069217443466187
AXISBANK,2023-01-23,India's Axis Bank profit beats view on strong interest income - Reuters,-0.7585052251815796
AXISBANK,2022-09-08,"Axis Bank Head Office Branch IFSC Code, MICR Code, Address & Phone Number - The Economic Times",-0.9376319646835327
AXISBANK,2025-12-17,"Private capex not doing well is no longer true, says Axis Bank’s Neelkanth Mishra - BFSI News",-0.749764084815979
AXISBANK,2022-09-16,"Axis Bank Sector 62 Noida Branch IFSC Code, MICR Code, Address & Phone Number - The Economic Times",-0.939304769039154
AXISBANK,2023-10-25,"MSME segment key growth driver, 5k businesses onboarded every month under 'Neo for Business', says Amitabh C.. - BFSI News",0.5460439324378967
AXISBANK,2022-09-08,"Axis Bank Jawahar Nagar Branch IFSC Code, MICR Code, Address & Phone Number - The Economic Times",-0.9412455558776855
AXISBANK,2024-10-19,Axis Bank's sluggish loan growth and elevated slippages raise concerns - BFSI News,-0.8792693018913269
AXISBANK,2017-09-01,"Axis Bank IFSC Code: Find Axis Bank IFSC code, MICR code, Branches and Address - The Economic Times",-0.9445434212684631
AXISBANK,2017-11-06,"Axis Bank North Zonal Office Nzo Branch IFSC Code, MICR Code, Address & Phone Number - The Economic Times",-0.9402605891227722
AXISBANK,2024-10-17,India's Axis Bank posts Q2 profit beat on strong credit demand - Reuters,0.8596863746643066
AXISBANK,2023-08-09,India's Axis Bank to raise stake in Max Life via 16.12 bln rupee investment - Reuters,-0.8346825242042542
AXISBANK,2022-09-08,"Axis Bank East Zonal Office Ezo Branch IFSC Code, MICR Code, Address & Phone Number - The Economic Times",-0.9412795305252075
AXISBANK,2024-10-30,Axis Bank says AI won’t mean job losses as it adds frontliners - BFSI News,-0.8131163120269775
AXISBANK,2025-11-21,India's Axis Bank to raise up to $559 million via private debt placement - Reuters,-0.7892453670501709
AXISBANK,2014-03-20,India's Axis Bank falls on government $935 mln stake sale offer - Reuters,-0.9029385447502136
AXISBANK,2017-09-04,"Axis Bank Maninagar Branch IFSC Code, MICR Code, Address & Phone Number - The Economic Times",-0.9374418258666992
AXISBANK,2015-05-22,AXSB/F: Axis Bank Ltd Stock Price Quote - - Bloomberg - Bloomberg.com,-0.9455953240394592
AXISBANK,2024-04-24,"India's Axis Bank beats Q4 profit estimates on strong loan, NII growth - Reuters",0.9227535128593445
AXISBANK,2025-02-25,Axis Bank is said to weigh majority stake sale of $1 bn shadow bank unit - BFSI News,-0.9393318295478821
AXISBANK,2022-06-29,Large banks with healthy performance to outperform industry: Axis Bank MD & CEO - BFSI News,0.752432644367218
AXISBANK,2026-02-24,Axis Bank champions linguistic authenticity with new ad - ET BrandEquity,0.832647442817688
AXISBANK,2025-01-16,"India's Axis Bank misses profit view on bad loan provisions, slow loan growth - Reuters",-0.9560166001319885
AXISBANK,2022-09-08,"Axis Bank Semi Urban Branches IFSC Code, MICR Code & Phone Number - The Economic Times",-0.9429396390914917
AXISBANK,2017-10-17,"Axis Bank Ludhiana Branch IFSC Code, MICR Code, Address & Phone Number - The Economic Times",-0.9407103657722473
AXISBANK,2018-02-16,"Axis Bank Surendranagar Gujarat Branch IFSC Code, MICR Code, Address & Phone Number - The Economic Times",-0.9398588538169861
AXISBANK,2024-04-08,"Bain Capital to sell $429 mln stake in India's Axis Bank, term sheet shows - Reuters",-0.9320007562637329
AXISBANK,2017-10-24,"Axis Bank Rampur Branch IFSC Code, MICR Code, Address & Phone Number - The Economic Times",-0.9382396936416626
AXISBANK,2022-09-08,"Axis Bank Dlf Phase Iii Branch IFSC Code, MICR Code, Address & Phone Number - The Economic Times",-0.9424688220024109
AXISBANK,2025-10-29,India-US trade deal is weeks away; deep alignment still intact: Axis Bank - CNBC,-0.7473481893539429
AXISBANK,2022-09-08,"Axis Bank Maharajganj Branch IFSC Code, MICR Code, Address & Phone Number - The Economic Times",-0.9403560757637024
