ticker,date,headline,sentiment_score
BANKBARODA,2018-01-05,"bankbaroda Forum Discussion on Market View, Business sectors,Stocks, Commodity, Personal Finance & More - Moneycontrol.com",-0.944898247718811
BANKBARODA,2018-01-11,"Bank Of Baroda Balance Sheet, Bank Of Baroda Financial Statement & Accounts - Moneycontrol.com",-0.9389375448226929
BANKBARODA,2025-09-17,"F&O Quote - Live FNO BSE/NSE Quote, Nifty Quotes, Indian Stock Market BSE/NSE Price Increase, Chart, Open Interest Analysis & more by Moneycontrol.com - Moneycontrol.com",-0.9385393857955933
BANKBARODA,2024-11-14,Bank Of Baroda - Moneycontrol.com,-0.9460332989692688
BANKBARODA,2025-06-27,Bank fraud: High Court orders Bank of Baroda to return money to customers with 6% interest - The Economic Times,-0.833492636680603
BANKBARODA,2025-08-22,"Quarterly Results, Bank Of Baroda Financial Statement & Accounts - Moneycontrol.com",-0.9349290728569031
BANKBARODA,2011-07-18,"Bank Of Baroda Registered Address Contact Details, Bank Of Baroda Management - Moneycontrol.com",-0.9478464722633362
BANKBARODA,2018-06-03,Bank Of Baroda - Moneycontrol.com,-0.9460332989692688
BANKBARODA,2024-11-15,Bank Of Baroda - Moneycontrol.com,-0.9460332989692688
BANKBARODA,2020-07-21,Bank Of Baroda Daily Technical Analysis | Stochastic RSI indicators - Moneycontrol.com,-0.9229519963264465
BANKBARODA,2024-11-15,Bank Of Baroda - Moneycontrol.com,-0.9460332989692688
BANKBARODA,2025-01-31,"Bank of Baroda's Q3 show fails to impress, stock sinks 4%; Jefferies, HSBC cut target price to Rs 250 - Moneycontrol.com",-0.8422894477844238
BANKBARODA,2025-02-20,Bank of Baroda FD Rates 2025 - The Economic Times,-0.9179275035858154
BANKBARODA,2024-11-20,Bank Of Baroda - Moneycontrol.com,-0.9460332989692688
BANKBARODA,2018-08-16,"Bank Of Baroda Key Financial Ratios, Bank Of Baroda Financial Statement & Accounts - Moneycontrol.com",-0.9340616464614868
BANKBARODA,2026-01-05,Bank of Baroda logs 15% loan growth in Q3 - The Economic Times,0.7558925151824951
BANKBARODA,2011-07-18,Bank Of Baroda Ltd. - Moneycontrol.com,-0.9467067718505859
BANKBARODA,2019-11-28,Merger of three RRBs to form Baroda UP Bank - The Economic Times,-0.9293171763420105
BANKBARODA,2018-08-24,"Bank Of Baroda Consolidated Key Financial Ratios, Bank Of Baroda Financial Statement & Accounts - Moneycontrol.com",-0.9333386421203613
BANKBARODA,2025-05-02,"RBI imposes penalties on ICICI Bank, Bank of Baroda, 2 other lenders - The Economic Times",-0.8621315360069275
BANKBARODA,2024-11-15,"Bank Of Baroda | AGM/EGM > Banks - Public Sector > Meetings of Bank Of Baroda - BSE: 532134, NSE: BANKBARODA - Moneycontrol.com",-0.9439800381660461
BANKBARODA,2025-12-05,Home loan EMI to fall for Bank of Baroda borrowers: PSU bank cuts lending rates for these borrowers - The Economic Times,-0.9520651698112488
BANKBARODA,2011-07-09,"Bank Of Baroda Cash Flow, Bank Of Baroda Financial Statement & Accounts - Moneycontrol.com",-0.9375280141830444
BANKBARODA,2024-10-03,Bank of Baroda to sell Oman operation to Bank Dhofar - The Economic Times,-0.9296854734420776
BANKBARODA,2025-06-08,"Baroda BNP Paribas Health and Wellness Fund Regular-Growth (₹ 9.54) - NAV, Reviews & asset allocation - The Economic Times",-0.9037336707115173
BANKBARODA,2018-07-09,"Bank Of Baroda Profit & Loss account, Bank Of Baroda Financial Statement & Accounts - Moneycontrol.com",-0.8764481544494629
BANKBARODA,2026-02-24,"> Listing Details > > Listing Details of - BSE: , NSE: - Moneycontrol.com",-0.9465444087982178
BANKBARODA,2018-05-25,"Brokerage Reports | Latest & Breaking News on Brokerage Reports | Photos, Videos, Breaking Stories and Articles on Brokerage Reports - Moneycontrol.com",-0.9128261208534241
BANKBARODA,2024-09-24,"Latest daily cash deposit limit at ATMs: SBI, HDFC Bank, Bank of Baroda, Union Bank of India, PNB - The Economic Times",-0.9382888078689575
BANKBARODA,2018-01-05,"Online Business Forum, Economics & Stocks Discussion, Share Market Ideas, Questions and Answers India - MoneyControl - Moneycontrol.com",-0.944476842880249
BANKBARODA,2025-05-06,India's Bank of Baroda expects margin pressure to persist for two more quarters - Reuters,-0.9531548619270325
BANKBARODA,2026-02-28,"US–Iran war news: How could the S&P 500, Dow Jones and Nasdaq react? Are defense stocks the real winners, - The Economic Times",-0.9101974368095398
BANKBARODA,2025-05-20,"7.9% rate on 444 day-FD: Check highest interest rate of SBI, Indian Bank, Bank of Baroda and Canara bank - The Economic Times",-0.8721761107444763
BANKBARODA,2011-12-28,Corporation Bank - Moneycontrol.com,-0.9468943476676941
BANKBARODA,2018-01-13,Stock Quotes|Company Stock Price quotes|NSE/ BSE Listed Company Stocks|Indian Stock Market - Moneycontrol.com,-0.9217756390571594
BANKBARODA,2025-04-08,'One state-one RRB' to be effective from May 1 as FinMin approves consolidation of 15 regional rural banks - The Economic Times,-0.9201207160949707
BANKBARODA,2013-08-03,Buy Bank of Baroda; target Rs 775: Religare Retail - Moneycontrol.com,-0.9333898425102234
BANKBARODA,2026-03-12,Bank holidays in March 2026: Full list of state-wise bank holidays you should check before planning visits - The Economic Times,-0.9244245290756226
BANKBARODA,2018-03-12,Gupta firms lose bid to have bank Baroda remain in South Africa - Reuters,-0.8639625310897827
BANKBARODA,2018-06-15,Baroda BNP Paribas Multi Cap Fund Regular Growth - Moneycontrol.com,-0.9433355927467346
BANKBARODA,2023-05-10,"FD Interest Rates: Latest FD Interest Rates, Fixed deopsit rate online | ET Wealth - The Economic Times",-0.9391880631446838
BANKBARODA,2024-04-18,"Baroda BNP Paribas Retirement Fund Regular - Growth (₹ 11.01) - NAV, Reviews & asset allocation - The Economic Times",-0.9192050099372864
BANKBARODA,2023-02-06,India's Bank of Baroda says open to lending to Adani Group - Reuters,-0.8611612319946289
BANKBARODA,2019-04-01,What India's new mega bank means for banks & customers - The Economic Times,-0.8963682055473328
BANKBARODA,2025-10-31,"SBI, PNB, HDFC Bank & others have changed their website domain names on RBI’s instructions; Is your bank a - The Economic Times",-0.9118726253509521
BANKBARODA,2023-10-10,India's Bank of Baroda falls after RBI ban on adding new app customers - Reuters,-0.8227381706237793
BANKBARODA,2017-10-16,Select State for Airtel Payments Bank Limited IFSC Code - The Economic Times,-0.917026698589325
BANKBARODA,2024-09-06,Retirement planning: How to invest Rs 95 lakh PF money for a monthly income of Rs 1 lakh after retirement? - The Economic Times,-0.9361101984977722
BANKBARODA,2018-09-17,"Bank of Baroda, Vijaya Bank and Dena Bank to be merged - The Economic Times",-0.9452791810035706
BANKBARODA,2023-04-04,Exclusive: India's Bank of Baroda stops clearing payment for above-cap Russian oil - sources - Reuters,-0.9200555086135864
