ticker,date,headline,sentiment_score
BOSCHLTD,2022-06-06,(BOSH.NS) | Stock Price & Latest News - Reuters,-0.9112196564674377
BOSCHLTD,2012-04-28,"Most Active Shares - F&O Market, All Futures & Options, Index Futures, Index Options, Stock Futures, Stock Options - Moneycontrol",-0.9498177766799927
BOSCHLTD,2024-11-17,"Bosch | Bonus > Auto Ancillaries > Bonus declared by Bosch - BSE: 500530, NSE: BOSCHLTD - Moneycontrol",-0.9312775135040283
BOSCHLTD,2024-11-15,"Bosch | Splits > Auto Ancillaries > Dividends declared by Bosch - BSE: 500530, NSE: BOSCHLTD - Moneycontrol",-0.9079813361167908
BOSCHLTD,2024-11-14,"Bosch | Dividends > Auto Ancillaries > Dividends declared by Bosch - BSE: 500530, NSE: BOSCHLTD - Moneycontrol",-0.9420812726020813
BOSCHLTD,2025-08-06,"Stock Market Highlights: Sensex settles 166 pts lower, Nifty below 24,600; TechM, Sun Pharma drop 2% each - The Economic Times",-0.9616106748580933
BOSCHLTD,2011-12-18,Bosch Ltd. - Moneycontrol,-0.9492092132568359
BOSCHLTD,2018-06-03,"Bosch Profit & Loss account, Bosch Financial Statement & Accounts - Moneycontrol",-0.9201849102973938
BOSCHLTD,2024-11-18,"Bosch | Board Meetings > Auto Ancillaries > Board Meetings of Bosch - BSE: 500530, NSE: BOSCHLTD - Moneycontrol",-0.9461961388587952
BOSCHLTD,2011-07-17,"Bosch Registered Address Contact Details, Bosch Management - Moneycontrol",-0.9485586881637573
BOSCHLTD,2014-09-16,Bangalore: Bosch Ltd's Adugodi plant workers launch indefinite strike - The Economic Times,-0.9431623816490173
BOSCHLTD,2025-09-22,"bosch Forum Discussion on Market View, Business sectors,Stocks, Commodity, Personal Finance & More - Moneycontrol",-0.9441167712211609
BOSCHLTD,2011-07-17,"Bosch > Company History > Auto Ancillaries > Company History of Bosch - BSE: 500530, NSE: BOSCHLTD - Moneycontrol",-0.946885883808136
BOSCHLTD,2018-05-28,"Bosch > Company History > Auto Ancillaries > Company History of Bosch - BSE: 500530, NSE: BOSCHLTD - Moneycontrol",-0.946885883808136
BOSCHLTD,2023-08-01,Bosch Ltd to increase manufacturing in India - Reuters,0.7727565169334412
BOSCHLTD,2023-03-22,Bosch appoints Guruprasad Mudlapur as its Managing Director - The Economic Times,-0.9252809286117554
BOSCHLTD,2021-07-20,Bosch Ltd - Reuters,-0.9466928243637085
BOSCHLTD,2018-06-22,"Bosch Cash Flow, Bosch Financial Statement & Accounts - Moneycontrol",-0.9506189823150635
BOSCHLTD,2024-11-16,Bosch Announcements - Moneycontrol,-0.9175161719322205
BOSCHLTD,2025-06-25,Stock market update: Nifty Auto index advances 0.65% in an upbeat market - The Economic Times,0.9278413653373718
BOSCHLTD,2018-08-31,"Bosch Consolidated Key Financial Ratios, Bosch Financial Statement & Accounts - Moneycontrol",-0.948085367679596
BOSCHLTD,2024-11-12,"Stock Market Highlights: Nifty’s short-term trend remains weak, key support at 23,500. How to trade tomorrow - The Economic Times",-0.6892275810241699
BOSCHLTD,2025-06-16,Stock market update: Nifty Auto index advances 0.18% - The Economic Times,0.8686821460723877
BOSCHLTD,2025-07-28,Stock market update: Nifty Auto index falls 0.37% - The Economic Times,-0.9494646191596985
BOSCHLTD,2025-08-07,Bosch gets over Rs 140 crore demand from customs authority for differential duty on oxygen sensors - The Economic Times,-0.6244184970855713
BOSCHLTD,2025-07-03,"Stock Market Highlights | Sensex settles 170 pts lower after volatile trade, Nifty below 25,450; SBI Lif... - The Economic Times",-0.9554475545883179
BOSCHLTD,2019-11-07,Bosch shares plunge nearly 5% post Q2 earnings - The Economic Times,-0.9630628824234009
BOSCHLTD,2026-01-02,"Market Highlights: Nifty settles at fresh high, Sensex soars 573 pts; Coal India jumps 7%, Hindalco 4% - The Economic Times",0.8075743913650513
BOSCHLTD,2022-12-08,Stock Market Highlight: Nifty forms a small positive candle. What traders should do on Friday - The Economic Times,-0.8923852443695068
BOSCHLTD,2025-07-15,"Stock Market Highlights: Sensex settles 317 pts higher, Nifty above 25,150; Hero MotoCorp jumps 5%, Bajaj... - The Economic Times",0.9099282026290894
BOSCHLTD,2025-09-10,"Stock Market Highlights: Sensex settles 324 pts higher, Nifty above 24,950; BEL rises 4%, HCL Tech 2% - The Economic Times",0.9074469208717346
BOSCHLTD,2025-12-11,"Market Highlights: Sensex settles 427 pts higher, Nifty above 25,850; Eternal, Kotak Bank rise 2% each - The Economic Times",0.9248464703559875
BOSCHLTD,2022-01-04,Amp Energy commissions 30 MW solar project for Bosch - The Economic Times,-0.8607473969459534
BOSCHLTD,2025-07-25,"Stock Market Highlights: Sensex settles 721 pts lower, Nifty below 24,850; Power Grid drops 3%, TechM 2% - The Economic Times",-0.968887209892273
BOSCHLTD,2024-05-15,"India's weight in key MSCI equity index hits another high, to boost inflows - Reuters",0.9148983955383301
BOSCHLTD,2024-09-26,Stock Market Highlights: Nifty's bullish breakout signals upward momentum. What's next on D-Street - The Economic Times,-0.7942384481430054
BOSCHLTD,2024-09-24,Import approval system for IT hardware products extended till December 31 - The Economic Times,-0.9040416479110718
BOSCHLTD,2023-12-18,Sandeep Nelamangala to manage Bosch's mobility business portfolio in India - The Economic Times,-0.8959364295005798
BOSCHLTD,2025-09-16,"Stock Market Highlights: Sensex resumes winning run after 1-day break, rallies 595 pts; Nifty tops 25,200 - The Economic Times",0.8385877013206482
BOSCHLTD,2025-11-13,India’s Samvardhana Motherson quarterly profit beats views as revenue rises across units - Reuters,0.4432406723499298
BOSCHLTD,2024-11-07,"Stock Market Highlights: Nifty forms long negative candle, minor dips towards 23,800 expected. How to tra... - The Economic Times",-0.5700741410255432
BOSCHLTD,2025-09-08,"Stock Market Highlights: Sensex settles 76 pts higher, Nifty above 24,750; Gold prices hit record high - The Economic Times",0.921494722366333
BOSCHLTD,2025-09-02,Bosch back in reckoning as it reinvents to repeat China success in India EVs - The Economic Times,-0.6329376101493835
BOSCHLTD,2025-05-28,"US Stock Markets | Dow Jones: US stocks open mixed after sharp rally, investors cautious ahead of Nvidia’... - The Economic Times",-0.8006680607795715
BOSCHLTD,2024-10-23,"Stock Market Highlights: Nifty’s drop below 24,350, could trigger a slide to 24K in near term. How to tra... - The Economic Times",-0.8661624193191528
BOSCHLTD,2015-08-18,Bosch commissions 12 MW solar plant at Cochin airport - The Economic Times,-0.8872995376586914
BOSCHLTD,2015-10-13,Mahindra & Mahindra tops CSR list in India even as companies scale up operations - The Economic Times,0.7316290140151978
BOSCHLTD,2008-12-03,NSE details S&P CNX Nifty Index Futures - Reuters,-0.895451545715332
BOSCHLTD,2019-11-08,"Traders’ Diary: Nifty is likely hit 12,750 level - The Economic Times",-0.792173445224762
BOSCHLTD,2022-07-12,"Closing Bell: Sensex tumbles 509 points, gives up 54,000 on losses in Infy, financials; Nifty below 16,10... - The Economic Times",-0.953550398349762
