ticker,date,headline,sentiment_score
BOSCHLTD,2026-03-09,"Forum Discussion on Market View, Business sectors,Stocks, Commodity, Personal Finance & More - Moneycontrol.com",-0.9462059736251831
BOSCHLTD,2025-08-04,"Bosch Q1 Results: Net profit surges over twofold to Rs 1,115 crore - The Economic Times",0.9305233955383301
BOSCHLTD,2022-06-06,(BOSH.NS) | Stock Price & Latest News - Reuters,-0.9112196564674377
BOSCHLTD,2025-08-26,"Quarterly Results, Bosch Financial Statement & Accounts - Moneycontrol.com",-0.9323955774307251
BOSCHLTD,2024-11-15,"Bosch | Splits > Auto Ancillaries > Dividends declared by Bosch - BSE: 500530, NSE: BOSCHLTD - Moneycontrol.com",-0.8961418271064758
BOSCHLTD,2024-11-14,"Bosch | Dividends > Auto Ancillaries > Dividends declared by Bosch - BSE: 500530, NSE: BOSCHLTD - Moneycontrol.com",-0.9396363496780396
BOSCHLTD,2024-11-16,"Bosch Announcements/Notices: Latest Sotck/Share Market Notices/Announcements on Bosch, Bosch Stock Split,Bonus, Rights, Re-Structuring, Dividends, Board Meetings, Quarterly Results, Record Date, Ex-Date, Book Closure on BSE/NSE - Moneycontrol.com",-0.9070892333984375
BOSCHLTD,2011-12-18,Bosch Ltd. - Moneycontrol.com,-0.9514267444610596
BOSCHLTD,2018-03-29,"Bosch Key Financial Ratios, Bosch Financial Statement & Accounts - Moneycontrol.com",-0.9450162649154663
BOSCHLTD,2018-07-11,"Bosch Balance Sheet, Bosch Financial Statement & Accounts - Moneycontrol.com",-0.9483823776245117
BOSCHLTD,2018-06-03,"Bosch Profit & Loss account, Bosch Financial Statement & Accounts - Moneycontrol.com",-0.9047773480415344
BOSCHLTD,2024-11-18,"Bosch | Board Meetings > Auto Ancillaries > Board Meetings of Bosch - BSE: 500530, NSE: BOSCHLTD - Moneycontrol.com",-0.943324863910675
BOSCHLTD,2021-07-20,Bosch Ltd - Reuters,-0.9466928243637085
BOSCHLTD,2026-03-09,(BOSH.NS) | Stock Price & Latest News - Reuters,-0.9112196564674377
BOSCHLTD,2025-09-22,"bosch Forum Discussion on Market View, Business sectors,Stocks, Commodity, Personal Finance & More - Moneycontrol.com",-0.9458299279212952
BOSCHLTD,2011-07-17,"Bosch > Listing Details > Auto Ancillaries > Listing Details of Bosch - BSE: 500530, NSE: BOSCHLTD - Moneycontrol.com",-0.9487016797065735
BOSCHLTD,2023-08-01,Bosch Ltd to increase manufacturing in India - Reuters,0.7727565169334412
BOSCHLTD,2025-11-09,Michael Burry’s big short on AI sent shockwaves across global tech. Which Dalal Street tech stocks caught - The Economic Times,-0.7554117441177368
BOSCHLTD,2011-07-17,"Bosch > Company History > Auto Ancillaries > Company History of Bosch - BSE: 500530, NSE: BOSCHLTD - Moneycontrol.com",-0.9464917778968811
BOSCHLTD,2018-08-31,"Bosch Consolidated Key Financial Ratios, Bosch Financial Statement & Accounts - Moneycontrol.com",-0.9469002485275269
BOSCHLTD,2024-05-15,"India's weight in key MSCI equity index hits another high, to boost inflows - Reuters",0.9148983955383301
BOSCHLTD,2022-01-04,Amp Energy commissions 30 MW solar project for Bosch - The Economic Times,-0.8607473969459534
BOSCHLTD,2022-06-06,SONB.NS - Reuters,-0.9409125447273254
BOSCHLTD,2026-02-10,India's Samvardhana Motherson posts quarterly profit rise on strong auto demand - Reuters,0.9352257251739502
BOSCHLTD,2025-11-13,India’s Samvardhana Motherson quarterly profit beats views as revenue rises across units - Reuters,0.4432406723499298
BOSCHLTD,2025-08-07,Bosch gets over Rs 140 crore demand from customs authority for differential duty on oxygen sensors - The Economic Times,-0.6244184970855713
BOSCHLTD,2026-03-02,UNOI.NS - Reuters,-0.9434300065040588
BOSCHLTD,2026-03-02,(SAMD.NS) | Stock Price & Latest News - Reuters,-0.918798565864563
BOSCHLTD,2025-11-11,"Bosch India's quarterly profit rises on demand for auto parts, consumer electronics - Reuters",0.8589276671409607
BOSCHLTD,2022-06-09,(BOSH.BO) | Stock Price & Latest News - Reuters,-0.9061596393585205
BOSCHLTD,2015-10-13,Mahindra & Mahindra tops CSR list in India even as companies scale up operations - The Economic Times,0.7316290140151978
BOSCHLTD,2025-08-13,India's Samvardhana Motherson posts lower quarterly profit on weak global car demand - Reuters,-0.9686721563339233
BOSCHLTD,2023-12-18,Sandeep Nelamangala to manage Bosch's mobility business portfolio in India - The Economic Times,-0.8959364295005798
BOSCHLTD,2025-05-09,Motherson Sumi Wiring India's quarterly profit falls on higher costs - Reuters,-0.9585009813308716
BOSCHLTD,2026-02-06,Bosch's India unit posts higher quarterly profit on tax cut boost - Reuters,0.906679630279541
BOSCHLTD,2015-08-18,Cochin International Airport becomes world's first to operate on solar power - The Economic Times,-0.6635459661483765
BOSCHLTD,2024-08-13,Indian auto parts maker Samvardhana Motherson beats quarterly profit estimates - Reuters,-0.7161981463432312
BOSCHLTD,2025-02-06,Motherson Sumi Wiring India posts lower Q3 profit as expansion weighs - Reuters,-0.9619375467300415
BOSCHLTD,2025-08-04,Bosch's India unit posts higher quarterly profit on strong auto parts sales - Reuters,0.9489826560020447
BOSCHLTD,2025-08-05,India's Exide Industries beats first-quarter profit estimates on better demand - Reuters,0.9185912013053894
BOSCHLTD,2024-08-06,India's Bosch posts smallest rise in profit in five quarters - Reuters,0.8138557076454163
BOSCHLTD,2008-12-05,India's Bosch says to cut output on poor demand - Reuters,-0.9465217590332031
BOSCHLTD,2025-04-30,"India's Exide Industries misses quarterly profit view on higher costs, tepid demand - Reuters",-0.9681527614593506
BOSCHLTD,2021-06-24,Sona BLW Precision Forgings Ltd - Reuters,-0.9431645274162292
BOSCHLTD,2025-07-28,India's Motherson Sumi Wiring reports Q1 profit below estimates on higher expansion costs - Reuters,-0.960049033164978
BOSCHLTD,2023-02-14,"Bosch's India unit reports Q3 profit jump, warns of ""challenging 2023"" - Reuters",-0.39352983236312866
BOSCHLTD,2023-02-07,Samvardhana Motherson International Ltd - Reuters,-0.9433750510215759
BOSCHLTD,2019-07-10,MNCs with over 65% promoter holding may consider delisting after budget proposals; 14 stocks in focus - Moneycontrol.com,-0.8338247537612915
BOSCHLTD,2025-01-16,"Car plants in Europe, North America face closures in 2025, Gartner says in report - Reuters",-0.958914577960968
BOSCHLTD,2026-03-05,HDFC MNC Fund Regular - Growth - The Economic Times,-0.9152217507362366
