ticker,date,headline,sentiment_score
CHOLAFIN,2026-03-06,"Half Yearly Results, Half yearly Earnings for Yaap Digital Ltd. - The Economic Times",-0.9223089218139648
CHOLAFIN,2018-01-08,"cholamandalam Forum Discussion on Market View, Business sectors,Stocks, Commodity, Personal Finance & More - Moneycontrol.com",-0.9470462203025818
CHOLAFIN,2025-09-16,CHOLAFIN 30Mar2026 - Moneycontrol.com,-0.939997673034668
CHOLAFIN,2025-08-26,"Quarterly Results, Cholamandalam Financial Holdings Financial Statement & Accounts - Moneycontrol.com",-0.9390507340431213
CHOLAFIN,2026-03-07,Cholamandalam Investment and Finance Company - Moneycontrol.com,-0.9522597789764404
CHOLAFIN,2026-02-20,"Chola Fin Hold Consolidated December 2025 Net Sales at Rs 9,948.79 crore, up 17.2% Y-o-Y - Moneycontrol.com",0.9509261250495911
CHOLAFIN,2024-11-28,Cholamandalam Investment and Finance Company - Moneycontrol.com,-0.9522597789764404
CHOLAFIN,2024-11-20,Cholamandalam Investment and Finance Company - Moneycontrol.com,-0.9522597789764404
CHOLAFIN,2024-11-13,Cholamandalam Investment and Finance Company - Moneycontrol.com,-0.9522597789764404
CHOLAFIN,2024-12-05,Cholamandalam Investment and Finance Company - Moneycontrol.com,-0.9522597789764404
CHOLAFIN,2011-08-06,Cholamandalam Investment and Finance Company Ltd. - Moneycontrol.com,-0.9502135515213013
CHOLAFIN,2019-04-23,Cholamandalam Financial Holdings Ltd. - Moneycontrol.com,-0.9501132965087891
CHOLAFIN,2025-11-14,"Chola Fin Hold Consolidated September 2025 Net Sales at Rs 9,461.41 crore, up 16.95% Y-o-Y - Moneycontrol.com",0.9496763348579407
CHOLAFIN,2019-04-19,Cholamandalam Financial Holdings Ltd. - Moneycontrol.com,-0.9501132965087891
CHOLAFIN,2026-02-10,"Chola Fin Hold Standalone December 2025 Net Sales at Rs 3.69 crore, up 24.66% Y-o-Y - Moneycontrol.com",0.9461501836776733
CHOLAFIN,2018-07-30,Cholamandalam Investment and Finance Company Ltd. - Moneycontrol.com,-0.9502135515213013
CHOLAFIN,2019-04-08,Cholamandalam Financial Holdings Ltd. - Moneycontrol.com,-0.9501132965087891
CHOLAFIN,2022-08-03,Cholamandalam Investment and Finance Company Ltd. - Moneycontrol.com,-0.9502135515213013
CHOLAFIN,2019-04-10,Cholamandalam Financial Holdings Ltd. - Moneycontrol.com,-0.9501132965087891
CHOLAFIN,2018-05-07,Cholamandalam Investment and Finance Company Ltd. - Moneycontrol.com,-0.9502135515213013
CHOLAFIN,2025-12-23,Cholamandalam Investment shares rise 8% as firm terms Cobrapost report as 'malicious and baseless' - Moneycontrol.com,-0.765288233757019
CHOLAFIN,2018-05-07,Cholamandalam Investment and Finance Company Ltd. - Moneycontrol.com,-0.9502135515213013
CHOLAFIN,2011-08-06,Cholamandalam Investment and Finance Company Ltd. - Moneycontrol.com,-0.9502135515213013
CHOLAFIN,2024-06-12,"Share Market Live, Share Market Today: Latest Share Market News, Share Market Live Updates on - The Economic Times",-0.9394532442092896
CHOLAFIN,2025-07-02,HDB Financial Services shares: Are unlisted shares the new road to high gains? - The Economic Times,-0.7025261521339417
CHOLAFIN,2025-10-21,Indian stock benchmarks inch higher to one-year highs in special Diwali session - Reuters,0.9031543731689453
CHOLAFIN,2025-02-03,Buy Cholamandalam Investment and Finance Company; target of Rs 1475: Motilal Oswal - Moneycontrol.com,-0.9407747387886047
CHOLAFIN,2026-03-03,DCBA.NS - | Stock Price & Latest News - Reuters,-0.9321852922439575
CHOLAFIN,2025-03-20,Indian shares jump as Fed's rate cut outlook bolsters sentiment - Reuters,0.5998339056968689
CHOLAFIN,2018-01-13,Stock Quotes|Company Stock Price quotes|NSE/ BSE Listed Company Stocks|Indian Stock Market - Moneycontrol.com,-0.9217756390571594
CHOLAFIN,2025-02-06,How long can homegrown investors hold up India’s equity market? - Reuters,-0.9226229786872864
CHOLAFIN,2024-11-04,Indian shares post worst session in over a month ahead of US election - Reuters,-0.9402206540107727
CHOLAFIN,2025-01-24,India's Religare says US businessman makes competing offer for stake - Reuters,-0.8493753671646118
CHOLAFIN,2021-07-20,Zomato Ltd - Reuters,-0.9363437294960022
CHOLAFIN,2024-07-25,Premier Energies Ltd - Reuters,-0.944858729839325
CHOLAFIN,2024-01-19,Ola Electric Mobility Ltd - Reuters,-0.9438528418540955
CHOLAFIN,2025-02-28,Indian grocery giant BigBasket eyes IPO in 2 years as business booms - Reuters,-0.847979724407196
CHOLAFIN,2018-05-18,YOU ARE HERE Moneycontrol Market F&O > Active Calls - Moneycontrol.com,-0.9465038180351257
CHOLAFIN,2021-07-01,Tata Sons Pvt Ltd - Reuters,-0.9362220168113708
CHOLAFIN,2016-06-17,"Stock Starting with 'c', List of Companies Stock Starting with 'c', Stock Symbol with 'c' at Moneycontrol - Moneycontrol.com",-0.947422444820404
CHOLAFIN,2018-10-10,"Atishay Target Share Price, Atishay Share Price Forecast - The Economic Times",-0.937178909778595
CHOLAFIN,2018-05-10,"Indian Stock/Share Market: Sensex, Nifty, Stock/Share Prices, Share Market Live, Stock/Share Recommendations, Hot Stocks, Stock Market Investing, BSE, NSE, Derivatives, Best Stocks to Buy, Penny Stocks India - Moneycontrol.com",-0.943528413772583
CHOLAFIN,2023-10-16,Trade setup for Tuesday: 15 things to know before opening bell - Moneycontrol.com,-0.9379271864891052
CHOLAFIN,2026-02-26,Vellayan Subbiah to exit Cholamandalam Investment Finance as part of Murugappa family settlement - Moneycontrol.com,-0.9526777863502502
CHOLAFIN,2024-12-24,Gross Deliverables - NIFTY 500 - Moneycontrol.com,-0.9315404295921326
CHOLAFIN,2024-11-05,Buy Cholamandalam Investment and Finance Company; target of Rs 1600: Sharekhan - Moneycontrol.com,-0.9291322231292725
CHOLAFIN,2018-05-02,"F&O Market Snapshot: Future and Options NSE, BSE, F&O margin, F&O quotes - Moneycontrol - Moneycontrol.com",-0.9391407370567322
CHOLAFIN,2023-10-08,Trade setup for Monday: 15 things to know before opening bell - Moneycontrol.com,-0.9395567774772644
CHOLAFIN,2024-06-12,Altman Z-score - Insolvent - The Economic Times,-0.8885997533798218
CHOLAFIN,2024-02-21,Trade setup for Thursday: 15 things to know before opening bell - Moneycontrol.com,-0.9383028745651245
