ticker,date,headline,sentiment_score
COALINDIA,2026-02-03,Coal India Share Price Live Updates: Coal India Weekly Volume Comparison - The Economic Times,-0.9343985915184021
COALINDIA,2026-02-02,Coal India Share Price Highlights: Coal India Ltd Stock Price History - The Economic Times,-0.9380397200584412
COALINDIA,2026-02-01,Coal India Share Price Highlights: Coal India Ltd Stock Price History - The Economic Times,-0.9380397200584412
COALINDIA,2026-01-29,"Coal India, BCCL shares rise up to 5% as govt designates coking coal as critical mineral - Moneycontrol",0.9477468729019165
COALINDIA,2023-12-13,Coal India Stocks Live Updates: Coal India News - The Economic Times,-0.9352300763130188
COALINDIA,2026-02-03,Innovassynth Inv Profit and Loss Reports - The Economic Times,-0.8185244798660278
COALINDIA,2026-02-03,What is nil deduction certificate and how will Budget 2026 change the process? - The Economic Times,-0.9321954846382141
COALINDIA,2026-02-03,"Supreme Court sets aside NCLAT order of CCI probe against Flipkart, sends back case for fresh adjudication - The Economic Times",-0.8839933276176453
COALINDIA,2026-02-03,"Piyush Goyal breaks down India-US trade deal: 'Rahul misleading people, farmers fully protected' - The Economic Times",-0.7857154607772827
COALINDIA,2026-01-30,"Forum Discussion on Market View, Business sectors,Stocks, Commodity, Personal Finance & More - Moneycontrol",-0.9452173113822937
COALINDIA,2026-02-03,"Large cap and small cap gains - Silver tops 10-year return chart, outperforms gold, equity and bonds. Check details - The Economic Times",-0.4783393144607544
COALINDIA,2026-02-03,Budget 2026: Are you eligible for Standard Deduction in FY 2026-27? - The Economic Times,-0.9014543890953064
COALINDIA,2026-02-04,Shailendra Singh on Peak XV exits; Tax breaks for global talent - The Economic Times,-0.7828196287155151
COALINDIA,2026-02-02,"US stock market on the move today: Dow and S&P 500 surge, but why is Nasdaq down - Gold, silver and bitcoi - The Economic Times",-0.5758197903633118
COALINDIA,2026-02-04,Sensex Today | Nifty 50 | Stock Market Live Updates: Gift Nifty signals negative start; Asian stocks fall - The Economic Times,-0.955502986907959
COALINDIA,2026-02-03,HDFC Bank Share Price Highlights: HDFC Bank Stock Price History - The Economic Times,-0.936156153678894
COALINDIA,2026-02-03,35 stocks to benefit from 5 key Union Budget 2026 announcements. Check full list - The Economic Times,-0.8904933929443359
COALINDIA,2026-02-03,Budget 2026: Key NRI-related income tax reforms - The Economic Times,-0.8740885853767395
COALINDIA,2026-02-03,Section 87A rebate in FY 2026-27: Who gets full tax relief and who doesn’t? - The Economic Times,-0.9215171933174133
COALINDIA,2026-02-02,Budget stock picks: SBI Securities select 5 stocks with up to 17% upside. Do you own any? - The Economic Times,-0.8986825942993164
COALINDIA,2026-02-03,7 daily habits we didn't have in 2016 - The Economic Times,-0.9004732370376587
COALINDIA,2026-02-03,"Lupin, SBI among 6 stocks that hit 52-week high; rally up to 7% in a month - The Economic Times",0.9394084215164185
COALINDIA,2026-02-03,"Quantitatively eased, but quality's the deal - The Economic Times",-0.6511005163192749
COALINDIA,2026-02-03,Rare earths provide a rare opportunity - The Economic Times,-0.7856457233428955
COALINDIA,2026-02-03,Positive breakout: These 11 stocks close cross above their 200 DMA - The Economic Times,0.7585598230361938
COALINDIA,2026-02-03,STT hike shouldn't bury price discovery - The Economic Times,-0.8464059829711914
COALINDIA,2026-02-03,"MFs’ Bets: 15 smallcap stocks turn volatile, tumble up to 50% in 3 months. Do you own any? - The Economic Times",-0.8592814803123474
COALINDIA,2026-02-03,Buyback taxation Budget 2026 explained: How share buybacks will be taxed - The Economic Times,-0.9365404844284058
COALINDIA,2026-02-02,"Market Trading Guide: Buy Bajaj Consumer, Delhivery, 3 more stocks on Tuesday for up to 10% potential upside - The Economic Times",-0.7891886830329895
COALINDIA,2026-02-02,FIIs turn bullish: Raise stakes in these 9 smallcap stocks after two quarters of trimming - The Economic Times,0.6414670348167419
COALINDIA,2026-02-03,Technical picks: Choice Equity bets on 4 stocks after Union Budget 2026. Do you own any? - The Economic Times,-0.9389462471008301
COALINDIA,2026-02-03,"Stocks to buy in 2026 for long term: Vedanta, Delhivery among 5 stocks that could give 10-30% return - The Economic Times",-0.5221370458602905
COALINDIA,2026-02-03,13 midcap stocks deliver record quarterly profits over 10 quarters - The Economic Times,0.9151754379272461
COALINDIA,2026-02-04,"Positive Breakout:Adani Ports, Bajaj Finance among14 stocks that rallied above their 200 DMAs - The Economic Times",0.8981964588165283
COALINDIA,2026-02-03,“Rahul Gandhi Ko Kya Mirchi Lagti Hai?”: Goyal attacks Congress leader over opposition to US Trade deal - The Economic Times,-0.8488854765892029
COALINDIA,2026-02-03,IIFL Finance - Positive breakout: These 11 stocks close cross above their 200 DMA - The Economic Times,0.8211901783943176
COALINDIA,2026-02-03,"Market Trading Guide: Buy Prime Focus, MRPL and 2 more stocks on Wednesday for up to 16% potential upside - The Economic Times",-0.7715070843696594
COALINDIA,2026-02-03,Walmart hits $1 trillion market value as AI push and value shopping drive growth - The Economic Times,0.752964973449707
COALINDIA,2026-02-03,"Rahul vs Rijiju: LoP says ‘Don’t need permission’, Minister retorts ‘speak outside Parliament’ - The Economic Times",-0.6042984127998352
COALINDIA,2026-02-03,ChatGpt down: OpenAI outage hits users. Check latest status - The Economic Times,-0.7613397836685181
COALINDIA,2026-02-03,"Canara Robeco Equity Hybrid Fund turns Rs 10,000 SIP to Rs 6.20 crore in 33 years - The Economic Times",0.49360930919647217
COALINDIA,2026-02-03,"Amid wedding rumours with Dhanush, actress Mrunal Thakur shares how love changes you into a ‘better person - The Economic Times",-0.8161619305610657
COALINDIA,2026-02-03,"Gold price again closer to $5,000 – Why gold futures are surging today – How gold has outperformed stocks - The Economic Times",-0.5625794529914856
COALINDIA,2026-02-03,AI scrambles IT's old growth clues. The new signals matter now - The Economic Times,-0.923677921295166
COALINDIA,2026-02-03,"8 Personal Tax Changes You Must Know | Budget 2026, Shalini Jain from EY India explains - The Economic Times",-0.9201019406318665
COALINDIA,2026-02-03,"As Budget deepens RBI’s trilemma, it is likely to allow rupee to fall further - The Economic Times",-0.9550577998161316
COALINDIA,2026-02-03,"Jefferies increases weight in Hindustan Zinc, adds Eternal in latest portfolio tweak. Check list - The Economic Times",-0.8524503111839294
COALINDIA,2026-02-03,UK privacy watchdog launches investigation into Grok - The Economic Times,-0.6217724680900574
COALINDIA,2026-02-03,"Data centres, logistics parks could help build REIT frenzy - The Economic Times",-0.7701173424720764
COALINDIA,2026-02-04,Experts flag AI-only social site Moltbook - The Economic Times,-0.9082087874412537
