ticker,date,headline,sentiment_score
DLF,2026-03-20,"dlf performance: Latest News & Videos, Photos about dlf performance - The Economic Times",-0.9316343665122986
DLF,2026-03-20,Volumes soar at DLF Ltd counter - Business Standard,-0.6606044769287109
DLF,2026-03-16,"Nifty Realty index tanks 18% in 1 month; DLF, Oberoi, Lodha at 52-week lows - Business Standard",-0.9392881989479065
DLF,2026-03-20,IT stocks advance after strong Accenture Q2 - Business Standard,0.9430186152458191
DLF,2026-03-16,"Luxury high-rises drive Delhi property values up 27%, rentals up 7-9% - Business Standard",0.9341273307800293
DLF,2026-03-16,Bandhan Bank tanks 12% on huge volumes; why stock price under pressure? - Business Standard,-0.5063061714172363
DLF,2026-03-20,"Goldman Sachs, ICICI Pru MF buy DLF shares worth Rs 231 crore via block deals - The Economic Times",-0.8909210562705994
DLF,2026-03-20,Indiqube Spaces gains on inking major GCC leasing deal in Pune - Business Standard,0.9478245973587036
DLF,2026-03-16,Operation 'Epic Churn': Kotak Equities' advise amid Iran war market crash - Business Standard,-0.6965546011924744
DLF,2026-03-20,"Oil War Volatility Hits Stocks, Bonds and Gold - Business Standard",-0.6372302770614624
DLF,2026-03-16,"Mkt fall amid Iran crisis: Time for 'epic churn' in portfolios, says Kotak - Business Standard",-0.8967725038528442
DLF,2026-03-18,"Sensex, Nifty surge over 1%; realty shares climb - Business Standard",0.9307669401168823
DLF,2026-03-17,"This is not a time to be bearish on markets: Rishi Kohli, Jio BlackRock AMC - Business Standard",-0.9100789427757263
DLF,2026-03-21,"Goldman Sachs, ICICI Pru MF buy DLF shares worth ₹231 crore via block deals - ET Realty",-0.884464681148529
DLF,2026-03-16,"Multi, flexicaps best for SIP amid West Asia crisis, say analysts - Business Standard",0.847917377948761
DLF,2026-03-20,"Sensex surges over 1,005 pts; metal shares shine - Business Standard",0.9216964244842529
DLF,2026-03-19,"Nifty below 23,250; realty shares tumble - Business Standard",-0.9516909718513489
DLF,2017-03-23,"DLF Share Price Today, DLF Stock Price Live NSE/BSE Updates - The Economic Times",-0.9348658323287964
DLF,2025-07-13,DLF LIMITED - bsmedia.business-standard.com,-0.9519363641738892
DLF,2021-06-02,Stock Research Report for DLF Ltd - The Economic Times,-0.9236497282981873
DLF,2017-08-05,Check out DLF Ltd's stock price (DLF-IN) in real time - CNBC,-0.94426429271698
DLF,2025-08-04,India's DLF posts higher first-quarter profit on sustained demand for premium homes - Reuters,0.9471902847290039
DLF,2025-11-06,DLF Ltd - bsmedia.business-standard.com,-0.9503095149993896
DLF,2021-07-01,DLF Ltd - Reuters,-0.9436340928077698
DLF,2017-03-29,Announcement - The Economic Times,-0.9166386723518372
DLF,2017-03-29,"Half Yearly Results, Half yearly Earnings for DLF - The Economic Times",-0.9150169491767883
DLF,2014-03-15,DLFU: DLF Ltd Stock Price Quote - Natl India - Bloomberg - Bloomberg.com,-0.9493336081504822
DLF,2017-03-29,The Economic Times - The Economic Times,-0.9159992933273315
DLF,2014-07-31,India's DLF quarterly profit falls 29 pct on lower home sales - Reuters,-0.964633047580719
DLF,2026-03-16,Motilal Oswal stays 'Neutral' on Dabur amid geopolitical risks; trims EPS - Business Standard,0.7270438075065613
DLF,2026-03-09,(DLF.NS) | Stock Price & Latest News - Reuters,-0.9114468097686768
DLF,2012-10-08,"India's Gandhi family hit by loan row, DLF shares plunge - Reuters",-0.9148908853530884
DLF,2024-01-24,Luxury Real Estate Boom in India Buoys DLF’s Profit to Six-Year High - Bloomberg.com,0.8879794478416443
DLF,2026-03-16,DLF.NS - | Stock Price & Latest News - Reuters,-0.9250365495681763
DLF,2026-03-16,DLF.BO - | Stock Price & Latest News - Reuters,-0.9264214038848877
DLF,2017-09-02,DLF Limited - bsmedia.business-standard.com,-0.9519363641738892
DLF,2008-06-11,"DLF Falls, Biggest Drop on India's Benchmark, After Rate Rise - Bloomberg.com",-0.9279038310050964
DLF,2018-09-16,DLF CEMENTS LIMITED - The Economic Times,-0.9192478060722351
DLF,2026-01-22,DLF's net profit up 13.66% in Q3 FY26 - ET Realty,0.9549547433853149
DLF,2026-03-16,(DLF.M3) | Stock Price & Latest News - Reuters,-0.9130498170852661
DLF,2018-09-14,DLF GENERAL FINANCE LTD - The Economic Times,-0.9199388027191162
DLF,2025-06-18,Indian developer DLF clocks $1.3 billion from luxury project sellout - Reuters,-0.8468708992004395
DLF,2008-07-14,"DLF, Unitech, Parsvnath Developers Downgraded By Credit Suisse - Bloomberg.com",-0.7402705550193787
DLF,2023-08-10,India's DLF to foray into hospital space - Reuters,-0.8197546005249023
DLF,2025-10-30,DLF's net profit dips 14.56% in Q2 FY26 - ET Realty,-0.9738326668739319
DLF,2025-07-17,India's DLF says will consider partnerships as embarks on Mumbai luxury development - Reuters,-0.8228404521942139
DLF,2026-03-16,DLF.M3 - | Stock Price & Latest News - Reuters,-0.9322327971458435
DLF,2025-07-13,DLF reports 32% jump in consolidated revenue in FY25 - ET Realty,0.951548159122467
DLF,2014-10-26,"DLF slumps over 8 percent, Jindal Steel falls 7.5 percent - Reuters",-0.938093364238739
DLF,2025-07-14,DLF Chairman Rajiv Singh's remuneration rises 34% to Rs 36.65 cr last fiscal - ETHRWorld.com,0.8824625611305237
DLF,2025-01-24,DLF clocks record bookings in $4 billion 'super luxury' home project as rich Indians splurge - Reuters,0.7731016278266907
DLF,2016-09-28,"DLF is India's top real estate brand, followed by Godrej Properties & Lodha Group: Report - ET Realty",-0.7635121941566467
DLF,2025-03-24,DLF - bsmedia.business-standard.com,-0.9497054815292358
DLF,2025-02-09,"DLF Cyber City Developers' rental income rises 10% to nearly Rs 1,200 crore in Q3 FY25 - ET Realty",0.9528141021728516
DLF,2007-08-09,Indian realty firm DLF raises $2.25 bln in IPO - Reuters,0.5502606630325317
DLF,2022-12-26,"NCLAT sets aside CCI order on DLF, remanded back directing to examine - ETLegalWorld.com",-0.8810563683509827
DLF,2024-07-17,DLF's chairman receives Rs 27.3 crore as remuneration for FY24 - ET Realty,-0.6107766628265381
DLF,2023-03-16,"India's DLF to focus on luxury, premium housing after near-$1 bln project sells out - Reuters",0.6349747180938721
DLF,2024-12-08,DLF: India is coming back to real estate in a 'big way' - CNBC,0.8514674305915833
DLF,2007-08-21,India's DLF gets contract to develop township - Reuters,-0.7935133576393127
DLF,2024-05-16,"DLF Readies to Enter Luxury Housing Markets of Mumbai, Goa - Bloomberg.com",-0.9101759791374207
DLF,2007-08-09,"WEEK AHEAD IN INDIA/NEPAL-DLF IPO, industrial data - Reuters",-0.9216766953468323
DLF,2015-12-20,"DLF reveals the launch date of 1,800 cr shopping mall, DLF Mall of India - ET Retail",-0.9357317686080933
DLF,2025-01-27,DLF's $4 billion luxury Indian project to take four years to build - Reuters,-0.8188061118125916
DLF,2021-02-27,Kushal Pal Singh - The Economic Times,-0.8952476978302002
DLF,2025-06-18,India’s Top Developer’s New $1.3 Billion Luxury Project Sells Out in One Week - Bloomberg.com,-0.9115235209465027
DLF,2019-05-03,"DLF transfers Noida mall to its subsidiary for 2,950 crore - ET Retail",-0.9311493635177612
DLF,2023-12-14,India's Hero MotoCorp names DLF's Vivek Anand as CFO - Reuters,-0.9480890035629272
DLF,2012-08-06,India's DLF net down 18 pct on high finance costs - Reuters,-0.9686389565467834
DLF,2024-12-11,"Tesla restarts search for New Delhi showroom with India's DLF, sources say - Reuters",-0.5723705887794495
DLF,2017-01-30,DLF Noida mall in CBRE list of 22 best global retail projects - ET Realty,-0.7496989965438843
DLF,2019-08-26,Bang in the Middle is DLF Mall of India’s new creative agency - ET BrandEquity,-0.9264401793479919
DLF,2025-05-27,"DLF to invest Rs 10,000 crore by FY27 to build commercial properties, boost rental income - ET Realty",0.8939212560653687
DLF,2013-01-31,DLF says sells part of wind power assets for 2.82 billion rupees - Reuters,-0.9383128881454468
DLF,2019-02-14,DLF Shopping Malls to come up with 3 new shopping centers - ET Retail,-0.6224299669265747
DLF,2019-05-03,"DLF transfers Noida mall to its subsidiary for Rs 2,950 crore - ET Realty",-0.9352980852127075
DLF,2017-09-04,"State Bank Of India Dlf Newtown Bangalore Branch IFSC Code, MICR Code, Address & Phone Number - The Economic Times",-0.9430912733078003
DLF,2024-11-26,"P.F. Chang’s expands to DLF Mall of India, Noida - ET Hospitality",0.5820906162261963
DLF,2022-09-08,"Axis Bank Dlf Phase Iii Branch IFSC Code, MICR Code, Address & Phone Number - The Economic Times",-0.9424688220024109
DLF,2024-05-19,"DLF Cyber City Developers' office rental income rises 7% to Rs 3,460 crore in FY24 - ET Realty",0.9518085718154907
DLF,2026-03-05,SC orders CBI inquiry into DLF's housing project in Gurugram - ET Realty,-0.9163222908973694
DLF,2020-10-21,StanChart to Rent Offices in India Project For One of Its Largest Campuses - Bloomberg.com,-0.8741303086280823
DLF,2017-10-06,"DLF's K P Singh tops realty rich list, M P Lodha second - ET Realty",0.5549934506416321
DLF,2017-10-18,"Axis Bank Dlf Gurgaon Haryana Branch IFSC Code, MICR Code, Address & Phone Number - The Economic Times",-0.9422085285186768
DLF,2019-10-04,No outstanding loans to DLF: Indiabulls Housing Finance - ET Realty,-0.9504125118255615
DLF,2017-09-03,"Yes Bank Dlf Cyber City Gurgaon Branch IFSC Code, MICR Code, Address & Phone Number - The Economic Times",-0.9448153376579285
DLF,2024-12-04,DLF appoints Badal Bagri as CFO - ET Realty,-0.9393647313117981
DLF,2023-03-06,"Nannies on call, spas; India witnessing 'mad rush' for luxury housing - Reuters",-0.7001692652702332
DLF,2017-09-04,"State Bank Of India Dlf Phase Iv Gurgaon Branch IFSC Code, MICR Code, Address & Phone Number - The Economic Times",-0.9421076774597168
DLF,2022-09-09,"Hdfc Bank Dlf Phase I Branch IFSC Code, MICR Code, Address & Phone Number - The Economic Times",-0.9446887969970703
DLF,2022-09-08,"Axis Bank Dlf Shivaji Marg Branch IFSC Code, MICR Code, Address & Phone Number - The Economic Times",-0.939018189907074
DLF,2025-03-09,"DLF to invest Rs 6,000 crore to develop 75 lakh sq ft office, retail spaces in Gurugram - ET Realty",0.6684011816978455
DLF,2022-09-19,"Icici Bank Chennai Dlf It Park Tamil Nadu Branch IFSC Code, MICR Code, Address & Phone Number - The Economic Times",-0.9430119395256042
DLF,2014-10-17,"Banned: Property tycoon KP Singh, who built India's first 'smart' city - Reuters",-0.8413110375404358
