ticker,date,headline,sentiment_score
ENRIN,2011-07-16,Godfrey Phillips India Ltd. - Moneycontrol.com,-0.9486996531486511
ENRIN,2011-12-24,Godawari Power & Ispat Ltd. - Moneycontrol.com,-0.9505295753479004
ENRIN,2025-11-26,ENRIN IN 25Nov25 - images.moneycontrol.com,-0.9423364996910095
ENRIN,2019-01-07,10 years to Satyam: How India's Enron moment unfolded - Moneycontrol.com,-0.9293787479400635
ENRIN,2025-11-25,Siemens Energy India shares fall 6% from day's high after Q4 results; firm announces Rs 4 dividend - Moneycontrol.com,-0.9641638398170471
ENRIN,2025-08-25,"Quarterly Results, Siemens Energy India Financial Statement & Accounts - Moneycontrol.com",-0.9388144016265869
ENRIN,2025-12-12,Accumulate Siemens Energy India; target of Rs 3312: Prabhudas Lilladher - Moneycontrol.com,-0.934971034526825
ENRIN,2025-06-18,Siemens Energy India Ltd. - Moneycontrol.com,-0.9486585259437561
ENRIN,2025-06-24,Siemens Energy India - Moneycontrol.com,-0.9465032815933228
ENRIN,2025-09-25,Hold Siemens Energy India; target of Rs 3360: Prabhudas Lilladher - Moneycontrol.com,-0.9379675984382629
ENRIN,2025-06-19,Siemens Energy India Ltd. - Moneycontrol.com,-0.9486585259437561
ENRIN,2025-06-22,Siemens Energy India - Moneycontrol.com,-0.9465032815933228
ENRIN,2025-07-08,Buy Siemens Energy India; target of Rs 3300: Motilal Oswal - Moneycontrol.com,-0.9345227479934692
ENRIN,2025-06-22,Siemens Energy India - Moneycontrol.com,-0.9465032815933228
ENRIN,2025-08-05,Buy Siemens Energy India; target of Rs 3600: Motilal Oswal - Moneycontrol.com,-0.9359934329986572
ENRIN,2026-02-16,Accumulate Siemens Energy India; target of Rs 3145: Prabhudas Lilladher - Moneycontrol.com,-0.9376192092895508
ENRIN,2025-06-19,Siemens Energy India Ltd. - Moneycontrol.com,-0.9486585259437561
ENRIN,2026-03-07,"Transmission and powergen demand lift capital goods; Siemens Energy, KOEL in focus - The Economic Times",-0.8747896552085876
ENRIN,2025-06-18,"Siemens Energy India Key Financial Ratios, Siemens Energy India Financial Statement & Accounts - Moneycontrol.com",-0.9418995380401611
ENRIN,2025-09-22,"siemens Forum Discussion on Market View, Business sectors,Stocks, Commodity, Personal Finance & More - Moneycontrol.com",-0.9474851489067078
ENRIN,2026-01-27,Buy Siemens Energy India; target of Rs 3400: Motilal Oswal - Moneycontrol.com,-0.9356760382652283
ENRIN,2025-06-18,"Siemens Energy India Profit & Loss account, Siemens Energy India Financial Statement & Accounts - Moneycontrol.com",-0.77727210521698
ENRIN,2013-02-08,Siemens Ltd. - Moneycontrol.com,-0.9503717422485352
ENRIN,2025-06-22,Siemens Energy India vwap live chart | vwap indicator | Volume Weighted Average Price – Moneycontrol - Moneycontrol.com,-0.94237220287323
ENRIN,2011-07-18,Engineers India Ltd. - Moneycontrol.com,-0.9479147791862488
ENRIN,2011-07-20,Entertainment Network India Ltd. - Moneycontrol.com,-0.9486790299415588
ENRIN,2011-07-22,Wockhardt Ltd. - Moneycontrol.com,-0.9437372088432312
ENRIN,2025-11-25,"Siemens Energy Standalone September 2025 Net Sales at Rs 2,645.70 crore, up 27.27% Y-o-Y - Moneycontrol.com",0.9417691230773926
ENRIN,2025-06-18,Siemens Energy India Monthly Technical Analysis | Stochastic RSI indicators - Moneycontrol.com,-0.9216775894165039
ENRIN,2024-10-11,Indian Energy Exchange vwap live chart | vwap indicator | Volume Weighted Average Price – Moneycontrol - Moneycontrol.com,-0.9440898299217224
ENRIN,2026-03-09,"Stock Price, Market Indices, Price, Stock Performance & Comparison - Moneycontrol.com",-0.9366623759269714
ENRIN,2024-09-12,Sanofi Consumer Healthcare India Ltd. - Moneycontrol.com,-0.9462011456489563
ENRIN,2024-11-09,Crorepati Dreams? Recognize these 8 behavioural biases to build lasting wealth - The Economic Times,-0.8694623708724976
ENRIN,2025-11-25,"Siemens Energy India shares rally 4% post robust Q4, strong order book - The Economic Times",0.9436745643615723
ENRIN,2026-02-18,Siemens Energy India - 9 large-cap stocks where DIIs are trimming their stakes in Q3 - The Economic Times,-0.8393955826759338
ENRIN,2025-06-19,"Siemens Energy shares list at Rs 2,850 on BSE after demerger; growth prospects bullish - The Economic Times",-0.4748905897140503
ENRIN,2025-06-19,Siemens Energy may see up to $180 million in outflows after MSCI exit - The Economic Times,-0.6017871499061584
ENRIN,2026-01-21,"ITC, Siemens Energy India and 8 other stocks hit 52-week lows; slip up to 20% in a month - The Economic Times",-0.9664092063903809
ENRIN,2025-06-19,"Siemens Energy shares zoom 5%, hit upper circuit post listing; brokerages project 30% upside - The Economic Times",0.8572829365730286
