ticker,date,headline,sentiment_score
ENRIN,2026-03-17,Biggest takeaways from Nvidia GTC 2026 - CNBC,-0.883185863494873
ENRIN,2025-06-18,"Siemens Energy India Share Price Today, Siemens Energy India Stock Price Live NSE/BSE Updates - The Economic Times",-0.942582905292511
ENRIN,2025-06-21,ENRIN: Siemens Energy India Ltd Stock Price Quote - Natl India - Bloomberg - Bloomberg.com,-0.950346827507019
ENRIN,2025-06-24,Check out Siemens Energy India Ltd's stock price (ENRIN-IN) in real time - CNBC,-0.9476624727249146
ENRIN,2025-06-23,Stock Research Report for Siemens Energy India Ltd - The Economic Times,-0.9288367629051208
ENRIN,2026-03-20,"Siemens Share Price Today, Siemens Stock Price Live NSE/BSE Updates - The Economic Times",-0.9404165744781494
ENRIN,2021-11-29,"ABB Power Share Price Today, ABB Power Stock Price Live NSE/BSE Updates - The Economic Times",-0.9380207657814026
ENRIN,2024-02-14,Lyft CEO takes blame for 'extra zero that slipped into' earnings release - CNBC,-0.5979558825492859
ENRIN,2025-02-12,Lyft shares sink nearly 8% on underwhelming fourth-quarter results - CNBC,-0.9546999931335449
ENRIN,2018-03-05,"HDB Financial Servic Share Price Today, HDB Financial Servic Stock Price Live NSE/BSE Updates - The Economic Times",-0.9433214664459229
ENRIN,2024-02-13,Lyft shares pull way back after CFO corrects major earnings release error - CNBC,-0.5410787463188171
ENRIN,2015-12-03,Is this the worst analyst call of all time? - CNBC,-0.823469877243042
ENRIN,2024-03-22,"Enfuse Solutions Share Price Today, Enfuse Solutions Stock Price Live NSE/BSE Updates - The Economic Times",-0.9401891231536865
ENRIN,2025-11-06,Lyft CFO Erin Brewer on Q3 results: Our marketplace has never been healthier - CNBC,-0.8160468339920044
ENRIN,2021-07-30,Gibbs Wealth Management's Erin Gibbs on companies' overall earnings performance - CNBC,-0.8823187947273254
ENRIN,2019-08-15,GE falls the most in 11 years after Madoff whistleblower calls it a 'bigger fraud than Enron' - CNBC,-0.9291142225265503
ENRIN,2025-10-26,Earnings playbook: Five 'Magnificent Seven' members are set to report in busy week - CNBC,-0.9074388742446899
ENRIN,2017-04-09,"Eicher Motors Share Price Today, Eicher Motors Stock Price Live NSE/BSE Updates - The Economic Times",-0.9403820037841797
ENRIN,2023-05-24,American Eagle Outfitters shares sink as retailer lowers forecast - CNBC,-0.8747504353523254
ENRIN,2024-02-14,"Lyft shares jump over 35%, retaining some gains after forecast error - CNBC",0.8263142704963684
ENRIN,2019-02-21,"Kraft Heinz shares tank after company writes down two iconic brands, slashes dividend and discloses SEC subpoena - CNBC",-0.9535009860992432
ENRIN,2026-01-06,SlateStone’s Erin Gibbs flags a market regime shift toward earnings in 2026 - CNBC,-0.7584840655326843
ENRIN,2017-06-19,"Eris Lifesciences Share Price Today, Eris Lifesciences Stock Price Live NSE/BSE Updates - The Economic Times",-0.9425890445709229
ENRIN,2023-05-25,"Dollar Tree shares plunge after company misses on earnings, slashes full-year profit outlook - CNBC",-0.9549494981765747
ENRIN,2025-07-30,Bunge Banks on Viterra to Revive Profits After Slump - Bloomberg.com,0.7197935581207275
ENRIN,2018-09-14,ENRON SECURITIES PRIVATE LIMITED - The Economic Times,-0.9366278052330017
ENRIN,2025-08-18,"Dog days of earnings season, alternative investing woes, the new smartphone war and more in Morning Squawk - CNBC",-0.832330584526062
ENRIN,2021-01-18,Check out Erin Energy Corp's stock price (ERINQ) in real time - CNBC,-0.9452136754989624
ENRIN,2025-08-05,5 things to know before the Tuesday open: Palantir earnings | ChatGPT's next milestone | Trump applauds American Eagle - CNBC,-0.8855404853820801
ENRIN,2023-01-27,Big Oil poised to smash annual profit records — sparking outcry from campaigners and activists - CNBC,-0.7030192613601685
ENRIN,2026-01-28,"The Fed meeting, Starbucks earnings, Amazon layoffs and more in Morning Squawk - CNBC",-0.8617620468139648
ENRIN,2025-08-27,Wall Street Awaits Nvidia’s Results After 90% Jump: Markets Wrap - Bloomberg.com,-0.8906998038291931
ENRIN,2025-05-29,5 things to know before the stock market opens Thursday - CNBC,-0.9296842813491821
ENRIN,2019-10-28,"Google parent Alphabet makes offer to buy Fitbit, sending stock soaring - CNBC",-0.7920766472816467
ENRIN,2025-07-16,5 things to know before the stock market opens Wednesday - CNBC,-0.9291952848434448
ENRIN,2025-07-21,5 things to know before the stock market opens on Monday - CNBC,-0.931956946849823
ENRIN,2025-07-15,5 things to know before the stock market opens Tuesday - CNBC,-0.9290711879730225
ENRIN,2025-09-04,"Trump's Supreme Court request, American Eagle's rally, lackluster labor data and more in Morning Squawk - CNBC",-0.6241565346717834
ENRIN,2025-03-26,Dollar Tree says it's winning over higher-income shoppers and may offset tariffs with price hikes - CNBC,0.8350386619567871
ENRIN,2019-08-17,"GE stock is fast recovering, but short seller investigator Harry Markopolos got his digs in - CNBC",-0.8585811257362366
ENRIN,2025-07-23,Morgan Stanley's highest conviction picks into earnings - CNBC,-0.9041723608970642
ENRIN,2025-11-11,'Big Short' investor Michael Burry accuses AI hyperscalers of artificially boosting earnings - CNBC,-0.49043917655944824
ENRIN,2020-04-14,UnitedHealth kicks off key health-care earnings season - CNBC,-0.7606154084205627
ENRIN,2025-07-28,"5 things to know before the Monday open: EU trade deal, all-time high streak, 'quishing' - CNBC",-0.8474156260490417
ENRIN,2025-11-25,Nvidia name-checks Michael Burry in secret memo pushing back on AI bubble allegations - CNBC,-0.7519422769546509
ENRIN,2025-07-14,5 things to know before the stock market opens Monday - CNBC,-0.9309641718864441
ENRIN,2023-04-11,Morgan Stanley named this health stock a top pick because of its business diversification - CNBC,-0.6921087503433228
ENRIN,2026-01-15,JB Hunt Drops After Revenue Miss Extends Freight Slump - Bloomberg.com,-0.9382286667823792
ENRIN,2021-12-02,"Twenty years after epic bankruptcy, Enron leaves a complex legacy - CNBC",-0.8722078204154968
ENRIN,2025-08-25,Stocks Halt Rally as Yields Rise Before Price Data: Markets Wrap - Bloomberg.com,-0.8463907837867737
ENRIN,2019-02-22,Wall Street doubts Kraft Heinz after it writes down two of its best known brands - CNBC,-0.9600207209587097
ENRIN,2022-02-03,Facebook's $232 billion fall sets record for largest one-day value drop in stock market history - CNBC,-0.9044363498687744
ENRIN,2022-05-31,"Watch CNBC’s full discussion with Eugene Profit, Erin Brown and Eric Johnston - CNBC",-0.9448044896125793
ENRIN,2025-05-06,ADM Profits Shrink to Lowest Since 2020 Amid Trade Uncertainty - Bloomberg.com,-0.962790846824646
ENRIN,2021-11-22,Check out IREN Ltd's stock price (IREN) in real time - CNBC,-0.94521164894104
ENRIN,2019-08-15,Read the full report from the Madoff whistleblower accusing GE of an Enron-like fraud - CNBC,-0.8449716567993164
ENRIN,2019-02-12,"Stock buyback ban would backfire and lead more companies to go private, Canaccord says - CNBC",-0.7880864143371582
ENRIN,2025-08-05,Crop Trader ADM Cuts Outlook as Trade Uncertainty Persists - Bloomberg.com,-0.49017706513404846
ENRIN,2019-04-23,Why Tesla is such a battleground stock - CNBC,-0.9298369884490967
ENRIN,2019-08-15,GE Whistleblower Report - fm.cnbc.com,-0.8911662101745605
ENRIN,2025-03-21,"Elon Musk tells Tesla employees 'hang onto your stock,' urges vandals to 'stop being psycho' - CNBC",-0.7595106363296509
ENRIN,2025-08-21,"Avoid these stocks that saw ‘double misses’ this earnings season, Wolfe Research warns - CNBC",-0.49968454241752625
ENRIN,2002-08-04,What's AOL Time Warner's Net Worth? - Bloomberg.com,-0.9500806331634521
ENRIN,2025-08-10,"Nvidia and AMD to pay 15% of China chip sales revenues to the U.S. government, FT reports - CNBC",-0.9066790342330933
ENRIN,2025-07-29,5 things to know before the Tuesday open: Another record | Baseline tariffs | Fed meeting ruling - CNBC,-0.9307258725166321
ENRIN,2021-12-02,Watch CNBC's full interview with Kynikos' Jim Chanos and journalist Bethany McLean on Enron's fall - CNBC,-0.9445695877075195
ENRIN,2025-11-07,KKR Credit Fuels Best Fundraising in Four Years as Profits Rise - Bloomberg.com,0.7510069608688354
ENRIN,2025-07-22,These charts show just how hard Trump’s tariffs are hitting Europe’s auto giants - CNBC,-0.7203354239463806
ENRIN,2026-03-17,Kelly Evans: The fight between public and private - CNBC,-0.9134832620620728
ENRIN,2019-03-23,Former Enron CEO Jeffrey Skilling wants back into the energy business - CNBC,-0.9340512752532959
ENRIN,2011-12-02,"Ten Years Later, Some Press a Different View of Enron - CNBC",-0.9004918932914734
ENRIN,2025-04-12,"Trump exempts phones, computers, chips from new tariffs - CNBC",-0.8142284154891968
ENRIN,2025-08-05,"Apollo Draws $61 Billion in Record Quarter, But Less From Wealth - Bloomberg.com",-0.9305947422981262
ENRIN,2025-09-18,Powell’s Path Might Be Just Fine for Stock and Bond Prices - Bloomberg.com,-0.9073262810707092
ENRIN,2025-09-30,"Shutdown repercussions, OpenAI's shopping chatbot, Coach coffee shops and more in Morning Squawk - CNBC",-0.8031393885612488
ENRIN,2025-09-10,"Jobs data revisions, Lisa Cook's firing blocked, Klarna prices IPO and more in Morning Squawk - CNBC",-0.7579255700111389
ENRIN,2025-09-16,"Federal Reserve meeting, TikTok deal 'framework,' tech rally and more in Morning Squawk - CNBC",-0.9199891090393066
ENRIN,2008-06-12,"Lehman Shakes Up Top Brass, But Investors Wary - CNBC",-0.5370214581489563
ENRIN,2019-03-29,"If you invested $1,000 in Chipotle 10 years ago, here's how much you'd have now - CNBC",-0.9430267810821533
ENRIN,2019-08-15,GE CEO Larry Culp bought nearly $2 million worth of the company's stock after fraud accusation - CNBC,-0.9010183811187744
ENRIN,2021-03-26,Check out Galaxy Digital's stock price (GLXY) in real time - CNBC,-0.9460235238075256
ENRIN,2022-02-10,Cannabis ETFs have made a double-digit comeback in recent weeks. What managers are saying - CNBC,-0.744744062423706
ENRIN,2025-09-13,UnitedHealth soars but Berkshire's new stake may still be in the red - CNBC,-0.8647836446762085
ENRIN,2025-09-02,"Tariff legal troubles, Kraft Heinz splits, another Spirit bankruptcy and more in Morning Squawk - CNBC",-0.6306941509246826
ENRIN,2020-01-21,David Einhorn says the Netflix story is 'busted' and he now has 'substantial' bet against stock - CNBC,-0.8383328914642334
ENRIN,2025-09-21,Top Wall Street analysts recommend these dividend stocks for income investors - CNBC,-0.9219308495521545
ENRIN,2013-06-20,Former Enron CEO Skilling to Ask for Early Prison Release - CNBC,-0.8025410771369934
ENRIN,2021-12-02,Enron turned obscure businesspeople into household names. Here's where they are now - CNBC,-0.910576343536377
ENRIN,2025-08-20,"Jackson Hole, Target's next CEO, tech's market rout and more in Morning Squawk - CNBC",-0.9239426851272583
ENRIN,2025-02-11,Lyft's first-quarter bookings forecast pressured by fierce competition with Uber - Reuters,-0.9753233790397644
ENRIN,2025-08-11,5 things to know before the Monday open: Chipmakers and China | Apple's run | 'Loud luxury' - CNBC,-0.9320962429046631
ENRIN,2011-02-08,Former Enron CEO Denied Release to Attend Son's Funeral - CNBC,-0.8241732120513916
ENRIN,2002-04-28,Commentary: Was Jack Welch's Run All It Was Cracked Up to Be? - Bloomberg.com,-0.9123985767364502
ENRIN,2021-11-17,Former Theranos patient testifies that a blood test at Walgreens came back with false positive for HIV - CNBC,-0.4788450598716736
ENRIN,2025-09-18,How an Enron Parody Turned Into a Financial Mess of Its Own - Bloomberg.com,-0.755464494228363
ENRIN,2024-06-18,"Nvidia’s 591,078% Rally to Most Valuable Stock Came in Waves - Bloomberg.com",-0.7744008302688599
