ticker,date,headline,sentiment_score
GAIL,2026-04-06,Swiggy among 4 stocks that closed crossing above VWAP - The Economic Times,-0.7832708358764648
GAIL,2026-04-06,"Persistent Systems - Mahindra, Billionbrains Garage among 6 stocks flashing bullish signals - The Economic Times",-0.8505887985229492
GAIL,2026-04-06,"mahavir jayanti correct date 2026: Latest News & Videos, Photos about mahavir jayanti correct date 2026 - The Economic Times",-0.9428157806396484
GAIL,2026-04-07,7 egg breakfasts for energetic workdays - The Economic Times,-0.8953174352645874
GAIL,2026-04-07,Meta to release open source versions of its upcoming AI models - The Economic Times,-0.8942826986312866
GAIL,2026-04-06,"India logs record 6.05 GW wind capacity addition in FY26, up 46% YoY - The Economic Times",0.9486021995544434
GAIL,2026-04-06,Coal offtake under watch as industry builds stocks - The Economic Times,-0.9021755456924438
GAIL,2026-04-06,"vishal mega mart ltd q2 results: Latest News & Videos, Photos about vishal mega mart ltd q2 results - The Economic Times",-0.9355398416519165
GAIL,2026-04-06,"puc result 2026: Latest News & Videos, Photos about puc result 2026 - The Economic Times",-0.936823308467865
GAIL,2026-04-06,"kseab karnataka gov in: Latest News & Videos, Photos about kseab karnataka gov in - The Economic Times",-0.9365240335464478
GAIL,2026-04-07,KSEAB KARNATAKA GOV IN AND KARRESULTS NIC IN - The Economic Times,-0.9283360838890076
GAIL,2026-04-06,"aiadmk candidates chennai 2026: Latest News & Videos, Photos about aiadmk candidates chennai 2026 - The Economic Times",-0.9349114298820496
GAIL,2026-04-06,"maharashtra rte merit list 2026: Latest News & Videos, Photos about maharashtra rte merit list 2026 - The Economic Times",-0.9367055892944336
GAIL,2026-04-06,"jujutsu kaisen season 3 review: Latest News & Videos, Photos about jujutsu kaisen season 3 review - The Economic Times",-0.9328165054321289
GAIL,2026-04-06,"zodiac predictions february 2026: Latest News & Videos, Photos about zodiac predictions february 2026 - The Economic Times",-0.9356510043144226
GAIL,2026-04-06,"maharashtra rte lottery result 226: Latest News & Videos, Photos about maharashtra rte lottery result 226 - The Economic Times",-0.9390283823013306
GAIL,2026-04-06,"scorpio love horoscope april 2026: Latest News & Videos, Photos about scorpio love horoscope april 2026 - The Economic Times",-0.9303535223007202
GAIL,2026-04-06,"mi vs kkr ipl 2026: Latest News & Videos, Photos about mi vs kkr ipl 2026 - The Economic Times",-0.9356280565261841
GAIL,2026-04-06,"jujutsu kaisen culling game part 1: Latest News & Videos, Photos about jujutsu kaisen culling game part 1 - The Economic Times",-0.9335049390792847
GAIL,2026-04-06,"ncis 500th episode: Latest News & Videos, Photos about ncis 500th episode - The Economic Times",-0.9342511296272278
GAIL,2025-05-14,GAIL Ltd - bsmedia.business-standard.com,-0.9493972063064575
GAIL,2025-07-28,GAIL India posts bigger-than-expected drop in quarterly profit on higher input costs - Reuters,-0.9670614004135132
GAIL,2017-07-31,Check out Gail (India) Ltd's stock price (GAIL-IN) in real time - CNBC,-0.9440620541572571
GAIL,2025-05-13,"GAIL (India)'s quarterly profit falls more than expected on lower gas margins, cost pressures - Reuters",-0.9740412831306458
GAIL,2025-11-28,GAIL (India)| BUY - bsmedia.business-standard.com,-0.9472134113311768
GAIL,2020-10-06,"GAIL Q1 Results: Cons PAT soars 78% YoY to Rs 3,183 crore; revenue rises 6% - The Economic Times",0.9472060203552246
GAIL,2019-09-10,"gail india ltd q4 results: Latest News & Videos, Photos about gail india ltd q4 results - The Economic Times",-0.9336310625076294
GAIL,2020-10-05,"GAIL Q4 Results: Profit grows over 3x to Rs 2,177 crore; revenue drops 2% - The Economic Times",-0.9714051485061646
GAIL,2017-07-30,GAIL (India) Ltd. - The Economic Times,-0.9152386784553528
GAIL,2017-07-19,"GAIL Share Price Today, GAIL Stock Price Live NSE/BSE Updates - The Economic Times",-0.9337294697761536
GAIL,2017-07-30,"GAIL Cash Flow, Financial Statements - The Economic Times",-0.9177282452583313
GAIL,2023-09-11,GAIL India poised for sustained outperformance with multiple growth drivers: Report - ET EnergyWorld,0.67995285987854
GAIL,2025-05-13,"GAIL posts record ₹11,312 crore PAT in FY25; revenue rises 5% to ₹1.37 lakh crore - ET EnergyWorld",0.94736647605896
GAIL,2021-06-17,GAIL (India) Ltd - Reuters,-0.9431967735290527
GAIL,2019-09-10,"gail india ltd q2 results: Latest News & Videos, Photos about gail india ltd q2 results - The Economic Times",-0.9335446357727051
GAIL,2014-03-15,GAIL: GAIL India Ltd Stock Price Quote - Natl India - Bloomberg - bloomberg.com,-0.9467085003852844
GAIL,2021-10-29,"GAIL Q2 results: Net profit doubles to Rs 2,863 crore - ET EnergyWorld",0.8285730481147766
GAIL,2019-08-09,"GAIL Q1 net profit increases 4.22% to Rs 1,504 crore - ET EnergyWorld",0.950038492679596
GAIL,2022-06-09,GAIL.NS - Reuters,-0.9457980990409851
GAIL,2022-10-03,"Natural gas price increase negative for GAIL, IGL, marginal beneficiary is RIL - ET EnergyWorld",-0.4263608455657959
GAIL,2025-10-31,"GAIL Q2 net profit falls 18% to ₹2,823 crore as petrochemical margins weaken - ET EnergyWorld",-0.969841480255127
GAIL,2023-01-30,India's GAIL Q3 profit slumps on supply hit - Reuters,-0.9566097855567932
GAIL,2025-01-30,"GAIL reports ₹1.01 lakh crore revenue in nine months, PAT up 39% - ET EnergyWorld",0.9005821943283081
GAIL,2025-11-01,"GAIL reports 17% profit decline in Q2, affected by petrochemical losses - ET EnergyWorld",-0.9745356440544128
GAIL,2019-02-05,GAIL’s net profit up 33 per cent in third quarter - ET EnergyWorld,0.9524632692337036
GAIL,2024-11-05,India's GAIL beats Q2 profit view on natgas marketing boost - Reuters,-0.7725447416305542
GAIL,2024-06-11,"GAIL announces ₹60,000 crore investment for new ethane cracker project in Madhya Pradesh - ET EnergyWorld",0.5972222089767456
GAIL,2024-07-30,GAIL (India) beats Q1 profit view on gas marketing boost - Reuters,-0.7434443235397339
GAIL,2024-11-05,"GAIL's revenue hits Rs 66,622 cr in H1 FY25, profit after tax climbs to Rs 5,396 crore - ET EnergyWorld",0.9050518870353699
GAIL,2018-01-13,"Gail india ltd - Latest gail india ltd , Information & Updates - Energy - ET EnergyWorld",-0.9444062113761902
GAIL,2017-10-15,"Gail - Latest gail , Information & Updates - Energy - ET EnergyWorld",-0.9480478763580322
GAIL,2019-09-10,"gail india ltd q1 results: Latest News & Videos, Photos about gail india ltd q1 results - The Economic Times",-0.9346107244491577
GAIL,2025-08-22,GAIL India unveils AI Tarang to build artificial intelligence literacy among employees - ETHRWorld.com,-0.7966421246528625
GAIL,2020-08-31,"GAIL India looks at petrochemicals, renewables for growth - ET EnergyWorld",-0.8019939661026001
GAIL,2023-01-30,India's GAIL Q3 profit slumps on supply hit - ET EnergyWorld,-0.9672747254371643
GAIL,2020-08-31,"GAIL India looks at petrochemicals, renewables for growth - ET Auto",-0.7735176086425781
GAIL,2026-03-05,India's GAIL weighs supply cuts to gas customers after Petronet LNG force majeure - Reuters,-0.7728021144866943
GAIL,2024-06-30,GAIL's Urja Ganga gas pipeline project completion delayed until March 2025 - business-standard.com,-0.9232569336891174
GAIL,2025-01-30,"GAIL India's pre-tax adjusted profit falls on higher costs, muted volume growth - Reuters",-0.9653514623641968
GAIL,2026-03-28,GAIL.BO - | Stock Price & Latest News - Reuters,-0.922387421131134
GAIL,2022-11-04,GAIL India's profit tumbles on supply cut from former Gazprom unit - Reuters,-0.9565098881721497
GAIL,2023-05-18,"Gail India's profit slumps 77% as petrochemicals drag, expenses jump - Reuters",-0.9629434943199158
GAIL,2024-05-27,GAIL's 10 MW green hydrogen plant in Madhya Pradesh inaugurated - ET EnergyWorld,-0.8632621765136719
GAIL,2023-11-14,"GAIL does world's first ship-to-ship LNG transfer, cuts CO2 emissions - ET EnergyWorld",0.5082876682281494
GAIL,2026-03-11,"India GAIL buys Oman LNG cargo, sources say - Reuters",-0.7867885828018188
GAIL,2014-03-24,GAID: GAIL India Ltd Stock Price Quote - London Intl - Bloomberg - bloomberg.com,-0.9476147294044495
GAIL,2023-02-16,India's GAIL explores up to 26% equity stake in U.S. LNG projects - Reuters,-0.8674131035804749
GAIL,2023-10-31,GAIL India posts Q2 profit beat on gas transmission volume strength - Reuters,0.5480536818504333
GAIL,2024-01-05,India's GAIL signs 10-yr LNG purchase deal with Vitol - Reuters,0.8185357451438904
GAIL,2023-01-16,GAIL India seeks two LNG cargoes for February delivery - sources - Reuters,-0.9152669906616211
GAIL,2023-11-22,PEDA signs pact with GAIL to set up 10 compressed biogas projects in Punjab - ET EnergyWorld,0.8455578684806824
GAIL,2026-03-03,"West Asia crisis: GAIL, IOC cut industrial gas supplies as Qatar halts LNG output - ET EnergyWorld",-0.9634990096092224
GAIL,2026-03-09,"India's GAIL seeks LNG cargo for March delivery, say industry sources - Reuters",-0.9125019907951355
GAIL,2022-08-02,India's GAIL rationing gas as former Gazprom unit cuts supplies - Reuters,-0.9244359135627747
GAIL,2026-03-01,Deepak Gupta takes over as chairman and managing director of GAIL - business-standard.com,-0.9466841220855713
GAIL,2025-08-13,"GAIL, TruAlt Bioenergy form joint venture to boost compressed biogas sector - ET EnergyWorld",0.8425062298774719
GAIL,2022-10-20,GAIL India issues swap tender for four cargoes - Reuters,-0.9071799516677856
GAIL,2019-08-27,GAIL to spend Rs 751 crore to add new unit at petrochemical complex in Uttar Pradesh - ET EnergyWorld,0.675468921661377
GAIL,2025-03-19,"GAIL India to seek three LNG cargoes per year for three years, says chairman - Reuters",-0.6617944240570068
GAIL,2025-06-06,GAIL India's Dabhol LNG terminal goes all-weather with first monsoon cargo - Reuters,-0.8432888984680176
GAIL,2024-01-29,GAIL India tops Q3 profit view on gas transmission growth - Reuters,-0.8263837099075317
GAIL,2022-08-05,"GAIL faces profit hit over gas supply cut, says finance chief - ET EnergyWorld",-0.9424622058868408
GAIL,2025-08-07,"ND/GAIL/SECTT/2025 August 07, 2025 1. Listing Compliance National Stock Exchange of India Limited Exchange Plaza, 5th Floor, - bsmedia.business-standard.com",-0.9501191973686218
GAIL,2019-07-23,State-owned GAIL hires LNG ship from Mitsui for ferrying US gas - ET EnergyWorld,-0.7679591774940491
GAIL,2026-01-01,"GAIL Gas cuts CNG, PNG prices by ₹1 after pipeline tariff rationalisation - ET EnergyWorld",0.520055890083313
GAIL,2025-04-11,Indian gas firm GAIL seeks 26% stake in US LNG - Reuters,-0.8895444869995117
GAIL,2019-07-25,IOC/BPCL-GAIL M&A deal on govt’s agenda this fiscal - ET EnergyWorld,-0.806805431842804
GAIL,2023-06-14,"Russia's Yamal LNG to resume LNG supplies to India's GAIL, Kommersant reports - Reuters",-0.4975278377532959
GAIL,2025-02-10,India's GAIL revives plan to buy US LNG as Trump ends ban on export permits - Reuters,-0.6564128994941711
GAIL,2026-02-09,"GAIL Rs 600 Billion Ethane Cracking Unit in Sehore, Madhya Pradesh: Project Details & Timeline - The Economic Times B2B",-0.9292771220207214
GAIL,2022-08-04,India’s GAIL faces profit hit over gas supply cut - Reuters,-0.9310796856880188
GAIL,2024-05-16,GAIL (India) misses Q4 profit estimates as gas marketing segment weighs - Reuters,-0.8182834982872009
GAIL,2018-06-20,GAIL Gas partners with UBER to promote CNG ecosystem in India - ET EnergyWorld,0.7971510887145996
GAIL,2025-04-12,GAIL floats tender for 26% stake in LNG project in US - ET EnergyWorld,-0.8350486159324646
GAIL,2022-06-22,India's GAIL to enter gas liquefaction for retail sales - Reuters,-0.9068907499313354
GAIL,2023-01-30,Russian gas supply hit pushes India's GAIL to scout for long-term LNG - Reuters,-0.8646939396858215
GAIL,2025-07-09,Gail India extends gas purchase agreement with Oil India for 15 years - Reuters,0.5470547676086426
GAIL,2025-07-15,"India's GAIL in initial talks for long-term LNG deal with Alaska LNG, sources say - Reuters",-0.7950240969657898
