ticker,date,headline,sentiment_score
GAIL,2026-03-30,"Over 30k homes get PNG in Patna, GAIL plans expansion - ET EnergyWorld",-0.7321538329124451
GAIL,2026-04-03,Informal sector steps up coal stocking over price concerns - The Economic Times,-0.4943094849586487
GAIL,2026-04-03,Bank CASA ratio falls to two-year low of 37.9% in December quarter: RBI Data - The Economic Times,-0.9520525336265564
GAIL,2026-04-02,India looks to turn LPG import crisis into push for piped gas - Reuters,-0.8202590346336365
GAIL,2026-04-04,"itc hotels ltd q2 results: Latest News & Videos, Photos about itc hotels ltd q2 results - The Economic Times",-0.9364808797836304
GAIL,2026-04-04,"ETtech Deals Digest: Startups raise $187 million this week, down 28% on-year - The Economic Times",-0.9733304977416992
GAIL,2026-04-03,"mp board result 2026 class 5: Latest News & Videos, Photos about mp board result 2026 class 5 - The Economic Times",-0.9412900805473328
GAIL,2026-04-04,Who are Delve founders Karun Kaushik and Selin Kocalar? - The Economic Times,-0.9348270893096924
GAIL,2026-04-04,Kotak Multi Asset Active FoF Regular-IDCW - The Economic Times,-0.9110361933708191
GAIL,2026-04-04,Artemis II mission: NASA shares first images of Earth by astronauts aboard - The Economic Times Video | ET Tv - The Economic Times,-0.910578727722168
GAIL,2026-04-04,RBI revises rules for Floating Rate Savings Bonds 2020: Key changes investors should know - The Economic Times,-0.9300522208213806
GAIL,2026-04-04,DHURANDHAR 2 OPENING WEEKEND COLLECTION - The Economic Times,-0.9169645309448242
GAIL,2026-04-03,"why dhurandhar 2 tickets cancelled: Latest News & Videos, Photos about why dhurandhar 2 tickets cancelled - The Economic Times",-0.9270188212394714
GAIL,2026-04-04,"oscars 2026 kpop demon hunters: Latest News & Videos, Photos about oscars 2026 kpop demon hunters - The Economic Times",-0.9352432489395142
GAIL,2026-04-04,"oil price march 24: Latest News & Videos, Photos about oil price march 24 - The Economic Times",-0.9361136555671692
GAIL,2026-04-04,'LDF will be out of power': PM Modi says corruption is a key obstacle to Kerala's growth - The Economic Times,-0.6702951192855835
GAIL,2026-04-04,ITR changes from April 2026: 5 key updates for Tax Year 2026–27 explained - The Economic Times,-0.9162776470184326
GAIL,2026-04-04,LIVE KERALA LOTTERY RESULT BHAGYATHARA BT 46 - The Economic Times,-0.9168386459350586
GAIL,2026-04-04,"puducherry assembly polls 2023: Latest News & Videos, Photos about puducherry assembly polls 2023 - The Economic Times",-0.9381169676780701
GAIL,2026-04-04,"24k gold prices: Latest News & Videos, Photos about 24k gold prices - The Economic Times",-0.9361081123352051
GAIL,2026-04-03,"australian open 2026: Latest News & Videos, Photos about australian open 2026 - The Economic Times",-0.9352359175682068
GAIL,2026-04-04,"winter olympics 2026 opening ceremony: Latest News & Videos, Photos about winter olympics 2026 opening ceremony - The Economic Times",-0.9342475533485413
GAIL,2026-04-04,"government offices april 9: Latest News & Videos, Photos about government offices april 9 - The Economic Times",-0.9257012009620667
GAIL,2026-04-04,"indian premier league 2026: Latest News & Videos, Photos about indian premier league 2026 - The Economic Times",-0.9362003803253174
GAIL,2026-04-04,"operation cyber hawk 3 0: Latest News & Videos, Photos about operation cyber hawk 3 0 - The Economic Times",-0.9341831803321838
GAIL,2026-04-04,"powerball march 23 drawing: Latest News & Videos, Photos about powerball march 23 drawing - The Economic Times",-0.9296663403511047
GAIL,2026-04-04,"aquarius love horoscope april 2026: Latest News & Videos, Photos about aquarius love horoscope april 2026 - The Economic Times",-0.9349830150604248
GAIL,2026-04-04,EASY HOMEMADE CHOCOLATES FOR CHOCOLATE DAY 2026 - The Economic Times,-0.9211908578872681
GAIL,2026-04-04,"bt46 lottery result: Latest News & Videos, Photos about bt46 lottery result - The Economic Times",-0.9387406706809998
GAIL,2026-04-04,"rcb tickets 2026: Latest News & Videos, Photos about rcb tickets 2026 - The Economic Times",-0.9385147094726562
GAIL,2026-04-04,"astrology february 2026: Latest News & Videos, Photos about astrology february 2026 - The Economic Times",-0.937063992023468
GAIL,2026-04-04,"budget 2026 middle class impact: Latest News & Videos, Photos about budget 2026 middle class impact - The Economic Times",-0.920911431312561
GAIL,2026-04-04,"India’s crude oil supply fully secured, no payment hurdle for Iranian imports: Petroleum Ministry - The Economic Times",-0.900404155254364
GAIL,2026-04-03,"'You just lied under oath!': Dems, Bondi get into epic clash over Epstein Files at explosive hearing - The Economic Times",-0.7670228481292725
GAIL,2026-04-04,'Iran’s nuke threat imminent?’: Democrats GRILL Tulsi Gabbard over Trump’s war - The Economic Times,-0.7101824879646301
GAIL,2026-04-04,"iran war 2026: Latest News & Videos, Photos about iran war 2026 - The Economic Times",-0.9338733553886414
GAIL,2026-04-02,"Centre uses LPG import crunch to speed up piped gas adoption, cut imports - Business Standard",-0.5888566374778748
GAIL,2025-05-14,GAIL Ltd - bsmedia.business-standard.com,-0.9493972063064575
GAIL,2024-11-07,GAIL India - bsmedia.business-standard.com,-0.9460340738296509
GAIL,2025-07-28,GAIL India posts bigger-than-expected drop in quarterly profit on higher input costs - Reuters,-0.9670614004135132
GAIL,2017-07-31,Check out Gail (India) Ltd's stock price (GAIL-IN) in real time - CNBC,-0.9440620541572571
GAIL,2025-05-13,"GAIL (India)'s quarterly profit falls more than expected on lower gas margins, cost pressures - Reuters",-0.9740412831306458
GAIL,2025-11-28,GAIL (India)| BUY - bsmedia.business-standard.com,-0.9472134113311768
GAIL,2020-10-06,"GAIL Q1 Results: Cons PAT soars 78% YoY to Rs 3,183 crore; revenue rises 6% - The Economic Times",0.9472060203552246
GAIL,2020-10-05,"GAIL Q4 Results: Profit grows over 3x to Rs 2,177 crore; revenue drops 2% - The Economic Times",-0.9714051485061646
GAIL,2017-07-30,"GAIL (India) News - GAIL (India) Announcement, Latest News on GAIL (India) - The Economic Times - The Economic Times",-0.9308675527572632
GAIL,2017-07-19,"GAIL Share Price Today, GAIL Stock Price Live NSE/BSE Updates - The Economic Times",-0.9337294697761536
GAIL,2023-09-11,GAIL India poised for sustained outperformance with multiple growth drivers: Report - ET EnergyWorld,0.67995285987854
GAIL,2025-05-13,"GAIL posts record ₹11,312 crore PAT in FY25; revenue rises 5% to ₹1.37 lakh crore - ET EnergyWorld",0.94736647605896
GAIL,2021-10-29,"GAIL Q2 results: Net profit doubles to Rs 2,863 crore - ET EnergyWorld",0.8285730481147766
GAIL,2025-11-01,"GAIL reports 17% profit decline in Q2, affected by petrochemical losses - ET EnergyWorld",-0.9745356440544128
GAIL,2019-09-10,"gail india ltd q1 results: Latest News & Videos, Photos about gail india ltd q1 results - The Economic Times",-0.9346107244491577
GAIL,2024-07-31,GAIL IN 31Jul24 - bsmedia.business-standard.com,-0.9455890655517578
GAIL,2022-06-09,GAIL.NS - Reuters,-0.9457980990409851
GAIL,2022-10-03,"Natural gas price increase negative for GAIL, IGL, marginal beneficiary is RIL - ET EnergyWorld",-0.4263608455657959
GAIL,2025-10-31,"GAIL Q2 net profit falls 18% to ₹2,823 crore as petrochemical margins weaken - ET EnergyWorld",-0.969841480255127
GAIL,2023-01-30,India's GAIL Q3 profit slumps on supply hit - Reuters,-0.9566097855567932
GAIL,2024-06-11,"GAIL announces ₹60,000 crore investment for new ethane cracker project in Madhya Pradesh - ET EnergyWorld",0.5972222089767456
GAIL,2019-02-05,GAIL’s net profit up 33 per cent in third quarter - ET EnergyWorld,0.9524632692337036
GAIL,2024-11-05,India's GAIL beats Q2 profit view on natgas marketing boost - Reuters,-0.7725447416305542
GAIL,2021-06-17,GAIL (India) Ltd - Reuters,-0.9431967735290527
GAIL,2025-01-30,"GAIL reports ₹1.01 lakh crore revenue in nine months, PAT up 39% - ET EnergyWorld",0.9005821943283081
GAIL,2024-11-05,"GAIL's revenue hits Rs 66,622 cr in H1 FY25, profit after tax climbs to Rs 5,396 crore - ET EnergyWorld",0.9050518870353699
GAIL,2018-01-13,"Gail india ltd - Latest gail india ltd , Information & Updates - Energy - ET EnergyWorld",-0.9444062113761902
GAIL,2024-07-30,GAIL (India) beats Q1 profit view on gas marketing boost - Reuters,-0.7434443235397339
GAIL,2020-08-31,"GAIL India looks at petrochemicals, renewables for growth - ET EnergyWorld",-0.8019939661026001
GAIL,2023-01-30,India's GAIL Q3 profit slumps on supply hit - ET EnergyWorld,-0.9672747254371643
GAIL,2026-03-05,India's GAIL weighs supply cuts to gas customers after Petronet LNG force majeure - Reuters,-0.7728021144866943
GAIL,2020-08-31,"GAIL India looks at petrochemicals, renewables for growth - ET Auto",-0.7735176086425781
GAIL,2024-06-30,GAIL's Urja Ganga gas pipeline project completion delayed until March 2025 - Business Standard,-0.8713253140449524
GAIL,2025-01-30,"GAIL India's pre-tax adjusted profit falls on higher costs, muted volume growth - Reuters",-0.9653514623641968
GAIL,2023-05-18,"Gail India's profit slumps 77% as petrochemicals drag, expenses jump - Reuters",-0.9629434943199158
GAIL,2023-01-16,GAIL India seeks two LNG cargoes for February delivery - sources - Reuters,-0.9152669906616211
GAIL,2022-05-22,GAIL's natural gas supply reaches HPCL Mittal Energy refinery in Bathinda - Business Standard,-0.8178910613059998
GAIL,2026-03-28,GAIL.BO - | Stock Price & Latest News - Reuters,-0.922387421131134
GAIL,2022-11-04,GAIL India's profit tumbles on supply cut from former Gazprom unit - Reuters,-0.9565098881721497
GAIL,2026-04-01,(GAIL.BO) | Stock Price & Latest News - Reuters,-0.9011985063552856
GAIL,2018-09-14,GAIL GAS LIMITED - The Economic Times,-0.9171823263168335
GAIL,2026-03-11,"India GAIL buys Oman LNG cargo, sources say - Reuters",-0.7867885828018188
GAIL,2023-02-16,India's GAIL explores up to 26% equity stake in U.S. LNG projects - Reuters,-0.8674131035804749
GAIL,2024-05-27,GAIL's 10 MW green hydrogen plant in Madhya Pradesh inaugurated - ET EnergyWorld,-0.8632621765136719
GAIL,2023-11-14,"GAIL does world's first ship-to-ship LNG transfer, cuts CO2 emissions - ET EnergyWorld",0.5082876682281494
GAIL,2014-03-24,GAID: GAIL India Ltd Stock Price Quote - London Intl - Bloomberg - bloomberg.com,-0.9476147294044495
GAIL,2024-01-05,India's GAIL signs 10-yr LNG purchase deal with Vitol - Reuters,0.8185357451438904
GAIL,2023-10-31,GAIL India posts Q2 profit beat on gas transmission volume strength - Reuters,0.5480536818504333
GAIL,2023-11-22,PEDA signs pact with GAIL to set up 10 compressed biogas projects in Punjab - ET EnergyWorld,0.8455578684806824
GAIL,2026-03-03,"West Asia crisis: GAIL, IOC cut industrial gas supplies as Qatar halts LNG output - ET EnergyWorld",-0.9634990096092224
GAIL,2026-04-02,GAIL.NS - | Stock Price & Latest News - Reuters,-0.9233196973800659
GAIL,2022-10-20,GAIL India issues swap tender for four cargoes - Reuters,-0.9071799516677856
GAIL,2019-08-27,GAIL to spend Rs 751 crore to add new unit at petrochemical complex in Uttar Pradesh - ET EnergyWorld,0.675468921661377
GAIL,2022-08-02,India's GAIL rationing gas as former Gazprom unit cuts supplies - Reuters,-0.9244359135627747
GAIL,2026-03-09,"India's GAIL seeks LNG cargo for March delivery, say industry sources - Reuters",-0.9125019907951355
GAIL,2026-03-01,Deepak Gupta takes over as chairman and managing director of GAIL - Business Standard,-0.9489873647689819
GAIL,2025-08-13,"GAIL, TruAlt Bioenergy form joint venture to boost compressed biogas sector - ET EnergyWorld",0.8425062298774719
GAIL,2025-06-06,GAIL India's Dabhol LNG terminal goes all-weather with first monsoon cargo - Reuters,-0.8432888984680176
GAIL,2024-01-29,GAIL India tops Q3 profit view on gas transmission growth - Reuters,-0.8263837099075317
GAIL,2022-08-05,"GAIL faces profit hit over gas supply cut, says finance chief - ET EnergyWorld",-0.9424622058868408
GAIL,2025-04-11,Indian gas firm GAIL seeks 26% stake in US LNG - Reuters,-0.8895444869995117
