ticker,date,headline,sentiment_score
GODREJCP,2026-02-03,Stock Market: Stock Market Today | Stock Market Live News Update - Moneycontrol,-0.9442839622497559
GODREJCP,2011-12-23,Godrej Consumer Products Ltd. - Moneycontrol,-0.9427085518836975
GODREJCP,2012-04-28,"Most Active Shares - F&O Market, All Futures & Options, Index Futures, Index Options, Stock Futures, Stock Options - Moneycontrol",-0.9498177766799927
GODREJCP,2018-01-06,"godrej consumer Forum Discussion on Market View, Business sectors,Stocks, Commodity, Personal Finance & More - Moneycontrol",-0.942353367805481
GODREJCP,2024-11-14,Godrej Consumer Products - Moneycontrol,-0.9283028841018677
GODREJCP,2024-11-14,Godrej Consumer Products - Moneycontrol,-0.9283028841018677
GODREJCP,2024-11-16,Godrej Consumer Products - Moneycontrol,-0.9283028841018677
GODREJCP,2011-07-31,Godrej Consumer Products Ltd. - Moneycontrol,-0.9427085518836975
GODREJCP,2025-08-26,"Quarterly Results, Godrej Consumer Products Financial Statement & Accounts - Moneycontrol",-0.9444166421890259
GODREJCP,2024-11-14,Godrej Consumer Products - Moneycontrol,-0.9283028841018677
GODREJCP,2022-06-06,About Godrej Consumer Products Ltd (GOCP.BO) - Reuters,-0.9434638619422913
GODREJCP,2011-07-31,"Godrej Consumer Products Registered Address Contact Details, Godrej Consumer Products Management - Moneycontrol",-0.9504250288009644
GODREJCP,2024-11-17,Godrej Consumer Products - Moneycontrol,-0.9283028841018677
GODREJCP,2018-07-15,"Godrej Consumer Products Balance Sheet, Godrej Consumer Products Financial Statement & Accounts - Moneycontrol",-0.9474478960037231
GODREJCP,2025-10-09,"Stocks to buy in 2025 for long term: Kaynes Technology, Titan among 4 stocks that could give 17-40% return - The Economic Times",-0.8203526735305786
GODREJCP,2024-05-03,Godrej Consumer Products Ltd. - Moneycontrol,-0.9427085518836975
GODREJCP,2024-12-09,"Godrej Consumer shares tank 9% after firm flags Q3 margin, volume growth warning - Moneycontrol",0.9072253108024597
GODREJCP,2022-04-23,About Godrej Consumer Products Ltd (GOCP.NS) - Reuters,-0.9455651640892029
GODREJCP,2025-07-07,"Godrej Consumer Products shares rally 5% on positive Q1 update, sees double-digit EBITDA growth for FY26 - Moneycontrol",0.9513480067253113
GODREJCP,2020-02-16,"Godrej Consumer Products Key Financial Ratios, Godrej Consumer Products Financial Statement & Accounts - Moneycontrol",-0.9450970888137817
GODREJCP,2025-11-03,Godrej Consumer shares jump 6% despite decline in Q2 net profit: analysts expect stronger H2FY26 - Moneycontrol,0.7482264041900635
GODREJCP,2024-11-14,Godrej Consumer Products - Moneycontrol,-0.9283028841018677
GODREJCP,2025-05-06,"Q4 Results 2025 Highlights: HPCL net profit rises 18% YoY, Piramal Enterprises net profit jumps 166% QoQ - Moneycontrol",0.9283381104469299
GODREJCP,2018-07-12,Traders’ Diary: Market likely to consolidate ahead - The Economic Times,-0.4595237672328949
GODREJCP,2020-07-21,Godrej Consumer Products Daily Technical Analysis | Stochastic RSI indicators - Moneycontrol,-0.9305525422096252
GODREJCP,2021-03-18,"Traders' Guide: Nifty hurdles shift lower to 14,950 and 15,050 levels - The Economic Times",-0.6596009731292725
GODREJCP,2025-05-20,Godrej Consumer Products Ltd - images.moneycontrol.com,-0.9474592208862305
GODREJCP,2018-05-10,"Indian Stock/Share Market: Sensex, Nifty, Stock/Share Prices, Share Market Live, Stock/Share Recommendations, Hot Stocks, Stock Market Investing, BSE, NSE, Derivatives, Best Stocks to Buy, Penny Stocks India - Moneycontrol",-0.9420502781867981
GODREJCP,2021-12-22,"Taking Stock | Sensex up 612 points, Nifty above 16,950 led by realty, pharma, metals and auto stocks - Moneycontrol",0.9260959625244141
GODREJCP,2018-05-02,"F&O Market Snapshot: Future and Options NSE, BSE, F&O margin, F&O quotes - Moneycontrol",-0.9373857378959656
GODREJCP,2024-01-31,Godrej Consumer Products Ltd - images.moneycontrol.com,-0.9474592208862305
GODREJCP,2021-08-25,Stock Mantra: This consumer goods company is poised for near 30% rally - Moneycontrol,0.9225130081176758
GODREJCP,2026-01-07,"Stocks to Watch Today: Titan, Jubilant Foodworks, Godrej Consumer Products, IRB Infrastructure Trust,... - Moneycontrol",-0.9185866117477417
GODREJCP,2018-03-21,ICICI Prudential Mutual Fund launches Bharat Consumption Fund - Moneycontrol,-0.8978873491287231
GODREJCP,2025-11-10,Godrej Consumer Products Ltd. Q2FY26 - images.moneycontrol.com,-0.9479838609695435
GODREJCP,2018-09-18,Godrej Consumer Products gains 3% after board approves bonus share allotment - Moneycontrol,0.9365972280502319
GODREJCP,2021-03-04,Trade setup for Friday: Top 15 things to know before Opening Bell - Moneycontrol,-0.9416532516479492
GODREJCP,2018-10-20,"Increase in Open Interest, Increase in Price, Increase in Open Interest & Increase in Price in All Futures For All Expiries - Moneycontrol",0.8093093633651733
GODREJCP,2022-05-10,"Closing Bell: Market ends lower amid high volatility; metals down 5%, banks shine - Moneycontrol",-0.9600909948348999
GODREJCP,2026-01-20,Trade setup for January 21: Top 15 things to know before the opening bell - Moneycontrol,-0.9399917125701904
GODREJCP,2020-05-20,"Closing Bell: Nifty ends above 9,050, Sensex gains 622 pts; pharma stocks rally - Moneycontrol",0.872708797454834
GODREJCP,2018-01-13,"Godrej Consumer Products Balance Sheet, Godrej Consumer Products Financial Statement & Accounts - Moneycontrol",-0.9474478960037231
GODREJCP,2012-04-21,"Increase in Open Interest, Decrease in Price, Increase in Open Interest & Decrease in Price In All Futures For All Expiries - Moneycontrol",-0.9109435677528381
GODREJCP,2025-08-29,FMCG is catching investors’ eye ahead of upcoming GST reforms – These are the likely beneficiaries - Moneycontrol,-0.8469698429107666
GODREJCP,2023-12-08,Trade setup for Friday: 15 things to know before opening bell - Moneycontrol,-0.9422727823257446
GODREJCP,2019-12-10,"Closing Bell: Sensex ends 248 pts lower, Nifty holds 11,850; FMCG, IT, metal, PSU banks drag the most - Moneycontrol",-0.9342905282974243
GODREJCP,2020-09-14,"Active Calls - F&O Market, All Futures & Options, Index Futures, Index Options, Stock Futures, Stock Options - Moneycontrol",-0.9502313137054443
GODREJCP,2025-11-04,Buy Godrej Consumer; target of Rs 1400: Motilal Oswal - Moneycontrol,-0.8759389519691467
GODREJCP,2020-08-27,Trade Setup for Friday: Top 15 things to know before Opening Bell - Moneycontrol,-0.9416532516479492
GODREJCP,2022-07-25,Trade setup for today: Top 15 things to know before the opening bell - Moneycontrol,-0.9429438710212708
