ticker,date,headline,sentiment_score
GRASIM,2026-02-03,Grasim Inds Share Price Live Updates: Grasim Industries Market Activity - The Economic Times,-0.9331533312797546
GRASIM,2026-02-02,Grasim Inds Share Price Highlights: Grasim Inds. Stock Price History - The Economic Times,-0.9389934539794922
GRASIM,2026-02-01,Grasim Inds Share Price Highlights: Grasim Inds. Stock Price History - The Economic Times,-0.9389934539794922
GRASIM,2026-01-30,Grasim Inds Share Price Highlights: Grasim Inds. Stock Price History - The Economic Times,-0.9389934539794922
GRASIM,2026-01-29,Grasim Inds Share Price Highlights: Grasim Inds. Stock Price History - The Economic Times,-0.9389934539794922
GRASIM,2026-01-23,Grasim Industries RE Ltd. - Moneycontrol,-0.947128176689148
GRASIM,2026-01-23,Grasim Industries RE Ltd. - Moneycontrol,-0.947128176689148
GRASIM,2026-01-28,Grasim Industries - Axis Bank among 4 Nifty stocks showing bullish RSI upswing - The Economic Times,-0.6224032640457153
GRASIM,2026-01-23,Grasim Industries RE Ltd. SWOT Analysis | Opportunity - Moneycontrol,-0.9473918080329895
GRASIM,2026-01-31,"Half Yearly Results, Half yearly Earnings for Consecutive Investments - The Economic Times",-0.9043841361999512
GRASIM,2026-02-03,Innovassynth Inv Profit and Loss Reports - The Economic Times,-0.8185244798660278
GRASIM,2026-01-31,"Vaghani Techno Target Share Price, Vaghani Techno Share Price Forecast - The Economic Times",-0.9385890960693359
GRASIM,2024-03-06,Grasim Industries Share Price Today Live Updates: Grasim Industries Closes at Rs 2231.5 with 1050 Shares - The Economic Times,-0.9376311302185059
GRASIM,2024-03-05,Grasim Industries Stocks Live Updates: Grasim Industries Closes at Rs 2234.15 with 1-Month Return of 4.43 - The Economic Times,-0.44289255142211914
GRASIM,2024-03-15,Grasim Industries Share Price Live Updates: Grasim Industries Closes at Rs 2196.5 with a 6-Month Beta of - The Economic Times,-0.5260702967643738
GRASIM,2026-01-28,Positive Breakout: These 13 stocks cross above their 200 DMAs - The Economic Times,0.7979812026023865
GRASIM,2024-03-07,"Grasim Industries Share Price Live Updates: Grasim Industries Witnesses Slight Increase in Price, Deliver - The Economic Times",0.7362019419670105
GRASIM,2024-03-15,"Grasim Industries Share Price Live Updates: Grasim Industries Sees a Slight Decline in Price, EMA3 Remain - The Economic Times",-0.8673633337020874
GRASIM,2026-02-03,MC Exclusive: India Is Set to Outperform in 2026: Sandeep Tandon on Markets After the Trade Deal - Moneycontrol,0.6943108439445496
GRASIM,2026-02-03,Ananya Birla forays into films with launch of Birla Studios - The Economic Times,-0.7729602456092834
GRASIM,2026-02-02,The Economic Times - The Economic Times,-0.9159992933273315
GRASIM,2024-03-06,"Grasim Industries Share Price Today Live Updates: Grasim Industries Sees 1.23% Decrease in Price, Average - The Economic Times",-0.9483423829078674
GRASIM,2026-02-03,"F&O Quote - Live FNO BSE/NSE Quote, Nifty Quotes, Indian Stock Market BSE/NSE Price Increase, Chart, Open Interest Analysis & more by Moneycontrol.com - Moneycontrol",-0.9344049096107483
GRASIM,2026-02-02,"F&O Quote - Live FNO BSE/NSE Quote, Nifty Quotes, Indian Stock Market BSE/NSE Price Increase, Chart, Open Interest Analysis & more by Moneycontrol.com - Moneycontrol",-0.9344049096107483
GRASIM,2026-02-03,"F&O Quote - Live FNO BSE/NSE Quote, Nifty Quotes, Indian Stock Market BSE/NSE Price Increase, Chart, Open Interest Analysis & more by Moneycontrol.com - Moneycontrol",-0.9344049096107483
GRASIM,2026-01-28,Grasim Inds Share Price Live Updates: Grasim Industries market performance - The Economic Times,-0.9207925796508789
GRASIM,2024-04-18,"Moving Averages Updates: Grasim Industries Breaks Above 20-Day SMA, Registers 0.36% Daily Gain - The Economic Times",0.8654516935348511
GRASIM,2023-11-24,Grasim Industries Share Price Today Live Updates: Grasim Industries Reports Steady Price Increase and Str - The Economic Times,0.8998621106147766
GRASIM,2023-11-23,Grasim Industries Share Price Updates: Grasim Industries Closes at Rs 1957.2 with a 0.85% Decrease - The Economic Times,-0.8945251107215881
GRASIM,2023-12-21,Grasim Industries Share Price Live Updates: Grasim Industries Closes at Rs 2063.55 with a 6-Month Beta of - The Economic Times,0.4510529935359955
GRASIM,2024-02-01,Grasim Industries Stocks Live Updates: Grasim Industries Closes at Rs 2175.0 with a 6-Month Beta of 1.716 - The Economic Times,-0.6745306253433228
GRASIM,2018-07-27,Business News Videos | Breaking News Videos Online - Moneycontrol,-0.9142545461654663
GRASIM,2023-12-05,Grasim Industries Stocks Live Updates: Grasim Industries Closes at Rs 2052.95 with 764 Units Traded - The Economic Times,-0.9187412858009338
GRASIM,2026-01-14,"Stocks to buy for 2026: HCL Tech, TCS among 4 stocks that could give 15-30% return in long term - The Economic Times",0.7230231165885925
GRASIM,2022-06-06,About Grasim Industries Ltd (GRAS.NS) - Reuters,-0.9464975595474243
GRASIM,2025-11-06,India's Grasim falls most in over 3 years as paints chief exit stokes growth worries - Reuters,-0.9151415824890137
GRASIM,2026-01-23,Grasim Industries - Positive Breakout: These 13 stocks cross above their 200 DMAs - The Economic Times,0.7351344227790833
GRASIM,2024-02-01,"Grasim Industries Stocks Live Updates: Grasim Industries Witnesses 2.3% Price Surge, SMA7 at Rs 2097.75 - The Economic Times",-0.5759409070014954
GRASIM,2018-01-06,"grasim Forum Discussion on Market View, Business sectors,Stocks, Commodity, Personal Finance & More - Moneycontrol",-0.9435553550720215
GRASIM,2025-11-05,Grasim’s consolidated profit up 76%; paints business CEO resigns - The Economic Times,-0.7204399704933167
GRASIM,2026-01-16,Grasim names Sachin Sahay as new Birla Opus CEO - The Economic Times,-0.9320898056030273
GRASIM,2024-01-11,Grasim Industries Stocks Live Updates: Grasim Industries Closes at Rs 2068.55 with -0.85% Weekly Return - The Economic Times,-0.5327391028404236
GRASIM,2024-05-01,Grasim Industries - Thinking of creating wealth with Birlas? Here’s how group stocks have performed in 2024 - The Economic Times,-0.8044840693473816
GRASIM,2025-08-26,Grasim's market capitalisation near Rs 2 lakh crore: Kumar Mangalam Birla - The Economic Times,-0.9081506729125977
GRASIM,2003-06-18,"Birlas clinch L&T cement in Rs 2,200-cr deal - The Economic Times",-0.9054350852966309
GRASIM,2025-08-12,"Stocks to buy in 2025 for long term: Grasim Industries, Biocon among 5 stocks that could give 19-30% returns - The Economic Times",0.5314886569976807
GRASIM,2024-07-22,Announcements Updates: Announcement under Regulation 30 (LODR)-Newspaper Publication - The Economic Times,-0.9482991695404053
GRASIM,2009-10-04,Grasim spins off cement biz into 100% subsidiary - The Economic Times,-0.9100608825683594
GRASIM,2025-12-02,Grasim Industries - Insurance firms cut stakes in these 10 Largecap stocks in Q2FY26 - The Economic Times,-0.9196176528930664
GRASIM,2023-11-28,Grasim Industries Share Price Today Live Updates: Grasim Industries Trades at Rs 1967.7 with 0.93% Increa - The Economic Times,-0.8763359189033508
