ticker,date,headline,sentiment_score
HAVELLS,2026-03-22,ET 500 - Top 50 Companies - The Economic Times,-0.9059955477714539
HAVELLS,2026-03-15,"thermostat problem: Latest News & Videos, Photos about thermostat problem - The Economic Times",-0.9290933012962341
HAVELLS,2026-03-19,"Despite headwinds, air-conditioner growth to remain healthy this summer - Business Standard",0.9542978405952454
HAVELLS,2026-03-19,Moving from gas to induction? A buyer's guide to induction cooktops - Business Standard,-0.9209372401237488
HAVELLS,2026-03-19,"Sensex crashes over 2,131 pts; consumer durables shares decline - Business Standard",-0.9632091522216797
HAVELLS,2014-03-24,HAVL: Havells India Ltd Stock Price Quote - Natl India - Bloomberg - Bloomberg.com,-0.9469423294067383
HAVELLS,2024-10-18,Havells India - bsmedia.business-standard.com,-0.9467448592185974
HAVELLS,2026-01-19,Havells India posts quarterly profit rise on healthy cables demand - Reuters,0.8743622899055481
HAVELLS,2025-05-16,HAVELLS - bsmedia.business-standard.com,-0.9491893649101257
HAVELLS,2025-10-18,Havells India Ltd - bsmedia.business-standard.com,-0.9504027366638184
HAVELLS,2017-08-06,Check out Havells India Ltd's stock price (HAVELLS-IN) in real time - CNBC,-0.9415790438652039
HAVELLS,2026-01-19,Havells India| BUY - bsmedia.business-standard.com,-0.9478718638420105
HAVELLS,2025-10-17,India's Havells reports quarterly profit rise on cables strength - Reuters,0.46196576952934265
HAVELLS,2024-04-30,Havells India beats Q4 profit estimates on strong demand for appliances - Reuters,0.8908084630966187
HAVELLS,2025-07-22,"Havells, India - bsmedia.business-standard.com",-0.9478154182434082
HAVELLS,2026-01-19,"19th January, 2026 The National Stock Exchange of India Limited Exchange Plaza, 5th Floor Plot No. C/1, G Block Bandra Kurla Com - bsmedia.business-standard.com",-0.9494532942771912
HAVELLS,2017-03-24,"Havells India Share Price Today, Havells India Stock Price Live NSE/BSE Updates - The Economic Times",-0.922602653503418
HAVELLS,2025-04-22,"22nd April 2025 The National Stock Exchange of India Limited Exchange Plaza, 5th Floor Plot No. C/1, G Block Bandra Kurla Comple - bsmedia.business-standard.com",-0.9499712586402893
HAVELLS,2017-03-29,Havells India Ltd. - The Economic Times,-0.9107607007026672
HAVELLS,2026-03-16,The Economic Times - The Economic Times,-0.9159992933273315
HAVELLS,2025-11-26,"26th November, 2025 The National Stock Exchange of India Ltd. Exchange Plaza, 5th Floor Plot No. C/1, G Block Bandra Kurla Comp - bsmedia.business-standard.com",-0.9491701126098633
HAVELLS,2025-07-21,"Havells India's Q1 net profit falls 33% sequentially, revenue down 17% - ET Retail",-0.9754020571708679
HAVELLS,2025-04-23,Havells India Q4 net profit rises 16% to Rs 517 cr; FY25 revenue up 17% - ET Retail,0.9483428001403809
HAVELLS,2025-10-10,Shaping human ethos in a tech-driven world: Inside Havells’ human story - ETHRWorld.com,-0.9090325832366943
HAVELLS,2025-10-17,Havells India's net profit rises 18.86% in Q2 FY26 - ET Realty,0.9462093114852905
HAVELLS,2024-06-09,NCLT allows insolvency against Himalayan Mineral Water on J-K Bank's plea - Business Standard,-0.917751669883728
HAVELLS,2023-09-20,R R Kabel Ltd - Reuters,-0.938504159450531
HAVELLS,2019-04-03,"Polycab India Share Price Today, Polycab India Stock Price Live NSE/BSE Updates - The Economic Times",-0.9426051378250122
HAVELLS,2017-04-29,"switchgear industry: Latest News & Videos, Photos about switchgear industry - The Economic Times",-0.9340599179267883
HAVELLS,2026-03-20,"Brahmaputra Infra Share Price Today, Brahmaputra Infra Stock Price Live NSE/BSE Updates - The Economic Times",-0.9382563829421997
HAVELLS,2022-06-14,About Polycab India Ltd (POLC.NS) - Reuters,-0.9474443793296814
HAVELLS,2022-06-06,KEIN.NS - Reuters,-0.9443854093551636
HAVELLS,2017-03-30,"Apollo Sindoori Share Price Today, Apollo Sindoori Stock Price Live NSE/BSE Updates - The Economic Times",-0.9417442679405212
HAVELLS,2025-08-07,"India's Bajaj Electricals posts quarterly profit plunge on weak demand, one-time charge - Reuters",-0.970838189125061
HAVELLS,2026-01-28,India's V Guard posts quarterly profit climb on healthy electricals demand - Reuters,0.937079131603241
HAVELLS,2024-07-30,India's R R Kabel Q1 profit falls as costs surge - Reuters,-0.9600670337677002
HAVELLS,2025-10-18,Orient Electric Ltd - bsmedia.business-standard.com,-0.9506593942642212
HAVELLS,2026-01-16,"Polycab India's third-quarter profit jumps on sustained demand for wires, cables - Reuters",0.8985044956207275
HAVELLS,2020-01-08,"bhagirath palace: Latest News & Videos, Photos about bhagirath palace - The Economic Times",-0.9371572732925415
HAVELLS,2021-05-16,"Hrms - Latest hrms , Information & Updates - HR - ETHRWorld.com",-0.9477330446243286
HAVELLS,2025-08-11,Unseasonal rains impact up to 34% room AC makers' revenue in June quarter - ET Retail,-0.9488976001739502
HAVELLS,2017-03-29,Blue Star Ltd. - The Economic Times,-0.9086118340492249
HAVELLS,2021-01-08,"Suzlon Energy shares drop 30% in six months, but Motilal Oswal sees 61% upside; here’s why - The Economic Times",-0.9544448256492615
HAVELLS,2017-03-23,"Lupin Share Price Today, Lupin Stock Price Live NSE/BSE Updates - The Economic Times",-0.9361072778701782
HAVELLS,2021-01-08,"Polycab shares in focus after Q3 results. Should you buy, sell or hold? - The Economic Times",-0.9352014064788818
HAVELLS,2025-01-22,"India's Polycab misses Q3 profit estimates on wires business slowdown, high copper prices - Reuters",-0.9667999744415283
HAVELLS,2021-08-06,APLAPOLLO - bsmedia.business-standard.com,-0.9509145617485046
HAVELLS,2017-07-30,HPL Electric & Power Ltd. - The Economic Times,-0.9224403500556946
HAVELLS,2017-03-24,"Voltas Share Price Today, Voltas Stock Price Live NSE/BSE Updates - The Economic Times",-0.9380523562431335
HAVELLS,2024-07-29,Whirlpool's India unit beats Q1 profit estimate on strong demand - Reuters,0.9113890528678894
HAVELLS,2020-10-05,"Kotak Mahindra Bank reports 23% rise in Q1 net profit, misses estimates - The Economic Times",0.8935344815254211
HAVELLS,2026-01-19,"Q3 results: Hindustan Zinc, BHEL, Havells, IRFC among 35 firms on Jan 19 - Business Standard",-0.8566107749938965
HAVELLS,2025-08-07,India's Crompton Greaves Consumer Electricals misses profit view on weak demand for fans - Reuters,-0.9592817425727844
HAVELLS,2017-10-21,"Waaree energies - Latest waaree energies , Information & Updates - Energy - ET EnergyWorld",-0.9465857744216919
HAVELLS,2024-05-10,Orient Electric Q4 profit falls as mounting expenses offset demand - ET Retail,-0.9726042747497559
HAVELLS,2025-10-14,LGEL IN Equity 14Oct25 - bsmedia.business-standard.com,-0.948901891708374
HAVELLS,2026-03-20,Punjab National Bank - The Economic Times,-0.9063418507575989
HAVELLS,2024-07-31,India's Crompton Greaves beats Q1 profit view on strong demand for cooling products - Reuters,0.7760798931121826
HAVELLS,2023-07-20,"Share Market Today | Latest Stock Market News, Sensex Today and Nifty Live Updates - Business Standard",-0.9348509311676025
HAVELLS,2022-05-17,"India's heatwave to lift AC sales to record, but supplies from China delayed - Reuters",0.9204100370407104
HAVELLS,2017-03-29,Finolex Cables Ltd. - The Economic Times,-0.9323753714561462
HAVELLS,2026-01-29,"India's TTK Prestige's quarterly profit drops 44% on higher spends, one-off charge - Reuters",-0.9717254042625427
HAVELLS,2025-07-02,Shrinking Profit Margins Unwind Popular ‘Make in India’ Trade in Electronics - Bloomberg.com,-0.9641282558441162
HAVELLS,2025-11-04,Whirlpool of India's profit falls on sluggish demand for refrigerators - Reuters,-0.943816065788269
HAVELLS,2025-01-23,KEII IN Equity 22Jan25 RU - bsmedia.business-standard.com,-0.9448171257972717
HAVELLS,2025-10-14,BUY LG Electronics India - bsmedia.business-standard.com,-0.9475216269493103
HAVELLS,2020-10-05,Wipro Q1 results: Five things to watch out for - The Economic Times,-0.9183399081230164
HAVELLS,2024-08-17,SG MART LIMITED - bsmedia.business-standard.com,-0.9514420628547668
HAVELLS,2018-09-14,JINDAL POWER LIMITED - The Economic Times,-0.919365406036377
HAVELLS,2025-05-06,"Polycab India beats quarterly profit estimates on high demand for wires, cables - Reuters",0.9289669990539551
HAVELLS,2020-01-21,"unitech takeover: Latest News & Videos, Photos about unitech takeover - The Economic Times",-0.9386000037193298
HAVELLS,2026-01-20,Investors Seek Safety of India State-Owned Firms as Selloff Deepens - Bloomberg.com,-0.7444859743118286
HAVELLS,2024-10-20,"Havells, Polycab flip the switch on high-voltage growth potential - Business Standard",-0.8028942942619324
HAVELLS,2020-10-05,"Q3 results today: Bajaj Finance, Adani Ports among 111 companies to report earnings on Tuesday - The Economic Times",-0.7875674962997437
HAVELLS,2025-09-16,EUREKAFO IN EQUITY 15Sep25 IC - bsmedia.business-standard.com,-0.9472976922988892
HAVELLS,2025-05-15,India's Crompton Greaves misses quarterly revenue view on subdued demand for fans - Reuters,-0.9583685994148254
HAVELLS,2025-02-12,India's Crompton Greaves misses quarterly profit view on soft demand for electrical goods - Reuters,-0.9415940046310425
HAVELLS,2021-06-23,KEI Industries23Jun21 - bsmedia.business-standard.com,-0.9446431994438171
HAVELLS,2024-06-11,BSE LARGECAP Top Losers Stocks - BSE LARGECAP Top Losers Shares Live - The Economic Times,-0.933271050453186
HAVELLS,2025-02-12,HANSRAJ SINGH - bsmedia.business-standard.com,-0.9469707608222961
HAVELLS,2021-02-15,"LIC: LIC News, Life Insurance Corporation of India Latest Updates - The Economic Times",-0.9259388446807861
HAVELLS,2026-02-16,Cello World16Feb26 - bsmedia.business-standard.com,-0.946647047996521
HAVELLS,2025-01-13,APR IN Equity 10Jan25 IC - bsmedia.business-standard.com,-0.9431536793708801
HAVELLS,2026-01-20,Jyoti Verma - bsmedia.business-standard.com,-0.9493200778961182
HAVELLS,2020-08-11,BAJAJ ELECTRICALS - bsmedia.business-standard.com,-0.9512336254119873
HAVELLS,2025-10-14,SANJAY SINGHANIA - bsmedia.business-standard.com,-0.9478464722633362
HAVELLS,2024-07-26,Anil Agarwal Master Classes - Video Lessons by ET GrandMasters - The Economic Times,-0.9189147353172302
HAVELLS,2025-08-07,"MSCI to add Swiggy, 3 other Indian stocks to flagship index, reduce Eternal's weight - Reuters",-0.7465771436691284
HAVELLS,2025-10-22,Core areas light up Havells India as consumer durables dim the spark - Business Standard,0.9269863367080688
HAVELLS,2025-02-12,Ehrr OECO-M|CA Ltci. 6.)R}\ - bsmedia.business-standard.com,-0.9515875577926636
HAVELLS,2017-10-20,"State Bank Of India Pandu Nagar Branch IFSC Code, MICR Code, Address & Phone Number - The Economic Times",-0.9391822814941406
HAVELLS,2025-05-14,Integra Engineering India Limited IEIL/BM/2024-25/Q4 Date - bsmedia.business-standard.com,-0.9491273760795593
HAVELLS,2025-05-20,Dixon Technologies (India) Limited - bsmedia.business-standard.com,-0.9523537755012512
HAVELLS,2024-08-13,NIBE LIMITED - bsmedia.business-standard.com,-0.9515641331672668
HAVELLS,2019-02-14,LIMITED - bsmedia.business-standard.com,-0.9504042267799377
HAVELLS,2025-07-19,EPACK DURABLE LIMITED - bsmedia.business-standard.com,-0.9531318545341492
HAVELLS,2019-10-06,"khadim shoes: Latest News & Videos, Photos about khadim shoes - The Economic Times",-0.9356318116188049
