ticker,date,headline,sentiment_score
HCLTECH,2026-04-06,IT firms may post muted Q4; weak INR to cushion earnings; FY27 guidance key - business-standard.com,-0.9572206735610962
HCLTECH,2026-04-07,"Nifty IT up 2%; Wipro, Infy, TCS rise up to 4% as investors eye Q4 results - business-standard.com",0.9250752925872803
HCLTECH,2026-04-06,"Tessolve appoints HCL Tech's Ravi Kumar Chirugudu as President, COO - business-standard.com",-0.941329836845398
HCLTECH,2026-04-06,"Persistent Systems - Mahindra, Billionbrains Garage among 6 stocks flashing bullish signals - The Economic Times",-0.8505887985229492
HCLTECH,2026-04-01,"Si Reporter/undefined - Read all News, Stories, Videos and Photos from Si Reporter/undefined - business-standard.com",-0.9473554491996765
HCLTECH,2026-04-06,"Indian IT firms face subdued fourth quarter as war, AI concerns persist; weak rupee helps earnings - Reuters",-0.956290066242218
HCLTECH,2026-04-06,"Reliance slips 4%; stock hits over 10-month low, m-cap falls below ₹18 trn - business-standard.com",-0.9506584405899048
HCLTECH,2026-04-06,Every $10 rise in oil above $90/bbl may hit Nifty earnings by 3%: Bernstein - business-standard.com,-0.8500698208808899
HCLTECH,2026-04-06,"Bank stocks mixed after Q4 update: BoB, BoM jump; HDFC Bank, IndusInd slip - business-standard.com",-0.7013976573944092
HCLTECH,2026-04-06,Wipro bags $1 bn deal from Olam Group; to acquire Mindsprint for $375 mn - business-standard.com,-0.8952046036720276
HCLTECH,2026-04-03,"Maruti Suzuki India aims for 8,000 service touchpoints by FY31: MD & CEO - business-standard.com",-0.9120271801948547
HCLTECH,2026-04-06,Ola Electric soars 34% in 3 days; hits 7-wk high on huge volume; here's why - business-standard.com,0.8763629198074341
HCLTECH,2024-03-12,HCL Technologies Share Price Live Updates: HCL Technologies Closes at Rs 1638.65 with 6-Month Beta of 0.5 - The Economic Times,-0.4770928919315338
HCLTECH,2025-07-14,"India's HCLTech narrows revenue forecast, sees demand stability - Reuters",-0.6006059050559998
HCLTECH,2026-01-12,India's HCLTech narrows annual revenue forecast on deal momentum - Reuters,-0.8964933753013611
HCLTECH,2026-01-12,"TCS, HCL Tech Results Bring Setback for India Stock Bulls - bloomberg.com",-0.691428542137146
HCLTECH,2025-01-13,"India's HCLTech misses Q3 revenue estimate, tightens forecast - Reuters",-0.942722499370575
HCLTECH,2024-04-28,HCLTech falls most in nearly 17 months on lower-than-expected FY25 outlook - Reuters,-0.9722626209259033
HCLTECH,2025-04-22,HCLTech CEO signals opportunities despite expected tariff impact - Reuters,-0.6525825262069702
HCLTECH,2017-08-07,Check out HCL Technologies Ltd's stock price (HCLTECH-IN) in real time - CNBC,-0.9483378529548645
HCLTECH,2017-03-24,HCL Technologies Ltd. - The Economic Times,-0.923650860786438
HCLTECH,2014-03-15,HCLT: HCL Technologies Ltd Stock Price Quote - Natl India - Bloomberg - bloomberg.com,-0.9486417770385742
HCLTECH,2017-01-05,"Hcl technologies - Latest hcl technologies , Information & Updates - Telecom - telecom.economictimes.indiatimes.com",-0.9471663236618042
HCLTECH,2026-01-12,HCL Technologies - bsmedia.business-standard.com,-0.9526538848876953
HCLTECH,2025-10-13,India's HCLTech optimistic after upbeat quarter despite tariff uncertainty - Reuters,0.8886584639549255
HCLTECH,2021-12-21,"HCL Tech Q2 Results: Profit rises 10% YoY to Rs 3,832 crore; revenue up 8% - The Economic Times",0.9500507712364197
HCLTECH,2021-06-16,HCL Technologies Ltd - Reuters,-0.9420044422149658
HCLTECH,2020-05-07,"HCL Tech Q4 Results: Net profit zooms 226% to Rs 3,593 crore - The Economic Times",0.9301520586013794
HCLTECH,2020-10-05,"HCL Tech Q1 Results: Profit growth flat at Rs 3,283 crore; revenue jumps 17% - The Economic Times",0.6701987981796265
HCLTECH,2025-07-10,"India’s HCL Technologies, Tech Mahindra Lift Veil on IT Industry Outlook - bloomberg.com",-0.8985229134559631
HCLTECH,2024-08-29,HCL Technologies Ltd - bsmedia.business-standard.com,-0.9517417550086975
HCLTECH,2026-01-13,"HCLTech adds 2,852 freshers in Q3; total headcount falls by 261 - ETHRWorld.com",-0.8958035111427307
HCLTECH,2024-01-12,"India's HCLTech trims full-year revenue forecast, says demand unchanged - Reuters",-0.9429137706756592
HCLTECH,2018-05-07,HCL Tech prefers linking dividend to net income: CFO Anil Chanana - cfo.economictimes.indiatimes.com,-0.9466250538825989
HCLTECH,2017-01-05,"Hcl technologies - Latest hcl technologies , Information & Updates - CIO - ET CIO",-0.9451940059661865
HCLTECH,2022-10-12,India's HCL Technologies raises 2023 revenue growth target on order strength - Reuters,0.8891144394874573
HCLTECH,2023-10-12,India's HCLTech cuts fiscal-year revenue outlook as clients trim spending - Reuters,-0.9567019939422607
HCLTECH,2007-08-13,"UPDATE 1-India's HCL Tech's Q4 net jumps, sees more growth - Reuters",0.9414318799972534
HCLTECH,2026-01-12,"TCS, HCL Tech kick off IT earnings today: Why AI matters more than numbers - Indiatimes",-0.9186958074569702
HCLTECH,2023-07-12,India's HCLTech to buy German automotive services firm ASAP for $280 million - Reuters,-0.8770310282707214
HCLTECH,2026-01-13,HCL Technologies| ADD - bsmedia.business-standard.com,-0.9503574967384338
HCLTECH,2024-07-12,HCLTech projects growth as Indian IT industry bets on cautious recovery - Reuters,0.8275536298751831
HCLTECH,2020-10-17,"Trump H-1B visa policy: HCL Tech may relocate work within US and to low-cost Mexico, Canada - cfo.economictimes.indiatimes.com",-0.9211851954460144
HCLTECH,2024-10-18,IT hiring: TCS and Infosys expand workforce while HCLTech cuts headcount in Q2 FY25 - cfo.economictimes.indiatimes.com,-0.7852423787117004
HCLTECH,2023-04-20,India's HCLTech sees smaller-than-expected FY revenue growth on budget cuts - Reuters,0.7708994150161743
HCLTECH,2018-10-07,HCL Technologies BPO Services Limited - The Economic Times,-0.9236321449279785
HCLTECH,2024-03-28,HCL Technologies Share Price - business-standard.com,-0.946800172328949
HCLTECH,2025-07-15,"HCLTech sees rating downgrade post Q1 results, guidance disappointment - business-standard.com",-0.6655331254005432
HCLTECH,2024-04-02,"How HCLTech’s learning hour per employee jumped 200 times during Covid-19, explains Ashok Madaan - ETHRWorld.com",-0.755502462387085
HCLTECH,2024-02-08,Fostering Workforce Productivity in an Enterprise : The HCLTech experience - ETHRWorld.com,-0.8524768948554993
HCLTECH,2026-03-10,"Infosys, HCL Tech FY27 guidance may steer IT stocks amid AI fears: HSBC - business-standard.com",-0.732511043548584
HCLTECH,2026-01-13,HCLTech counts on M&As to add 1.5% to revenue: CEO & MD C Vijayakumar - business-standard.com,-0.586551308631897
HCLTECH,2024-11-22,Mkt regulator Sebi nod to Roshni Nadar to acquire majority stake in HCLTech - business-standard.com,-0.8781144618988037
HCLTECH,2025-07-15,HCL Tech can crack 12% from here; check stock strategy - business-standard.com,-0.727013349533081
HCLTECH,2025-04-22,"Q4 results today: HCL Tech, Tata Communications to post results on April 22 - business-standard.com",-0.9319579005241394
HCLTECH,2025-07-17,"Dividend stocks: HCL Tech, 46 others go ex-date July 18; do you own any? - business-standard.com",-0.9519758224487305
HCLTECH,2026-01-16,"Infosys, TCS, HCL Tech, 2 others: How to trade IT stocks post Q3 results? - business-standard.com",-0.9377201199531555
HCLTECH,2025-10-15,HCL Tech vs TechM vs Persistent: Which IT stock to bet on post Q2 results? - business-standard.com,-0.9257249236106873
HCLTECH,2025-11-19,HCLTech rises 4% as it expands Canada footprint with new Calgary office - business-standard.com,0.9362338781356812
HCLTECH,2025-01-13,"HCLTech Q3 net profit up 5.5%, lower end of revenue forecast raised - business-standard.com",0.8359739184379578
HCLTECH,2026-01-12,"HCLTech Q3 results: Profit falls 11% to ₹4,076 cr on labour code impact - business-standard.com",-0.9657210111618042
HCLTECH,2025-10-13,"HCLTech profit flat at ₹4,235 crore, revenue rises 10.7% in Q2FY26 - business-standard.com",-0.6418269872665405
HCLTECH,2025-10-13,"Q2 results today: HCL Tech, Anand Rathi Wealth, Just Dial on Oct 13 - business-standard.com",-0.9423786401748657
HCLTECH,2025-01-13,"Q3 FY25 results Jan 13: HCL Tech, Delta among 14 to report earnings today - business-standard.com",-0.868297815322876
HCLTECH,2025-04-22,Q4 results: HCLTech rewrites playbook for FY26 with tariffs in play - business-standard.com,-0.9059975743293762
HCLTECH,2025-10-14,HCL Tech shares gain 3% on delivering 'standout quarter'; should you buy? - business-standard.com,0.7873328328132629
HCLTECH,2026-01-12,"HCLTech Q3 results: Net profit falls 11.2% to ₹4,076 cr; revenue up 13.3% - business-standard.com",-0.9340003132820129
HCLTECH,2025-07-14,"HCLTech Q1 results: Net profit slips 10% to ₹3,843 cr, revenue up 8.2% - business-standard.com",-0.9709681272506714
HCLTECH,2025-07-11,"HCL Tech Q1 preview: What to expect amid tariff jitters, seasonal weakness - business-standard.com",-0.654293954372406
HCLTECH,2025-04-21,"HCLTech Q4 results today: Check date, time, expectations, dividend - business-standard.com",-0.9416506290435791
HCLTECH,2025-01-14,"Jefferies, CLSA, Morgan Stanley retain 'Hold' on HCLTech despite Q3 miss - business-standard.com",-0.8990792632102966
HCLTECH,2025-10-13,"HCLTech Q2 result: Net profit flat at ₹4,235 cr, dividend declared - business-standard.com",-0.9046823382377625
HCLTECH,2025-07-14,"HCLTech Q1 results: Net profit down 9.7% at ₹3,843 cr, dividend declared - business-standard.com",-0.9721202254295349
HCLTECH,2025-10-10,HCL Tech Q2 preview: Street expects sequential rise in margins and profit - business-standard.com,0.9350911974906921
HCLTECH,2026-01-12,"Q3 results: TCS, HCL Tech, Anand Rathi to announce their earnings today - business-standard.com",-0.9023632407188416
HCLTECH,2025-04-23,Nifty IT index rallies 3% post HCLTech Q4 earnings. Should you buy IT stks? - business-standard.com,-0.855438768863678
HCLTECH,2025-03-28,"HCL Technologies Ltd Quarterly Results, 02 Apr 2026 - NSE 1,402.20, BSE 1,401.85 - business-standard.com",-0.9466099143028259
HCLTECH,2024-10-11,HCL Tech market-cap tops Rs 5 trn for 1st time; stock up 50% from June low - business-standard.com,0.9482446312904358
HCLTECH,2025-10-13,"Stocks to watch today, Oct 13: HCLTech, Tata Capital, DMart, Axis Bank, HCC - business-standard.com",-0.944851279258728
HCLTECH,2025-10-07,TCS vs Infosys vs HCL Tech: Here's the best IT stock for your portfolio - business-standard.com,-0.9203236103057861
HCLTECH,2025-10-07,Page 5 - HCL Technologies Ltd News - business-standard.com,-0.9493618607521057
HCLTECH,2025-07-15,HCL Tech shares slide 4% as analysts trim estimates post Q1 miss - business-standard.com,-0.9649021029472351
HCLTECH,2025-10-23,HCL Tech shares gain 3% on partnership with UAE-based DIB; IT stocks rally - business-standard.com,0.836889922618866
HCLTECH,2024-10-14,"HCLTech Q2 results: Net profit rises 10.5% to Rs 4,235 cr, revenue up 8.2% - business-standard.com",0.9504117965698242
HCLTECH,2024-10-11,"HCL Tech Q2 Preview: Brokerages expect flat revenue, decline in TCV - business-standard.com",-0.9645707011222839
HCLTECH,2026-01-13,Brokerages bullish on HCLTech post Q3FY26 results; raise target price - business-standard.com,-0.8766500353813171
HCLTECH,2026-01-13,"Stock Alert: HCL Tech, Tata Consultancy Services, TVS Supply Chain, PSP Projects - business-standard.com",-0.9494906067848206
HCLTECH,2026-01-09,HCL Tech Q3 preview: Double-digit QoQ profit growth seen on seasonal boost - business-standard.com,-0.5223320126533508
HCLTECH,2025-10-08,"TCS, Infy, HCL Tech gain 2%; IT index up 5% in 1 week ahead of Q2 results - business-standard.com",0.9389283061027527
HCLTECH,2024-10-15,"Brokerages bullish on HCL Tech post Q2FY25 outperformance, raise EPS target - business-standard.com",-0.6384629607200623
HCLTECH,2024-03-28,Page 2 - HCL Technologies Ltd News - business-standard.com,-0.9490975141525269
HCLTECH,2026-01-13,"Stocks to Watch today, Jan 13: TCS, HCL Tech, Anand Rathi Wealth, Biocon - business-standard.com",-0.9397637844085693
HCLTECH,2026-01-12,"Stocks to Watch today, Jan 12: TCS, HCL Tech, DMart, Ireda, Vedanta - business-standard.com",-0.9448883533477783
HCLTECH,2025-07-15,"Stocks to Watch today, July 15: HCL Tech, Rallis India, Tata Tech, LIC - business-standard.com",-0.9427681565284729
HCLTECH,2025-01-14,Noteworthy changes looming in biz landscape: HCLTech's C Vijayakumar - business-standard.com,-0.9354267716407776
HCLTECH,2025-10-14,"HCL Tech gains as Q2 PAT jumps 10% QoQ to Rs 4,235 cr - business-standard.com",0.8609596490859985
HCLTECH,2025-11-17,"Infosys, TCS, HCL Tech: Nifty IT up 8% since Oct; time to buy or sell? - business-standard.com",0.5222983956336975
HCLTECH,2013-04-18,HCL Tech posts robust numbers in March quarter - business-standard.com,0.9392943978309631
HCLTECH,2026-01-12,"HCL Tech Q3 PAT slides 4% QoQ to Rs 4,076 cr - business-standard.com",-0.9033498764038086
