ticker,date,headline,sentiment_score
HCLTECH,2026-03-20,Page 5 - HCL Technologies Ltd News - Business Standard,-0.943904459476471
HCLTECH,2026-03-19,"Fed pause, inflation risks drag IT stocks; TCS, Wipro, HCL drop up to 3% - Business Standard",-0.9610984921455383
HCLTECH,2026-03-18,"Nifty IT snaps six-day losing streak, up 4%; Coforge, Persistent lead gains - Business Standard",0.9221301674842834
HCLTECH,2026-03-20,AI tailwinds not enough: Analysts cautious on Indian IT after Accenture Q2 - Business Standard,-0.9464097619056702
HCLTECH,2026-03-18,Shipping Corporation signs ship building contract with Mazagon Dock Shipbuilders - Business Standard,0.8682505488395691
HCLTECH,2026-03-20,Indices trade in positive terrain; IT shares rally - Business Standard,0.7535622119903564
HCLTECH,2026-03-18,IT stocks rebound 2.8% as brokerages downplay AI disruption fears - Business Standard,-0.5382964015007019
HCLTECH,2026-03-20,IT stocks advance after strong Accenture Q2 - Business Standard,0.9430186152458191
HCLTECH,2026-03-17,IT stocks extend slide; Nifty IT down nearly 5% in six sessions - Business Standard,-0.9722627401351929
HCLTECH,2026-03-18,"₹7 trn gain: Sensex zooms 900 pts, Nifty tops 23,800; Key factors here - Business Standard",-0.6888284683227539
HCLTECH,2026-03-19,IT stocks drop after Fed holds rates - Business Standard,-0.9654688239097595
HCLTECH,2026-03-18,"Sensex zooms 807 pts higher; Nifty jumps above 23,750 mark; VIX slumps 4.56% - Business Standard",-0.8816428780555725
HCLTECH,2026-03-20,"Sensex settles 326 pts higher; Nifty ends above 23,100 level - Business Standard",0.8976506590843201
HCLTECH,2025-07-14,"India's HCLTech narrows revenue forecast, sees demand stability - Reuters",-0.6006059050559998
HCLTECH,2025-01-13,India's HCLTech tumbles nearly 10% after Q3 revenue miss - Reuters,-0.9650747179985046
HCLTECH,2026-01-12,India's HCLTech narrows annual revenue forecast on deal momentum - Reuters,-0.8964933753013611
HCLTECH,2026-01-12,"TCS, HCL Tech Results Bring Setback for India Stock Bulls - Bloomberg.com",-0.691428542137146
HCLTECH,2025-01-13,"India's HCLTech misses Q3 revenue estimate, tightens forecast - Reuters",-0.942722499370575
HCLTECH,2025-04-22,HCLTech CEO signals opportunities despite expected tariff impact - Reuters,-0.6525825262069702
HCLTECH,2017-08-07,Check out HCL Technologies Ltd's stock price (HCLTECH-IN) in real time - CNBC,-0.9483378529548645
HCLTECH,2014-03-15,HCLT: HCL Technologies Ltd Stock Price Quote - Natl India - Bloomberg - Bloomberg.com,-0.9486417770385742
HCLTECH,2017-01-05,"Hcl technologies - Latest hcl technologies , Information & Updates - Telecom - ET Telecom",-0.939172089099884
HCLTECH,2025-10-13,India's HCLTech optimistic after upbeat quarter despite tariff uncertainty - Reuters,0.8886584639549255
HCLTECH,2024-04-29,HCLTech falls most in nearly 17 months on lower-than-expected FY25 outlook - Reuters,-0.9722626209259033
HCLTECH,2017-03-23,"HCL Tech Share Price Today, HCL Tech Stock Price Live NSE/BSE Updates - The Economic Times",-0.9389203190803528
HCLTECH,2026-03-18,HCL Technologies Ltd. - The Economic Times,-0.923650860786438
HCLTECH,2026-01-12,HCL Technologies - bsmedia.business-standard.com,-0.9526538848876953
HCLTECH,2024-07-15,HCL Technologies Ltd. ACCUMULATE HCL Technologies Ltd. - bsmedia.business-standard.com,-0.9530856609344482
HCLTECH,2024-08-29,HCL Technologies Ltd - bsmedia.business-standard.com,-0.9517417550086975
HCLTECH,2021-06-16,HCL Technologies Ltd - Reuters,-0.9420044422149658
HCLTECH,2025-07-10,"India’s HCL Technologies, Tech Mahindra Lift Veil on IT Industry Outlook - Bloomberg.com",-0.8985229134559631
HCLTECH,2021-12-21,"HCL Tech Q2 Results: Profit rises 10% YoY to Rs 3,832 crore; revenue up 8% - The Economic Times",0.9500507712364197
HCLTECH,2017-01-05,"Hcl technologies - Latest hcl technologies , Information & Updates - CIO - ET CIO",-0.9451940059661865
HCLTECH,2025-10-14,HCLT IN Equity 14Oct25 - bsmedia.business-standard.com,-0.9474325776100159
HCLTECH,2026-03-13,The Economic Times - The Economic Times,-0.9159992933273315
HCLTECH,2026-01-13,"HCLTech adds 2,852 freshers in Q3; total headcount falls by 261 - ETHRWorld.com",-0.8958035111427307
HCLTECH,2018-05-07,HCL Tech prefers linking dividend to net income: CFO Anil Chanana - ETCFO.com,-0.9426215887069702
HCLTECH,2020-05-22,"Hcl technologies - Latest hcl technologies , Information & Updates - HR - ETHRWorld.com",-0.949540376663208
HCLTECH,2025-04-14,"April 14, 2025 The General Manager BSE Limited Corporate Relationship Department Phiroze Jeejeebhoy Towers Dalal Street Mumbai- - bsmedia.business-standard.com",-0.9457237124443054
HCLTECH,2024-01-12,"India's HCLTech trims full-year revenue forecast, says demand unchanged - Reuters",-0.9429137706756592
HCLTECH,2026-01-12,"TCS, HCL Tech kick off IT earnings today: Why AI matters more than numbers - Indiatimes",-0.9186958074569702
HCLTECH,2023-10-12,India's HCLTech cuts fiscal-year revenue outlook as clients trim spending - Reuters,-0.9567019939422607
HCLTECH,2023-02-16,"AI, multi-cloud, quantum computing to drive digital transformation in 2023: HCL Tech - ET CIO",-0.8403713703155518
HCLTECH,2021-12-13,"HCL Tech shares jump nearly 2% after Q3 results. Should you buy, sell or hold? - The Economic Times",-0.923206627368927
HCLTECH,2024-07-14,"India's HCLTech gains on growth outlook, demand recovery hopes - Reuters",0.9051463603973389
HCLTECH,2025-01-20,"Infosys, HCLTech report hiring growth in Q3; TCS, Wipro see decline - ETCFO.com",-0.5545862317085266
HCLTECH,2020-05-07,"HCL Tech Q4 Results: Net profit zooms 226% to Rs 3,593 crore - The Economic Times",0.9301520586013794
HCLTECH,2026-01-13,HCL Technologies| ADD - bsmedia.business-standard.com,-0.9503574967384338
HCLTECH,2020-10-05,"HCL Tech Q1 Results: Profit growth flat at Rs 3,283 crore; revenue jumps 17% - The Economic Times",0.6701987981796265
HCLTECH,2018-10-07,HCL TECHNOLOGIES BPO SERVICES LIMITED - The Economic Times,-0.9236321449279785
HCLTECH,2020-10-17,"Trump H-1B visa policy: HCL Tech may relocate work within US and to low-cost Mexico, Canada - ETCFO.com",-0.9267265200614929
HCLTECH,2023-07-12,India's HCLTech to buy German automotive services firm ASAP for $280 million - Reuters,-0.8770310282707214
HCLTECH,2023-12-20,"HCLTech hit by ransomware attack, IT major says investigation underway - Business Standard",-0.6967388391494751
HCLTECH,2017-10-14,"HCL Tech discontinues JV arrangement with DXC, inks IP deal - ET CIO",-0.9155499339103699
HCLTECH,2019-05-11,"HCL Comnet, three other subsidiaries to merge with HCL Tech - ET CIO",-0.9465920925140381
HCLTECH,2025-10-17,"Pain Persists for India IT Stocks on Weak Outlook, Spending Cuts - Bloomberg.com",-0.9251319169998169
HCLTECH,2025-10-14,Indian shares extend losses as financials retreat; LG India surges on debut - Reuters,-0.8717179298400879
HCLTECH,2024-04-02,"How HCLTech’s learning hour per employee jumped 200 times during Covid-19, explains Ashok Madaan - ETHRWorld.com",-0.755502462387085
HCLTECH,2024-04-25,Tech companies plug into India's smaller cities for talent - Reuters,-0.9123867750167847
HCLTECH,2020-04-27,"HDFC Life Q4 Results: Cons PAT rises 15% YoY to Rs 475 crore, revenue jumps 16% - The Economic Times",0.9350414872169495
HCLTECH,2026-03-18,HCL Infosystems Ltd. - The Economic Times,-0.9230032563209534
HCLTECH,2024-01-17,"HCL Technologies Share Price Live Updates: HCL Technologies Sees 0.92% Increase in Stock Price, Trading a - The Economic Times",0.8279199004173279
HCLTECH,2026-03-20,"Diligent Ind Share Price Today, Diligent Ind Stock Price Live NSE/BSE Updates - The Economic Times",-0.938038170337677
HCLTECH,2026-03-20,"Intellivate Cap Share Price Today, Intellivate Cap Stock Price Live NSE/BSE Updates - The Economic Times",-0.9372138977050781
HCLTECH,2018-01-29,Untitled - bsmedia.business-standard.com,-0.947187066078186
HCLTECH,2017-03-29,Announcement - The Economic Times,-0.9166386723518372
HCLTECH,2017-03-23,Tech Mahindra Ltd. - The Economic Times,-0.9147879481315613
HCLTECH,2026-03-17,Avenue Supermarts Ltd. - The Economic Times,-0.9275007247924805
HCLTECH,2026-03-10,Spandana Sphoorty Financial Ltd. - The Economic Times,-0.926966667175293
HCLTECH,2017-03-27,Indian Hotels Company Ltd. - The Economic Times,-0.9216436743736267
HCLTECH,2018-04-04,"ihcl: Latest News & Videos, Photos about ihcl - The Economic Times",-0.937250018119812
HCLTECH,2026-03-19,Tata Consultancy Services Ltd. - The Economic Times,-0.922202467918396
HCLTECH,2026-01-16,"Park Medi World Yearly results, Financial Summary - The Economic Times",-0.9191035032272339
HCLTECH,2022-06-15,"Wipro Q2 Results: Cons PAT jumps 21% YoY to Rs 3,209 crore, beats estimates - The Economic Times",0.9120424389839172
HCLTECH,2017-04-11,Infosys Ltd. - The Economic Times,-0.9256874918937683
HCLTECH,2024-03-28,HCL Technologies Share Price - Business Standard,-0.9295104742050171
HCLTECH,2023-08-21,Jio Financial Services Ltd. - The Economic Times,-0.9285960793495178
HCLTECH,2025-11-19,Excelsoft Technologies Ltd. - The Economic Times,-0.927111029624939
HCLTECH,2022-12-18,"Elin Electronics Cash Flow, Financial Statements - The Economic Times",-0.9253056049346924
HCLTECH,2023-07-14,"Netweb Technologies Share Price Today, Netweb Technologies Stock Price Live NSE/BSE Updates - The Economic Times",-0.941333532333374
HCLTECH,2026-03-18,Oracle Financial Services Software Ltd. - The Economic Times,-0.9308862686157227
HCLTECH,2017-03-27,Symphony Ltd. - The Economic Times,-0.9229980707168579
HCLTECH,2025-09-23,Pace Digitek Ltd. - The Economic Times,-0.9344900846481323
HCLTECH,2026-03-20,Coforge Ltd. - The Economic Times,-0.9232677817344666
HCLTECH,2017-08-18,Max Financial Services Ltd. - The Economic Times,-0.9299257397651672
HCLTECH,2017-05-14,Hitech Corporation Ltd. - The Economic Times,-0.9273308515548706
HCLTECH,2017-04-20,Zen Technologies Ltd. - The Economic Times,-0.9257535338401794
HCLTECH,2020-01-20,"FACT Cash Flow, Financial Statements - The Economic Times",-0.9269641041755676
HCLTECH,2017-03-27,3i Infotech Ltd. - The Economic Times,-0.9270395040512085
HCLTECH,2026-01-28,ICICI Prudential Life Insurance Company Ltd. - The Economic Times,-0.9318598508834839
HCLTECH,2026-03-20,National Securities Depository Ltd. - The Economic Times,-0.9261100888252258
HCLTECH,2026-03-20,Lodha Developers Ltd. - The Economic Times,-0.926206111907959
HCLTECH,2018-09-07,Ircon International Ltd. - The Economic Times,-0.9261210560798645
HCLTECH,2026-03-20,Sagility Ltd. - The Economic Times,-0.9227110743522644
HCLTECH,2025-12-06,Meesho Ltd. - The Economic Times,-0.9241359829902649
