ticker,date,headline,sentiment_score
HDFCBANK,2026-03-30,HDFC Bank chairman's sudden exit exposes leadership strains at top Indian lender - Reuters,-0.9224974513053894
HDFCBANK,2026-04-03,"Q4 impact: Bank stocks slump up to 32% in 3 months, but brokerages bet on SBI, HDFC Bank, 6 more stocks. Che.. - BFSI News",-0.9593794941902161
HDFCBANK,2026-04-01,Banking On Silence: Can credibility cushion the silence of HDFC Bank? - ET BrandEquity,-0.8739522695541382
HDFCBANK,2026-04-03,Q4 results preview: Banks set for steady quarter amid macro uncertainty; margins rangebound - BFSI News,-0.6574022173881531
HDFCBANK,2026-04-03,HDFC Bank penalises 12 execs for role in mis-selling AT1 bonds - BFSI News,-0.8386906385421753
HDFCBANK,2026-04-03,HDFC Bank penalises 12 executives for role in mis-selling AT1 bonds - ETHRWorld.com,-0.8896937966346741
HDFCBANK,2026-04-03,AIBEA writes to FM seeking probe into HDFC Bank matter after chairman's exit - ETHRWorld.com,-0.875248908996582
HDFCBANK,2026-04-03,"Dubai regulator probe found HDFC's DIFC branch kept quiet for 5 years, failed to meet integrity standards - BFSI News",-0.8266209363937378
HDFCBANK,2026-04-02,Groww Dynamic Term Fund - Regular Plan Fund info - The Economic Times,-0.9340303540229797
HDFCBANK,2026-04-03,The billion-dollar question: Where to invest? - BFSI News,-0.9446905255317688
HDFCBANK,2026-04-03,"nifty 50 vs nifty midcap 150 performance: Latest News & Videos, Photos about nifty 50 vs nifty midcap 150 performance - The Economic Times",-0.9182888269424438
HDFCBANK,2026-04-04,Kotak Multi Asset Active FoF Regular-IDCW - The Economic Times,-0.9110361933708191
HDFCBANK,2026-04-03,Axis Bank to deepen insurance bet with Rs 389 crore infusion in Axis Max Life; stake seen at 19.99% - BFSI News,0.8563381433486938
HDFCBANK,2026-04-03,Bank CASA ratio falls to two-year low of 37.9% in December quarter: RBI Data - The Economic Times,-0.9520525336265564
HDFCBANK,2026-04-03,When fear outpaces fundamentals: Why RBI's signal matters more than rates - BFSI News,-0.9259176850318909
HDFCBANK,2026-04-03,Informal sector steps up coal stocking over price concerns - The Economic Times,-0.4943094849586487
HDFCBANK,2026-04-04,"budget 2026 middle class impact: Latest News & Videos, Photos about budget 2026 middle class impact - The Economic Times",-0.920911431312561
HDFCBANK,2026-04-04,"itc hotels ltd q2 results: Latest News & Videos, Photos about itc hotels ltd q2 results - The Economic Times",-0.9364808797836304
HDFCBANK,2026-04-03,"pan card documents required 2026: Latest News & Videos, Photos about pan card documents required 2026 - The Economic Times",-0.9474258422851562
HDFCBANK,2026-04-04,Artemis II mission: NASA shares first images of Earth by astronauts aboard - The Economic Times Video | ET Tv - The Economic Times,-0.910578727722168
HDFCBANK,2026-04-04,"24k gold prices: Latest News & Videos, Photos about 24k gold prices - The Economic Times",-0.9361081123352051
HDFCBANK,2026-04-04,"aquarius love horoscope april 2026: Latest News & Videos, Photos about aquarius love horoscope april 2026 - The Economic Times",-0.9349830150604248
HDFCBANK,2026-04-03,"mp board result 2026 class 5: Latest News & Videos, Photos about mp board result 2026 class 5 - The Economic Times",-0.9412900805473328
HDFCBANK,2026-04-04,LIVE KERALA LOTTERY RESULT BHAGYATHARA BT 46 - The Economic Times,-0.9168386459350586
HDFCBANK,2026-04-04,"bt46 lottery result: Latest News & Videos, Photos about bt46 lottery result - The Economic Times",-0.9387406706809998
HDFCBANK,2026-04-04,DHURANDHAR 2 OPENING WEEKEND COLLECTION - The Economic Times,-0.9169645309448242
HDFCBANK,2026-04-04,RBI revises rules for Floating Rate Savings Bonds 2020: Key changes investors should know - The Economic Times,-0.9300522208213806
HDFCBANK,2026-04-04,"astrology february 2026: Latest News & Videos, Photos about astrology february 2026 - The Economic Times",-0.937063992023468
HDFCBANK,2026-04-03,"australian open 2026: Latest News & Videos, Photos about australian open 2026 - The Economic Times",-0.9352359175682068
HDFCBANK,2026-04-04,Who are Delve founders Karun Kaushik and Selin Kocalar? - The Economic Times,-0.9348270893096924
HDFCBANK,2026-04-04,"oil price march 24: Latest News & Videos, Photos about oil price march 24 - The Economic Times",-0.9361136555671692
HDFCBANK,2026-04-03,"why dhurandhar 2 tickets cancelled: Latest News & Videos, Photos about why dhurandhar 2 tickets cancelled - The Economic Times",-0.9270188212394714
HDFCBANK,2026-04-04,"puducherry assembly polls 2023: Latest News & Videos, Photos about puducherry assembly polls 2023 - The Economic Times",-0.9381169676780701
HDFCBANK,2026-04-04,'LDF will be out of power': PM Modi says corruption is a key obstacle to Kerala's growth - The Economic Times,-0.6702951192855835
HDFCBANK,2026-04-04,"indian premier league 2026: Latest News & Videos, Photos about indian premier league 2026 - The Economic Times",-0.9362003803253174
HDFCBANK,2026-04-04,"winter olympics 2026 opening ceremony: Latest News & Videos, Photos about winter olympics 2026 opening ceremony - The Economic Times",-0.9342475533485413
HDFCBANK,2026-04-04,ITR changes from April 2026: 5 key updates for Tax Year 2026–27 explained - The Economic Times,-0.9162776470184326
HDFCBANK,2026-04-04,"operation cyber hawk 3 0: Latest News & Videos, Photos about operation cyber hawk 3 0 - The Economic Times",-0.9341831803321838
HDFCBANK,2026-04-04,"rcb tickets 2026: Latest News & Videos, Photos about rcb tickets 2026 - The Economic Times",-0.9385147094726562
HDFCBANK,2026-04-04,"oscars 2026 kpop demon hunters: Latest News & Videos, Photos about oscars 2026 kpop demon hunters - The Economic Times",-0.9352432489395142
HDFCBANK,2026-04-04,"powerball march 23 drawing: Latest News & Videos, Photos about powerball march 23 drawing - The Economic Times",-0.9296663403511047
HDFCBANK,2026-04-04,EASY HOMEMADE CHOCOLATES FOR CHOCOLATE DAY 2026 - The Economic Times,-0.9211908578872681
HDFCBANK,2026-04-04,'Iran’s nuke threat imminent?’: Democrats GRILL Tulsi Gabbard over Trump’s war - The Economic Times,-0.7101824879646301
HDFCBANK,2026-04-03,"'You just lied under oath!': Dems, Bondi get into epic clash over Epstein Files at explosive hearing - The Economic Times",-0.7670228481292725
HDFCBANK,2026-04-04,"India’s crude oil supply fully secured, no payment hurdle for Iranian imports: Petroleum Ministry - The Economic Times",-0.900404155254364
HDFCBANK,2026-04-04,"iran war 2026: Latest News & Videos, Photos about iran war 2026 - The Economic Times",-0.9338733553886414
HDFCBANK,2017-03-23,"Karur Vysya Bank Share Price Today, Karur Vysya Bank Stock Price Live NSE/BSE Updates - The Economic Times",-0.935710072517395
HDFCBANK,2025-07-19,India's HDFC Bank reports 12.2% profit growth in Q1 due to higher interest income - Reuters,0.9452545642852783
HDFCBANK,2025-10-18,India's HDFC Bank beats quarterly profit estimates; margins remain weak - Reuters,-0.963021993637085
HDFCBANK,2024-01-18,Why are HDFC Bank shares falling? - BFSI News,-0.9395937919616699
HDFCBANK,2025-07-15,How much has HDFC Bank grown in first full year of merger? - BFSI News,-0.7297751903533936
HDFCBANK,2025-04-03,India's HDFC Bank says growth in quarterly deposits outpaces loans - Reuters,0.8168204426765442
HDFCBANK,2026-01-17,India's HDFC Bank beats quarterly profit expectations on better lending margins - Reuters,0.9404294490814209
HDFCBANK,2024-01-16,"India's HDFC Bank beats Q3 profit forecast, plans listing consumer finance unit - Reuters",-0.8565685749053955
HDFCBANK,2024-01-17,HDFC Bank’s Shares Tumble After Results Signal Slowdown - bloomberg.com,-0.9512388110160828
HDFCBANK,2024-04-20,India's HDFC Bank misses Q4 profit view on higher provisions; margins stable - Reuters,0.5088596343994141
HDFCBANK,2024-01-17,India's HDFC Bank posts worst day in nearly 4 years on margin concerns - Reuters,-0.9473960995674133
HDFCBANK,2022-04-04,HDFC Bank creates Indian lending behemoth in $40 billion deal - Reuters,-0.7555971741676331
HDFCBANK,2024-07-20,"India's HDFC Bank beats Q1 profit forecast, margins stable - Reuters",0.882148265838623
HDFCBANK,2025-07-21,HDFC Bank stock climbs over 2 pc post earnings announcement - BFSI News,0.7973678708076477
HDFCBANK,2025-07-16,HDFC Bank’s Board to Consider Issue of Bonus Shares on July 19 - bloomberg.com,-0.9458993077278137
HDFCBANK,2022-07-16,"Hdfc bank results - Latest hdfc bank results , Information & Updates - BFSI -ET BFSI - BFSI News",-0.9444063305854797
HDFCBANK,2014-03-15,HDFCB: HDFC Bank Ltd Stock Price Quote - Natl India - Bloomberg - bloomberg.com,-0.9479336738586426
HDFCBANK,2022-07-16,"HDFC Bank Q1 results: Net profits shoots 19% YoY to Rs 9,196 Cr; NII grew 14.5% - BFSI News",0.9432883858680725
HDFCBANK,2026-01-06,"Indian shares slip from near record highs as Reliance, HDFC Bank weigh - Reuters",-0.9435144662857056
HDFCBANK,2021-02-25,Check out HDFC Bank Ltd's stock price (0A7I-GB) in real time - CNBC,-0.9454439282417297
HDFCBANK,2026-03-19,HDFC Bank shares fall over 5% as part-time chair of India’s largest private bank resigns over 'ethics' - CNBC,-0.9562240242958069
HDFCBANK,2017-08-04,Check out HDFC Bank Ltd's stock price (HDFCBANK-IN) in real time - CNBC,-0.9452770948410034
HDFCBANK,2021-06-20,HDFC Bank Ltd - Reuters,-0.942567765712738
HDFCBANK,2025-07-21,"HDFC Bank, ICICI Bank lead India's stock benchmarks higher, Reliance caps gains - Reuters",0.6184461116790771
HDFCBANK,2026-03-19,India's HDFC Bank says chairman exit may be over rift with management; stock falls - Reuters,-0.944725751876831
HDFCBANK,2025-07-20,"India's HDFC Bank, ICICI Bank rise on upbeat quarterly results - Reuters",0.7364698648452759
HDFCBANK,2026-01-06,HDFC Bank logs 12% rise in loans in December quarter - BFSI News,0.920631468296051
HDFCBANK,2026-01-18,HDFC Bank’s Recovery Gains Momentum on Lending Expansion - bloomberg.com,0.8380207419395447
HDFCBANK,2026-04-02,"HDFC Bank Share Price Today, HDFC Bank Stock Price Live NSE/BSE Updates - The Economic Times",-0.9379709362983704
HDFCBANK,2012-10-12,"India's HDFC Bank Q2 net up 30 pct, meets forecast - Reuters",0.9419518709182739
HDFCBANK,2024-08-20,HDFC Bank keeps focus on sustainable growth and margin improvement - BFSI News,0.5040068626403809
HDFCBANK,2020-08-17,HDFC Bank describes reports of allegations in lawsuit as ‘Frivolous’ - BFSI News,-0.5693084597587585
HDFCBANK,2024-01-16,HDFC Bank Posts Quarterly Profit That Tops Analysts’ Estimates - bloomberg.com,0.817881166934967
HDFCBANK,2024-10-22,"HDFC Bank may undergo prolonged realignment, faces near-term growth challenges - BFSI News",-0.8033885955810547
HDFCBANK,2025-07-19,"HDFC Bank, ICICI Bank face profit pressures in Q1 amid tepid loan growth, margin strain - BFSI News",-0.9525023102760315
HDFCBANK,2025-07-19,HDFC Bank Profit Beats Estimate Despite Higher Provision - bloomberg.com,0.6751730442047119
HDFCBANK,2024-07-20,HDFC Bank’s Profit Beats Estimate Buoyed by Strong Loan Growth - bloomberg.com,0.8294591903686523
HDFCBANK,2026-01-17,HDFC Bank’s Net Income Exceeds Estimates on Strong Loan Growth - bloomberg.com,0.720878541469574
HDFCBANK,2025-10-05,HDFC Bank records 9% loan growth in Q2; Kotak Bank credit rises 16% - BFSI News,0.9295765161514282
HDFCBANK,2017-08-10,Check out HDFC Bank Ltd's stock price (HDB) in real time - CNBC,-0.944404125213623
HDFCBANK,2023-04-18,HDFC Limited - Reuters,-0.9409374594688416
HDFCBANK,2023-07-07,HDFC Bank: Bigger and stronger - BFSI News,0.9281306266784668
HDFCBANK,2026-02-16,"Indian shares up on value buying in HDFC Bank, Reliance - Reuters",0.9099706411361694
HDFCBANK,2025-04-05,"Large lenders report robust growth in Q4 advances, deposits; HDFC Bank shines, IndusInd Bank sees mixed tren.. - BFSI News",0.587863564491272
HDFCBANK,2022-03-15,HDFC Bank to deliver growth post lifting of RBI restrictions: Report - BFSI News,-0.7440463900566101
HDFCBANK,2025-07-15,"HDFC Bank CEO eyes accelerated growth, says it’s time to 'go for the boundaries' - BFSI News",0.5464955568313599
HDFCBANK,2024-01-16,"Will go for granular deposits, replace higher cost borrowings: HDFC Bank CFO - BFSI News",-0.872839093208313
HDFCBANK,2025-04-15,India's HDFC Bank hits four-month high as deposit rate cut seen lifting margins - Reuters,0.9306253790855408
HDFCBANK,2024-07-03,HDFC Bank shares may gain amid potential MSCI Index weight change - BFSI News,0.6338626742362976
HDFCBANK,2023-10-16,"HDFC Bank Posts $1.91 Billion in Profit, Surpasses Expectations - bloomberg.com",0.7478069067001343
HDFCBANK,2022-04-05,"Hdfc share price - Latest hdfc share price , Information & Updates - BFSI -ET BFSI - BFSI News",-0.9496279954910278
HDFCBANK,2026-03-18,HDFC Bank chairman quits over 'values and ethics'; Keki Mistry is interim head - Reuters,-0.7686645984649658
HDFCBANK,2025-01-25,"HDFC Bank prepares for next growth cycle, but near-term hurdles persist - BFSI News",-0.7474371194839478
HDFCBANK,2023-06-30,"HDFC to merge into HDFC Bank on July 1, create India’s financial behemoth - Reuters",-0.9113766551017761
