ticker,date,headline,sentiment_score
HINDUNILVR,2026-01-29,Indian shares rise for third session; gains capped by record-low rupee - Reuters,0.4932432770729065
HINDUNILVR,2018-07-03,Traders’ Diary: Go for wait-and-watch approach - The Economic Times,-0.9294167757034302
HINDUNILVR,2026-01-28,"Indian shares rise on EU deal; defence, infrastructure stocks gain ahead of budget - Reuters",0.8880199790000916
HINDUNILVR,2025-09-22,"hul Forum Discussion on Market View, Business sectors,Stocks, Commodity, Personal Finance & More - Moneycontrol",-0.9447313547134399
HINDUNILVR,2012-04-28,"Most Active Shares - F&O Market, All Futures & Options, Index Futures, Index Options, Stock Futures, Stock Options - Moneycontrol",-0.9498177766799927
HINDUNILVR,2011-12-23,Hindustan Unilever (HUL) | Buy | Target price - Moneycontrol,-0.9401909112930298
HINDUNILVR,2021-07-17,Hindustan Unilever - Moneycontrol,-0.9310309290885925
HINDUNILVR,2020-06-12,HINDUNILVR 24Feb2026 - Moneycontrol,-0.9241721630096436
HINDUNILVR,2025-01-22,"HUL Q3 Results FY25 Live Updates: HUL Q3 profit at Rs 3,001 cr beats estimates; revenue at Rs 15,408 cr - The Economic Times",-0.8658072352409363
HINDUNILVR,2020-11-02,Hindustan Unilever - Moneycontrol,-0.9310309290885925
HINDUNILVR,2025-11-12,Hindustan Unilever - Positive Breakout: These 11 stocks cross above their 200 DMAs - The Economic Times,0.6305984854698181
HINDUNILVR,2025-08-28,"Quarterly Results, Hindustan Unilever Financial Statement & Accounts - Moneycontrol",-0.9419714212417603
HINDUNILVR,2020-02-28,Hindustan Unilever - Moneycontrol,-0.9310309290885925
HINDUNILVR,2011-07-10,"Hindustan Unilever Registered Address Contact Details, Hindustan Unilever Management - Moneycontrol",-0.9504534602165222
HINDUNILVR,2020-11-02,Hindustan Unilever - Moneycontrol,-0.9310309290885925
HINDUNILVR,2020-02-13,"Hindustan Unilever | AGM/EGM > Personal Care > Meetings of Hindustan Unilever - BSE: 500696, NSE: HINDUNILVR - Moneycontrol",-0.9464420080184937
HINDUNILVR,2023-10-23,"Hindustan Unilever Balance Sheet, Hindustan Unilever Financial Statement & Accounts - Moneycontrol",-0.9427191019058228
HINDUNILVR,2011-07-14,Hindustan Unilever Ltd. - Moneycontrol,-0.9444519281387329
HINDUNILVR,2021-04-21,Hindustan Unilever - Moneycontrol,-0.9310309290885925
HINDUNILVR,2011-07-14,Hindustan Unilever Ltd. - Moneycontrol,-0.9444519281387329
HINDUNILVR,2011-07-23,"Hindustan Unilever Cash Flow, Hindustan Unilever Financial Statement & Accounts - Moneycontrol",-0.9439709186553955
HINDUNILVR,2025-06-27,HUL Share Price Highlights: HUL Stock Price History - The Economic Times,-0.9357123374938965
HINDUNILVR,2025-12-10,Hindustan Unilever - JSW Energy among 5 F&O stocks that saw a high increase in futures open interest - The Economic Times,0.7899353504180908
HINDUNILVR,2025-10-24,"HUL shares fall 3% today after Q2 results, brokerages see gradual recovery; should you buy or sell? - Moneycontrol",-0.9550973773002625
HINDUNILVR,2024-11-05,Hindustan Unilever Ltd. - images.moneycontrol.com,-0.9470927715301514
HINDUNILVR,2023-12-15,"Hindustan Unilever Consolidated Key Financial Ratios, Hindustan Unilever Financial Statement & Accounts - Moneycontrol",-0.9410905241966248
HINDUNILVR,2025-10-31,"Hindustan Unilever's India arm gets Rs 1,986 crore tax notice - The Economic Times",-0.859825074672699
HINDUNILVR,2022-11-27,"Share Price, Stock Price, Stock Price, Share Price, Live BSE/NSE, Bids Offers. Buy/Sell news & tips, & F&O Quotes, NSE/BSE Forecast News and Live Quotes - Moneycontrol",-0.9510061144828796
HINDUNILVR,2025-12-01,HUL-Kwality Wall's demerger record date fixed for December 5: What it means for shareholders - Moneycontrol,-0.9283713102340698
HINDUNILVR,2026-01-23,"India's Nifty 50 logs steepest weekly drop in four months on tepid earnings, foreign outflows - Reuters",-0.9641455411911011
HINDUNILVR,2026-01-06,"Market Highlights: Sensex settles 376 pts lower, Nifty below 26,200; ITC, Kotak Bank drop 2% each - The Economic Times",-0.9624190330505371
HINDUNILVR,2026-01-21,"Market Highlights: Sensex settles 271 pts lower, Nifty below 25,200; ICICI Bank, Trent drop 2% each; rupe... - The Economic Times",-0.9650412797927856
HINDUNILVR,2025-11-26,"India's stock benchmarks ascend towards new peaks on Fed, RBI rate cut optimism - Reuters",0.47041448950767517
HINDUNILVR,2025-08-20,"Stock Market Highlights: Sensex settles 213 pts higher, Nifty above 25K as D-St maintains winning run for... - The Economic Times",0.9149729013442993
HINDUNILVR,2026-01-12,Indian shares snap losing streak as US envoy's remarks soothe tariff woes - Reuters,-0.6238376498222351
HINDUNILVR,2025-12-02,"India stock benchmarks fall for 3rd straight session, financials drag - Reuters",-0.9628227949142456
HINDUNILVR,2025-07-21,"HDFC Bank, ICICI Bank lead India's stock benchmarks higher, Reliance caps gains - Reuters",0.6184461116790771
HINDUNILVR,2025-11-24,"Market Highlights: Sensex settles 331 pts lower; Nifty below 25,950; BEL drops 3%, M&M 2% - The Economic Times",-0.9685625433921814
HINDUNILVR,2025-11-04,Indian shares drop as broader profit booking dampens earnings optimism - Reuters,-0.9474688768386841
HINDUNILVR,2026-01-21,Indian shares extend losses after Tuesday's selloff; rupee slumps to record low - Reuters,-0.9604122042655945
HINDUNILVR,2025-12-04,India's stock benchmarks snap losing run ahead of RBI rate decision - Reuters,-0.9275100827217102
HINDUNILVR,2025-11-21,"Market Highlights: Sensex settles 401 pts lower; Nifty below 26,100; Tata Steel drops 3%, Bajaj Fin 2% - The Economic Times",-0.9612054228782654
HINDUNILVR,2025-10-31,Indian benchmark shares log best month since March on strong earnings outlook - Reuters,0.9133738279342651
HINDUNILVR,2025-12-29,"Market Highlights: Sensex extends losing run to 4th day, ends 346 pts lower; Nifty below 25,950; HCL Tech... - The Economic Times",-0.9556516408920288
HINDUNILVR,2025-11-17,Financials lead Indian stocks higher on earnings optimism; mid-caps hit record high - Reuters,0.9400767087936401
HINDUNILVR,2025-11-12,"Indian shares rally on IT boost, Reliance gains; Bihar state exit polls lift mood - Reuters",0.9182494282722473
HINDUNILVR,2025-11-25,Indian shares slip for third session as profit-taking persists near record highs - Reuters,-0.9596724510192871
HINDUNILVR,2025-12-08,Indian shares post worst day in over two months; IndiGo sheds 8% - Reuters,-0.9624630212783813
HINDUNILVR,2025-08-28,"Stock Market Highlights: Sensex settles 706 pts lower, Nifty at 24,500 as 50% US tariffs take effect - The Economic Times",-0.9455522894859314
HINDUNILVR,2025-07-08,India's stock benchmarks muted on tariff jitters; Trump says India deal close - Reuters,-0.558691143989563
