ticker,date,headline,sentiment_score
INDHOTEL,2017-03-24,"NTPC Share Price Today, NTPC Stock Price Live NSE/BSE Updates - The Economic Times",-0.9381704330444336
INDHOTEL,2017-08-07,Check out Indian Hotels Company Ltd's stock price (INDHOTEL-IN) in real time - CNBC,-0.9444486498832703
INDHOTEL,2026-03-20,"Indian Hotels Share Price Today, Indian Hotels Stock Price Live NSE/BSE Updates - The Economic Times",-0.937212347984314
INDHOTEL,2026-03-20,Indian Hotels Company Ltd. - The Economic Times,-0.9216436743736267
INDHOTEL,2014-03-15,IH: Indian Hotels Co Ltd/The Stock Price Quote - Natl India - Bloomberg - Bloomberg.com,-0.9477452635765076
INDHOTEL,2024-02-01,IHCL announces financial results for Q3 FY 2023-24 - ET Hospitality,-0.8954970240592957
INDHOTEL,2025-08-13,Taj Hotels owner goes global with bold expansion into Europe and the Middle East - CNBC,0.891735851764679
INDHOTEL,2019-04-27,"Dalmia Bharat Share Price Today, Dalmia Bharat Stock Price Live NSE/BSE Updates - The Economic Times",-0.9409792423248291
INDHOTEL,2021-07-09,Indian Hotels Company Ltd - Reuters,-0.943303108215332
