ticker,date,headline,sentiment_score
INDIGO,2026-03-27,IndiGo shares slip 2% in trade; Motilal Oswal cuts target price on stock - Business Standard,-0.9524353742599487
INDIGO,2026-03-23,IndiGo appoints Aloke Singh as Chief Strategy Officer - ET Infra,-0.9216729402542114
INDIGO,2026-03-24,IndiGo shares jump 4% after appointing former Air India Express CEO Aloke Singh as chief strategy head - ET Hospitality,-0.8083014488220215
INDIGO,2026-03-25,IndiGo plans to build integrated campus on 4.5-acre land in Gurugram - Business Standard,-0.86981201171875
INDIGO,2026-03-23,IndiGo appoints ex-Air India Express MD Aloke Singh as strategy chief - Business Standard,-0.9221441745758057
INDIGO,2026-03-28,IndiGo flight makes emergency landing at Delhi airport after engine failure - Business Standard,-0.7780322432518005
INDIGO,2026-03-22,"IndiGo to run select Gulf flights, warns of last-minute schedule changes amid Middle East tensions - ET Infra",-0.9422897100448608
INDIGO,2026-03-24,Higher airfares due to any further cost escalation will hit demand: IndiGo amid Middle East conflict - ET Infra,-0.7607384324073792
INDIGO,2026-03-23,IndiGo appoints former Air India Express MD Aloke Singh as CSO from April 6 - Business Standard,-0.9344342947006226
INDIGO,2026-03-25,Higher airfares due to any further cost escalation will hit demand: IndiGo amid Middle East conflict - ET TravelWorld,-0.5669134855270386
INDIGO,2026-03-23,"Airline stocks: IndiGo, SpiceJet tumble up to 10% as ATF price hike looms - Business Standard",-0.9246318936347961
INDIGO,2026-03-21,Govt to lift airfare cap from March 23 imposed after IndiGo disruptions - Business Standard,-0.6501175165176392
INDIGO,2026-03-22,"Air India, IndiGo, SpiceJet oppose govt's 60 pc free seat selection decision - ET TravelWorld",-0.8251008987426758
INDIGO,2026-03-23,Govt removes domestic fare caps as airline operating costs skyrocket; flying to cost more - ET TravelWorld,-0.6414231061935425
INDIGO,2026-03-28,IndiGo flight makes emergency landing at Delhi's IGI airport due to engine failure - ET Infra,-0.8510487675666809
INDIGO,2026-03-23,"DGCA releases summer schedule for domestic airlines, effective March 29 - Business Standard",-0.9350794553756714
INDIGO,2026-03-27,Indian airlines to operate 10% fewer flights in summer schedule - ET Infra,-0.6676828861236572
INDIGO,2026-03-22,"global oil prices war impact: Latest News & Videos, Photos about global oil prices war impact - The Economic Times",-0.9314758777618408
INDIGO,2026-03-21,Air India to introduce crew fitness policy; lapses may lead to pay loss - Business Standard,-0.9653970003128052
INDIGO,2026-03-26,Airbus mulls ATR final assembly line in India after Embraer - ET Infra,-0.8216004371643066
INDIGO,2026-03-27,Foreign investors rethink India bet: BNP Paribas flags 4 risks for markets - Business Standard,-0.8625406622886658
INDIGO,2026-03-23,"Iran War forces India-West flights to take longer detours, sending travel times and fares soaring - ET Infra",-0.9534404277801514
INDIGO,2026-03-27,Noida International Airport: Here's everything you need to know about India's newest international airport - ET Infra,-0.9208930134773254
INDIGO,2026-03-27,Uttar Pradesh's 5th international airport to take wings on Saturday - Business Standard,-0.8124931454658508
INDIGO,2026-03-27,Airlines facing big challenges; 'hope we see better days': DGCA chief - ET Infra,-0.7246944904327393
INDIGO,2026-03-21,India withdraws domestic airfare caps in relief to airlines - reuters.com,-0.7895711064338684
INDIGO,2026-03-24,Centre seeks more time in SC on airfare volatility amid West Asia crisis - ET Infra,-0.7461942434310913
INDIGO,2026-03-27,Domestic airfares set to soar as flight count drops 12% - ET Infra,-0.7803478837013245
INDIGO,2026-03-27,"Fewer flights, no fare caps: Domestic airfares set to soar - ET TravelWorld",0.797645092010498
INDIGO,2026-03-27,"Fewer flights, no fare caps: Domestic airfares set to soar - ET Hospitality",0.9231335520744324
INDIGO,2026-03-25,"Price hikes, outlook cuts - What airlines are doing as fuel costs surge - ET TravelWorld",-0.8638255596160889
INDIGO,2026-03-25,Binance’s Grip on Crypto Loosens as Market Crash Rattles Faith - Bloomberg.com,-0.5915476083755493
INDIGO,2026-03-28,Why megapolis Delhi needs a second airport - ET Infra,-0.9148406982421875
INDIGO,2026-03-25,Indian shares rise for second day on Middle East ceasefire prospects - reuters.com,-0.6108385920524597
INDIGO,2026-03-23,"Iran war: Financial impact yet to be fully felt; check unnecessary expenses, Air India CEO tells staff - ET TravelWorld",-0.4746394157409668
INDIGO,2026-03-24,Airlines cancel more flights as Middle East conflict escalates - ET TravelWorld,-0.8513474464416504
INDIGO,2026-03-27,"Acme Solar gains 7% in trade; Centrum initiates with 'Buy', sees 16% upside - Business Standard",0.9290580153465271
INDIGO,2026-03-27,RIL share price tumbles 4%; govt's export duty on fuel spooks investors - Business Standard,-0.9672334790229797
INDIGO,2026-03-27,"'Will hunt you down without apology': From prayers to punchline, Hegseth’s ‘sarcastic’ Iran warnings - The Economic Times",-0.8527477383613586
INDIGO,2026-03-25,FCRA amendment Bill proposes new authority to manage NGOs that lose licence - Business Standard,-0.9303337335586548
INDIGO,2026-03-27,"₹1.5 trn hit to exchequer as govt cuts petrol, diesel excise: Deven Choksey - Business Standard",-0.7923145890235901
INDIGO,2026-03-27,"Taxiing to take off, Jewar airport likely to drive land value surge - Business Standard",0.911109983921051
INDIGO,2026-03-28,"Jewar Airport to boost investment, jobs, economic growth: Aviation Minister - Business Standard",-0.7917817234992981
INDIGO,2026-03-23,"Hindustan Zinc falls 6% as markets crash, silver prices drag sentiment - Business Standard",-0.9644691348075867
INDIGO,2026-03-23,Oil turmoil: OMCs raise industrial diesel rate; ATF hike likely from April - Business Standard,0.7394904494285583
INDIGO,2026-03-25,Form high-level committee to review systemic failures: Parl panel to MoCA - Business Standard,-0.906745970249176
INDIGO,2026-03-26,Gulf airspace closures leave travellers stranded and bleeding cash - Business Standard,-0.9668254852294922
INDIGO,2026-03-24,"HDFC Bank shares rebound after 4-day fall, stock up 2%; time to buy? - Business Standard",0.9007027745246887
INDIGO,2026-03-27,"DGCA tells pilots to resist pressure on VVIP flights, stress safety norms - Business Standard",-0.9097649455070496
INDIGO,2026-03-28,PM Modi to inaugurate Phase I of Noida International Airport at Jewar today - Business Standard,-0.9262412786483765
INDIGO,2026-03-23,MacBook Neo review: What you got wrong about Apple's entry MacBook - Business Standard,-0.8250563144683838
INDIGO,2026-03-25,US court questions Trump administration's ban on Anthropic AI's usage - Business Standard,-0.6978923678398132
INDIGO,2026-03-24,"Mphasis, TCS, HCLTech, Wipro: Why did Nifty IT rise 3% in trade today? - Business Standard",-0.7110230922698975
INDIGO,2026-03-23,HDFC Bank: Sebi chief says independent directors must act responsibly - Business Standard,-0.9298735857009888
INDIGO,2026-03-27,"Xiaomi 17 review: Leica camera and battery shine, software holds back - Business Standard",-0.6564159989356995
INDIGO,2026-03-24,NOCIL soars 12%; Arvind Mafatlal Group stock rallies 28% in 3 days - Business Standard,0.8937174677848816
INDIGO,2026-03-27,EvoFox Deck 2 review: Takes mobile gaming closer to handheld consoles - Business Standard,-0.7346819639205933
INDIGO,2026-03-25,Is fuel efficiency back on the radar as crude prices surge again? - Business Standard,-0.8723991513252258
INDIGO,2026-03-27,India VIX rises 9% amid West Asia jitters; up 90% since February 27 - Business Standard,0.9469934105873108
INDIGO,2026-03-26,DGCA is looking to ease rules for airlines to help them grow: Chief - Business Standard,-0.8735109567642212
INDIGO,2026-03-25,Parliamentary Panel seeks relief for shippers hit by West Asia disruption - Business Standard,-0.8890168070793152
INDIGO,2026-03-26,DGCA seeks corrective steps from Air India over Vancouver flight error - Business Standard,-0.7224159836769104
INDIGO,2026-03-23,"Nifty Realty down 5%; Lodha, DLF, Prestige Estates fall up to 6%: Check why - Business Standard",-0.9528757333755493
INDIGO,2026-03-24,"Acutaas Chemicals zooms 50% in 2 months, hits new high; here's why - Business Standard",0.774712324142456
INDIGO,2026-03-27,ICRA lowers aviation outlook to negative; sees 0-3% traffic growth for FY26 - Business Standard,-0.8320584893226624
INDIGO,2026-03-27,"Govt cuts excise duty on petrol, diesel, stks dip; Deven Choksey on impact - Business Standard",-0.5062665939331055
INDIGO,2026-03-23,"Sebi eases reporting norms for brokers, reduces compliance burden - Business Standard",0.9201313853263855
INDIGO,2026-03-24,"Fino Payments Bank tanks 19%, stock hits record low - Business Standard",0.8007281422615051
INDIGO,2026-03-27,"IOC, BPCL, HPCL shares react as govt trims excise duty on petrol, diesel - Business Standard",-0.8771960139274597
INDIGO,2026-03-25,"West Asia crisis: 426,000 passengers have returned to India, says MEA - Business Standard",-0.627451479434967
INDIGO,2026-03-24,"Apple WWDC26 starts June 8: New OS platforms, AI Siri overhaul expected - Business Standard",-0.5171605944633484
INDIGO,2026-03-26,"Samsung Galaxy S26 review: Refined and reliable flagship, but plays it safe - Business Standard",-0.8322556614875793
INDIGO,2026-03-24,Mkts rebound as US pauses Iran strikes; gains capped as oil recoups losses - Business Standard,0.8506540060043335
INDIGO,2026-03-26,"Air India's London-bound A350 aircraft faces tech issue, returns to Delhi - Business Standard",0.5018374919891357
INDIGO,2026-03-24,"Rain, thunderstorms likely across many states; Delhi to stay partly cloudy - Business Standard",-0.835017204284668
INDIGO,2026-03-25,Odisha conviction rate in crimes against women among highest in country: CM - Business Standard,-0.7645142078399658
INDIGO,2026-03-22,ATF price rise impact may be visible from April 1: Aviation minister - Business Standard,-0.9406511187553406
INDIGO,2026-03-20,Indian airlines seek fare cap removal as Iran crisis hits operations - reuters.com,-0.6268357038497925
INDIGO,2026-03-13,"IndiGo, Air India seek government support during Iran crisis, sources say - reuters.com",-0.874957799911499
INDIGO,2026-03-11,India's IndiGo shares rise after CEO quits; analysts see smooth transition - reuters.com,-0.5241748690605164
INDIGO,2025-05-27,IndiGo’s Gangwal Seeks $1.3 Billion From Upsized Stake Sale - Bloomberg.com,-0.9226124286651611
INDIGO,2025-01-24,India's IndiGo forecasts higher fourth-quarter demand - reuters.com,0.7755038142204285
INDIGO,2026-02-05,India Antitrust Body Orders Probe Into IndiGo Flight Disruptions - Bloomberg.com,-0.6468667984008789
INDIGO,2022-06-03,IndiGo Airlines - reuters.com,-0.9434090256690979
INDIGO,2026-03-23,India's IndiGo airline names former Air India Express CEO as strategy chief - reuters.com,-0.9337477684020996
INDIGO,2024-10-25,"Indian airline IndiGo sees 40% of grounded jets flying by April, swings to quarterly loss - reuters.com",-0.7447348237037659
INDIGO,2025-12-08,INDIGO IN Equity 08Dec25 - bsmedia.business-standard.com,-0.9444571733474731
INDIGO,2024-07-28,INDIGO IN Equity 28Jul24 RU - bsmedia.business-standard.com,-0.9396960139274597
INDIGO,2025-09-29,INDIGO IN Equity 29Sep25 CU - bsmedia.business-standard.com,-0.9410454630851746
INDIGO,2021-06-05,Indian airline IndiGo reports fifth straight quarterly loss - reuters.com,-0.904743492603302
INDIGO,2025-07-30,"IndiGo Profit Slips 20% on Border Conflict, Air Crash Impact - Bloomberg.com",-0.9603021740913391
INDIGO,2026-01-22,Indian airline IndiGo warns of higher costs after mass cancellations hit profit - reuters.com,-0.9132094979286194
INDIGO,2026-01-23,IndiGo Projects 10% Capacity Growth for Q4 FY26 - ET TravelWorld,0.9484772682189941
INDIGO,2016-03-11,INDIGO: InterGlobe Aviation Ltd Stock Price Quote - Natl India - Bloomberg.com,-0.9463085532188416
INDIGO,2026-01-23,India's largest airline sees shares drop after earnings plunge 78% on forex and other provisions - CNBC,-0.9667974710464478
INDIGO,2026-01-22,IndiGo Profit Plunges 78% as December Meltdown Takes a Toll - Bloomberg.com,-0.9522823691368103
INDIGO,2025-12-08,The operator of India's largest airline sees shares tumble after thousands of cancelations - CNBC,-0.9262276887893677
INDIGO,2026-01-04,Crises at Top India Airlines Strain Aviation Boom - Bloomberg.com,-0.6892167925834656
INDIGO,2021-07-27,IndiGo parent's shares fall nearly 5% after record quarterly loss - reuters.com,-0.9530375599861145
INDIGO,2023-08-15,India's Indigo down on report co-founder's family to sell stake of up to $450 mln - reuters.com,-0.6816539764404297
