ticker,date,headline,sentiment_score
ITC,2026-02-03,'Wake up ITC shares’: Fund manager uses Mughal-e-Azam meme as stock refuses to participate in Dalal Street - The Economic Times,-0.7070494890213013
ITC,2026-02-03,ITC Share Price Live Updates: ITC Sees High Trading Activity - The Economic Times,-0.6831498146057129
ITC,2026-02-02,ITC Share Price Live Updates: ITC's monthly performance shows a downturn - The Economic Times,-0.9265110492706299
ITC,2026-02-01,ITC Share Price Highlights: ITC Stock Price History - The Economic Times,-0.9362127184867859
ITC,2026-02-01,"ITC, Godfrey Phillips shares fall up to 3% after Budget 2026: Here's why - Moneycontrol",-0.9524487853050232
ITC,2026-01-30,ITC Share Price Highlights: ITC Stock Price History - The Economic Times,-0.9362127184867859
ITC,2026-01-29,"Stocks to Watch Today: Paytm, Swiggy, ITC, Hindustan Aeronautics, Atlanta Electricals, Vedanta, Voltas,... - Moneycontrol",-0.9244301915168762
ITC,2026-02-01,The tax shock for cigarette companies continues in India Budget 2026 - Moneycontrol,-0.6278685927391052
ITC,2026-01-29,"ITC shares fall marginally, Tata Motors down 1% ahead of Q3 results today: Here's what brokerages expect - Moneycontrol",-0.9622626304626465
ITC,2026-02-01,Cigarette prices jump up to ₹55 per pack as new excise duty kicks in. Check what gets costlier and by how - The Economic Times,-0.8450443148612976
ITC,2026-01-30,"ITC Standalone December 2025 Net Sales at Rs 18,017.14 crore, up 5.65% Y-o-Y - Moneycontrol",0.9507150650024414
ITC,2026-01-29,ITC Q3 Results FY26 Live Updates: Revenue seen rising up to 8.4% YoY on cigarette volume growth; Key thin... - The Economic Times,0.9483152627944946
ITC,2024-04-19,"Moving Averages Updates: ITC Stock Price Exceeds 20-Day SMA, Reaches Rs 424.90 with 1.44% Daily Gain - The Economic Times",0.8970354199409485
ITC,2026-01-30,"ITC Consolidated December 2025 Net Sales at Rs 20,047.30 crore, up 6.69% Y-o-Y - Moneycontrol",0.9513023495674133
ITC,2026-01-28,ITC Share Price Highlights: ITC Stock Price History - The Economic Times,-0.9362127184867859
ITC,2026-02-02,Jindal Steel signals fresh uptrend; Religare Broking suggests accumulating on dips - The Economic Times,0.7121917605400085
ITC,2026-02-02,"'If we don't make a deal, then...': Trump reacts to Iranian leader Khamenei's US regional war claim - The Economic Times",-0.8171072602272034
ITC,2026-02-02,'Will fight to tear ICE up from roots...': New Texas Democratic rep Menefee vows to dismantle ICE - The Economic Times,-0.8398656249046326
ITC,2026-02-03,Here’s what you can expect from Apple’s rumoured iPhone Flip - The Economic Times,-0.9383665919303894
ITC,2026-02-03,"Screenplay writer, who penned Bollywood’s most iconic film, once slept on footpaths - The Economic Times",-0.9162366986274719
ITC,2026-02-02,Dhurandhar star Akshaye Khanna shakes a leg to Shah Rukh Khan’s superhit song in old video; netizens react - The Economic Times,-0.8021438717842102
ITC,2026-02-03,Quote of the day by American actress Jennifer Garner: 'Beauty comes from a life well lived...' - The Economic Times,-0.8881288766860962
ITC,2026-02-03,Quote of day by Hollywood actress Ana de Armas: 'You may miss what is right in front of you because you se - The Economic Times,-0.7955582737922668
ITC,2026-02-03,Stranger Things Tales From ’85 release date in India confirmed: When and where to watch the spin-off serie - The Economic Times,-0.9289466142654419
ITC,2026-02-03,"Dhurandhar 2: The Revenge OTT release: Where to watch Aditya Dhar, Ranveer Singh's upcoming sequel to bloc - The Economic Times",-0.9119070172309875
ITC,2026-02-02,"ITC, Godfrey Phillips and other tobacco stocks fall up to 5% as cigarette prices rise after excise duty hi - The Economic Times",-0.9704599380493164
ITC,2026-02-02,"Stocks in news: BEL, HAL, ITC, Hero MotoCorp, Anant Raj, Adani Green - The Economic Times",-0.922964870929718
ITC,2026-02-03,"Ram Charan’s wife Upasana reveals how she inherited Rs 77,000 crore empire: ‘Women asked for their share’ - The Economic Times",-0.9025086760520935
ITC,2026-02-01,"Budget 2026 highlights: Key announcements on income tax, NRIs, small taxpayers and more - The Economic Times",-0.9280257821083069
ITC,2026-02-01,"Budget 2026: EaseMyTrip, ITC Hotels & other travel stocks soar up to 9% as FM Sitharaman unveils big touri - The Economic Times",0.9408538937568665
ITC,2026-02-03,BEL trades above key moving averages; technicals signal continuation of uptrend: Rajesh Palviya - The Economic Times,-0.6154621243476868
ITC,2026-02-01,ITC investors alert: What does a hike in statutory tobacco taxation in Budget fineprint reveal - The Economic Times,-0.8856766223907471
ITC,2026-02-01,ITC investors lose Rs 1 lakh crore after tax shock. Is there more pain in Budget 2026? - The Economic Times,-0.901590883731842
ITC,2026-02-03,Innovassynth Inv Profit and Loss Reports - The Economic Times,-0.8185244798660278
ITC,2026-01-30,"Buy, Sell or Hold: Morgan Stanley maintains Equal Weight on ITC; Motilal Oswal retains Buy on Swiggy - The Economic Times",-0.8449777364730835
ITC,2024-02-09,"ITC Stocks Live Updates: ITC Sees 1.27% Increase in Stock Price, EMA7 at Rs 425.97 - The Economic Times",0.9012166857719421
ITC,2026-02-03,AI scrambles IT's old growth clues. The new signals matter now - The Economic Times,-0.923677921295166
ITC,2026-02-03,Rare earths provide a rare opportunity - The Economic Times,-0.7856457233428955
ITC,2026-02-03,STT hike shouldn't bury price discovery - The Economic Times,-0.8464059829711914
ITC,2026-02-02,Bharat Electronics - Oil India among 4 stocks that hit 52-week highs & rallied up to 22% in a month - The Economic Times,0.9272786974906921
ITC,2026-02-03,"As Budget deepens RBI’s trilemma, it is likely to allow rupee to fall further - The Economic Times",-0.9550577998161316
ITC,2026-02-03,Frost & Sullivan recognises leading manufacturers and sustainability leaders at the 2025 IMEA and Sustaina - The Economic Times,0.8103796243667603
ITC,2024-04-19,"ITC Stocks Live Updates: ITC Sees 1.17% Price Increase, Average Daily Volatility at 2.86 Units Over 3 Mon - The Economic Times",0.8885999917984009
ITC,2026-02-02,Stranger Things: Tales From '85: Eleven & gang coming back to Netflix. Check release date and plot details - The Economic Times,-0.9387080669403076
ITC,2026-02-02,NTPC Share Price Live Updates: NTPC's performance highlights positive monthly returns - The Economic Times,0.7415261268615723
ITC,2026-02-04,Experts flag AI-only social site Moltbook - The Economic Times,-0.9082087874412537
ITC,2026-02-03,"Piyush Goyal breaks down India-US trade deal: 'Rahul misleading people, farmers fully protected' - The Economic Times",-0.7857154607772827
ITC,2026-02-02,Noida International Airport likely to be inaugurated this month: UP CM Yogi Adityanath - The Economic Times,-0.8822318315505981
ITC,2026-02-02,Tech Mahindra Share Price Live Updates: Tech Mahindra's monthly return reflects strong market position - The Economic Times,0.8991650342941284
ITC,2026-02-03,Future rapid rails can be modelled on Namo Bharat: Deutsche Bahn - The Economic Times,-0.9199953675270081
