ticker,date,headline,sentiment_score
JIOFIN,2023-08-21,"Jio Financial Services Share Price Today, Jio Financial Services Stock Price Live NSE/BSE Updates - The Economic Times",-0.93930983543396
JIOFIN,2023-08-21,JIOFIN: Jio Financial Services Ltd Stock Price Quote - Natl India - Bloomberg - Bloomberg.com,-0.9459842443466187
JIOFIN,2023-08-21,Check out Jio Financial Services Ltd's stock price (JIOFIN-IN) in real time - CNBC,-0.9428161978721619
JIOFIN,2024-07-15,Jio Financial Services Q1 results: Net profit down 5.72% at Rs 313 crore - Business Standard,-0.9750908613204956
JIOFIN,2023-08-21,Jio Financial Services Ltd. - The Economic Times,-0.9285960793495178
JIOFIN,2024-01-04,"As Jio Fin awaits MF biz licence, this brokerage sees 24% upside in stock - Business Standard",0.9521371126174927
JIOFIN,2024-01-16,Jio Financial Services slips 7% post December quarter results - Business Standard,-0.9729381799697876
JIOFIN,2024-05-30,"JioFin launches beta version of JioFinance app, to offer UPI, digi banking - Business Standard",-0.8487585186958313
JIOFIN,2024-04-16,Jio Financial shares rally after company announces JV with BlackRock - Business Standard,-0.6315388083457947
JIOFIN,2024-04-16,"Jio Fin Services zooms 5% on announcing new broking, wealth management biz - Business Standard",0.8335220217704773
JIOFIN,2024-07-16,Jio Financial Services share price falls over 2% after tepid Q1FY25 results - Business Standard,-0.9650629758834839
JIOFIN,2024-06-28,"Jio Fin, Zomato part of Nifty50? List of likely F&O inclusions, exclusions - Business Standard",-0.9369649887084961
JIOFIN,2024-03-28,Jio Fin's arm invests Rs 2.5 cr in Reliance International Leasing IFSC Ltd - Business Standard,-0.9294595718383789
JIOFIN,2025-02-21,"New-Age Tech Stocks Zomato, Jio Financial Set to Join India’s Nifty 50 - Bloomberg.com",-0.7717742919921875
JIOFIN,2024-06-19,Jio Fin appoints S. Anantharaman as group CRO - Business Standard,-0.9389469027519226
JIOFIN,2024-04-15,"Jio Financial-BlackRock JV to launch wealth management, broking business - Business Standard",-0.9023462533950806
JIOFIN,2024-02-23,Mukesh Ambani's Jio Financial Services market cap tops Rs 2 trillion - Business Standard,-0.7269412279129028
JIOFIN,2024-07-16,"Stocks to watch, July 16: Vedanta, HUL, Lupin, SpiceJet, Jio Fin Services - Business Standard",-0.9235613346099854
JIOFIN,2024-05-30,Jio Financial Services launches 'JioFinance' app in beta version - Business Standard,-0.8999807238578796
JIOFIN,2023-08-18,Jio Financial Services set to be listed on stock exchanges on August 21 - Business Standard,-0.9547520279884338
JIOFIN,2024-03-28,Jio Financial Services Ltd News - Business Standard,-0.9355979561805725
JIOFIN,2023-08-21,Jio Financial Services Ltd - Bloomberg.com,-0.9460481405258179
JIOFIN,2026-03-12,"Jio Financial may deliver 48% PAT CAGR in FY26-28, lending arm to lead growth: Motilal Oswal - BFSI News",0.6312083601951599
JIOFIN,2023-08-20,JIOF.NS - reuters.com,-0.9372907876968384
JIOFIN,2025-10-16,"Stocks to watch today, Oct 16: Infosys, Wipro, Axis Bank, Jio Fin, Nestle - Business Standard",-0.9379258155822754
JIOFIN,2024-05-03,"NSE Q4 results: Net profit rises 20% to Rs 2,478 crore, revenue up 34% - Business Standard",0.9529340863227844
JIOFIN,2020-10-09,Mukesh Ambani’s mega IPO Reliance Jio is said to set bank fees in line with NSE - The Economic Times,0.6785848140716553
JIOFIN,2025-03-04,Jio Financial up 3%; to acquire 79 mn shares of Jio Payments Bank from SBI - Business Standard,0.9356486201286316
JIOFIN,2025-07-18,"Jio Financial Q1 PAT rises 3.8% YoY, AMC business scales rapidly - Business Standard",0.8942211270332336
JIOFIN,2023-08-28,Reliance AGM: Where and how to watch Reliance's 46th annual general meeting - Business Standard,-0.9462101459503174
JIOFIN,2025-10-17,"Jio Platforms Q2FY26 results: Net profit up 12.8% at ₹7,379 crore - Business Standard",0.9519696235656738
JIOFIN,2023-07-26,Jio Financial Services Ltd - reuters.com,-0.9372657537460327
JIOFIN,2023-08-28,Reliance AGM 2023 today: Here are the key takeaways from last year's meet - Business Standard,-0.9167588949203491
JIOFIN,2024-08-06,Go cashless in Paris: JioFinance app forays into international segment - Business Standard,-0.7131202220916748
JIOFIN,2025-10-16,Jio Financial Services Q2FY26 results: Profit almost flat at ₹695 crore - Business Standard,-0.9460501670837402
JIOFIN,2026-01-16,"Stocks to Watch today, Jan 16: RIL, Infosys, ICICI Pru AMC, Jio Financial - Business Standard",-0.9331231117248535
JIOFIN,2026-01-15,Jio Financial Services reports 9% drop in Q3 profit at ₹269 crore - Business Standard,-0.974412739276886
JIOFIN,2025-07-17,"Axis Bank Q1 results: Profit dips 3.8% to ₹5,806 cr on bad loan provisions - Business Standard",-0.9742075800895691
JIOFIN,2020-04-30,"Reliance Jio Q4 Results: Net profit rises 3% QoQ to Rs 5,307 crore - The Economic Times",0.9322582483291626
JIOFIN,2024-04-22,IT firm Persistent System shares slump 9% post Q4 results with flat margins - Business Standard,-0.9756327271461487
JIOFIN,2025-07-08,Exclusive: Jio BlackRock to disrupt India's funds sector with low-cost strategy: sources - reuters.com,-0.8584871888160706
JIOFIN,2024-02-09,"Stocks to Watch today, Feb 9: LIC, Zomato, Airtel, Paytm, Hero Moto, ZEE - Business Standard",-0.9377960562705994
JIOFIN,2025-10-24,Jio Financial's AI-generated festive film celebrates the spirit of Diwali - Business Standard,-0.708388090133667
JIOFIN,2024-10-11,"October 11, 2024 BSE Limited Phiroze Jeejeebhoy Towers, Dalal Street, Fort, Mumbai 400 001 Scrip Code: 543940 National Stock Exc - bsmedia.business-standard.com",-0.9462767243385315
JIOFIN,2025-03-21,Jio Finance looks to postpone debt offering to FY26 amid elevated yields - Business Standard,-0.9427074790000916
JIOFIN,2025-11-14,Jio Leasing invests ₹45 crore in Reliance International Leasing IFSC unit - Business Standard,-0.8853021860122681
JIOFIN,2024-02-22,"Angel One plans to raise Rs 2,000 cr to tap opportunities in fintech space - Business Standard",0.7473781704902649
JIOFIN,2026-01-16,Jio Financial Q3 PAT drops 8% YoY to Rs 269 cr - Business Standard,-0.9716582894325256
JIOFIN,2024-01-18,"Market rally has margin trading book hitting record Rs 54,537 crore in Jan - Business Standard",0.914524257183075
JIOFIN,2025-04-08,"April 8, 2025 BSE Limited Phiroze Jeejeebhoy Towers, Dalal Street, Fort, Mumbai 400 001 Scrip Code - bsmedia.business-standard.com",-0.9495348930358887
JIOFIN,2023-07-20,"Jio financial services - Latest jio financial services , Information & Updates - CFO - ET CFO",-0.9490514397621155
JIOFIN,2024-05-01,Adi-Nadir Godrej family makes open offer to acquire Astec Lifesciences - Business Standard,-0.6240301728248596
JIOFIN,2024-03-13,77% of investment in Indian real estate in 2019-23 by foreigners: Report - Business Standard,-0.9174860715866089
JIOFIN,2023-09-16,"Jio Financial Services Target Share Price, Jio Financial Services Share Price Forecast - The Economic Times",-0.9365862607955933
JIOFIN,2026-03-20,The Economic Times - The Economic Times,-0.9159992933273315
JIOFIN,2025-01-31,Bandhan Bank Q3FY25 results: Net profit drops 42% to Rs 426.5 crore - Business Standard,-0.9744994044303894
JIOFIN,2022-11-04,"jio financial services: Latest News & Videos, Photos about jio financial services - The Economic Times",-0.936293363571167
JIOFIN,2024-06-13,Arvind share price jumps 3% after workers call off strike at Santej plant - Business Standard,-0.9053636789321899
JIOFIN,2026-01-15,"Q3 results: HDFC Life Insurance, Jio Financial, L&T Tech, 24 more on Jan 15 - Business Standard",-0.9073981046676636
JIOFIN,2024-03-11,What could weigh on InterGlobe Aviation shares today? All you need to know - Business Standard,-0.8895289897918701
JIOFIN,2024-04-12,"LKP Securities initiates coverage with buy on Sansera Engg, stock jumps 4% - Business Standard",0.9066685438156128
JIOFIN,2023-12-07,"Bharat Electronics up 4%; hits new high on securing orders worth Rs 3,915cr - Business Standard",0.945296049118042
JIOFIN,2018-09-12,HDFC Life names Vibha Padalkar as MD & CEO - The Economic Times Video | ET Now - The Economic Times,-0.94190514087677
JIOFIN,2024-05-31,Bharat Rasayan share zooms 17% post Q4 results; profits jump two fold - Business Standard,0.9387820363044739
JIOFIN,2024-05-14,UPL slides 6% on weak Q4 earnings; profit drops 95% hit by lower prices - Business Standard,-0.9724039435386658
JIOFIN,2025-07-30,"Jio Financial to raise ₹15,825 cr from promoters via warrant issue - Business Standard",0.6152681708335876
JIOFIN,2023-07-19,Reliance - Jio Financial Services demerger: what you need to know - reuters.com,-0.9463934302330017
JIOFIN,2025-07-21,"Network 18 Media & Investments Ltd Quarterly Results, 27 Mar 2026 - NSE 28.74, BSE 28.72 - Business Standard",-0.9274416565895081
JIOFIN,2024-05-30,Reliance Industries among TIME's 100 most influential global companies - Business Standard,-0.6019928455352783
JIOFIN,2024-03-18,40% surge in health insurance coverage among women: What data reveals - Business Standard,-0.6588242053985596
JIOFIN,2025-05-06,Ambani’s Jio Finance Plans Debut Rupee Bond Sale of $118 Million - Bloomberg.com,-0.9268189668655396
JIOFIN,2024-06-13,Saksoft to acquire 100% equity in Augmento Labs for Rs 100 cr; stock up 15% - Business Standard,0.9424135684967041
JIOFIN,2025-05-27,Jio BlackRock gets approval to start mutual fund business in India - reuters.com,-0.795596182346344
JIOFIN,2024-07-24,India's fast pace transformation reflects changing consumer trends: HUL MD - Business Standard,-0.6352463960647583
JIOFIN,2024-07-21,"Vedanta raises $1 bn via QIP; Goldman, Morgan Stanley among top investors - Business Standard",0.7703279852867126
JIOFIN,2017-08-31,Live Blog - Stocks - Markets - The Economic Times,-0.9404935240745544
JIOFIN,2019-10-04,Announcement - The Economic Times,-0.9166386723518372
JIOFIN,2023-08-29,Gokaldas Exports hits 20% upper circuit on Atraco acquisition - Business Standard,0.9425538778305054
JIOFIN,2017-03-24,"JP Power Share Price Today, JP Power Stock Price Live NSE/BSE Updates - The Economic Times",-0.9383313059806824
JIOFIN,2021-03-12,"Kalyan Jewellers Ind Share Price Today, Kalyan Jewellers Ind Stock Price Live NSE/BSE Updates - The Economic Times",-0.938016951084137
JIOFIN,2020-03-31,"Wipro Q4 Results: PAT rises 26% YoY to Rs 3,570 crore, beats estimates - The Economic Times",0.9371432065963745
JIOFIN,2024-05-31,Apple's AI-based Siri assistant to let you control app functions with voice - Business Standard,-0.9248731732368469
JIOFIN,2023-07-17,India's Reliance spin-off Jio Financial Services worth 160-190 rupees/share -analysts - reuters.com,-0.9444940686225891
JIOFIN,2024-09-06,"R Shyam Sunder, Jio Financial Services Ltd: Profile and Biography - Bloomberg.com",-0.9460495114326477
JIOFIN,2023-07-19,"PAN-trading account freeze extended to all listed firms, says Sebi - Business Standard",-0.9378266334533691
JIOFIN,2018-06-01,"Havells India : Latest News Headlines, Videos and Photo Galleries on Havells India - Business Standard",-0.9360970258712769
JIOFIN,2023-07-19,"Reliance spin-off Jio Financial valued at $20 billion, above estimates - reuters.com",-0.9319674968719482
JIOFIN,2024-05-30,Vodafone Idea announces new prepaid plans with Netflix partnership - Business Standard,-0.6455175876617432
JIOFIN,2024-06-28,Stanley Lifestyles makes strong debut; lists at 35% premium to issue price - Business Standard,0.9106314182281494
JIOFIN,2024-03-28,"Chennai refinery expansion cost goes up over Rs 3,600 crore, says IOC - Business Standard",0.9522149562835693
JIOFIN,2024-09-15,USFDA cites manufacturing lapses at Zydus Lifesciences' Gujarat plant - Business Standard,-0.970425009727478
JIOFIN,2024-10-04,"India's Jio Financial, BlackRock get in-principle approval to set up mutual fund business - reuters.com",-0.8463500738143921
JIOFIN,2017-08-31,Results - The Economic Times,-0.9012740254402161
JIOFIN,2018-05-31,"Indian Overseas Bank : Latest News Headlines, Videos and Photo Galleries on Indian Overseas Bank - Business Standard",-0.9370645880699158
JIOFIN,2026-01-09,"Ambani's Reliance Jio considers 2.5% public offering in 2026 India IPO, sources say - reuters.com",-0.9319431185722351
JIOFIN,2024-03-28,Wipro aims to become AI-first firm; more than 220K trained in GenAI - Business Standard,0.6027898788452148
JIOFIN,2024-10-11,Jio financial services unveils new app packed with features and upgrades - Business Standard,-0.5554493069648743
JIOFIN,2024-11-12,"Fireside Chat KV Kamath, Independent Director and Non Executive Chairman, Jio Financial Services - Business Standard",-0.9013118743896484
JIOFIN,2024-01-16,"LIC at 20-mth high, nears listing day-lifetime high; up 69% from March low - Business Standard",0.947123110294342
