ticker,date,headline,sentiment_score
LODHA,2026-03-23,"Nifty Realty down 5%; Lodha, DLF, Prestige Estates fall up to 6%: Check why - Business Standard",-0.9528757333755493
LODHA,2026-03-22,"Godrej Properties, Lodha acquire over 25 land parcels in FY26 to build homes, eye Rs 1 lakh cr revenue - The Economic Times",0.5045523643493652
LODHA,2026-03-23,"Godrej, Lodha acquire 25+ land parcels; eye ₹1 lakh crore housing pipeline - Business Standard",-0.5705946683883667
LODHA,2026-03-25,"ISPL Hosts ""Pitch & Play"" Weekend in Mumbai; Minister Shri Mangal Prabhat Lodha to Attend as Chief Guest - Business Standard",-0.9213650822639465
LODHA,2026-03-22,"luxury residential development noida: Latest News & Videos, Photos about luxury residential development noida - The Economic Times",-0.9334597587585449
LODHA,2026-03-28,"mmr bengaluru housing market: Latest News & Videos, Photos about mmr bengaluru housing market - The Economic Times",-0.9343053102493286
LODHA,2026-03-27,"luxury residential apartments in mumbai: Latest News & Videos, Photos about luxury residential apartments in mumbai - The Economic Times",-0.9249698519706726
LODHA,2026-03-27,"housing sales dip: Latest News & Videos, Photos about housing sales dip - The Economic Times",-0.5653639435768127
LODHA,2026-03-27,"mumbai property mutations: Latest News & Videos, Photos about mumbai property mutations - The Economic Times",-0.9295510649681091
LODHA,2026-03-27,"santacruz housing project: Latest News & Videos, Photos about santacruz housing project - The Economic Times",-0.9361350536346436
LODHA,2026-03-27,"jewar plot price: Latest News & Videos, Photos about jewar plot price - The Economic Times",-0.9386813044548035
LODHA,2014-06-19,"Business News, Finance News, India News, Stock Markets BSE/NSE News, SENSEX, NIFTY, Personal Finance News - Business Standard",-0.9441770315170288
LODHA,2026-03-23,"Hindustan Zinc falls 6% as markets crash, silver prices drag sentiment - Business Standard",-0.9644691348075867
LODHA,2026-03-23,$5 trillion in gold: Why India feels richer-but is not growing its wealth - Business Standard,-0.8074140548706055
LODHA,2026-03-27,Madhuri Dixit takes office on lease in Lower Parel for ₹4.25 lakh per month - Business Standard,-0.9479292631149292
LODHA,2026-03-24,"West Asia impact: Consumer durables, plywood, pipes stocks slide up to 21% - Business Standard",-0.9700210094451904
LODHA,2026-03-23,"HDFC Bank, ICICI Bank, Bajaj Fin among 13 Nifty 50 stocks hit 52-week lows - Business Standard",-0.9391475915908813
LODHA,2026-03-27,Benchmarks trade in negative terrain; realty shares drop - Business Standard,-0.971281111240387
LODHA,2026-03-23,"Airline stocks: IndiGo, SpiceJet tumble up to 10% as ATF price hike looms - Business Standard",-0.9246318936347961
LODHA,2026-03-24,Lodha Developers Ltd. - The Economic Times,-0.926206111907959
LODHA,2024-10-04,LODHA IN EQUITY 04Oct24 CU - bsmedia.business-standard.com,-0.9473850727081299
LODHA,2021-07-30,Check out Lodha Developers Ltd's stock price (LODHA-IN) in real time - CNBC,-0.9466681480407715
LODHA,2016-10-30,LODHA: Lodha Developers Ltd Stock Price Quote - Natl India - Bloomberg.com,-0.9472593069076538
LODHA,2026-01-19,India's Lodha Developers to invest $11 billion in 2.5 GW data centre park in Maharashtra - reuters.com,-0.8848469853401184
LODHA,2017-10-18,"lodha group: Latest News & Videos, Photos about lodha group - The Economic Times",-0.9355165958404541
LODHA,2018-04-26,India's Lodha Developers files for IPO - reuters.com,-0.9494263529777527
LODHA,2018-01-11,"lodha developers: Latest News & Videos, Photos about lodha developers - The Economic Times",-0.9358333349227905
LODHA,2025-08-15,The Economic Times - The Economic Times,-0.9159992933273315
LODHA,2021-03-01,Mangal Prabhat Lodha - The Economic Times,-0.8993922472000122
LODHA,2015-09-22,Lodha Group CMO R Karthik resigns - ET BrandEquity,-0.8403652310371399
LODHA,2026-02-16,Lodha Developers acquires 80% stake in Solidrise Realty for ₹294.07 crore - ET Realty,-0.8964222073554993
LODHA,2024-12-21,NFRA’s latest audit inspections reveal major deficiencies in BSR & Co. and Lodha & Co. - ET CFO,-0.9483775496482849
LODHA,2017-06-02,"London property sales still 'quite good' after Brexit, India's Lodha Group says - CNBC",0.882645845413208
LODHA,2022-12-06,G.O.A.T Brand Labs appoints Mukesh Lodha as Chief of Finance - ETHRWorld.com,-0.9334686994552612
LODHA,2026-01-07,"Lodha Developers' sales bookings up 25% to ₹5,620 crore in Q3 FY26 - ET Realty",0.9560730457305908
LODHA,2025-07-26,Lodha Developers' net profit grows 41.86% in Q1 FY26 - ET Realty,0.9432015419006348
LODHA,2016-12-30,"Lodha group - Latest lodha group , Information & Updates - Real Estate - ET Realty",-0.9487077593803406
LODHA,2026-01-29,Lodha Developers' profit rises marginally to ₹957 crore in Q3 FY26 - ET Realty,0.9451022744178772
LODHA,2025-07-25,Realtor Lodha Planning to Enter Delhi With $220 Million Project - Bloomberg.com,-0.9170315861701965
LODHA,2019-06-12,"Lodha, ESR ink JV to develop 89 acre industrial park at Palava - ET Realty",-0.866894543170929
LODHA,2017-01-04,"Lodha developers - Latest lodha developers , Information & Updates - Real Estate - ET Realty",-0.9485217928886414
LODHA,2025-05-14,Abhinandan drops 'Lodha' from his holding co's identity - ET BrandEquity,-0.7435153722763062
LODHA,2021-12-13,"Xanadu lodha group - Latest xanadu lodha group , Information & Updates - Marketing & Advertising - ET BrandEquity",-0.9511292576789856
LODHA,2017-05-05,Lodha Group gets partial relief on Rs 473-crore fine order for stamp duty evasion - ET Realty,0.9168475866317749
LODHA,2018-06-04,Here’s how Lodha Group is homing in on customer experience with digital - Indiatimes,-0.8481506705284119
LODHA,2016-09-28,"DLF is India's top real estate brand, followed by Godrej Properties & Lodha Group: Report - ET Realty",-0.7635121941566467
LODHA,2017-10-06,"DLF's K P Singh tops realty rich list, M P Lodha second - ET Realty",0.5549934506416321
LODHA,2019-08-27,"Here’s how Lodha Group delivers seamless customer experience, projects on time - Indiatimes",-0.9074461460113525
LODHA,2025-10-30,Lodha Developers' net profit rises 86.67% in Q2 FY26 - ET Realty,0.9448870420455933
LODHA,2021-02-01,Lodha Developers underlines sense of belongingness in new campaign - ET BrandEquity,-0.7282537221908569
LODHA,2023-07-29,Lodha elevates the living experience with its latest campaign - ET BrandEquity,-0.66501784324646
LODHA,2025-07-21,Lodha Developers raises ₹350 crore via private placement of NCDs - ET Realty,0.7983266711235046
LODHA,2019-10-21,Trump Tower Builder Cuts Luxury for Cheap Homes in India - Bloomberg.com,-0.8197813034057617
LODHA,2018-11-21,Lodha Is Richest Indian Property Tycoon With $3.8 Billion Wealth - Bloomberg.com,-0.9340797662734985
LODHA,2025-01-27,Macrotech Developers' MD terms trademark dispute with brother a corporate matter - ET Realty,-0.5584447979927063
LODHA,2016-03-28,Power couple Akshay Kumar and Twinkle Khanna to endorse Lodha Group project - ET BrandEquity,-0.8726641535758972
LODHA,2016-05-03,Lodha panel warns public from dealing in PACL's property - ET Realty,-0.6223366856575012
LODHA,2021-05-20,Akshay Kumar urges everyone to ‘unbox’ to bigger spaces in Lodha Group’s latest campaign - ET BrandEquity,-0.7828807830810547
LODHA,2023-10-10,HC sets aside transfer of IPS Amit Lodha's case from Patna CAT to Delhi - ET Government,-0.9480583667755127
LODHA,2024-01-24,"SC seeks details of amount collected, disbursed to investors of ponzi schemes of PACL - legal.economictimes.indiatimes.com",-0.9440878033638
LODHA,2026-01-20,Lodha Developers to invest ₹1 trillion more in Maharashtra data centre park - Business Standard,-0.5606828927993774
LODHA,2025-11-11,KRISHIVAL FOODS LIMITED - bsmedia.business-standard.com,-0.95168137550354
LODHA,2025-04-07,"Lodha clocks record pre-sales of Rs 4,810 crore in Q4 FY25, up 14% - Business Standard",0.9521416425704956
LODHA,2026-03-16,"Nifty Realty index tanks 18% in 1 month; DLF, Oberoi, Lodha at 52-week lows - Business Standard",-0.9392881989479065
LODHA,2025-06-08,Major 26 listed realty firms sell ₹1.62 lakh crore properties in FY25 - ET Realty,-0.9138866662979126
LODHA,2017-07-13,​Rahul Mahajan joins Lodha Group as Executive Vice President- IT - Indiatimes,-0.9305775761604309
LODHA,2025-10-31,Lodha Developers gains after Q2 PAT surges 86% YoY to Rs 789 cr - Business Standard,0.9419593811035156
LODHA,2025-01-22,"BSE Realty index hits 10-month low; Oberoi, Prestige, Lodha fall up to 7% - Business Standard",-0.9620937705039978
LODHA,2016-02-06,"Meet Harsh Lodha, chief of Birla Corp, whose DNA combines of a professional & an entrepreneur - ET Realty",-0.8801361918449402
LODHA,2025-07-29,Lodha Developers' share price rises 4%; is it right time to buy the stock? - Business Standard,0.4991549253463745
LODHA,2026-01-20,"Lodha, Godrej Properties, Brigade at 52-week lows; why realty stocks fell? - Business Standard",-0.875566840171814
LODHA,2025-06-16,Macrotech Developers rebrands as Lodha Developers after dispute settlement - Business Standard,-0.9230696558952332
LODHA,2025-04-15,Macrotech Developers shares jump 8% as Lodha brothers resolve dispute - Business Standard,0.8760164380073547
LODHA,2025-07-27,"Lodha Developers plans to launch ₹17,000 cr worth housing projects in FY26 - Business Standard",-0.7998117804527283
LODHA,2026-01-18,"Lodha Developers net debt rises 15% to ₹6,170 cr on land acquisitions - Business Standard",0.94782954454422
LODHA,2025-07-23,"Nifty Realty sheds 3% in firm market; Lodha, Brigade, Oberoi slide up to 7% - Business Standard",-0.956027626991272
LODHA,2026-01-11,Lodha Developers acquires 5 land parcels in Q3 for projects worth ₹34k cr - Business Standard,-0.8039363622665405
LODHA,2025-07-29,House of Abhinandan Lodha enters hospitality with Miros Goa property - Business Standard,-0.8986774682998657
LODHA,2024-08-29,"Macrotech acquires Opexefi Services, One Box Warehouse for nearly Rs 100 cr - Business Standard",-0.8878306150436401
LODHA,2026-01-05,NCCCL bags ₹112.5 crore construction contract from Lodha Developers - Business Standard,0.8335393071174622
LODHA,2025-07-02,Lodha Developers to deposit ₹520 cr as security in case against VHL - Business Standard,-0.9149668216705322
LODHA,2017-04-24,Trump Tower Mumbai Sales to Resume After Post-Election Pause - Bloomberg.com,-0.9337639212608337
LODHA,2026-01-07,"Stocks to Watch today, Jan 7: Titan, Biocon, Godrej Con, Lodha, YES Bank - Business Standard",-0.913312554359436
LODHA,2022-10-18,Jim Sarbh gives his loved ones the gift of a home in Lodha’s festive campaign - ET BrandEquity,-0.8373446464538574
LODHA,2025-07-23,"Invesco sells Oberoi, Lodha shares worth ₹3,202 crore via open market - Business Standard",-0.9304109811782837
LODHA,2025-01-27,Macrotech Developers up 3% as Q3 profit jumps 88% YoY; check details here - Business Standard,0.7007648944854736
LODHA,2018-10-25,IPG Mediabrands' OOH arm Rapport whips up a campaign for real estate major Lodha Group - ET BrandEquity,-0.8755356073379517
LODHA,2025-07-29,The House of Abhinandan Lodha unveils Miros Hotels with first hotel in Goa - ET Hospitality,-0.7624780535697937
LODHA,2025-07-11,Lodha Developers Share Price - Business Standard,-0.9457810521125793
LODHA,2025-09-23,"HoABL invests ₹200 crore in affordable housing project, looks to develop seven more sites in Mumbai - ET Realty",-0.6542271971702576
LODHA,2019-06-25,Trump Tower Developer Battles Bond Slump Amid India Cash Crunch - Bloomberg.com,-0.741607129573822
LODHA,2024-08-15,House of Abhinandan Lodha eyes 30% growth in property sales in FY25 - Business Standard,0.9439969658851624
LODHA,2026-02-22,Lodha Developers signs ₹365 crore joint development deal in Mumbai - Business Standard,0.7258926033973694
LODHA,2023-05-22,PFS auditors issue unqualified opinion on FY23 accounts but highlight governance issues - ET CFO,-0.9344534277915955
LODHA,2025-10-12,"Lodha Developers buys 1 land parcel in Q2 to build homes worth ₹2,300 cr - Business Standard",-0.8196783661842346
LODHA,2025-07-15,Lodha earns Prestigious 'Great Place To Work' Recognition for Exemplary Workplace Culture - Business Standard,0.9273698925971985
LODHA,2019-09-28,"neral: Latest News & Videos, Photos about neral - The Economic Times",-0.9389808773994446
LODHA,2025-01-22,Explained: Why are the Lodha brothers fighting over the family brand name? - Business Standard,-0.7980620265007019
LODHA,2026-02-15,Lodha Developers buys 80% stake in Pune-based SRPL for ₹294 crore - Business Standard,-0.904327392578125
LODHA,2023-02-07,Wingreen's Pawan Sarda to become House of Abhinandan Lodha's CGO - ET BrandEquity,-0.9435390830039978
