ticker,date,headline,sentiment_score
LT,2026-03-31,"L&T Finance bets on retail scale, AI push to drive earnings re-rating - BFSI News",-0.7168371081352234
LT,2026-03-31,"academy awards 2026: Latest News & Videos, Photos about academy awards 2026 - The Economic Times",-0.9348073601722717
LT,2026-04-03,Vikran Engineering wins ₹530 crore power distribution projects in Maharashtra - ET EnergyWorld,0.8590288162231445
LT,2026-03-30,Telangana Assembly clears resolution to take over Hyderabad Metro phase-I from L&T - ET Infra,-0.8746718764305115
LT,2026-04-03,BCom to Goldman Sachs: Karnataka colleges race to churn out more ‘job-ready’ graduates - ET Education,-0.7416123747825623
LT,2026-04-03,Informal sector steps up coal stocking over price concerns - The Economic Times,-0.4943094849586487
LT,2026-04-02,Hedge Funds Walloped by a Month of Turmoil Sparked by Iran War - bloomberg.com,-0.6282801628112793
LT,2026-03-26,I Thought I Was Fit Until I Tried Hyrox - bloomberg.com,-0.93060702085495
LT,2026-04-01,"Renault India March sales surge 77% ; Kiger, Triber make up 63% of volumes - ET Auto",0.9152593016624451
LT,2026-04-01,"sir telangana 2026: Latest News & Videos, Photos about sir telangana 2026 - The Economic Times",-0.9374414086341858
LT,2026-04-01,"bihar election 2025: Latest News & Videos, Photos about bihar election 2025 - The Economic Times",-0.9334477186203003
LT,2026-03-29,"tvk people candidates: Latest News & Videos, Photos about tvk people candidates - The Economic Times",-0.9379293918609619
LT,2026-03-31,"Freed From US Punishment, Wells Fargo Bolsters the Repo Market - bloomberg.com",0.7976068258285522
LT,2026-04-01,"Stocks to buy today: Analyst at Kotak Sec bets on ONGC, Emmvee Photovoltaic - Business Standard",-0.8418906927108765
LT,2026-03-29,IPL 2026: RCB's early momentum driven by Padikkal's ruthless touch - Business Standard,0.9476907849311829
LT,2026-04-01,Lt General Dhiraj Seth takes charge as Vice Chief of the Army Staff - ETGovernment.com,-0.9401406645774841
LT,2017-03-24,"L&T Share Price Today, L&T Stock Price Live NSE/BSE Updates - The Economic Times",-0.9360049366950989
LT,2017-08-05,Check out Larsen and Toubro Ltd's stock price (LT-IN) in real time - CNBC,-0.9456689953804016
LT,2014-03-15,LT: Larsen & Toubro Ltd Stock Price Quote - Natl India - Bloomberg - bloomberg.com,-0.9445640444755554
LT,2020-10-05,L&T shares rebound 3% as Donald Trump signals potential end to war. Why does it matter for the construction major? - The Economic Times,-0.6169554591178894
LT,2026-04-02,L&T Finance Ltd. - The Economic Times,-0.9252150058746338
LT,2026-04-01,Larsen & Toubro Ltd. - The Economic Times,-0.9242165684700012
LT,2017-03-24,"LT Foods Share Price Today, LT Foods Stock Price Live NSE/BSE Updates - The Economic Times",-0.939771831035614
LT,2024-04-02,"L&T Fin Holding Share Price Today, L&T Fin Holding Stock Price Live NSE/BSE Updates - The Economic Times",-0.9383857846260071
LT,2017-03-26,LT Foods Ltd. - The Economic Times,-0.9248437881469727
LT,2017-03-24,"L&T Tech Share Price Today, L&T Tech Stock Price Live NSE/BSE Updates - The Economic Times",-0.9387945532798767
LT,2025-05-15,India's LT Foods posts higher quarterly profit on strong demand - Reuters,0.9470986127853394
LT,2026-01-30,LT Foods Q3 net profit rises 8.23% to Rs 157.35 cr - ET BrandEquity,0.9447667002677917
LT,2026-03-30,L&T Technology Services Ltd. - The Economic Times,-0.9233373999595642
LT,2025-07-25,LT Foods Q1 profit rises 8.5% to Rs 168.5 cr - ET Retail,0.940265417098999
LT,2016-12-30,LT FOODS - ET Retail,-0.9440224170684814
LT,2022-09-09,LT Foods Ltd - Reuters,-0.9455894827842712
LT,2025-05-15,"LT Foods Q4 profit up 7% to Rs 161 crore, FY25 revenue crosses $1 billion mark - ET Retail",0.9524323344230652
LT,2024-07-25,Indian basmati rice maker LT Foods' Q1 profit jumps on strong demand - ET Retail,0.9321087002754211
LT,2023-05-19,India's LT Foods Q4 profit leaps on strong demand - ET Retail,0.9249305725097656
LT,2025-10-30,"India's LT Foods profit rises on strong domestic demand, lower crop prices - Reuters",0.9148837924003601
LT,2026-03-03,Indian infra major L&T hits one‑month low on concerns over Mideast exposure - Reuters,-0.9436610341072083
LT,2025-07-16,"India's L&T Technology misses quarterly revenue estimates, targets double-digit FY26 growth - Reuters",-0.8777722716331482
LT,2018-05-22,LT Foods Limited - bsmedia.business-standard.com,-0.9518725275993347
LT,2025-10-17,"India's L&T Tech quarterly revenue a tad above view, maintains FY26 outlook - Reuters",-0.6575477719306946
LT,2025-10-14,MONIKA JAGGIA - bsmedia.business-standard.com,-0.9503092765808105
LT,2026-01-28,"L&T Q3FY26 profit slips 4% to ₹3,215 crore - ET EnergyWorld",-0.9717319011688232
LT,2025-10-08,"From Custodian to Co-Pilot: How L&T Finance’s CFO Is Steering a Smarter, Stronger NBFC - ET CFO",-0.6151900887489319
LT,2022-11-23,"LTIMindtree Share Price Today, LTIMindtree Stock Price Live NSE/BSE Updates - The Economic Times",-0.9411593675613403
LT,2025-10-29,"India's L&T posts profit rise, forecasts annual order outlook beat - Reuters",-0.5481778383255005
LT,2025-11-27,"L&T hits 52-week high at ₹4,140, among top gainers in early trade - ET Infra",0.893404483795166
LT,2025-07-30,L&T rises 4% on posting Q1 results; most brokerages raise target price - Business Standard,0.9360889792442322
LT,2025-03-07,L&T announces one-day paid menstrual leave - ETHRWorld.com,-0.7806931734085083
LT,2025-01-27,LT Foods Q3 profit down 5 pc to Rs 145 crore - ET Retail,-0.9739435315132141
LT,2025-05-08,India's L&T sees higher margins in FY26 as international orders surge - Reuters,0.9485777616500854
LT,2024-03-28,Larsen & Toubro Share Price - Business Standard,-0.9425272941589355
LT,2026-03-27,"Ukraine, Saudi Arabia sign defense deal as U.S. reportedly weighs redirecting Kyiv aid - CNBC",-0.6978597640991211
LT,2024-07-30,"Date: July 30, 2024 To, BSE Limited Phiroze Jeejeebhoy Towers Dalal Street Mumbai- 400001 National Stock E - bsmedia.business-standard.com",-0.9482880234718323
LT,2014-03-15,LTG: LT Group Inc Stock Price Quote - Philippines - Bloomberg - bloomberg.com,-0.945802628993988
LT,2022-11-29,LTIMindtree Ltd. - The Economic Times,-0.9198735952377319
LT,2025-05-08,"L&T Q42025 result: Net profit jumps 25% to ₹5,497 crore, dividend announced - Business Standard",0.9442798495292664
LT,2024-07-15,~E Lt. - bsmedia.business-standard.com,-0.9512178897857666
LT,2022-01-20,LT Foods appoints K Ganapathy Subramaniam as head of marketing - ET BrandEquity,-0.919104278087616
LT,2026-01-15,"L&T Technology Services cuts revenue forecast, sees mid single-digit growth in fiscal 2026 - Reuters",-0.7727088332176208
LT,2022-06-06,About Larsen and Toubro Ltd (LART.NS) - Reuters,-0.945220410823822
LT,2025-10-15,"LT Finance Q2FY26 net profit up 6 per cent, GST reform to support growth - Business Standard",0.9546120762825012
LT,2024-09-03,"LT GENERAL RAJ SHUKLA, MEMBER, UNION PUBLIC SERVICE COMMISSION - ETGovernment.com",-0.9371354579925537
LT,2025-05-15,"LT Foods Q4 results: Net profit rises 6.8% to ₹160.51 cr, revenue up 7% - Business Standard",0.9541967511177063
LT,2024-03-28,L T Foods Ltd - Business Standard,-0.9202064275741577
LT,2026-01-28,"India's L&T misses quarterly profit view on tepid order inflows, one-time labour code charge - Reuters",-0.948118269443512
LT,2024-08-30,"LT Foods strengthens RTC, organic product lines for double-digit growth - Business Standard",0.9512726664543152
LT,2025-07-21,"L T Foods Ltd Quarterly Results, 02 Apr 2026 - NSE 386.05, BSE 386.50 - Business Standard",-0.9416180849075317
LT,2023-01-26,"L amp t construction - Latest l amp t construction , Information & Updates - Infra - ET Infra",-0.946469783782959
LT,2024-10-24,"LT Foods Q2 results: PAT drops 4.9% to Rs 148 cr, revenue at Rs 2,108 cr - Business Standard",-0.9706682562828064
LT,2025-07-21,L&T Finance shares rise 4% after Q1 earnings: should you buy? - Business Standard,-0.7330119013786316
LT,2026-03-05,L&T up 3% after 9% fall amid West Asia crisis; brokerages retain 'Buy' call - Business Standard,-0.6492429375648499
LT,2025-01-27,"LT Foods Q3 result: PAT down 5% to Rs 145 cr, total income at Rs 2,288.2 cr - Business Standard",-0.9696522355079651
LT,2025-01-31,L&T secures highest ever quarterly orders worth Rs 1.16 lakh crore in Oct-Dec - ET Infra,0.9397211670875549
LT,2025-10-14,LT Foods to acquire Hungary’s Global Green Europe Kft. for €25 million; enters canned food segment - ET Retail,-0.846231997013092
LT,2025-03-11,foraward - bsmedia.business-standard.com,-0.9479970932006836
LT,2023-10-30,LT Foods profit surges 64.8% in Q2 FY24; Daawat brand's market share rises 30.2% in India - ET Retail,0.9477012753486633
LT,2025-01-30,"L&T Q3 results: Net profit rises 14% to Rs 3,359 crore, revenue up 17% - Business Standard",0.9540106654167175
LT,2024-11-26,"LT Foods enters Saudi Arabia market; eyes nearly Rs 1,000 cr revenue in 5 yrs - ET BrandEquity",0.7951233983039856
LT,2024-05-13,Director General Defence Intelligence Agency Lt Gen DS Rana proceeds to reinforce ties with Tanzania - ETGovernment.com,0.8695943355560303
LT,2020-11-12,rsrtH gt€rr&srgcrrfirrr *I M lT E D - bsmedia.business-standard.com,-0.9481098055839539
LT,2024-04-02,Lt Gen JS Sidana takes over as 33rd Director General of Electronics & Mechanical Engineer - ETGovernment.com,-0.9432188272476196
LT,2025-04-28,L&T Finance shares plunge 8% post Q4 earnings; results breakdown here - Business Standard,-0.7635586261749268
LT,2025-07-18,L&T chairman remuneration jumps 50% to Rs 76.25 cr in FY25 - ETHRWorld.com,0.9204902648925781
LT,2025-07-18,L&T chairman remuneration jumps 50% to Rs 76.25 cr in FY25 - ET CFO,0.9376288652420044
LT,2017-01-04,"Larsen amp toubro - Latest larsen amp toubro , Information & Updates - Auto - ET Auto",-0.950016438961029
LT,2025-09-27,"Telangana govt takes over Hyderabad Metro Phase 1, assumes ₹13,000-cr debt, pays ₹2,000 cr to L&T - ET Infra",-0.9243131875991821
LT,2019-03-26,Lt Gen Rajesh Pant (retd) takes over charge from India’s first cybersecurity chief Gulshan Rai: Sources - ET CIO,-0.9383028149604797
LT,2021-10-21,L&T AVIATION SERVICES PRIVATE LIMITED - The Economic Times,-0.930812418460846
LT,2025-07-18,"L&T Finance net profit rises 2% in Q1FY26, margins and fees moderate - Business Standard",0.948113739490509
LT,2024-02-19,Lt Gen Upendra Dwivedi assumes charge of Vice Chief of Army Staff - ETGovernment.com,-0.9294764995574951
LT,2026-03-01,Andaman oil exploration may propel India towards $20 trillion economy: Lt Governor Joshi - ET EnergyWorld,-0.6533529758453369
LT,2026-01-28,"L&T Q3FY26 profit slips 4% to ₹3,215 crore - ET Infra",-0.9711803197860718
LT,2025-12-26,LT Foods to invest in new Karnataka rice plant to strengthen regional supply chain - ET Retail,0.8953834176063538
LT,2025-12-18,Architects of victory: Decisive roles of Gen Sagat Singh and Gen J.F.R. Jacob in the 1971 war - ETGovernment.com,-0.871076762676239
LT,2026-02-09,"Zenfabs finica Lt[, - bsmedia.business-standard.com",-0.9468451738357544
LT,2021-08-20,LT Foods’ launches New Campaign for Daawat to extend its ‘Banega Toh Farq Dikhega’ Proposition - bsmedia.business-standard.com,-0.6601046323776245
LT,2023-11-24,L&T Technology Services lays off 200 employees: Report - ET Telecom,-0.9615713357925415
LT,2026-02-10,"MSCI to add India's Aditya Birla Capital, L&T Finance to flagship global index and drop IRCTC - Reuters",-0.9223334789276123
LT,2025-12-09,"LT Foods slips 7%, hits 6-month low; why is the basmati rice stock falling? - Business Standard",-0.9609647393226624
