ticker,date,headline,sentiment_score
LT,2026-04-07,"L&T Finance among 8 stocks flashing bullish signals, hinting at a possible uptrend - The Economic Times",-0.5132073760032654
LT,2026-03-31,"L&T Finance bets on retail scale, AI push to drive earnings re-rating - ET BFSI",0.7045093774795532
LT,2026-04-06,KRIDE encashes Rs 57 crore bank guarantees of L&T after Arbitration Tribunal ruling - ET BFSI,-0.7598265409469604
LT,2026-04-03,Vikran Engineering wins ₹530 crore power distribution projects in Maharashtra - ET EnergyWorld,0.8590288162231445
LT,2017-03-24,"L&T Share Price Today, L&T Stock Price Live NSE/BSE Updates - The Economic Times",-0.9360049366950989
LT,2026-04-07,Markets set on favourable FY27 base; Iran war ceasefire key trigger: MOFSL - business-standard.com,-0.8726372718811035
LT,2026-04-01,"Stocks to buy today: Analyst at Kotak Sec bets on ONGC, Emmvee Photovoltaic - business-standard.com",-0.9359299540519714
LT,2026-03-31,"Freed From US Punishment, Wells Fargo Bolsters the Repo Market - bloomberg.com",0.7976068258285522
LT,2017-08-05,Check out Larsen and Toubro Ltd's stock price (LT-IN) in real time - CNBC,-0.9456689953804016
LT,2014-03-15,LT: Larsen & Toubro Ltd Stock Price Quote - Natl India - Bloomberg - bloomberg.com,-0.9445640444755554
LT,2026-04-02,Larsen & Toubro Ltd. - The Economic Times,-0.9242165684700012
LT,2024-04-02,"L&T Fin Holding Share Price Today, L&T Fin Holding Stock Price Live NSE/BSE Updates - The Economic Times",-0.9383857846260071
LT,2026-04-02,LT Foods Ltd. - The Economic Times,-0.9248437881469727
LT,2017-08-01,Check out Alibaba Group Holding Ltd's stock price (BABA) in real time - CNBC,-0.9440178871154785
LT,2019-09-04,"lt foods ltd q1 results: Latest News & Videos, Photos about lt foods ltd q1 results - The Economic Times",-0.9332250952720642
LT,2025-05-15,India's LT Foods posts higher quarterly profit on strong demand - Reuters,0.9470986127853394
LT,2019-10-03,"lt q2 results: Latest News & Videos, Photos about lt q2 results - The Economic Times",-0.9350595474243164
LT,2026-01-30,LT Foods Q3 net profit rises 8.23% to Rs 157.35 cr - ET BrandEquity,0.9447667002677917
LT,2026-01-29,LT Foods Q3 net profit rises 8.23% to Rs 157.35 cr - ET Retail,0.9452194571495056
LT,2025-11-21,LT IN Equity 21Nov25 - bsmedia.business-standard.com,-0.9501338005065918
LT,2025-07-25,LT Foods Q1 profit rises 8.5% to Rs 168.5 cr - ET Retail,0.940265417098999
LT,2025-05-15,"LT Foods Q4 profit up 7% to Rs 161 crore, FY25 revenue crosses $1 billion mark - ET Retail",0.9524323344230652
LT,2016-12-30,LT FOODS - ET Retail,-0.9440224170684814
LT,2022-09-09,LT Foods Ltd - Reuters,-0.9455894827842712
LT,2024-07-25,Indian basmati rice maker LT Foods' Q1 profit jumps on strong demand - ET Retail,0.9321087002754211
LT,2023-05-19,India's LT Foods Q4 profit leaps on strong demand - ET Retail,0.9249305725097656
LT,2026-03-03,Indian infra major L&T hits one‑month low on concerns over Mideast exposure - Reuters,-0.9436610341072083
LT,2025-10-17,"India's L&T Tech quarterly revenue a tad above view, maintains FY26 outlook - Reuters",-0.6575477719306946
LT,2025-10-30,"India's LT Foods profit rises on strong domestic demand, lower crop prices - Reuters",0.9148837924003601
LT,2025-07-16,"India's L&T Technology misses quarterly revenue estimates, targets double-digit FY26 growth - Reuters",-0.8777722716331482
LT,2022-11-23,"LTIMindtree Share Price Today, LTIMindtree Stock Price Live NSE/BSE Updates - The Economic Times",-0.9411593675613403
LT,2018-05-22,LT Foods Limited - bsmedia.business-standard.com,-0.9518725275993347
LT,2025-01-27,LT Foods Q3 profit down 5 pc to Rs 145 crore - ET Retail,-0.9739435315132141
LT,2025-10-14,MONIKA JAGGIA - bsmedia.business-standard.com,-0.9503092765808105
LT,2024-03-28,Larsen & Toubro Share Price - business-standard.com,-0.9467823505401611
LT,2026-01-28,"L&T Q3FY26 profit slips 4% to ₹3,215 crore - ET EnergyWorld",-0.9717319011688232
LT,2025-10-08,"From Custodian to Co-Pilot: How L&T Finance’s CFO Is Steering a Smarter, Stronger NBFC - cfo.economictimes.indiatimes.com",-0.7398083806037903
LT,2025-05-08,India's L&T sees higher margins in FY26 as international orders surge - Reuters,0.9485777616500854
LT,2022-01-20,LT Foods appoints K Ganapathy Subramaniam as head of marketing - ET BrandEquity,-0.919104278087616
LT,2023-08-17,"L amp t - Latest l amp t , Information & Updates - Legal -ET LegalWorld - ETLegalWorld.com",-0.9494765400886536
LT,2025-03-07,L&T announces one-day paid menstrual leave - ETHRWorld.com,-0.7806931734085083
LT,2025-10-29,"India's L&T posts profit rise, forecasts annual order outlook beat - Reuters",-0.5481778383255005
LT,2022-11-29,LTIMindtree Ltd. - The Economic Times,-0.9198735952377319
LT,2024-07-30,"Date: July 30, 2024 To, BSE Limited Phiroze Jeejeebhoy Towers Dalal Street Mumbai- 400001 National Stock E - bsmedia.business-standard.com",-0.9482880234718323
LT,2014-03-15,LTG: LT Group Inc Stock Price Quote - Philippines - Bloomberg - bloomberg.com,-0.945802628993988
LT,2024-07-15,~E Lt. - bsmedia.business-standard.com,-0.9512178897857666
LT,2026-01-15,"L&T Technology Services cuts revenue forecast, sees mid single-digit growth in fiscal 2026 - Reuters",-0.7727088332176208
LT,2025-07-30,L&T rises 4% on posting Q1 results; most brokerages raise target price - business-standard.com,0.8542632460594177
LT,2025-10-15,"LT Finance Q2FY26 net profit up 6 per cent, GST reform to support growth - business-standard.com",0.8836352825164795
LT,2025-05-08,"L&T Q42025 result: Net profit jumps 25% to ₹5,497 crore, dividend announced - business-standard.com",0.939460277557373
LT,2025-05-15,"LT Foods Q4 results: Net profit rises 6.8% to ₹160.51 cr, revenue up 7% - business-standard.com",0.9515589475631714
LT,2024-03-28,L T Foods Ltd - business-standard.com,-0.9487107992172241
LT,2025-10-31,"LT Foods Q2 results: Profit up 9% to ₹163.85 crore, revenue jumps 30% - business-standard.com",0.9458026885986328
LT,2025-01-27,"LT Foods Q3 result: PAT down 5% to Rs 145 cr, total income at Rs 2,288.2 cr - business-standard.com",-0.9649235010147095
LT,2024-10-24,"LT Foods Q2 results: PAT drops 4.9% to Rs 148 cr, revenue at Rs 2,108 cr - business-standard.com",-0.9613062143325806
LT,2026-01-28,"India's L&T misses quarterly profit view on tepid order inflows, one-time labour code charge - Reuters",-0.948118269443512
LT,2025-07-21,"L T Foods Ltd Quarterly Results, 06 Apr 2026 - NSE 383.85, BSE 385.00 - business-standard.com",-0.9453093409538269
LT,2025-07-29,"L&T Q1 net profit grows 30% to ₹3,617.2 crore on higher ops revenue - business-standard.com",0.9429333806037903
LT,2025-07-21,L&T Finance shares rise 4% after Q1 earnings: should you buy? - business-standard.com,-0.8687782883644104
LT,2025-01-30,"L&T Q3 results: Net profit rises 14% to Rs 3,359 crore, revenue up 17% - business-standard.com",0.9485129714012146
LT,2025-05-06,L&T Q4 results preview: Analysts eye 13% jump in profit; check key factors - business-standard.com,0.4961118698120117
LT,2024-08-30,"LT Foods strengthens RTC, organic product lines for double-digit growth - business-standard.com",0.6156455874443054
LT,2025-01-31,L&T secures highest ever quarterly orders worth Rs 1.16 lakh crore in Oct-Dec - ET Infra,0.9397211670875549
LT,2025-10-14,LT Foods to acquire Hungary’s Global Green Europe Kft. for €25 million; enters canned food segment - ET Retail,-0.846231997013092
LT,2025-03-11,foraward - bsmedia.business-standard.com,-0.9479970932006836
LT,2024-11-26,"LT Foods enters Saudi Arabia market; eyes nearly Rs 1,000 cr revenue in 5 yrs - ET BrandEquity",0.7951233983039856
LT,2025-10-28,L&T Q2 results preview: Analysts eye 21% jump in profit; check key factors - business-standard.com,0.5024974346160889
LT,2026-01-27,L&T Q3 preview: Analysts eye up to 35% jump in profit; check key factors - business-standard.com,0.7493082284927368
LT,2023-10-22,RBI penalizes L&T Finance with Rs 2.5 crore fine for non-compliance - ETLegalWorld.com,-0.9103639721870422
LT,2025-09-27,"Telangana govt takes over Hyderabad Metro Phase 1, assumes ₹13,000-cr debt, pays ₹2,000 cr to L&T - ET Infra",-0.9243131875991821
LT,2025-11-11,Punjab relaxes norms for new power connections under 50 kW category - ET EnergyWorld,-0.8190276622772217
LT,2024-05-13,Director General Defence Intelligence Agency Lt Gen DS Rana proceeds to reinforce ties with Tanzania - ETGovernment.com,0.8695943355560303
LT,2020-11-12,rsrtH gt€rr&srgcrrfirrr *I M lT E D - bsmedia.business-standard.com,-0.9481098055839539
LT,2025-04-28,L&T Finance shares plunge 8% post Q4 earnings; results breakdown here - business-standard.com,-0.7920579314231873
LT,2014-03-30,LTOUF: Larsen & Toubro Ltd Stock Price Quote - OTC US - Bloomberg - bloomberg.com,-0.9472911357879639
LT,2025-07-18,L&T chairman remuneration jumps 50% to Rs 76.25 cr in FY25 - ETHRWorld.com,0.9204902648925781
LT,2026-03-12,"Nomura bets on AI-led NBFC growth; Piramal, LT Fin, Tata Capital rated Buy - business-standard.com",-0.8725093603134155
LT,2025-12-26,LT Foods to invest in new Karnataka rice plant to strengthen regional supply chain - ET Retail,0.8953834176063538
LT,2023-10-30,LT Foods profit surges 64.8% in Q2 FY24; Daawat brand's market share rises 30.2% in India - ET Retail,0.9477012753486633
LT,2017-01-04,"Larsen amp toubro - Latest larsen amp toubro , Information & Updates - Auto - ET Auto",-0.950016438961029
LT,2025-01-27,Daawat basmati rice maker LT Foods Q3 profit drops on higher costs; shares slip - Reuters,-0.9710167646408081
LT,2024-02-19,Lt Gen Upendra Dwivedi assumes charge of Vice Chief of Army Staff - ETGovernment.com,-0.9294764995574951
LT,2014-03-24,LTFO: LT Foods Ltd Stock Price Quote - - Bloomberg - bloomberg.com,-0.9463422894477844
LT,2026-03-01,Andaman oil exploration may propel India towards $20 trillion economy: Lt Governor Joshi - ET EnergyWorld,-0.6533529758453369
LT,2026-01-28,"L&T Q3FY26 profit slips 4% to ₹3,215 crore - ET Infra",-0.9711803197860718
LT,2025-08-03,"Malegaon Blast Case | Lt Col. Purohit receives grand welcome at Pune residence, watch! - The Economic Times",-0.5845329761505127
LT,2026-03-05,L&T up 3% after 9% fall amid West Asia crisis; brokerages retain 'Buy' call - business-standard.com,-0.42910993099212646
LT,2025-07-18,"L&T Finance net profit rises 2% in Q1FY26, margins and fees moderate - business-standard.com",0.8765642046928406
LT,2019-03-26,Lt Gen Rajesh Pant (retd) takes over charge from India’s first cybersecurity chief Gulshan Rai: Sources - ET CIO,-0.9383028149604797
LT,2025-12-09,"LT Foods slips 7%, hits 6-month low; why is the basmati rice stock falling? - business-standard.com",-0.9595121741294861
LT,2012-11-08,Sensex snaps six-day winning streak; L&T falls - Reuters,-0.5468209385871887
LT,2025-06-30,L&T forays into green hydrogen with new subsidiary - ET EnergyWorld,-0.6842231154441833
LT,2026-02-09,"Zenfabs finica Lt[, - bsmedia.business-standard.com",-0.9468451738357544
LT,2021-08-20,LT Foods’ launches New Campaign for Daawat to extend its ‘Banega Toh Farq Dikhega’ Proposition - bsmedia.business-standard.com,-0.6601046323776245
LT,2023-11-24,L&T Technology Services lays off 200 employees: Report - telecom.economictimes.indiatimes.com,-0.9216293096542358
LT,2025-08-01,"NRDC, Doon University forge strategic partnership to drive innovation, commercialisation - ET Education",0.8351101279258728
LT,2024-08-01,Lt Gen Sadhna Saxena Nair becomes first woman DG Medical Services (Army) - ETGovernment.com,-0.9169896245002747
LT,2024-10-24,India's LT Foods reports first profit drop in 13 quarters as raw material costs rise - Reuters,-0.9686186909675598
LT,2026-02-10,"MSCI to add India's Aditya Birla Capital, L&T Finance to flagship global index and drop IRCTC - Reuters",-0.9223334789276123
