ticker,date,headline,sentiment_score
LTM,2026-04-06,LTM to offer MIT Open Learning's Universal AI program to its workforce - business-standard.com,-0.5476987957954407
LTM,2026-04-06,"Indian IT firms face subdued fourth quarter as war, AI concerns persist; weak rupee helps earnings - Reuters",-0.956290066242218
LTM,2026-04-06,Dmart gains on reporting healthy Q4 business update; store count reaches 500 - business-standard.com,0.9164861440658569
LTM,2026-04-06,Greaves Electric's Ampere Magnus Grand wins 'Electric Scooter of the Year 2026' award - business-standard.com,0.7419561147689819
LTM,2026-04-06,Krebs Biochemicals & Industries Ltd leads gainers in 'B' group - business-standard.com,0.8276706337928772
LTM,2026-04-06,UCO Bank reports strong Q4 FY26 business growth - business-standard.com,0.8677099943161011
LTM,2026-04-06,"Suryoday SFB rallies after Q4 deposits rises 32% YoY to Rs 13,958 crore - business-standard.com",0.9006823897361755
LTM,2026-04-01,"Making ai work - Latest making ai work , Information & Updates - Government - ETGovernment.com",-0.9471861124038696
LTM,2017-05-15,LTM: Latam Airlines Group SA Stock Price Quote - Sant. Comerc - Bloomberg - bloomberg.com,-0.9510242938995361
LTM,2022-06-06,LTM.SN - Reuters,-0.9430077075958252
LTM,2026-03-02,Check out LTM Ltd's stock price (LTM-IN) in real time - CNBC,-0.9427356719970703
LTM,2026-02-27,LTM: LTIMindtree Ltd Stock Price Quote - Natl India - Bloomberg - bloomberg.com,-0.9466715455055237
LTM,2026-03-29,LTM.Z - | Stock Price & Latest News - Reuters,-0.9304882884025574
LTM,2021-10-18,L.T.M MARKETING (INDIA) PRIVATE LIMITED - The Economic Times,-0.9356101751327515
LTM,2026-03-18,LTM.P - | Stock Price & Latest News - Reuters,-0.9317124485969543
LTM,2026-04-06,LTM Ltd - Reuters,-0.9448049068450928
LTM,2026-02-12,"LTIMindtree introduces new brand identity and positioning, to be renamed LTM - ET BrandEquity",-0.8397490978240967
LTM,2026-02-23,LTM bags $100 million deal from European medtech firm for 7 years - business-standard.com,-0.7730945944786072
LTM,2026-02-26,"LTIM/SE/STAT/2025-26/103 February 26, 2026 National Stock Exchange of India Limited, Exchange Plaza, Bandra-Kurla Complex, - bsmedia.business-standard.com",-0.9468042254447937
LTM,2026-03-17,Why LTM’s IIT Kharagpur partnership changes how AI skilling works - Indiatimes,-0.9262023568153381
LTM,2026-02-16,LTM Partners with NFDC and Waves Bazaar to Host AI Cinema Showcase at India AI Impact Summit 2026 - bsmedia.business-standard.com,-0.8084313869476318
LTM,2026-02-11,"LTIMindtree unveils new identity, to be renamed LTM Limited; board approves - business-standard.com",-0.897551417350769
LTM,2026-02-21,"Company Financials, Estimates and Pricing Point-in-Time - Bloomberg.com",-0.9330925345420837
LTM,2022-11-29,LTIMindtree Ltd. - The Economic Times,-0.9198735952377319
LTM,2026-03-28,(LTIM.BO) | Stock Price & Latest News - Reuters,-0.9095116853713989
LTM,2026-02-11,"LTIM/SE/STAT/2025-26/98 February 11, 2026 National Stock Exchange of India Limited Exchange Plaza, Bandra-Kurla Complex, Bandr - bsmedia.business-standard.com",-0.9446527361869812
LTM,2026-03-18,Inside India’s AI revolution: LTM’s vision for the future - business-standard.com,-0.8991502523422241
LTM,2026-02-26,LTM partners with Nvidia to modernise CBDT's tax analytics platform - business-standard.com,0.815802812576294
LTM,2021-01-18,Check out LATAM Airlines Group SA's stock price (LTMX-CL) in real time - CNBC,-0.9470457434654236
LTM,2025-11-07,Hexaware Technologies Reports Strong Q3 2025 Financial Results with 3.3% Revenue Growth - cfo.economictimes.indiatimes.com,0.8521069884300232
LTM,2026-03-04,LTM recognized as a Leader in GenAI & Process Automation for Banking - business-standard.com,0.8580293655395508
LTM,2022-11-23,"LTIMindtree Share Price Today, LTIMindtree Stock Price Live NSE/BSE Updates - The Economic Times",-0.9411593675613403
LTM,2022-08-12,Infosys CEO sees moderation in attrition over coming quarters - ET CIO,-0.48080044984817505
LTM,2026-02-25,"Billion-dollar AI bets shape IT narrative, says LTM executive Krishnan Iyer - business-standard.com",-0.9067620635032654
LTM,2023-01-04,(LTIM.NS) | Stock Price & Latest News - Reuters,-0.9144159555435181
LTM,2026-01-13,Tata Consultancy Services| BUY - bsmedia.business-standard.com,-0.9434701204299927
LTM,2020-10-05,"BofA Securities cuts Nifty earnings target to 8.5%, says market not in value zone - The Economic Times",-0.7720592021942139
LTM,2026-02-23,India's LTIMindtree wins $100 million deal with European medtech firm - Reuters,0.7973476052284241
LTM,2018-10-29,A $33 Billion Opportunity Just Presented Itself: Taking Stock - bloomberg.com,-0.9099152684211731
LTM,2026-04-02,Asian Energy Services Ltd. - The Economic Times,-0.9234619140625
LTM,2020-04-22,Learning And Development - ETHRWorld.com,-0.9481839537620544
LTM,2024-07-18,LATAM Airlines readies NYSE listing at $8.5 bln potential valuation - Reuters,-0.9470407962799072
LTM,2023-07-17,"TCS aims to hire 40,000 freshers in FY24: Report - telecom.economictimes.indiatimes.com",-0.8618085384368896
LTM,2025-10-31,Chevron Beats Estimates as Hess Deal Helps Boost Oil Production - bloomberg.com,0.6737226247787476
LTM,2026-01-17,Wipro | BUY - bsmedia.business-standard.com,-0.9511555433273315
LTM,2024-08-08,Planemaker Embraer shares jump after quarterly earnings beat - Reuters,-0.6257325410842896
LTM,2024-09-17,Op-ed: Here’s why a sale of Bausch + Lomb could lead to a windfall for Bausch Health investors - CNBC,-0.571574330329895
LTM,2025-07-28,Hindustan Aeronautics - bsmedia.business-standard.com,-0.9452593922615051
LTM,2021-06-30,Check out Meta Platforms's stock price (META) in real time - CNBC,-0.9474533796310425
LTM,2026-01-08,Placed holder for cover page image Do not delete - bsmedia.business-standard.com,-0.9403127431869507
LTM,2026-03-18,LTM recognized as NVIDIA Partner Network 'Rising Star Consulting Partner of the Year' - business-standard.com,0.8643667697906494
LTM,2016-08-08,Randstad Holding to acquire Monster Worldwide - Reuters,-0.9384876489639282
LTM,2026-02-18,"I&B Ministry to host AI-focused panels at AI Summit, 51 startups showcasing innovations in WAVES Creators Co.. - Indiatimes",-0.8582115173339844
LTM,2026-01-13,HCL Technologies| ADD - bsmedia.business-standard.com,-0.9503574967384338
LTM,2009-10-06,Bilfinger to Buy Austrian Rival for 350 Million Euros - bloomberg.com,-0.9312654137611389
LTM,2026-01-21,Reena Abhijit Raje - bsmedia.business-standard.com,-0.9435515403747559
LTM,2024-04-09,Bloomberg Launches Point-in-Time Data Solution that Gives Quants a Competitive Edge | Press | Bloomberg LP - bloomberg.com,-0.8198884129524231
LTM,2025-11-19,"LATAM Airlines and Chilean pilots union reach contract agreement, ending strike - Reuters",-0.6105514168739319
LTM,2024-06-12,Databricks tells investors annualized revenue will reach $2.4 billion at midway point of year - CNBC,-0.8581132292747498
LTM,2025-11-04,Stocks Halt Rally as Wall Street CEOs Sound Alarm: Markets Wrap - bloomberg.com,-0.6814903616905212
LTM,2013-07-02,Prove-It Time Ahead for Market as Earnings Loom - CNBC,-0.8959556818008423
LTM,2012-07-19,Fitch revises Sanmina-SCI rating outlook to stable - Reuters,-0.8717823624610901
LTM,2025-07-25,Coforge - bsmedia.business-standard.com,-0.9514967799186707
LTM,2023-10-30,"Chile's LATAM Airlines swings to profit, beating estimates as passenger traffic grows - Reuters",0.9229140877723694
LTM,2025-01-27,"DeepSeek's emergence could call U.S. tech's 'stratospheric valuations' into question, says Deutsche Bank - CNBC",-0.7277352809906006
LTM,2022-03-24,Coforge Ltd - bsmedia.business-standard.com,-0.9510436058044434
LTM,2024-07-11,"Inflation falls 0.1% in June from prior month, helping case for lower rates - CNBC",-0.8644982576370239
LTM,2016-10-29,LTI: LTIMindtree Ltd Stock Price Quote - - Bloomberg - bloomberg.com,-0.9448682069778442
LTM,2025-10-15,Leela Palaces Hotels & Resorts posts 11% revenue growth in Q2 FY26; enters Dubai with first international pr.. - ET TravelWorld,0.8534838557243347
LTM,2021-01-19,Check out Moon's stock price (1723-HK) in real time - CNBC,-0.9461671113967896
LTM,2018-06-08,"IT companies : Latest News Headlines, Videos and Photo Galleries on IT companies - business-standard.com",-0.9330800771713257
LTM,2025-04-26,"Tech Mahindra headcount drops by 1,757 in Q4 - ETHRWorld.com",-0.9578003287315369
LTM,2025-07-03,"U.S. payrolls increased by 147,000 in June, more than expected - CNBC",0.8975911736488342
LTM,2024-10-06,Mining giant Rio Tinto in talks to buy U.S. lithium producer Arcadium - CNBC,-0.8552800416946411
LTM,2024-08-05,LATAM Airlines to invest $2 bln in Brazil over 2 years - Reuters,-0.8213589787483215
LTM,2025-05-05,"Warren Buffett's return tally after 60 years: 5,502,284% - CNBC",-0.9230906963348389
LTM,2025-10-15,Leela Palaces Hotels & Resorts announces robust Q2 results - ET Hospitality,-0.540635347366333
LTM,2019-05-24,birlasoft - bsmedia.business-standard.com,-0.9498084187507629
LTM,2025-12-10,"TCS/SE/160/2025-26 December 10, 2025 National Stock Exchange of India Limited BSE Limited Exchange Plaza, C-1, Block G, P. J. To - bsmedia.business-standard.com",-0.9480754733085632
LTM,2018-11-05,SPACEAGE PRODUCTS LIMITED - bsmedia.business-standard.com,-0.9539727568626404
LTM,2015-05-05,The inside story of IGate's $4 billion sellout to Capgemini - telecom.economictimes.indiatimes.com,-0.9401339888572693
LTM,2014-05-28,These 9 companies are cranking out piles of cash - CNBC,-0.9159215688705444
LTM,2024-08-09,UK investment platform Hargreaves Lansdown agrees to $6.9 billion takeover by CVC consortium - CNBC,-0.6280519962310791
LTM,2024-05-16,LATAM Airlines expands frequency of Brazil international flights; Air France adds route - Reuters,-0.8472169041633606
LTM,2024-10-26,How United is trying to overtake Delta as the world's most profitable airline - CNBC,-0.8063638806343079
LTM,2024-06-20,BIKAJI IN EQUITY 20Jun24 IC - bsmedia.business-standard.com,-0.944929838180542
LTM,2021-11-27,LATAM Airlines files restructuring plan to exit bankruptcy - Reuters,-0.8784797787666321
LTM,2026-04-03,"IPO - Latest IPO, Upcoming IPO, IPO News, IPO Issue Price, Listing Details - The Economic Times",-0.9371590614318848
LTM,2024-09-19,CIO Community Engagement Company: ET CIO Brand Solutions - ET CIO,-0.9300491213798523
LTM,2012-12-13,S&P revises High Liner Foods outlook to positive - Reuters,-0.6427642107009888
LTM,2025-11-03,AWL IN EQUITY 03Nov25 OF - bsmedia.business-standard.com,-0.947401762008667
LTM,2014-03-14,SPX Quote - S&P 500 INDEX - bloomberg.com,-0.9321295022964478
LTM,2025-05-05,20. Los Angeles FC - CNBC,-0.9416896104812622
LTM,2025-10-01,"OpenAI generates $4.3 billion in revenue in first half of 2025, the Information reports - Reuters",-0.9312489032745361
LTM,2022-10-12,LATAM Airlines prepares to exit bankruptcy in November - Reuters,-0.9146736860275269
LTM,2025-10-14,HCL Technologies - bsmedia.business-standard.com,-0.9526538848876953
LTM,2023-03-09,LATAM Airlines posts $2.5 bln profit after emerging from bankruptcy - Reuters,-0.3361307680606842
LTM,2024-03-13,UNH - | Stock Price & Latest News - Reuters,-0.9249395728111267
LTM,2012-07-26,Fitch rates Bristol-Myers Squibb's senior notes 'A' - Reuters,-0.8566230535507202
LTM,2024-07-02,"LATAM Airlines to proceed with re-listing ADRs, secondary sale - Reuters",-0.9368280172348022
