ticker,date,headline,sentiment_score
MARUTI,2026-04-01,"maruti q3 results fy26: Latest News & Videos, Photos about maruti q3 results fy26 - The Economic Times",-0.9347836375236511
MARUTI,2026-04-03,"Maruti Suzuki India aims for 8,000 service touchpoints by FY31: MD & CEO - business-standard.com",-0.9120271801948547
MARUTI,2007-09-28,Discount schemes help Maruti beat interest rate blues - The Economic Times,-0.7749465703964233
MARUTI,2026-04-01,Maruti Suzuki may raise prices as Iran conflict drives up commodity costs - business-standard.com,-0.7081301808357239
MARUTI,2026-04-03,"Maruti Suzuki adds 502 service outlets in FY26, targets network of 8,000 by 2031 - ET Auto",-0.6230528354644775
MARUTI,2026-04-01,Maruti Suzuki exports jump 34% to record 4.47 lakh units in FY26 - ET Auto,0.9467467665672302
MARUTI,2026-04-01,Maruti Suzuki elevates Alok Jaitley to Executive Officer – Homologation - ET Auto,-0.8454933762550354
MARUTI,2026-04-05,Suzuki Motorcycle India aims to contribute more to parent's 2W sales: MD - business-standard.com,-0.5148515701293945
MARUTI,2026-04-01,"Gas shortage no hurdle as March PV sales hit record high; Maruti Suzuki, Tata Motors lead pack - ET Auto",0.7625918984413147
MARUTI,2026-04-01,India's Maruti Suzuki warns of price hikes as Gulf war raises costs - Reuters,-0.7752692103385925
MARUTI,2026-04-03,Auto companies cite cost pressure amid strong dispatches - ET BrandEquity,-0.9534473419189453
MARUTI,2026-04-07,Local wheels ride smooth on country roads as Indian carmakers overtake foreign rivals - ET Auto,0.6199555993080139
MARUTI,2026-04-02,Auto cos cite cost pressure amid strong dispatches - ET Auto,-0.9334271550178528
MARUTI,2026-04-01,Passenger vehicle wholesales rise 16% in March despite West Asia conflict - business-standard.com,0.9304885268211365
MARUTI,2026-04-01,"EV sales surge in March on discounts, price hike fears - ET Infra",0.8796299695968628
MARUTI,2026-04-01,"ADAS, AI safety and cybersecurity take centre stage - ET Auto",-0.8657357692718506
MARUTI,2026-04-06,"West Asia turmoil may disrupt auto supply chains, push up costs: FADA - ET Auto",-0.9282898306846619
MARUTI,2026-04-06,"Clean mobility surge: EV, hybrid & CNG cars capture nearly 30% of India's auto market in FY26 - ET Auto",0.6630492210388184
MARUTI,2026-03-30,"Indian shares log worst fiscal since 2020 as foreign exodus, war, trade woes bite - Reuters",-0.9501345753669739
MARUTI,2026-04-03,Lucid misses first-quarter vehicle delivery estimates on supplier disruptions - Reuters,-0.905379593372345
MARUTI,2026-04-06,"kseab karnataka gov in: Latest News & Videos, Photos about kseab karnataka gov in - The Economic Times",-0.9365240335464478
MARUTI,2026-04-06,"maharashtra rte merit list 2026: Latest News & Videos, Photos about maharashtra rte merit list 2026 - The Economic Times",-0.9367055892944336
MARUTI,2026-04-06,"puc result 2026: Latest News & Videos, Photos about puc result 2026 - The Economic Times",-0.936823308467865
MARUTI,2026-04-04,Gujarat's Sanand & MBSIR emerge as EV manufacturing hubs with new incentives - ET Auto,0.931510329246521
MARUTI,2026-04-02,Auto sector set for strong growth despite export headwinds: Nuvama - ET Auto,0.9474315047264099
MARUTI,2026-04-04,India extends duty-free yellow peas imports until March 2027 - Reuters,-0.9099314212799072
MARUTI,2026-04-01,EV Sales Step on Gas to Steal March Show - ET BrandEquity,-0.7715578675270081
MARUTI,2026-04-03,North Western Railway to run special trains until July 15 amid summer rush - business-standard.com,-0.9339516758918762
MARUTI,2026-04-01,Indigo to raise ticket prices again starting April 2 as ATF costs surge - business-standard.com,-0.8587287664413452
MARUTI,2026-04-03,Ola Electric receives PLI certification for Roadster X+ 4.5 kWh e-bike - business-standard.com,0.6784175038337708
MARUTI,2026-04-05,"After GST-led surge, car sales growth likely to decelerate in FY27 - business-standard.com",-0.6354466676712036
MARUTI,2026-04-02,"M&M, TVS Motor: BSE Auto slips 3% as brokerages flag demand, margin risks - business-standard.com",-0.964975118637085
MARUTI,2026-04-01,"Sensex settles 1,187 pts higher; Nifty ends above 22,650 mark; VIX slumps 10.31% - business-standard.com",-0.9642781019210815
MARUTI,2026-04-01,"Stocks to Watch today: Bharti Airtel, Adani Ports, PhysicsWallah, IndiGo - business-standard.com",-0.9467412829399109
MARUTI,2026-04-02,"Sensex settles 185 pts higher; Nifty ends above 22,700 level; VIX jumps 2.03% - business-standard.com",0.8778656721115112
MARUTI,2026-04-02,"Nifty trades below 22,450; European mrkt decline - business-standard.com",-0.7184100151062012
MARUTI,2023-10-16,India's Maruti to pay $1.54 bln in stock to Suzuki for local plant - Reuters,-0.8770632147789001
MARUTI,2026-02-01,"Indian carmaker Maruti Suzuki's production constraints to last a few more months, exec says - Reuters",-0.7848860025405884
MARUTI,2008-07-24,TU604 Maruti Suzuki 080724 - bsmedia.business-standard.com,-0.9455443024635315
MARUTI,2025-01-29,"Maruti Suzuki's Chairman seeks quashing of FIR, Delhi HC calls for status report - ETLegalWorld.com",-0.9277268052101135
MARUTI,2023-07-31,India's Maruti tops profit view; to buy parent's Gujarat plant - Reuters,0.5180218815803528
MARUTI,2014-03-15,Maruti Suzuki India Ltd - bloomberg.com,-0.9444242715835571
MARUTI,2025-04-26,Maruti Suzuki - bsmedia.business-standard.com,-0.9517219066619873
MARUTI,2024-07-31,India's Maruti Suzuki beats Q1 profit estimates on higher SUV sales - Reuters,0.916142463684082
MARUTI,2025-09-12,Q2 FY12 Results Update Maruti Suzuki India Ltd - bsmedia.business-standard.com,-0.9439103007316589
MARUTI,2024-01-31,India's Maruti Suzuki facing some challenges due to Red Sea crisis -exec - Reuters,-0.6389259099960327
MARUTI,2025-10-31,Maruti Suzuki expects small car sales to outpace SUVs on India tax cut boost - Reuters,0.9207929372787476
MARUTI,2025-06-10,Exclusive: India's Maruti Suzuki cuts near-term EV production amid rare earths crisis - Reuters,-0.9665002822875977
MARUTI,2026-01-28,"Maruti Suzuki's quarterly profit misses estimates on one-time charge, higher costs - Reuters",-0.9059754610061646
MARUTI,2025-04-25,Maruti Suzuki Profit Misses Estimate on Higher Input Costs - bloomberg.com,-0.9110636711120605
MARUTI,2025-08-14,COMPETENT AUTOMOBILES CO. LTD. MARUTI h‘ 3 Suzuki (Authorised Maruti Dealer) GST No. : 07AAACCA842R1Z9 J ’ Phone: 011-457000 - bsmedia.business-standard.com,-0.9451583027839661
MARUTI,2021-06-17,Maruti Suzuki India Ltd - Reuters,-0.9376232624053955
MARUTI,2024-04-26,"India's Maruti Suzuki misses Q4 profit view on higher input costs, discounts - Reuters",-0.9607965350151062
MARUTI,2026-01-28,Maruti Suzuki Net Misses Estimate as Discounts Pressure Margins - bloomberg.com,-0.6808056235313416
MARUTI,2023-08-08,Japan's Suzuki to get bigger stake in India's Maruti after sale of plant - Reuters,-0.7927384972572327
MARUTI,2025-04-25,"India's Maruti Suzuki plans up to $1 bln capex for new EV launch, higher exports - Reuters",0.9107467532157898
MARUTI,2025-10-31,Maruti Suzuki Misses Profit Estimate as Higher Costs Bite - bloomberg.com,-0.9252371191978455
MARUTI,2017-07-25,Check out Maruti Suzuki India Ltd's stock price (MARUTI-IN) in real time - CNBC,-0.943070650100708
MARUTI,2025-03-01,"Maruti Suzuki February sales rise marginally to 199,400 units - ET Auto",0.9270687103271484
MARUTI,2026-01-17,Maruti Suzuki to invest $3.9 billion in new India plant - Reuters,-0.8706821203231812
MARUTI,2025-04-01,Maruti Suzuki to report monthly sales via Vahan retail data - ET Auto,-0.9495630264282227
MARUTI,2025-07-31,"Maruti Suzuki Q1 net profit up 0.9% to ₹3,792 crore - ET Auto",0.9515497088432312
MARUTI,2024-10-29,"Indian carmaker Maruti Suzuki's revenue slows to near 3-year low, shares slide - Reuters",-0.9641526341438293
MARUTI,2025-10-31,"Maruti Suzuki Q2 profit rises 8% YoY to ₹3,349 crore - ET Auto",0.941402792930603
MARUTI,2025-08-06,Maruti Suzuki sets sights on 4 million units annual production capacity by FY31 - ET Auto,0.6956480741500854
MARUTI,2026-01-12,Maruti Suzuki to boost capacity by 1 million units in India expansion - Reuters,0.8795040249824524
MARUTI,2025-01-29,Indian carmaker Maruti Suzuki misses Q3 profit view on higher discounts - Reuters,-0.9343489408493042
MARUTI,2023-10-27,India's small car sales may rebound in 2-3 years - Maruti Suzuki exec - Reuters,0.7114614844322205
MARUTI,2019-07-26,Three Japanese Directors resign from Maruti Suzuki Board after dismal Q1 results - ET Auto,-0.9430397152900696
MARUTI,2015-07-23,Annexure-“A” Press Release Maruti Suzuki launches NEXA: A New Premium Automotive Experience - bsmedia.business-standard.com,-0.8663919568061829
MARUTI,2025-04-25,"Maruti Suzuki Q4 net profit skids 4.3% to ₹3,711.1 crore - ET Auto",-0.964130699634552
MARUTI,2021-06-07,The Car Retail Ranking Report 2021 Series: For Maruti Suzuki ranked 5th only one third outlets are large for.. - ET Auto,-0.9393035173416138
MARUTI,2020-12-16,"Opinion: Is Maruti Suzuki vulnerable, once again? - ET Auto",-0.6345837712287903
MARUTI,2025-09-15,Maruti Suzuki Victoris gets five-star Global NCAP rating for adult and child safety - ET Auto,0.9099929332733154
MARUTI,2024-01-09,India's Maruti Suzuki to invest $4 bln in second Gujarat car plant - Reuters,-0.8640711307525635
MARUTI,2019-01-08,Maruti Suzuki may open third plant in South India: Report - ET Auto,-0.8744906187057495
MARUTI,2022-12-25,Maruti Suzuki India Ltd - bsmedia.business-standard.com,-0.9500852823257446
MARUTI,2025-11-17,"Maruti Sec Share Price Today, Maruti Sec Stock Price Live NSE/BSE Updates - The Economic Times",-0.9379708170890808
MARUTI,2024-12-18,Maruti Suzuki partners with Bihar govt for automated driving license test tracks - ET Auto,0.6421388387680054
MARUTI,2015-11-24,SES backs Maruti’s contract manufacturing plan with Suzuki - ET Auto,0.7599332928657532
MARUTI,2023-11-19,99% of shareholders vote for Maruti Suzuki’s acquisition of Suzuki Motor Gujarat - ET Auto,0.5836703181266785
MARUTI,2025-12-03,Maruti Suzuki stock eases despite strong EV outlook; slips 1% after recent gains - ET Auto,-0.9269154667854309
MARUTI,2019-03-01,"Maruti, Honda Cars, Mahindra report sales growth in February - ET Auto",0.8785295486450195
MARUTI,2025-12-16,Maruti Suzuki Sees New EV Lifting Green-Car Share of India Sales to 45% - bloomberg.com,0.9181264042854309
MARUTI,2022-07-04,India's Maruti Suzuki to phase out pure petrol-powered cars in 10 years - ET - Reuters,-0.8494551777839661
MARUTI,2024-02-01,Maruti Suzuki facing some challenges due to Red Sea crisis: Executive - ET Auto,-0.8480965495109558
MARUTI,2019-04-27,"US sanction on Iran, BS VI major dampeners: R C Bhargava, chairman, Maruti Suzuki - ET EnergyWorld",-0.9268851280212402
MARUTI,2025-09-15,Maruti Suzuki| BUY - bsmedia.business-standard.com,-0.9467427134513855
MARUTI,2020-07-29,Maruti Suzuki Q1 FY'21 net loss at Rs 249 crore - ET Auto,-0.9369579553604126
MARUTI,2025-04-26,"Maruti Suzuki bets on exports, new SUV launch to drive sales in FY26 - ET Auto",0.9384328126907349
MARUTI,2025-07-31,Exports help India's top carmaker Maruti Suzuki post surprise profit rise - Reuters,0.8255857825279236
MARUTI,2025-09-01,"Maruti Suzuki domestic sales dip 7% to 144,145 units in August - ET Auto",-0.9655830264091492
MARUTI,2025-09-26,"At $57.6 billion, made-in-India Maruti tops Ford, GM & Volkswagen - ET Auto",-0.8534562587738037
MARUTI,2019-08-20,Maruti Suzuki to offer free 5-year warranty for select models - ET Auto,-0.7327897548675537
MARUTI,2020-07-29,Top India Carmaker Has First-Ever Loss With Virus Hitting Demand - bloomberg.com,-0.942780077457428
MARUTI,2025-09-25,Maruti Suzuki Invicto secures 5-star safety rating in Bharat NCAP - ET Auto,0.940792441368103
MARUTI,2019-07-27,Maruti Suzuki launches factory-fitted CNG Ertiga - ET Auto,0.5380250811576843
MARUTI,2024-05-31,Maruti Suzuki Gurgaon plant fire report incorrect - ET Auto,-0.6380241513252258
MARUTI,2025-01-30,"Measures to improve overall consumption momentum in Budget to aid auto industry, says Maruti Suzuki India - ET Auto",0.9311835765838623
MARUTI,2019-03-27,Maruti Suzuki re-appoints Kenichi Ayukawa as MD & CEO - ET Auto,-0.9414469003677368
