ticker,date,headline,sentiment_score
MARUTI,2026-02-03,Maruti Suzuki Share Price Live Updates: Maruti Suzuki Trading Volume Overview - The Economic Times,-0.9329672455787659
MARUTI,2026-02-02,Maruti Suzuki Share Price Highlights: Maruti Suzuki Stock Price History - The Economic Times,-0.9365962147712708
MARUTI,2026-02-02,"Maruti Suzuki sales up 12% to 2,36,963 units in January, highest ever monthly sales volume - The Economic Times",0.9518447518348694
MARUTI,2026-02-02,"Maruti Suzuki weighs price hike as commodity costs surge, demand stays strong - The Economic Times",0.5841941833496094
MARUTI,2026-02-01,Maruti Suzuki Share Price Highlights: Maruti Suzuki Stock Price History - The Economic Times,-0.9365962147712708
MARUTI,2026-02-02,"Maruti Suzuki's production constraints to last a few more months, exec says - The Economic Times",-0.7635121941566467
MARUTI,2026-01-30,Maruti Suzuki Share Price Highlights: Maruti Suzuki Stock Price History - The Economic Times,-0.9365962147712708
MARUTI,2026-01-30,Maruti Suzuki onboards 5 early-stage startups to create tech solutions - The Economic Times,-0.6717978119850159
MARUTI,2026-01-29,Maruti Suzuki Share Price Highlights: Maruti Suzuki Stock Price History - The Economic Times,-0.9365962147712708
MARUTI,2026-01-29,"Maruti Suzuki shares decline up to 3% on missing Q3 profit estimates, drag auto index up to 2% - Moneycontrol",-0.9720569252967834
MARUTI,2026-02-02,"Hold Maruti Suzuki; target of Rs 15,750: Prabhudas Lilladher - Moneycontrol",-0.9265540242195129
MARUTI,2026-01-30,Buy Maruti Suzuki; target of Rs 18197: Motilal Oswal - Moneycontrol,-0.9187023639678955
MARUTI,2026-02-03,India-US trade deal to enhance competitiveness of auto components: ACMA - The Economic Times,0.7485354542732239
MARUTI,2026-02-01,Tata Motors PV dispatches surge 47% in January - The Economic Times,0.9126440286636353
MARUTI,2026-02-03,"Bajaj Auto January sales rise 25% at 4,77,422 units - The Economic Times",0.9274911284446716
MARUTI,2026-02-01,"Hyundai sales up 11.5% to 73,137 units in January 2026 - The Economic Times",0.9489230513572693
MARUTI,2026-02-02,"Ashok Leyland sales rise 27% to 21,920 units in January - The Economic Times",0.9416800141334534
MARUTI,2026-02-02,"Tata Nexon leads January car sales in India, beats Maruti Suzuki Dzire amid SUV dominance - Moneycontrol",0.886788547039032
MARUTI,2026-02-02,Auto sales surge as tax cuts fuel demand momentum - The Economic Times,-0.5606409311294556
MARUTI,2026-02-01,Passenger vehicle sales begin New Year with a strong start - The Economic Times,0.9470977783203125
MARUTI,2026-01-29,"SJS Enterprises Standalone December 2025 Net Sales at Rs 148.63 crore, up 60.05% Y-o-Y - Moneycontrol",0.9500808715820312
MARUTI,2026-02-03,Innovassynth Inv Profit and Loss Reports - The Economic Times,-0.8185244798660278
MARUTI,2026-02-03,35 stocks to benefit from 5 key Union Budget 2026 announcements. Check full list - The Economic Times,-0.8904933929443359
MARUTI,2026-02-02,"Bengal STF seizes 296 kg ganja worth ₹80 lakh, two arrested - The Economic Times",-0.8309046626091003
MARUTI,2026-02-03,The Economic Times - The Economic Times,-0.9159992933273315
MARUTI,2026-02-01,"Markets see biggest Budget Day fall in 6 yrs: Sensex ends 1,550 pts lower, Nifty below 24,850; Rs 11 lakh... - Moneycontrol",-0.9726288914680481
MARUTI,2026-02-03,"F&O Quote - Live FNO BSE/NSE Quote, Nifty Quotes, Indian Stock Market BSE/NSE Price Increase, Chart, Open Interest Analysis & more by Moneycontrol.com - Moneycontrol",-0.9344049096107483
MARUTI,2026-02-01,What's good and bad in Budget 2026 for stock markets? Here's what analysts say - Moneycontrol,-0.8581040501594543
MARUTI,2026-02-02,"F&O Quote - Live FNO BSE/NSE Quote, Nifty Quotes, Indian Stock Market BSE/NSE Price Increase, Chart, Open Interest Analysis & more by Moneycontrol.com - Moneycontrol",-0.9344049096107483
MARUTI,2026-02-03,"F&O Quote - Live FNO BSE/NSE Quote, Nifty Quotes, Indian Stock Market BSE/NSE Price Increase, Chart, Open Interest Analysis & more by Moneycontrol.com - Moneycontrol",-0.9344049096107483
MARUTI,2026-02-03,"Markets give thumbs up to trade deal: Sensex settles nearly 2,100 pts higher, Nifty ends above 25,700 - Moneycontrol",0.8718318939208984
MARUTI,2026-02-02,"Taking Stock: Markets recover after Budget day selloff; Sensex rises 944 pts, Nifty ends near 25,100 - Moneycontrol",0.9077449440956116
MARUTI,2026-02-02,"Closing Bell: Market recovers from Budget blues; Sensex jumps 910 pts, Nifty near 25,100 - Moneycontrol",0.8960077166557312
MARUTI,2026-02-02,From stock selection to sectoral alpha: JioBlackRock AMC on expanding its systematic equity playbook - Moneycontrol,-0.5926664471626282
MARUTI,2026-02-01,"Bajaj Auto stock outlook: Brokerages mostly positive post Q3, but flag valuation discomfort; should you... - Moneycontrol",0.8333912491798401
MARUTI,2026-02-02,"Budget-led volatility continues: Sensex falls 400 pts from day's high, Nifty below 24,850; three reasons... - Moneycontrol",-0.9633150100708008
MARUTI,2026-02-01,"Taking Stock: Budget disappoints Dalal Street; Sensex down 1,547 pts, Nifty slips below 24,850 - Moneycontrol",-0.960405707359314
MARUTI,2026-01-28,Maruti Suzuki Share Price Live Updates: Maruti Suzuki's Closing Price Analysis - The Economic Times,-0.9360439777374268
MARUTI,2026-02-03,"India-US trade deal impact: IT, auto stocks jump up to 10%, indices surge 6%; here's why - Moneycontrol",0.8396856188774109
MARUTI,2026-02-03,"Adani Enterprises, other Adani Group shares rise up to 12% on India-US trade deal - Moneycontrol",0.9376105070114136
MARUTI,2026-02-02,"BSE, Angel One, other capital market stocks jump up to 4% after Budget-led crash; Jefferies says STT hike... - Moneycontrol",0.9313222765922546
MARUTI,2026-02-01,"BDL, GRSE, other defence stocks fall up to 14% as Budget 2026 misses expectations on capex outlay; index... - Moneycontrol",-0.9747476577758789
MARUTI,2026-02-01,"Pharma stocks surge as Budget 2026 unveils Rs 10,000 crore ‘Biopharma Shakti’ push - Moneycontrol",0.6420969367027283
MARUTI,2026-02-02,"Stocks to Watch Today: PB Fintech, UPL, Clean Science, IRB Infra, Unichem Labs, Awfis Space, Thermax, Aarti Industries, City Union Bank, Ather Energy in focus on 03 February - Moneycontrol",-0.9379612803459167
MARUTI,2026-02-01,"Stocks to Watch Today: Hero MotoCorp, Gabion Technologies, Hannah Joseph Hospital, Tourism Finance... - Moneycontrol",-0.9344333410263062
MARUTI,2026-02-03,"India-US trade deal to bring cheer to textiles, gems & jewellery, chemical stocks - Moneycontrol",0.5567088723182678
MARUTI,2026-02-01,"Union Budget: Max Healthcare, other hospital stocks rise up to 4% as FM proposes to build 5 medical... - Moneycontrol",0.9474122524261475
MARUTI,2026-02-02,"BDL, HAL, other defence shares fall up to 5% as brokerages see lack of 'big bang' measures in Budget 2026 - Moneycontrol",-0.9686132073402405
MARUTI,2026-02-02,India-US trade deal announced: Markets likely to open 3% higher today as GIFT Nifty surges nearly 800... - Moneycontrol,0.9442957639694214
MARUTI,2026-02-02,"Budget boosts long-term outlook for Dixon, Kaynes Tech, other EMS stocks, say brokerages - Moneycontrol",0.9206406474113464
