ticker,date,headline,sentiment_score
NTPC,2026-03-26,NTPC receives ESG ratings upgrade from MSCI ESG Ratings - Business Standard,0.9328135848045349
NTPC,2026-03-24,India File: War and a searing summer test coal readiness - reuters.com,-0.9301236867904663
NTPC,2026-03-25,"Exclusive: India delays coal flexibility plan as solar power curbs rise, document shows - reuters.com",-0.5725724697113037
NTPC,2026-03-24,Suzlon secures 100 MW wind energy order from GAIL in Maharashtra - ET EnergyWorld,0.9003480672836304
NTPC,2026-03-28,Dalal Street Week Ahead: Avoid aggressive long positions; focus on capital preservation - The Economic Times,-0.715239942073822
NTPC,2026-03-24,"IRFC signs ₹12,842 crore loan deal with HURL for debt refinancing - ET Infra",0.8800827264785767
NTPC,2026-03-25,Sammaan Capital soars 12% on huge volumes; why NBFC stock in focus? - Business Standard,-0.7211015820503235
NTPC,2026-03-25,"Oil falls over 5%, Asian shares gain over Trump's talk of Iran negotiations - Business Standard",0.5176042318344116
NTPC,2026-03-26,Concord Control Systems' arm secures order of Rs 84.68 cr from Indian Railways - Business Standard,0.9292871356010437
NTPC,2026-03-25,"Cabinet clears new climate targets, 47% emission reduction by 2035 - Business Standard",-0.7498945593833923
NTPC,2026-03-26,Pace Digitek bags Rs 23-cr North Western Railway contract - Business Standard,-0.9192408919334412
NTPC,2025-05-21,"India's NTPC Green posts bigger quarterly profit on higher power sales, interest income - reuters.com",0.8742754459381104
NTPC,2014-03-15,NTPC: NTPC Ltd Stock Price Quote - Natl India - Bloomberg - Bloomberg.com,-0.9479310512542725
NTPC,2017-03-24,"NTPC Share Price Today, NTPC Stock Price Live NSE/BSE Updates - The Economic Times",-0.9381704330444336
NTPC,2025-10-30,India's NTPC posts quarterly profit rise on lower expenses - reuters.com,0.8038082718849182
NTPC,2024-11-13,"India's NTPC Green Energy targets $10.8 bln valuation in IPO, analysts flag concerns - reuters.com",-0.933902382850647
NTPC,2026-03-25,NTPC Green Energy Ltd. - The Economic Times,-0.925265908241272
NTPC,2009-11-19,NTPC LIMITED RESEARCH - bsmedia.business-standard.com,-0.9516363739967346
NTPC,2020-10-05,"NTPC Q4 Results: Profit rises 12% YoY to Rs 5,200 crore - The Economic Times",0.932239294052124
NTPC,2025-02-24,India's NTPC plans to invest more than $23 billion on renewable energy in Madhya Pradesh - reuters.com,-0.8823344707489014
NTPC,2024-11-22,NTPC Green's IPO attracts bids worth $1.8 bln in India's third-biggest listing this year - reuters.com,-0.4883035719394684
NTPC,2022-06-11,(NTPC.NS) | Stock Price & Latest News - reuters.com,-0.9196348190307617
NTPC,2017-08-06,Check out NTPC Ltd's stock price (NTPC-IN) in real time - CNBC,-0.9438292384147644
NTPC,2024-11-26,"India's NTPC Green Energy jumps 14% in trading debut, valuing company at $12 billion - reuters.com",-0.601142168045044
NTPC,2024-11-14,"NTPC Green Energy Cash Flow, Financial Statements - The Economic Times",-0.9306174516677856
NTPC,2025-10-29,NTPC Green Energy Q2 profit climbs to ₹86 crore - ET EnergyWorld,0.9285157918930054
NTPC,2024-09-18,State-run NTPC's green energy arm files for $1.2 bln India IPO - reuters.com,-0.9347667694091797
NTPC,2023-04-13,NTPC Green Energy Ltd - reuters.com,-0.9478102922439575
NTPC,2024-10-24,India's NTPC posts Q2 profit decline on lower power generation - reuters.com,-0.9690236449241638
NTPC,2021-06-21,NTPC Ltd - reuters.com,-0.9367499351501465
NTPC,2025-05-24,India’s NTPC Reports Profit Growth on Boost in Power Generation - Bloomberg.com,0.8887624740600586
NTPC,2025-07-30,"NTPC profit rises 11% to Rs 6,108.46 cr in April-June - ET EnergyWorld",0.9415620565414429
NTPC,2017-03-29,NTPC Profit and Loss Reports - The Economic Times,-0.7126889228820801
NTPC,2026-03-20,The Economic Times - The Economic Times,-0.9159992933273315
NTPC,2026-01-30,India's NTPC posts higher Q3 profit on lower fuel costs - reuters.com,0.9398311972618103
NTPC,2025-10-30,NTPC reports higher quarterly profit as expenses ease - ET EnergyWorld,0.9346815347671509
NTPC,2026-01-30,"NTPC net profit up 8% to ₹5,489 crore in Q3 FY26 - ET EnergyWorld",0.9536728858947754
NTPC,2025-10-31,NTPC IN Equity 30Oct25 RU - bsmedia.business-standard.com,-0.9445561766624451
NTPC,2024-11-14,"JV of green arms of India's NTPC-ONGC is highest bidder for Ayana Renewable at $650 mln, sources say - reuters.com",0.5323002934455872
NTPC,2024-10-25,"NTPC Q2 Results: Net profit grows 14% to Rs 5,380 crore - ET EnergyWorld",0.9532972574234009
NTPC,2018-05-31,"NTPC : Latest News Headlines, Videos and Photo Galleries on NTPC - Business Standard",-0.9388196468353271
NTPC,2024-11-27,NTPCGREE: NTPC Green Energy Ltd Stock Price Quote - Natl India - Bloomberg.com,-0.9477688074111938
NTPC,2024-08-06,www.ntpc.co.in - bsmedia.business-standard.com,-0.9513311386108398
NTPC,2025-04-01,India's NTPC seeks global partners to build 15 GW nuclear reactors - reuters.com,0.5102819800376892
NTPC,2025-10-30,NTPC Limited - bsmedia.business-standard.com,-0.9523904323577881
NTPC,2025-08-07,"Ref. No.: 01:SEC:LA:1 Dated: 07.08.2025 General Manager Department of Corporate Services BSE Limited Floor 25, Phiroze Je - bsmedia.business-standard.com",-0.949604332447052
NTPC,2023-04-13,India's NTPC likely to divest 25% of green energy arm via public offer - source - reuters.com,-0.9428253769874573
NTPC,2022-12-14,Exclusive: Indian power producer NTPC to sell stake in green energy business- sources - reuters.com,-0.9391930103302002
NTPC,2025-04-07,India's NTPC aims to build small nuclear reactors to replace old coal plants - reuters.com,-0.80799800157547
NTPC,2024-11-28,Check out Ntpc Green Energy Ltd's stock price (NTPCGREEN-IN) in real time - CNBC,-0.9472697377204895
NTPC,2025-03-28,ONGC NTPC Green completes acquisition of Ayana Renewable Power - ET EnergyWorld,0.4997985064983368
NTPC,2024-07-05,Check out NTPC Ltd's stock price (NTPC-IN&__SOURCE=OTS) in real time - CNBC,-0.9454976916313171
NTPC,2026-03-16,NTPC.NS - | Stock Price & Latest News - reuters.com,-0.927308201789856
NTPC,2023-12-29,How NTPC is empowering women workforce and driving tech innovations - ETHRWorld.com,-0.8519327640533447
NTPC,2026-03-23,NTPC.BO - | Stock Price & Latest News - reuters.com,-0.9282109141349792
NTPC,2026-01-08,India’s NTPC Scopes 30 Sites In Fresh Bid for Nuclear Expansion - Bloomberg.com,-0.7368935942649841
NTPC,2025-02-17,"Exclusive: India's NTPC plans to spend $62 billion on 30 GW of nuclear power, sources say - reuters.com",-0.8973873257637024
NTPC,2025-06-06,"NTPC Group installed capacity stands at 80,265 MW post commissioning of 110.25 MW solar supply - ET EnergyWorld",-0.9075331091880798
NTPC,2025-06-11,"NTPC raises $750 million via ECB loan to fund capacity expansion, green projects - ET EnergyWorld",0.8381659388542175
NTPC,2025-11-12,"India's power giant NTPC plans to enter coal gasification business, source says - reuters.com",-0.9241548180580139
NTPC,2025-02-12,India’s ONGC-NTPC Green Energy joint venture to buy Ayana Renewable - reuters.com,-0.8081930875778198
NTPC,2018-07-23,Delay in shutting down NTPC power plant led to deadly blast in Uttar Pradesh - probe - reuters.com,-0.650001049041748
NTPC,2025-11-11,NTPC Green begins land work for 25 GW solar parks in Rajasthan - ET EnergyWorld,-0.7117690443992615
NTPC,2024-02-21,NTPC signs MoU for mega green hydrogen plant in AP - ET Auto,0.8224128484725952
NTPC,2020-08-05,CISF takes over security of critical NTPC power plant in MP - ET EnergyWorld,-0.9128108024597168
NTPC,2020-12-07,"NTPC offers to buy back its Rs 4,000 cr masala bonds from lenders - Business Standard",-0.8872402310371399
NTPC,2020-09-27,NTPC stops land acquisition for greenfield coal-based power projects - ET EnergyWorld,-0.909923255443573
NTPC,2024-11-19,NTPC Green Energy's ₹10000 cr IPO: Anchor investors pump ₹3960 cr at upper price band - ET Government,-0.8803367018699646
NTPC,2023-06-15,NTPC can acquire stranded thermal power plants rather investing in new projects: IEEFA - ET EnergyWorld,-0.8814823031425476
NTPC,2023-01-03,NTPC starts India’s first green hydrogen blending project - ET EnergyWorld,-0.7216506600379944
NTPC,2022-12-13,"NTPC to allot 5 GW for green hydrogen, ammonia out of 60-GW RE target by 2032 - ET EnergyWorld",0.6958068013191223
NTPC,2025-02-13,India's NTPC in talks with foreign nuclear firms for small reactors - reuters.com,-0.8742296099662781
NTPC,2014-11-10,K .K. Sharma Takes Over as Director Operations NTPC - ET EnergyWorld,-0.9407238960266113
NTPC,2025-08-05,India’s Top State Green Energy Firm Mulls First Local Bond Sale - Bloomberg.com,-0.9180976748466492
NTPC,2025-09-02,India’s NTPC flags risks to coal plant lifespan from reduced load - reuters.com,-0.48763763904571533
NTPC,2023-08-01,Another NTPC plant in Bihar begins commercial generation - ET EnergyWorld,-0.7704888582229614
NTPC,2019-07-17,"NTPC commissions first unit of Nabinagar plant; installed capacity reaches 55,786MW - ET EnergyWorld",-0.8300182223320007
NTPC,2010-10-26,India's NTPC Sept qtr net profit nearly flat - reuters.com,-0.5188369154930115
NTPC,2025-07-01,NTPC REL adds 97.5 MW capacity at Khavda solar projects in Gujarat - ET EnergyWorld,0.5717503428459167
NTPC,2017-10-19,"Fly ash - Latest fly ash , Information & Updates - Energy - ET EnergyWorld",-0.9495200514793396
NTPC,2024-03-28,NTPC Share Price - Business Standard,-0.9476765394210815
NTPC,2024-06-27,Jharkhand : CISF takes over security of NTPC-Coal Mining Project in Hazaribagh - ET EnergyWorld,-0.8953415155410767
NTPC,2019-07-24,"NTPC, BHEL to set-up world’s ‘most efficient’ coal-fired power plant - ET EnergyWorld",0.6194921731948853
NTPC,2019-08-30,NTPC commissions India’s first ultra-super critical plant in MP - ET EnergyWorld,-0.5055844783782959
NTPC,2025-11-19,NTPC Green commissions 75.5 MW at Khavda-I solar project in Gujarat - ET EnergyWorld,-0.7825329899787903
NTPC,2020-10-23,"Aviation Ministry allows NTPC to use drones for research, inspection at its 3 thermal power plants - ET EnergyWorld",-0.8767319321632385
NTPC,2025-06-12,"NTPC Group installed capacity reaches 81,368 MW; completes trial of Unit 3 at Karanpura STPP - ET EnergyWorld",0.8479793071746826
NTPC,2026-02-25,"NTPC rallies 15% in one month, stock hits 52-week high; here's why - Business Standard",-0.6778737306594849
NTPC,2025-11-13,"NTPC steps up nuclear play, starts site search in 16 states for new power plants - ET EnergyWorld",-0.8308711647987366
NTPC,2025-09-26,"NTPC pays ₹3,248 cr final dividend for FY25; total payout reaches ₹8,096 cr - ET EnergyWorld",-0.6287335157394409
NTPC,2018-01-23,"Punjab And Sind Bank Ntpc Noida Branch IFSC Code, MICR Code, Address & Phone Number - The Economic Times",-0.9416417479515076
NTPC,2025-10-09,Aditya Dar - bsmedia.business-standard.com,-0.9482673406600952
NTPC,2025-01-27,Analysts recommend 'Buy' on NTPC post Q3 on strong outlook; details here - Business Standard,-0.8191445469856262
NTPC,2024-11-27,NTPC Green Energy Share Price - Business Standard,-0.9355834722518921
NTPC,2025-07-18,"Karnataka govt tells NTPC to scout entire state for nuclear plant site, rejects initial locations - ET EnergyWorld",-0.9362808465957642
NTPC,2024-05-25,"NTPC FY24: Generation surges to 422 billion units, profits climb to ₹21,332 crore - ET EnergyWorld",0.9196511507034302
NTPC,2025-12-30,"GREW Solar wins 1,464 MW module supply order from NTPC Renewable Energy - ET EnergyWorld",-0.5423344969749451
NTPC,2017-10-16,"Ntpc dadri - Latest ntpc dadri , Information & Updates - Energy - ET EnergyWorld",-0.9500758051872253
NTPC,2020-07-25,"NTPC officials skip meeting, agitators hold their ground in Barkagaon - ET EnergyWorld",-0.7711306214332581
NTPC,2025-02-28,NTPC Electron Quiz 2025 - ET EnergyWorld,-0.9303336143493652
