ticker,date,headline,sentiment_score
ONGC,2026-03-27,ONGC gains 3% in weak market; outperforms thus far in CY2026 - Business Standard,0.8081706762313843
ONGC,2026-03-26,"ONGC stock may zoom 65%, OMCs may not hike petrol, diesel prices soon: CLSA - Business Standard",-0.8063873648643494
ONGC,2026-03-25,ONGC plans $20 billion deepwater push amid energy security concerns - Business Standard,-0.8087226152420044
ONGC,2026-03-24,"We are exploring geothermal energy, eyeing more sites with ONGC: R Meenakshi Sundaram, Planning Secretary, U.. - ET EnergyWorld",-0.887359082698822
ONGC,2026-03-25,ONGC floats $20 billion global tender for deepwater rigs - ET EnergyWorld,0.7707163095474243
ONGC,2026-03-27,Seamec-led consortium wins Rs 330-cr ONGC O&M contract - Business Standard,0.888495147228241
ONGC,2026-03-25,Drill India drill: Iran war triggers India's boldest hunt for oil - ET EnergyWorld,-0.8239942789077759
ONGC,2026-03-27,"imf sdr india reserves: Latest News & Videos, Photos about imf sdr india reserves - The Economic Times",-0.9371448755264282
ONGC,2026-03-27,India's stock benchmarks post fifth straight weekly loss on continuing Iran war - reuters.com,-0.9562397003173828
ONGC,2026-03-24,Ports and Shipping Newsletter - ET Infra,-0.9399759769439697
ONGC,2026-03-22,"art gallery trends india: Latest News & Videos, Photos about art gallery trends india - The Economic Times",-0.9299407005310059
ONGC,2026-03-27,HC junks plea seeking CBI probe against RIL over illegal gas extraction - Business Standard,-0.8582464456558228
ONGC,2026-03-22,"vinay kumar statement: Latest News & Videos, Photos about vinay kumar statement - The Economic Times",-0.9336563348770142
ONGC,2026-03-21,"cinema and grief: Latest News & Videos, Photos about cinema and grief - The Economic Times",-0.9300208687782288
ONGC,2026-03-22,"global manufacturing legacy: Latest News & Videos, Photos about global manufacturing legacy - The Economic Times",-0.929340124130249
ONGC,2026-03-25,Maruti Suzuki India to scale up rail-based dispatch to 35% by FY31 - Business Standard,-0.5446181297302246
ONGC,2026-03-27,RIL share price tumbles 4%; govt's export duty on fuel spooks investors - Business Standard,-0.9672334790229797
ONGC,2026-03-23,"Govt directs faster processing of city gas projects, hikes commercial LPG allocation to ease supply stress - ET EnergyWorld",0.8878430128097534
ONGC,2026-03-26,Global markets slip on higher crude oil prices amid West Asia war - Business Standard,-0.9471029043197632
ONGC,2026-03-25,"Tata Power commissions 400 kV Tanda-Gonda, Gonda-Basti lines in UP - Business Standard",-0.7416263818740845
ONGC,2026-03-27,"₹1.5 trn hit to exchequer as govt cuts petrol, diesel excise: Deven Choksey - Business Standard",-0.7923145890235901
ONGC,2026-03-27,Foreign investors flee Indian assets at record pace on oil shock - Business Standard,-0.9408867955207825
ONGC,2026-03-28,Most successful IPL captains over the years - Business Standard,-0.6014269590377808
ONGC,2026-03-28,Kohli to Rohit: Top 5 run-scorers in IPL history - Business Standard,-0.9033299088478088
ONGC,2026-03-28,NHPC signs implementation agreement for two hydroelectric projects in Jammu & Kashmir - Business Standard,0.9345353245735168
ONGC,2026-03-28,Goldman Sachs' new adviser Rishi Sunak urges small firms to adopt AI - Business Standard,-0.8522905707359314
ONGC,2026-03-28,Sammaan Capital receives regulatory approvals for investment from Avenir Investment RSC - Business Standard,0.799500584602356
ONGC,2026-03-28,"APL Apollo Tubes allots 22,379 equity shares under ESOP - Business Standard",-0.9542074799537659
ONGC,2026-03-28,RBI caps banks' NOP-INR exposure at $100 million - Business Standard,-0.907978892326355
ONGC,2026-03-27,Colgate Total Partners with Mumbai Indians; PLOT Initiative Rolled Out to Maintain Peak Dental Health - Business Standard,0.8383194208145142
ONGC,2026-03-27,Govt starts talks with automobile companies on shift from E20 to E25 - Business Standard,-0.8459337949752808
ONGC,2026-03-27,India's Micro-Drama Market Hit $300Mn in Year One; Total Interactive Media Economy Clocks $14Bn - Business Standard,-0.7752943634986877
ONGC,2026-03-28,Pharmaids Pharmaceuticals announces divestment of step-down subsidiary - Business Standard,-0.7958493828773499
ONGC,2026-03-27,APSEZ sets up India's first Port of Refuge to boost maritime safety - Business Standard,0.7619284391403198
ONGC,2026-03-27,March sees $30 billion drop in India's foreign exchange reserves - Business Standard,-0.9752697348594666
ONGC,2026-03-28,Birla Transasia Carpets reports standalone net loss of Rs 0.03 crore in the December 2025 quarter - Business Standard,-0.9438456892967224
ONGC,2026-03-28,Gujarat Ambuja Exports starts commercial production at new Maltodextrin unit in Hubli - Business Standard,-0.850722074508667
ONGC,2026-03-27,'Once upon a Time... in Hollywood': Oscars set to get a new venue - Business Standard,-0.7681291103363037
ONGC,2026-03-28,DMK finalises seat-sharing pact with allies ahead of Assembly polls - Business Standard,-0.8355093002319336
ONGC,2026-03-27,Justdial Strengthens Its All-in-One Business Platform to Support Local Merchants - Business Standard,0.9212204813957214
ONGC,2026-03-27,Sebi bars four from markets for 2 years in front-running case linked to FPI - Business Standard,-0.9405046105384827
ONGC,2026-03-28,Luxury Is Moving Inward: Tier 2 Cities Lead India's Aspirational Housing Shift - Business Standard,-0.6611403226852417
ONGC,2026-03-28,North East Shiksha Samvaad in Nagaland Calls for Urgent Shift to Future-Ready Education - Business Standard,-0.6536839604377747
ONGC,2026-03-28,GIFT City: India's Operational Gateway to Global Capital Scales New Heights - Business Standard,0.671841025352478
ONGC,2026-03-25,"Crude falls below $100/bbl; OMCs rise up to 3%, upstream stocks mixed - Business Standard",0.9219427704811096
ONGC,2026-03-28,Rentomojo files draft papers with Sebi for IPO; plans Rs 150-cr fresh issue - Business Standard,-0.9337892532348633
ONGC,2026-03-28,"Storms, rain sweep India; IMD issues yellow alert in Delhi as mercury dips - Business Standard",-0.8012074828147888
ONGC,2026-03-28,Celebrities Applaud Emerging Talent as a Star Showstopper Lights Up NIF Global 'The Runway' at Lakme Fashion Week x FDCI - Business Standard,0.7266618013381958
ONGC,2026-03-28,"G R Infraprojects successfully bids for Rs 1,453 cr NHAI project - Business Standard",0.8449334502220154
ONGC,2026-03-28,"Cyber threats moving beyond data theft, now risk human lives: Deloitte - Business Standard",-0.9254008531570435
ONGC,2026-03-27,HDFC Bank probes chairman's resignation letter; RBI's CBDC push; Fino PB withdraws CEO reappointment - Business Standard,-0.4764019250869751
ONGC,2026-03-27,Banking changes from April 1:Ignoring this could cost you ₹200-800 a year - Business Standard,-0.4739196002483368
ONGC,2026-03-27,CBSE introduces alternative evaluation for Class XII amid West Asia crisis - Business Standard,-0.854596734046936
ONGC,2026-03-27,ICICI Pru MF reclassifies its thematic advantage FoF; Sebi nod to 6 IPOs - Business Standard,-0.7860927581787109
ONGC,2026-03-28,"Thermax Babcock & Wilcox Energy Solutions bags boiler package order worth Rs 1,600 cr - Business Standard",-0.8725208044052124
ONGC,2026-03-27,"Taxiing to take off, Jewar airport likely to drive land value surge - Business Standard",0.911109983921051
ONGC,2026-03-28,Top 5 Virat Kohli moments in IPL - Business Standard,-0.8819410800933838
ONGC,2026-03-27,"Chattels Design Expands to Hyderabad, Bringing End-to-End Home Interior Solutions to Modern Homeowners - Business Standard",-0.6239848136901855
ONGC,2026-03-28,RailTel Corporation bags Rs 444-cr LoI for KSWAN 3.0 project - Business Standard,-0.8745514154434204
ONGC,2026-03-27,"Birla Estates enters Mumbai redevelopment market with ₹1,700 cr project - Business Standard",-0.5257453918457031
ONGC,2026-03-27,IPL salary debate: Are cricketers underpaid or bound by structure? - Business Standard,-0.8248274326324463
ONGC,2026-03-27,Govt relaxes rules for some state firms to procure key equipment from China - Business Standard,-0.6222500801086426
ONGC,2026-03-27,TCS gains 2% in weak market; stock among ICICI Securities top IT picks - Business Standard,0.9200562238693237
ONGC,2026-03-27,Uttar Pradesh's 5th international airport to take wings on Saturday - Business Standard,-0.8124931454658508
ONGC,2026-03-27,Govt plans to borrow ₹8.2 trillion in H1FY27; yields seen softening - Business Standard,0.8980112075805664
ONGC,2026-03-28,"KNR Constructions bags Rs 1,734 cr NHAI project in Telangana - Business Standard",-0.8493145108222961
ONGC,2026-03-24,US halts Iran strikes: Nifty set to rally; Emkay picks stocks to buy now - Business Standard,0.6450744867324829
ONGC,2026-03-28,IBEX India 2026: Anchoring the Next Phase of BFSI Innovation - Business Standard,-0.6414526700973511
ONGC,2026-03-27,"Odisha lags in spending despite record budget, capex remains a concern - Business Standard",-0.8881404995918274
ONGC,2026-03-27,"Markets crash: Sensex down 1,700 pts intraday, Nifty below 23k; key reasons - Business Standard",-0.9578759074211121
ONGC,2026-03-28,SC issues contempt notice to ASI chief over heritage sites of Delhi - Business Standard,-0.9352632164955139
ONGC,2026-03-28,Omax Autos confirms cyber security incident on its IT infrastructure - Business Standard,-0.9200456142425537
ONGC,2026-03-27,National Award winning director Anupam Patnaik's Horror Comedy - Mantra Muugdha - Business Standard,-0.7001854777336121
ONGC,2026-03-28,Gujarat Ambuja Exports starts commercial production at new maltodextrin facility - Business Standard,-0.7741261720657349
ONGC,2026-03-28,IPL 2026: Marsh says Pant's openness helps create strong team culture - Business Standard,0.8957498073577881
ONGC,2026-03-28,"IPL 2026: Ishan Kishan a confident player and leader, says Vettori - Business Standard",0.8570372462272644
ONGC,2026-03-27,"7 killed, 5 injured in avalanches along Srinagar-Leh national highway - Business Standard",-0.872790515422821
ONGC,2026-03-27,Lauritz Knudsen Powers Its Partnership with Mumbai Indians into a Successful Second Year - Business Standard,0.9200674295425415
ONGC,2026-03-27,Dulux Weathershield brings a 'Colourful and Powerful' Holi to Consumer Doorsteps with Blinkit - Business Standard,-0.7775209546089172
ONGC,2026-03-28,Olympic medallist Gurjant Singh calls time on international hockey career - Business Standard,-0.9253134727478027
ONGC,2026-03-28,AIFF opens media rights bids; Genius Sports puts Rs 2129 crore bid - Business Standard,-0.7925465106964111
ONGC,2026-03-28,Ceigall India arm bags Rs 603-cr NHAI road project - Business Standard,-0.8939233422279358
ONGC,2026-03-28,Tiger Woods: Timeline of major moments on and off the golf course - Business Standard,-0.9321833252906799
ONGC,2026-03-27,"Xiaomi 17 review: Leica camera and battery shine, software holds back - Business Standard",-0.6564159989356995
ONGC,2026-03-28,"Thermax arm bags Rs 1,600-cr boiler package order - Business Standard",-0.9366730451583862
ONGC,2026-03-28,IPL 2026: RCB coach Flower backs Impact Sub rule as tactical boost - Business Standard,-0.7497836947441101
ONGC,2026-03-28,Avantel secures Rs137-cr order from IMD - Business Standard,0.9062916040420532
ONGC,2026-03-28,"2 students dead, 7 others injured in Tennessee school bus crash in US - Business Standard",-0.9323623776435852
ONGC,2026-03-28,VinFast VF 6 or VF 7: Which SUV Fits Your Life Better? - Business Standard,-0.9184814691543579
ONGC,2026-03-27,Galgotias University is Among the Top Global Institutions in the QS Rankings 2026 for Computer Science - Business Standard,0.7349545359611511
ONGC,2026-03-28,"IPL 2026: Only aim is to win matches for team, says Angkrish Raghuvanshi - Business Standard",-0.8291178941726685
ONGC,2026-03-27,Garnier Color Naturals Celebrates Mother-daughter Trust with Raveena Tandon and Rasha Thadani in New Campaign - Business Standard,-0.6188387274742126
ONGC,2026-03-27,"Apple's 'iPhone 20' in 2027 may feature cutout-free, quad-curved display - Business Standard",-0.881731390953064
ONGC,2026-03-27,"DGCA tells pilots to resist pressure on VVIP flights, stress safety norms - Business Standard",-0.9097649455070496
ONGC,2026-03-28,Delhi school Class 6-8 results releasing March 28: How to check scores - Business Standard,-0.9343063831329346
ONGC,2026-03-28,"Telangana to explore AI tax to offset job losses, says CM Revanth Reddy - Business Standard",0.6306745409965515
ONGC,2026-03-27,UPTET 2026 application starts March 27 at official website; details inside - Business Standard,-0.9511379599571228
ONGC,2026-03-28,No Dhoni for CSK; MSD to miss first two weeks of IPL 2026 due to injury - Business Standard,-0.9464671015739441
ONGC,2026-03-27,Hindustan Aeronautics hits 52-week low; defence stock slips 10% in 6 days - Business Standard,-0.9674432873725891
ONGC,2026-03-28,IndiGo flight makes emergency landing at Delhi airport after engine failure - Business Standard,-0.7780322432518005
