ticker,date,headline,sentiment_score
PFC,2026-04-02,"pfc dividend 2025: Latest News & Videos, Photos about pfc dividend 2025 - The Economic Times",-0.9378722310066223
PFC,2026-04-01,Page 4 - Power Finance Corporation (pfc) - Business Standard,-0.9392074942588806
PFC,2026-04-02,Bhaskar Bhattacharya steps down from PFC board; two directors retire - BFSI News,-0.608441948890686
PFC,2026-04-02,Bhaskar Bhattacharya resigns as PFC independent director; to contest West Bengal assembly elections - ET EnergyWorld,-0.6891981959342957
PFC,2026-04-03,"west bengal voting date 2026: Latest News & Videos, Photos about west bengal voting date 2026 - The Economic Times",-0.9388896226882935
PFC,2017-03-24,"Power Finance Corp. Share Price Today, Power Finance Corp. Stock Price Live NSE/BSE Updates - The Economic Times",-0.9406113624572754
PFC,2026-04-02,"PFC Independent Director Bhaskar Bhattacharya resigns, to contest Bengal polls - The Economic Times",-0.5272325277328491
PFC,2017-08-06,Check out Power Finance Corporation Ltd's stock price (PFC-IN) in real time - CNBC,-0.9468237161636353
PFC,2025-11-07,"State-owned PFC net profit rises 9% to ₹7,834.39 cr in Q2 - ET EnergyWorld",0.9462617039680481
PFC,2017-03-28,Power Finance Corporation Ltd. - The Economic Times,-0.9273746013641357
PFC,2026-02-06,"India's PFC, REC will merge to create large state-run power financier - Reuters",-0.933208167552948
PFC,2020-12-31,Initiating Coverage Initiating Coverage - bsmedia.business-standard.com,-0.9495355486869812
PFC,2021-06-02,Stock Research Report for Power Finance Corporation Ltd - The Economic Times,-0.9282907247543335
PFC,2022-10-11,Power Finance Corporation Ltd - Reuters,-0.9459890723228455
PFC,2026-03-24,PFC names consultants for merger with REC - ET EnergyWorld,-0.8307925462722778
PFC,2026-02-11,PFC-REC merger may ease funding access for renewable firms: CreditSights - ET EnergyWorld,0.810850977897644
PFC,2026-02-03,Govt likely to consider merger of state-run financiers PFC and REC - Business Standard,-0.9394194483757019
PFC,2026-02-05,"Power Finance Corporation Q3 net profit rises 6% to ₹8,212 cr - ET EnergyWorld",0.945627748966217
PFC,2023-11-09,"Power Finance Corporation Q2 Results: Net profit jumps 27% YoY to Rs 6,628 crore - ET EnergyWorld",0.9440332651138306
PFC,2024-01-10,PFC gets Reserve Bank nod to set up finance company in GIFT City - BFSI News,-0.866053581237793
PFC,2026-02-16,Merger involving $61 billion of debt seen aiding India's credit market - Business Standard,0.9348405003547668
PFC,2025-01-21,Are PFC and REC well-equipped to finance India’s energy transition goals? - BFSI News,0.5368427634239197
PFC,2025-04-23,PFC files police case against Gensol for filing fake documents to get loans - ETLegalWorld.com,-0.5936078429222107
PFC,2023-04-21,PFC okays INR 633 cr EV financing facility to BluSmart Mobility - ET Auto,0.5089195370674133
PFC,2025-08-27,PFC signs MoU with Ministry of Power under CPSE performance framework - ET EnergyWorld,0.5944007635116577
PFC,2025-03-12,India's PFC gets government nod to issue deep-discount long-tenor debt - Reuters,-0.7316346764564514
PFC,2025-06-21,Final RBI norms on project financing positive trigger for the PFC - Business Standard,-0.5679128766059875
PFC,2018-10-23,Announcement - The Economic Times,-0.9166386723518372
PFC,2015-03-23,POWF: Power Finance Corp Ltd Stock Price Quote - Natl India - Bloomberg - Bloomberg.com,-0.9478514790534973
PFC,2017-03-30,"PFC-led lenders, PE firm seize control of Kasliwal’s 400 Mw Hydel Project - ET EnergyWorld",-0.8549403548240662
PFC,2024-10-07,PFC secures $1.265 billion foreign currency loan for green energy projects - ET EnergyWorld,0.9039299488067627
PFC,2024-05-06,"Shares of REC, PFC and IREDA plunge after RBI’s draft guidelines on project financing - BFSI News",-0.9337917566299438
PFC,2023-08-21,PFC secures JPY 1.85 billion loan from JBIC for Waste-to-Energy project in Karnataka - ET EnergyWorld,0.9012287259101868
PFC,2020-05-13,"PFC-REC to infuse Rs 90,000 crore liquidity injection to ailing discoms: Nirmala Sitharaman - ET EnergyWorld",-0.845721960067749
PFC,2023-06-05,Page 2 - Power Finance Corporation (pfc) - Business Standard,-0.9398794174194336
PFC,2025-04-19,"PFC, IREDA mull legal measures against Gensol to safeguard their loan exposure - ETLegalWorld.com",-0.9152414798736572
PFC,2019-03-01,Power Finance Corp Ltd - Bloomberg.com,-0.9488487839698792
PFC,2024-02-15,PFC and ABRPL ink ₹3037.50 crore loan deal for bio-refinery in Assam - ET EnergyWorld,0.9052496552467346
PFC,2026-03-23,"Dividend, bonus issue: PFC, 4 others to remain in focus; do you own any? - Business Standard",-0.9407361149787903
PFC,2022-01-20,PFC Consulting transfers 2 subsidiaries to Adani Transmission to implement projects - ET EnergyWorld,-0.8368861675262451
PFC,2023-10-04,CCI gives nod to deal involving Lanco Amarkantak Power - ET EnergyWorld,-0.7948809862136841
PFC,2026-03-18,Power Finance Corporation stock soars 4%; Motilal Oswal sees more upside - Business Standard,0.7845994234085083
PFC,2026-01-15,"PFC launches third public NCD issue, eyes ₹5,000 crore fundraising - Business Standard",-0.7053725719451904
PFC,2025-06-20,"PFC, REC gain as RBI unveils final project finance norms - Business Standard",-0.837888777256012
PFC,2025-03-12,"PFC board okays Rs 1.4 trn borrowing, Rs 3.5 per share interim dividend - Business Standard",-0.8735458850860596
PFC,2024-11-11,PFC shares gain 9% after reporting Q2 results; declares Rs 3.5 dividend - Business Standard,0.9109340906143188
PFC,2026-02-09,PFC-REC merger explained: What it means for investors & key scenarios ahead - Business Standard,-0.937044620513916
PFC,2026-02-06,PFC approves in-principle merger proposal with REC after Budget 2026 push - Business Standard,-0.4988071322441101
PFC,2025-08-06,"Power Finance Q1 results: Profit rises 24% at ₹6,866 cr, dividend declared - Business Standard",0.936809241771698
PFC,2026-02-13,"PFC, REC say merger transition smooth; merged firm to have 20% exposure cap - Business Standard",0.788601279258728
PFC,2024-11-08,"PFC Q2 results: Profit up nearly 9% to Rs 7,215 cr on higher revenue - Business Standard",0.9544543027877808
PFC,2026-02-06,"PFC board clears merger with REC to boost scale, efficiency of NBFCs - Business Standard",0.9422566890716553
PFC,2025-05-21,"PFC Q4 results: PAT rises 11% to Rs 8,358 crore, dividend at Rs 2.05/share - Business Standard",0.9370026588439941
PFC,2025-06-09,PFC withdraws zero-coupon bonds issuance due to weak investor demand - Business Standard,-0.9689699411392212
PFC,2026-02-05,"Power Finance Corp Q3FY26 results: Net profit rises 6% to ₹8,212 cr - Business Standard",0.94796222448349
PFC,2025-02-21,"Dividend, Stock-split: PFC, SBI Cards, 8 others to turn ex-date next week - Business Standard",-0.9492689371109009
PFC,2025-06-23,"Motilal Oswal sector of the week: NBFCs; REC, PFC among top bets - Business Standard",-0.5995267033576965
PFC,2018-11-28,Centre considers REC-PFC merger to bridge budget gap ahead of 2019 polls - Business Standard,0.6437191367149353
PFC,2025-05-21,"PFC Q4 results: Profit rises 11% to ₹8,358 crore on interest income gains - Business Standard",0.943511962890625
PFC,2025-02-12,"Power Finance Q3 results: Profit up 23% at Rs 7,760 cr, dividend declared - Business Standard",0.9532182812690735
PFC,2025-02-13,PFC share rises 5% as Q3 profit zooms 23%; Analysts positive on Q4 growth - Business Standard,0.9439283013343811
PFC,2025-05-16,"Mazagaon Dock overtakes Britannia, PFC, Tata Power, BPCL in m-cap ranking - Business Standard",-0.8125525712966919
PFC,2016-07-14,Power Finance Corp jumps after board's nod for bonus issue - Business Standard,-0.5449362397193909
PFC,2024-12-09,"PFC raises Rs 6,252 crore via issuance of bonds with different maturities - Business Standard",-0.9257760047912598
PFC,2025-04-30,Power Finance Corporation shelves bond issuance plan amid lacklustre demand - Business Standard,-0.9639977216720581
PFC,2026-02-06,Board of Power Finance Corporation accords in-principle approval for merger with REC - Business Standard,0.6090661287307739
PFC,2025-08-29,"PFC, JBIC sign ₹3,500 cr loan pact to fund clean energy projects in India - Business Standard",0.8443347215652466
PFC,2025-12-09,"ACC, MGL, Trent, REC, PFC, Bata and 35 others from BSE 500 hit 52-week lows - Business Standard",-0.9456241130828857
PFC,2018-10-22,"REC Share Price Today, REC Stock Price Live NSE/BSE Updates - The Economic Times",-0.9394363760948181
PFC,2020-07-29,"PFC ties up with IIT-Kanpur for research, training in smart grid technology - Business Standard",0.5390684604644775
PFC,2025-06-20,"PFC, REC shares rally up to 6% on RBI relief for project financiers - Business Standard",0.9408689737319946
PFC,2025-02-12,"Q3 results today: HAL, Ashok Leyland, Siemens to post earnings on Feb 12 - Business Standard",0.808330774307251
PFC,2024-11-13,PFC not to take exposure in Shapoorji Pallonji Group: CMD Chopra - Business Standard,-0.948851466178894
PFC,2025-06-27,Analyst recommends 'Bull Spread' on Bank Nifty & PFC; detailed analysis - Business Standard,-0.9179396629333496
PFC,2025-07-11,"F&O Cues: Analyst suggests 'Bull Spread' on Bank Nifty, PFC; check details - Business Standard",-0.9055659770965576
PFC,2026-01-12,"PFC plans to raise up to ₹5,000 crore through public issue of NCDs - Business Standard",0.5838555097579956
PFC,2026-02-05,"Power Finance Corporation posts PAT of Rs 4,763.33 crore in Q3 - Business Standard",-0.9036610722541809
PFC,2024-10-16,PFC Infra Finance IFSC Ltd gets approval to operate from GIFT City - Business Standard,0.727783203125
PFC,2025-04-23,PFC files police case against Gensol for filing fake documents to get loans - BFSI News,-0.5211142301559448
PFC,2026-02-01,"No word on merger: Budget 2026 proposes restructuring of PFC, REC - Business Standard",-0.9440533518791199
PFC,2026-02-09,"Stocks to Watch today: Tata Steel, SBI, Hind Zinc, BEML, PFC, Aurobindo - Business Standard",-0.9327651858329773
PFC,2017-03-23,"Canara Bank Share Price Today, Canara Bank Stock Price Live NSE/BSE Updates - The Economic Times",-0.9371769428253174
PFC,2025-12-30,"After upto 29% dip in 8 Nifty PSE stocks in 2025, experts turn bullish on 2 - Business Standard",-0.7360845804214478
PFC,2026-02-19,Govt forms high-level committee to monitor progress of PFC-REC merger - Business Standard,-0.9426978230476379
PFC,2017-03-31,"Shyamkamal Invst Share Price Today, Shyamkamal Invst Stock Price Live NSE/BSE Updates - The Economic Times",-0.9355712532997131
PFC,2026-04-02,"Bright Brothers Share Price Today, Bright Brothers Stock Price Live NSE/BSE Updates - The Economic Times",-0.9370564222335815
PFC,2025-02-27,"PFC inks pact to provide Rs 26,800 crore finance to MP power utilities - Business Standard",0.8257974982261658
PFC,2024-02-12,"Jasch Gauging Techno Share Price Today, Jasch Gauging Techno Stock Price Live NSE/BSE Updates - The Economic Times",-0.9375458359718323
PFC,2025-04-22,PFC takes Gensol Engineering's forgery case to Economic Offences Wing - Business Standard,-0.8933182954788208
PFC,2026-03-22,About Power Finance Corporation Ltd (PWFC.NS) - Reuters,-0.9504002332687378
PFC,2026-03-21,"Adani Electricity Mumbai, Tata Power Delhi, Noida Power top PFC's FY25 discom rankings - ET EnergyWorld",-0.8983017206192017
PFC,2025-01-16,PFC signs 120 bn yen loan pact with Japan's JBIC for RE project - Business Standard,0.9165874123573303
PFC,2017-04-18,"Elpro Intnl Share Price Today, Elpro Intnl Stock Price Live NSE/BSE Updates - The Economic Times",-0.9405940175056458
PFC,2026-03-20,"Dividend, bonus, stock-split: Vedanta, PFC, 10 others go ex-date next week - Business Standard",-0.946395218372345
PFC,2021-09-27,"Bombay Metrics Supply Chain Share Price Today, Bombay Metrics Supply Chain Stock Price Live NSE/BSE Updates - The Economic Times",-0.9335163831710815
PFC,2025-05-15,"India's IRFC receives approval to issue deep-discount debt, government document shows - Reuters",-0.8243062496185303
PFC,2017-07-20,"Prithvi Exchange Share Price Today, Prithvi Exchange Stock Price Live NSE/BSE Updates - The Economic Times",-0.9389122128486633
PFC,2026-02-15,Merger Involving $61 Billion of Debt to Help India Credit Market - Bloomberg.com,-0.8762245774269104
PFC,2017-08-03,"Morganite Crucible Share Price Today, Morganite Crucible Stock Price Live NSE/BSE Updates - The Economic Times",-0.9419122338294983
PFC,2025-10-06,RBIs latest policy measures are big relief for NBFCs and infra lending NBFCs: Report - ET Infra,0.6129480004310608
