ticker,date,headline,sentiment_score
POWERGRID,2024-01-31,Power Grid Corporation of India Share Price Today Live Updates: Power Grid Corporation of India Closes at - The Economic Times,-0.9149290323257446
POWERGRID,2024-03-28,Power Grid Corporation of India Share Price Live Updates: Power Grid Corporation of India Sees 1.61% Incr - The Economic Times,-0.8690893650054932
POWERGRID,2024-03-05,Power Grid Corporation of India Share Price Live Updates: Power Grid Corporation of India Closes at Rs 29 - The Economic Times,-0.9112352132797241
POWERGRID,2023-12-12,Power Grid Corporation of India Share Price Live Updates: Power Grid Corporation of India Closes at Rs 23 - The Economic Times,-0.9143784046173096
POWERGRID,2024-02-01,Power Grid Corporation of India Share Price Today Live Updates: Power Grid Corporation of India Closes at - The Economic Times,-0.9149290323257446
POWERGRID,2024-03-04,Power Grid Corporation of India Share Price Today Updates: Power Grid Corporation of India Closes at Rs 2 - The Economic Times,-0.9128488302230835
POWERGRID,2024-03-28,Power Grid Corporation of India Share Price Live Updates: Power Grid Corporation of India Sees 1.67% Incr - The Economic Times,-0.8577808737754822
POWERGRID,2024-03-28,Power Grid Corporation of India Share Price Live Updates: Power Grid Corporation of India Closes at Rs 27 - The Economic Times,-0.9084410071372986
POWERGRID,2024-03-04,Breakouts Updates: Power Grid Surges Above Second Resistance Level in Bullish Breakout - The Economic Times,0.36837679147720337
POWERGRID,2024-02-06,Power Grid Corporation of India Share Price Today Live Updates: Power Grid Corporation of India Witnesses - The Economic Times,-0.9326574206352234
POWERGRID,2024-02-16,Recos Updates: ICICI Direct Recommends Power Grid Corporation with 3.25% Upside Potential - The Economic Times,-0.8383658528327942
POWERGRID,2023-12-18,Power Grid Corporation of India Share Price Today Live Updates: Power Grid Corporation of India Closes at - The Economic Times,-0.9149290323257446
POWERGRID,2017-05-17,"Business News Live, Share Market News - Read Latest Finance News, IPO, Mutual Funds News - The Economic Times",-0.9387364387512207
POWERGRID,2024-03-07,Power Grid Corporation of India Stocks Live Updates: Power Grid Corporation of India Dividend Updates - The Economic Times,-0.9264015555381775
POWERGRID,2023-12-22,Power Grid Corporation of India Stocks Live Updates: Power Grid Corporation of India Sees 0.47% Dip in Pr - The Economic Times,-0.9535369873046875
POWERGRID,2024-01-05,Power Grid Corporation of India Stocks Live Updates: Power Grid Corporation of India Stock Details - The Economic Times,-0.9298635721206665
POWERGRID,2024-05-24,Power Grid Corporation of India Share Price Today Live Updates: Power Grid Corporation of India Sees 0.76 - The Economic Times,-0.8371014595031738
POWERGRID,2026-03-05,Millions left without power after major blackout hits Cuba's western region - The Economic Times,-0.8330098986625671
POWERGRID,2026-03-09,"Airtel lines up $1 bn investment for data centre arm Nxtra, to rope in Alpha Wave Global - The Economic Times",0.7950776815414429
POWERGRID,2026-03-03,Power Ministry extends deadline for Draft National Electricity Policy 2026 feedback till March 19 - The Economic Times,-0.9274142980575562
POWERGRID,2024-01-30,"Price Updates: Power Grid Hits New 52-Week High at Rs 254.6, Registers 0.26% Price Increase - The Economic Times",0.8900821805000305
POWERGRID,2026-03-03,Power ministry to set up selection panel to look for NTPC chief - The Economic Times,-0.9421806335449219
POWERGRID,2026-03-07,"Those Northern Lights Aren’t Just Pretty, They’re Telling Us Something About Space - The Economic Times",-0.9208701848983765
POWERGRID,2026-03-08,"Forum Discussion on Market View, Business sectors,Stocks, Commodity, Personal Finance & More - Moneycontrol.com",-0.9462059736251831
POWERGRID,2026-03-06,"Ahead of 2027 assembly polls, electricity tariff slashed in Punjab - The Economic Times",0.46217548847198486
POWERGRID,2026-03-09,"SBI, Tata Steel among top Nifty gainers of 2026 so far. How many do you own? - The Economic Times",-0.8921034336090088
POWERGRID,2026-03-03,"Stocks to Watch Today: Hindustan Aeronautics, JSW Cement, Affle, Lupin, Greenlam, Greenply, Tata Motors,... - Moneycontrol.com",-0.9443928003311157
POWERGRID,2011-12-24,HFCL Ltd. - Moneycontrol.com,-0.9478405714035034
POWERGRID,2026-03-08,"Safe anchor in a swirling world: With fires raging in West Asia, India's calm, calculated ascent offers a - The Economic Times",-0.7078784108161926
POWERGRID,2026-02-24,"Cabinet approves hike in Powergrid's equity investment threshold to Rs 7,500 cr per subsidiary - The Economic Times",0.6861657500267029
POWERGRID,2026-02-02,"Power Grid Corp raises FY26 capex forecast to Rs 32,000 cr from earlier Rs 28,000 cr - The Economic Times",0.8967638611793518
POWERGRID,2025-09-24,REC arm transfers Davanagere Power Transmission SPV to POWERGRID - The Economic Times,-0.9220559000968933
POWERGRID,2025-11-19,KEC International sees no material impact on existing Powergrid contracts - The Economic Times,-0.9289857149124146
POWERGRID,2025-05-21,Maharatna PSU Powergrid projects capex of over Rs 3 lakh crore by 2032 - The Economic Times,-0.5671213865280151
POWERGRID,2026-02-18,"Data centres later, fix the power ‘grid’-lock first - The Economic Times",-0.8903465270996094
POWERGRID,2025-10-31,"Sri Lanka, India talks on power grid integration move forward - The Economic Times",-0.8355535268783569
POWERGRID,2025-06-05,Power Grid Corp acquires MEL Power Transmission from PFC Consulting - The Economic Times,-0.9007390737533569
POWERGRID,2021-09-05,Power Grid Corporation of India Limited to develop around 11 EV charging stations in Shillong - The Economic Times,-0.5277312994003296
POWERGRID,2026-02-25,Cabinet panel allows increased equity investment limit in Power Grid arms - The Economic Times,-0.7454816699028015
POWERGRID,2022-01-29,PowerGrid getting contract sans bidding process irks private companies - The Economic Times,-0.6001061201095581
POWERGRID,2017-06-21,US announces $7.5 million to advance India's power grid - The Economic Times,0.7882313132286072
POWERGRID,2025-12-15,India emerging as preferred destination for data centres due to strong power grid: Piyush Goyal - The Economic Times,0.5862184166908264
POWERGRID,2022-06-06,(PGRD.BO) | Stock Price & Latest News - Reuters,-0.906144380569458
POWERGRID,2025-11-12,India's power grid struggles to absorb soaring solar supply - The Economic Times,-0.8751536011695862
POWERGRID,2016-12-06,Jindal University and Power Grid Corporation of India sign MoU - The Economic Times,-0.8925622701644897
POWERGRID,2020-05-07,TEPC wants PowerGrid to cancel deal with Fiberhome - The Economic Times,-0.5113393664360046
POWERGRID,2022-12-04,"Power Grid to separate telecom business, gets nod to foray into data centre biz - The Economic Times",-0.6499388217926025
POWERGRID,2025-11-03,"India's Power Grid Corp posts profit decline due on higher expenses, delayed projects - Reuters",-0.9710114598274231
POWERGRID,2024-08-30,Power Grid Corp acquires Bhadla-III & Bikaner-III Transmission - The Economic Times,-0.8987395167350769
POWERGRID,2016-11-16,Power Grid Corporation of India awards Sterling and Wilson a Rs 250 crore project - The Economic Times,-0.6178565621376038
