ticker,date,headline,sentiment_score
SBILIFE,2026-02-02,SBI Life Share Price Live Updates: SBI Life experiences a decline in returns - The Economic Times,-0.9678459167480469
SBILIFE,2026-02-01,SBI Life Share Price Highlights: SBI Life Stock Price History - The Economic Times,-0.938349187374115
SBILIFE,2026-02-03,SBI Life Share Price Live Updates: SBI Life's Volume Analysis - The Economic Times,-0.9378554821014404
SBILIFE,2026-01-30,SBI Life Share Price Highlights: SBI Life Stock Price History - The Economic Times,-0.938349187374115
SBILIFE,2026-01-29,SBI Life Share Price Highlights: SBI Life Stock Price History - The Economic Times,-0.938349187374115
SBILIFE,2026-01-29,"Q3 Results impact: SBI Card, SBI Life shares fall 3%; Gland Pharma surges 9% to two-month high - Moneycontrol",-0.9711233377456665
SBILIFE,2026-01-30,Buy SBI Life Insurance; target of Rs 2570: Motilal Oswal - Moneycontrol,-0.8872356414794922
SBILIFE,2026-01-30,"Stocks to buy in 2026 for long term: SBI Life, Metro Brands among 5 stocks that could give 10-30% return - The Economic Times",-0.810224711894989
SBILIFE,2026-01-29,SBI Life Insurance Company shares decline 4.05% amid volume surge - Moneycontrol,-0.9638588428497314
SBILIFE,2026-01-28,SBI Life Share Price Highlights: SBI Life Stock Price History - The Economic Times,-0.938349187374115
SBILIFE,2026-01-29,"Nifty 50 top losers: Asian Paints, SBI Life Insurance among stocks dragging benchmark index today - Moneycontrol",-0.7794182896614075
SBILIFE,2026-01-29,Hold SBI Life Insurance Company; target of Rs 2125: Prabhudas Lilladher - Moneycontrol,-0.9380156397819519
SBILIFE,2026-01-29,"SBI Life Insura Standalone December 2025 Net Sales at Rs 46,132.63 crore, up 144.58% Y-o-Y - Moneycontrol",0.9493917226791382
SBILIFE,2026-01-29,"Closing Bell: Markets climb for 3rd day in a row; Sensex up 222 pts, Nifty reclaims 25,400 - Moneycontrol",0.894343912601471
SBILIFE,2026-02-02,The Economic Times - The Economic Times,-0.9159992933273315
SBILIFE,2026-02-01,Union Budget 2026: Here are the 11 stocks analysts think could steal Budget Day spotlight - Moneycontrol,-0.8937071561813354
SBILIFE,2026-02-03,Innovassynth Inv Profit and Loss Reports - The Economic Times,-0.8185244798660278
SBILIFE,2026-01-29,"Taking Stock: Indices extend winning streak to 3rd day; Sensex jumps 222 pts, Nifty ends above 25,400 - Moneycontrol",0.7740517854690552
SBILIFE,2026-02-03,"F&O Quote - Live FNO BSE/NSE Quote, Nifty Quotes, Indian Stock Market BSE/NSE Price Increase, Chart, Open Interest Analysis & more by Moneycontrol.com - Moneycontrol",-0.9344049096107483
SBILIFE,2026-01-28,"L&T Q3 Results Highlights: Net profit falls 4% to Rs 3,215 crore, revenue up 10% - Moneycontrol",-0.7949973940849304
SBILIFE,2026-01-30,Buy TVS Motor Company; target of Rs 4461: Motilal Oswal - Moneycontrol,-0.9031674265861511
SBILIFE,2026-02-03,"F&O Quote - Live FNO BSE/NSE Quote, Nifty Quotes, Indian Stock Market BSE/NSE Price Increase, Chart, Open Interest Analysis & more by Moneycontrol.com - Moneycontrol",-0.9344049096107483
SBILIFE,2026-02-02,"F&O Quote - Live FNO BSE/NSE Quote, Nifty Quotes, Indian Stock Market BSE/NSE Price Increase, Chart, Open Interest Analysis & more by Moneycontrol.com - Moneycontrol",-0.9344049096107483
SBILIFE,2026-01-30,Buy Maruti Suzuki; target of Rs 18197: Motilal Oswal - Moneycontrol,-0.9187023639678955
SBILIFE,2026-01-28,"F&O Quote - Live FNO BSE/NSE Quote, Nifty Quotes, Indian Stock Market BSE/NSE Price Increase, Chart, Open Interest Analysis & more - Moneycontrol",-0.9073578715324402
SBILIFE,2026-01-29,"Asian Paints shares fall 3.46%, among top losers on Nifty 50 today - Moneycontrol",-0.9684045910835266
SBILIFE,2012-04-29,SBI Life - Smart Elite - Equity Elite Fund II - Moneycontrol,-0.9208873510360718
SBILIFE,2026-01-28,SBI Life Q3 Results: Profit rises 5% YoY to Rs 577 crore; net premium income jumps 22% - The Economic Times,0.9427415728569031
SBILIFE,2026-01-28,India's SBI Life reports higher quarterly profit as tax cuts boost demand - Reuters,0.9485223293304443
SBILIFE,2024-04-23,SBI Life Insurance Company Share Price Today Live Updates: SBI Life Insurance Company Sees Marginal Decli - The Economic Times,-0.9145622253417969
SBILIFE,2022-01-13,SBI Small Cap Fund Regular Plan Growth [162.42] - Moneycontrol,-0.8992401957511902
SBILIFE,2022-02-16,SBI Multicap Fund Regular Growth [16.19] - Moneycontrol,-0.8837414383888245
SBILIFE,2018-01-05,"sbi life insurance company Forum Discussion on Market View, Business sectors,Stocks, Commodity, Personal Finance & More - Moneycontrol",-0.9448946118354797
SBILIFE,2025-10-25,SBI Life net profit dips 7% in Q2 on higher expenses - The Economic Times,-0.9713016748428345
SBILIFE,2022-10-27,SBI Life Insurance Company Ltd. - Moneycontrol,-0.9527568817138672
SBILIFE,2025-01-21,"Stocks to buy for 2025: SBI Life, Wipro among top 5 stocks that could give 16-28% upside in next 12 months - The Economic Times",0.5698592662811279
SBILIFE,2025-07-10,SBI ELSS Tax Saver Fund Regular Growth [437.17] - Moneycontrol,-0.6023431420326233
SBILIFE,2025-07-28,"Stocks to buy in 2025 for long term: CG Power, SBI Life among 5 stocks that could give 10-28% return - The Economic Times",-0.8328142166137695
SBILIFE,2025-05-01,"​HDFC Bank, SBI Life among 10 largecap stocks that earned upgrades in last 1 month. Check revised target price - The Economic Times",-0.8307706713676453
SBILIFE,2025-08-14,SBI Life Insurance launches ‘SBI Life - Smart Shield Plus’. Details here - The Economic Times,-0.9388624429702759
SBILIFE,2025-10-29,SBI Life - Growth bets: Brokerages see 5 stocks offering up to 41% upside after strong Q2 results - The Economic Times,0.9226561784744263
SBILIFE,2024-10-25,"Buy SBI Life, target price Rs 2,100: Motilal Oswal Financial Services - The Economic Times",-0.9282428026199341
SBILIFE,2025-08-13,"Avendus Fund, SBI Life lead funding in Aragen - The Economic Times",-0.8698515295982361
SBILIFE,2025-11-15,SBI Life Insurance - Chris Wood’s India stocks: 8 counters see wild swings from -8% to 29% in 6 months - The Economic Times,0.7420108914375305
SBILIFE,2024-09-09,SBI Life Insurance fined Rs 1 crore for regulatory violations; Irdai asks insurer to adhere to rules to se - The Economic Times,-0.6278892755508423
SBILIFE,2025-01-20,Q3FY25 SBI Life Insurance Company Ltd. - images.moneycontrol.com,-0.947869062423706
SBILIFE,2025-11-10,"Shriram Finance, One97 Comm among 9 financial services stocks that hit 52-week highs; gained up to 23% in a month - The Economic Times",0.9461429119110107
SBILIFE,2025-10-06,SBI Life Share Price Highlights: SBI Life Stock Price History - The Economic Times,-0.938349187374115
SBILIFE,2025-10-24,SBI Life shares decline marginally ahead of September quarter results; here's what analysts expect - Moneycontrol,-0.9697812795639038
SBILIFE,2022-06-11,(SBIL.NS) | Stock Price & Latest News - Reuters,-0.9150764346122742
