ticker,date,headline,sentiment_score
SBILIFE,2023-12-15,"SBI Life Insurance Company Stocks Live Updates: SBI Life Insurance Company Sees 1.04% Decrease in Price, - economictimes.indiatimes.com",-0.957157552242279
SBILIFE,2026-04-06,"Quick Wrap: Nifty Financial Services Index records a surge of 2.34%, NIFTY climbs 1.12% - business-standard.com",0.8649388551712036
SBILIFE,2026-04-06,"Why Sensex cut losses, up 1,400 pts from day's low; Nifty at 22,968? - business-standard.com",0.9094837307929993
SBILIFE,2024-01-25,SBI Life Insurance Q3 result: PAT rises 5.8% to Rs 322 crore - ET BFSI,0.9502233862876892
SBILIFE,2026-01-28,India's SBI Life reports higher quarterly profit as tax cuts boost demand - Reuters,0.9485223293304443
SBILIFE,2025-04-24,"India's SBI Life quarterly profit flat, group insurance demand slows - Reuters",-0.9673377871513367
SBILIFE,2025-04-25,SBI Life Insurance - bsmedia.business-standard.com,-0.9516278505325317
SBILIFE,2021-06-16,SBI Life Insurance Company Ltd - Reuters,-0.9380497932434082
SBILIFE,2025-01-19,SBI Life Insurance Company - bsmedia.business-standard.com,-0.9526317119598389
SBILIFE,2017-09-30,SBI Life Insurance Co Ltd - bloomberg.com,-0.9482383728027344
SBILIFE,2025-07-24,India's SBI Life posts higher quarterly profit on boost from policy renewals - Reuters,0.9451263546943665
SBILIFE,2025-01-17,"SBI Life Insurance posts higher Q3 profit on policy renewals, new sales - Reuters",0.9533447027206421
SBILIFE,2025-10-24,"October 24, 2025 SBIL/CS/NSE-BSE/2526/120 Vice President General Manager Listing Department, Listing Department, Nation - bsmedia.business-standard.com",-0.9450773596763611
SBILIFE,2019-09-14,"Sbi life insurance - Latest sbi life insurance , Information & Updates - BFSI -ET BFSI - ET BFSI",-0.9516432881355286
SBILIFE,2017-10-14,"SBI Life Share Price Today, SBI Life Stock Price Live NSE/BSE Updates - economictimes.indiatimes.com",-0.9408985376358032
SBILIFE,2021-07-23,"Sbi life insurance company - Latest sbi life insurance company , Information & Updates - BFSI -ET BFSI - ET BFSI",-0.9523260593414307
SBILIFE,2024-04-27,India's SBI Life Insurance reports lower new business margin for FY 2024 - ET BFSI,-0.9589719176292419
SBILIFE,2025-08-07,"August 07, 2025 SBIL/CS/NSE-BSE/2526/75 Vice President General Manager Listing Department, Listing Department, National - bsmedia.business-standard.com",-0.9501212239265442
SBILIFE,2017-10-15,SBI Life Insurance Company Ltd. - economictimes.indiatimes.com,-0.9415627121925354
SBILIFE,2025-04-27,Shift in product mix will continue in FY26: SBI Life Insurance MD & CEO - business-standard.com,-0.933366596698761
SBILIFE,2025-07-26,"SBI Life set for strong growth for next 3 years amid product shift, margin expansion - ET BFSI",0.9378774166107178
SBILIFE,2023-06-13,SAT stays Irdai order to transfer Sahara Life Insurance assets to SBI Life - business-standard.com,-0.9457064270973206
SBILIFE,2019-01-23,"HDFC Life Share Price Today, HDFC Life Stock Price Live NSE/BSE Updates - economictimes.indiatimes.com",-0.9422152042388916
SBILIFE,2016-10-31,SBI Life Insurance Midcap Fund - bloomberg.com,-0.9494377374649048
SBILIFE,2019-01-23,HDFC Life Insurance Company Ltd. - economictimes.indiatimes.com,-0.9429468512535095
SBILIFE,2022-04-27,"LIC Share Price Today, LIC Stock Price Live NSE/BSE Updates - economictimes.indiatimes.com",-0.9391505122184753
SBILIFE,2017-03-23,"Max Financial Share Price Today, Max Financial Stock Price Live NSE/BSE Updates - economictimes.indiatimes.com",-0.9435651898384094
SBILIFE,2025-10-29,"SBI Life Insurance Company Ltd soars 1.87%, Gains for third straight session - business-standard.com",0.9008203744888306
SBILIFE,2023-10-09,LIC's market share drops to 58.5% till September from 68.2% in a year - business-standard.com,-0.9747100472450256
SBILIFE,2026-02-25,"Stocks to buy in March 2026: SBI Life, Polycab among Motilal Oswal's picks - business-standard.com",-0.926394522190094
SBILIFE,2026-01-29,"Stocks to Watch today: L&T, SBI Life, ACC, Cochin Shipyard, RVNL, M&M Fin - business-standard.com",-0.9463839530944824
SBILIFE,2024-03-28,SBI Life Insurance Company Share Price - business-standard.com,-0.9393783211708069
SBILIFE,2025-10-24,SBI Life Insurance Q2FY26 results: Net profit drops 6.6% to ₹494 crore - business-standard.com,-0.9715275764465332
SBILIFE,2025-07-24,SBI Life Insurance Q1 results: Profit up 14% to ₹590 cr on premium growth - business-standard.com,0.9507352709770203
SBILIFE,2025-05-26,"SBI Life, Vidyaniti acquire 4.25% stake in NHIT for Rs 1,100 crore - business-standard.com",-0.9435496926307678
SBILIFE,2025-10-16,"Buy Cholamandalam Investment, SBI Life, HAL, says analyst at Motilal Oswal - business-standard.com",-0.9228270053863525
SBILIFE,2025-10-28,"Hindalco, SBI Life rally up to 44% so far in 2025; market cap near ₹2 trn - business-standard.com",0.8874396681785583
SBILIFE,2025-02-24,Dividend Alert! SBI Life Insurance fixes record date; are you eligible? - business-standard.com,-0.9445015788078308
SBILIFE,2025-10-28,SBI vs SBI Card vs SBI Life: Which SBI group stock can gain the most? - business-standard.com,-0.888713002204895
SBILIFE,2025-01-17,SBI Life Insurance Q3 results: Net profit rises 71% to Rs 551 crore - business-standard.com,0.9397172927856445
SBILIFE,2026-01-29,"SBI Life slips 3% post Q3; Street flags GST impact, sees margin recovery - business-standard.com",-0.9420253038406372
SBILIFE,2025-01-17,SBI Life Insurance Q3 results: Net profit jumps 71% to Rs 551 crore - business-standard.com,0.9282387495040894
SBILIFE,2025-07-25,"SBI Life rises 3% on posting Q1 results; Should you buy, sell or hold? - business-standard.com",-0.6771402955055237
SBILIFE,2025-04-25,SBI Life stock rises 10% in trade today; Here's what you need to know - business-standard.com,0.6475139260292053
SBILIFE,2026-01-28,SBI Life Q3 profit rises 5% to ₹5.77 billion as tax cuts lift demand - business-standard.com,0.9189261198043823
SBILIFE,2025-10-27,"Steady growth, firm margins lift SBI Life to 52-wk high; analysts keep Buy - business-standard.com",0.9335411190986633
SBILIFE,2025-04-25,SBI Cards or SBI Life: Which stock should you buy post Q4 results? - business-standard.com,-0.949920654296875
SBILIFE,2024-10-24,Why SBI Life stock fell 5% despite net profit rising 39% YoY; reasons here - business-standard.com,-0.8241980671882629
SBILIFE,2026-03-18,"SBI Life Insurance Company Ltd soars 1.69%, up for third straight session - business-standard.com",0.9268087148666382
SBILIFE,2026-01-28,SBI Life Insurance's Q3FY26 results: Net profit rises 5% to ₹577 crore - business-standard.com,0.9431525468826294
SBILIFE,2025-01-20,SBI Life stock dips 3% post Q3 results; analysts lower target price - business-standard.com,-0.9544689655303955
SBILIFE,2024-10-23,SBI Life Insurance Q2 results: Net profit rises 39% to Rs 529 crore - business-standard.com,0.9385226368904114
SBILIFE,2025-04-25,"SBI Life Insurance registers New Business Premium of Rs. 35,577 crores for the year ended on 31st March, 2025 - business-standard.com",-0.9176737666130066
SBILIFE,2024-10-23,SBI Life Insurance Q2 results: Net profit jumps 39% to Rs 529 crore - business-standard.com,0.9248955845832825
SBILIFE,2025-01-17,"Q3 results today: Wipro, Tech Mahindra among 40 to post earnings on Jan 17 - business-standard.com",-0.804654061794281
SBILIFE,2025-01-17,"SBI Life Insurance registers New Business Premium of Rs.26,256 crores for the period ended on 31st December, 2024 - business-standard.com",-0.926856279373169
SBILIFE,2025-10-27,"SBI Life Insurance registers New Business Premium of ₹18,349 crores for the period ended on 30th September, 2025 - business-standard.com",-0.9047935605049133
SBILIFE,2025-04-15,India's ICICI Prudential Life posts higher quarterly profit on strong group insurance demand - Reuters,0.9474856853485107
SBILIFE,2025-07-30,SBI leads $9.2 bn QIP spree as firms tap market rally to raise funds - business-standard.com,-0.7965245842933655
SBILIFE,2026-01-28,"Q3 results today: BEL, Larsen & Toubro, Maruti Suzuki among 127 firms - business-standard.com",-0.8957095146179199
SBILIFE,2025-04-25,SBI Cards tanks over 6% after Q4 results: Here's what brokerages say - business-standard.com,-0.8270188570022583
SBILIFE,2025-10-14,ICICI Prudential Life Q2 FY26 result: Net profit jumps 18% to ₹296 cr - business-standard.com,0.9380786418914795
SBILIFE,2025-10-15,"HDFC Life Q2 profit rises 3.3% to ₹4470 cr, net premium income up 13% - business-standard.com",0.9461128115653992
SBILIFE,2025-05-23,"Life Insurance shares in focus; HDFC Life, Max Financial hit record highs - business-standard.com",-0.844803512096405
SBILIFE,2024-11-28,"Life insurance stocks fall; HDFC Life, SBI Life, Max Financial dip up to 7% - business-standard.com",-0.952503502368927
SBILIFE,2026-01-14,"SBI Life launches 'SBI Life- Smart Platina Advantage', a life insurance guaranteed savings plan for long-term financial confidence - business-standard.com",-0.6295287609100342
SBILIFE,2017-10-14,General Insurance Corporation of India - economictimes.indiatimes.com,-0.9426300525665283
SBILIFE,2025-10-10,Why are brokerages betting on SBI Life and HDFC Life among life insurers? - business-standard.com,-0.9397527575492859
SBILIFE,2024-12-30,Chaya M V of Bengaluru bags the 'Spell Master of India' Title at SBI Life Spell Bee Season 14 - business-standard.com,-0.8263899683952332
SBILIFE,2025-07-27,Banca channel key to achieve insurance for all: SBI Life MD Amit Jhingran - business-standard.com,-0.8823821544647217
SBILIFE,2026-02-03,"SBI Life Insurance registers New Business Premium of ₹31,326 crores for the period ended on 31st December, 2025 - business-standard.com",-0.9061661958694458
SBILIFE,2025-08-04,"Share Market Today | Latest Stock Market News, Sensex Today and Nifty Live Updates - business-standard.com",-0.9380323886871338
SBILIFE,2025-12-26,"One Plan, Two Benefits: Protection & Guaranteed Savings with SBI Life - New Smart Samriddhi - business-standard.com",-0.8053566217422485
SBILIFE,2025-08-19,"SBI Life, HDFC Life shares erase gains despite 5% GST buzz; Emkay decodes - business-standard.com",-0.5939276218414307
SBILIFE,2026-01-17,Avik Agrawal from Mumbai bags the 'Spell Master of India' Title at SBI Life Spell Bee Season 15 - business-standard.com,-0.8430092334747314
SBILIFE,2025-09-12,SBI Life simplifies processes to accept claims by North India flood victims - business-standard.com,-0.9216126799583435
SBILIFE,2024-09-12,"SBI Life Insurance and Mirchi return with the 14th edition of Spell Bee 2024, empowering India's young spelling wizards - business-standard.com",-0.7107431292533875
SBILIFE,2013-02-06,Union Bank of India ties up with SBI Life - business-standard.com,-0.8945544362068176
SBILIFE,2017-03-31,ICICI Prudential Life Insurance Company Ltd. - economictimes.indiatimes.com,-0.944054126739502
SBILIFE,2018-06-01,"ICICI Prudential Life Insurance : Latest News Headlines, Videos and Photo Galleries on ICICI Prudential Life Insurance - business-standard.com",-0.9340515732765198
SBILIFE,2019-05-21,"HDFC Life Insurance : Latest News Headlines, Videos and Photo Galleries on HDFC Life Insurance - business-standard.com",-0.9407040476799011
SBILIFE,2025-01-17,ICICI Lombard General Insurance Q3 net profit rises 68% to Rs 724 crore - business-standard.com,0.9344115853309631
SBILIFE,2025-07-24,"Q1 results today: ACC, Nestle, Motilal Oswal, Bajaj Fin among 64 on July 24 - business-standard.com",-0.9295714497566223
SBILIFE,2024-04-03,"Life Insurance brands failing to raise CX bar, Industry's NPS stagnated - ET BFSI",-0.8899871706962585
SBILIFE,2025-02-25,SBI Life appoints Dorababu Daparti as Deputy CEO - business-standard.com,-0.9147460460662842
SBILIFE,2024-11-28,Bank-backed private life insurers' scrips tumble on banca limit reports - business-standard.com,-0.839006781578064
SBILIFE,2026-01-29,"Q3 results today: ITC, Vedanta, Adani Power among 184 firms on Jan 29 - business-standard.com",-0.937426745891571
SBILIFE,2025-09-12,"SBI Life eases claim documentation requirements for flood affected policyholders in Jammu & Kashmir, Punjab and Himachal Pradesh - business-standard.com",-0.9313158988952637
SBILIFE,2026-04-02,Max Financial Services Ltd. - economictimes.indiatimes.com,-0.9419586658477783
SBILIFE,2026-01-28,Star Health Q3 results: Net profit falls 40% to ₹128 crore - business-standard.com,-0.968498945236206
SBILIFE,2017-07-30,Sangam (India) Ltd. - economictimes.indiatimes.com,-0.9373127818107605
SBILIFE,2017-03-27,"Amarnath Securities Yearly results, Financial Summary - economictimes.indiatimes.com",-0.923542320728302
SBILIFE,2026-01-28,Mahindra Finance Q3FY26 results: Net profit falls 10% to ₹826 crore - business-standard.com,-0.9631734490394592
SBILIFE,2026-01-29,"Adani Power Q3FY26 results: Profit falls 19% to ₹2,480 cr, revenue down 9% - business-standard.com",-0.9718434810638428
SBILIFE,2026-01-28,"L&T Q3FY26 results: Profit falls 4% to ₹3,215 crore on Labour Codes' costs - business-standard.com",-0.9692463278770447
SBILIFE,2018-03-12,"Clarification sought from Bandhan Bank Ltd | Announcement 16 Mar,2026, 01:03PM IST - economictimes.indiatimes.com",-0.9438671469688416
SBILIFE,2024-10-18,ICICI Lombard Q2FY25 results: Net profit jumps 20% to Rs 694 crore - business-standard.com,0.9356274008750916
SBILIFE,2017-07-28,"Gravity (India) Nine Monthly Results, Nine Monthly Earnings for Gravity (India) - economictimes.indiatimes.com",-0.929798424243927
SBILIFE,2017-08-05,"Alfred Herbert Nine Monthly Results, Nine Monthly Earnings for Alfred Herbert - economictimes.indiatimes.com",-0.9226096868515015
