ticker,date,headline,sentiment_score
SBIN,2026-04-03,"Eternal, SBI, Bharti Airtel, 6 other stocks can rally up to 57%. How many do you have? - The Economic Times",-0.49772343039512634
SBIN,2026-04-04,Earnings growth to double from FY27 as BFSI sector stabilises: MOSL Report - ET CFO,0.9327143430709839
SBIN,2026-04-02,Groww Dynamic Term Fund - Regular Plan Fund info - The Economic Times,-0.9340303540229797
SBIN,2026-04-03,Informal sector steps up coal stocking over price concerns - The Economic Times,-0.4943094849586487
SBIN,2026-04-04,"Plastic, glass crunch from West Asia conflict pricks packaged goods companies - The Economic Times",-0.849394679069519
SBIN,2026-04-04,RBI revises rules for Floating Rate Savings Bonds 2020: Key changes investors should know - The Economic Times,-0.9300522208213806
SBIN,2026-04-04,Who are Delve founders Karun Kaushik and Selin Kocalar? - The Economic Times,-0.9348270893096924
SBIN,2026-04-04,"ETtech Deals Digest: Startups raise $187 million this week, down 28% on-year - The Economic Times",-0.9733304977416992
SBIN,2026-04-04,ITR changes from April 2026: 5 key updates for Tax Year 2026–27 explained - The Economic Times,-0.9162776470184326
SBIN,2026-04-04,"oil price march 24: Latest News & Videos, Photos about oil price march 24 - The Economic Times",-0.9361136555671692
SBIN,2026-04-04,Kotak Multi Asset Active FoF Regular-IDCW - The Economic Times,-0.9110361933708191
SBIN,2026-04-04,"India’s crude oil supply fully secured, no payment hurdle for Iranian imports: Petroleum Ministry - The Economic Times",-0.900404155254364
SBIN,2026-04-02,"Axis Securities retains Nifty target at 28,080; Eternal among top 15 picks - Business Standard",0.907455563545227
SBIN,2017-07-28,Check out State Bank of India's stock price (SBIN-IN) in real time - CNBC,-0.9423370361328125
SBIN,2017-03-24,"SBI Share Price Today, SBI Stock Price Live NSE/BSE Updates - The Economic Times",-0.9361106157302856
SBIN,2021-12-21,"SBI Q2 Results: PSU lender posts highest-ever quarterly profit of Rs 13,265 crore - The Economic Times",0.8176034092903137
SBIN,2021-12-13,"SBI Q3 Results: Profit jumps 24% YoY to Rs 21,028 crore, NII rises 9% - The Economic Times",0.9219042062759399
SBIN,2026-04-02,State Bank of India - The Economic Times,-0.9167757630348206
SBIN,2020-10-05,"SBI Q1 Results: PAT rises marginally YoY to Rs 17,035 crore, beats estimates - The Economic Times",0.9341222047805786
SBIN,2020-04-01,"SBI Q4 Results: Net profit zooms 83% YoY to Rs 16,695 crore, beats estimates - The Economic Times",0.9256817698478699
SBIN,2025-08-08,SBIN IN Equity 08Aug25 RU - bsmedia.business-standard.com,-0.9480410218238831
SBIN,2020-10-06,SBI earnings: Analysts focus on bad loans as slippages rise - The Economic Times,-0.9055684804916382
SBIN,2026-04-02,"SBI Life Share Price Today, SBI Life Stock Price Live NSE/BSE Updates - The Economic Times",-0.939715564250946
SBIN,2020-05-05,"SBI Card Share Price Today, SBI Card Stock Price Live NSE/BSE Updates - The Economic Times",-0.9374772310256958
SBIN,2022-06-14,(SBI.NS) | Stock Price & Latest News - Reuters,-0.9118427634239197
SBIN,2014-03-15,SBIN: State Bank of India Stock Price Quote - Natl India - Bloomberg - Bloomberg.com,-0.9470100998878479
SBIN,2017-03-30,"SBI Target Share Price, SBI Share Price Forecast - The Economic Times",-0.9379588961601257
SBIN,2026-02-09,"India's SBI closes at record high on profit beat, upbeat loan growth outlook - Reuters",0.9237273335456848
SBIN,2025-08-11,"Indian shares gain ahead of US-Russia talks; SBI, Tata Motors rise post earnings - Reuters",0.906703531742096
SBIN,2017-10-15,SBI Life Insurance Company Ltd. - The Economic Times,-0.9276003241539001
SBIN,2026-04-02,"Ashok Leyland Share Price Today, Ashok Leyland Stock Price Live NSE/BSE Updates - The Economic Times",-0.9382628798484802
SBIN,2026-02-11,SBI Overtakes TCS in Market Value for the First Time in 15 Years - Bloomberg.com,-0.6724264621734619
SBIN,2026-02-09,"Indian shares rise on US trade optimism, strong earnings from top lender SBI - Reuters",0.9381745457649231
SBIN,2026-02-09,Higher Credit Growth Flags Year of Big Policy Action for Indian Banks - Bloomberg.com,0.573672890663147
SBIN,2018-09-14,SBI PAYMENT SERVICES PRIVATE LIMITED - The Economic Times,-0.9330481886863708
SBIN,2020-12-07,"SBI to boost retail loan book, sees earnings improving - Business Standard",0.955008327960968
SBIN,2026-03-30,(SBIN.NS) | Stock Price & Latest News - Reuters,-0.9120342135429382
SBIN,2017-09-01,"SBI IFSC Code: Find State Bank of India IFSC code, MICR code, all Branch details and Address - The Economic Times",-0.9473345875740051
SBIN,2018-09-14,SBI GLOBAL FACTORS LIMITED - The Economic Times,-0.9216316342353821
SBIN,2026-01-12,"Optimum credit-deposit ratio for banks is 76-80%, says SBI report - Business Standard",-0.8953728675842285
SBIN,2022-06-06,(SBI.BO) | Stock Price & Latest News - Reuters,-0.9048364758491516
SBIN,2025-05-01,"SBI Q4 results 2025: Check date, earnings expectations, fundraising update - Business Standard",-0.9265759587287903
SBIN,2026-01-22,"SBI rallies 3%, stock hits all-time high; what's driving PSB giant? - Business Standard",-0.6339559555053711
SBIN,2017-03-31,Central Bank of India - The Economic Times,-0.9171810746192932
SBIN,2024-03-28,"SBI Share Price Today: State Bank of India Stock Price Live NSE/BSE, SBI Latest News, and Financial Results - Business Standard",-0.9413357377052307
SBIN,2025-04-30,SBI dips 3% on profit booking on fund raising plan; should you buy or hold? - Business Standard,-0.9210305213928223
SBIN,2025-11-17,SBI m-cap hits ₹9 trn; surges 44% from March low. Should you buy or hold? - Business Standard,-0.5415777564048767
SBIN,2026-02-07,"SBI Q3FY26 results: Net profit up 24.5% to ₹21,028 crore on strong NII - Business Standard",0.9525570869445801
SBIN,2025-11-03,SBI Q2 results today: Analysts expect a flattish quarter from PSU bank - Business Standard,-0.9416579008102417
SBIN,2024-11-06,"SBI Q2 results preview: Profit may rise upto 17%, provisions could shoot up - Business Standard",0.94770747423172
SBIN,2026-02-11,"SBI pips TCS, takes 4th spot in market-cap ranking; stock up 10% in 3 days - Business Standard",0.9475468993186951
SBIN,2025-08-06,"SBI Q1 results date, time, analysts expectations: All you need to know - Business Standard",-0.9338075518608093
SBIN,2025-02-07,"Analysts cut earnings, SBI share target price after mixed Q3 show; details - Business Standard",-0.9037721753120422
SBIN,2025-11-04,"SBI stock hits new high, trades firm in weak market post Q2 results - Business Standard",-0.571366548538208
SBIN,2026-02-05,"SBI Q3 results preview: Analysts see muted profit growth, higher provisions - Business Standard",-0.9684223532676697
SBIN,2025-10-28,SBI vs SBI Card vs SBI Life: Which SBI group stock can gain the most? - Business Standard,-0.8920018076896667
SBIN,2021-10-08,SBI FOUNDATION - The Economic Times,-0.9150366187095642
SBIN,2025-05-03,"SBI Q4 results: Net profit falls by 9.9% Y-o-Y to Rs 18,643 crore - Business Standard",-0.9751015901565552
SBIN,2017-03-24,"Federal Bank Share Price Today, Federal Bank Stock Price Live NSE/BSE Updates - The Economic Times",-0.9357379078865051
SBIN,2026-02-09,"SBI shares hit record high after Q3; brokerages raise target up to ₹1,300 - Business Standard",0.9079504013061523
SBIN,2025-01-29,SBI Card's credit costs pinch Q3 earnings; analysts in wait-and-watch mode - Business Standard,-0.9463310837745667
SBIN,2026-04-02,"HDFC Bank Share Price Today, HDFC Bank Stock Price Live NSE/BSE Updates - The Economic Times",-0.9379709362983704
SBIN,2017-04-28,"Punjab Sind Bank Share Price Today, Punjab Sind Bank Stock Price Live NSE/BSE Updates - The Economic Times",-0.9379422068595886
SBIN,2025-09-08,"SAIL Share Price Today, SAIL Stock Price Live NSE/BSE Updates - The Economic Times",-0.94205641746521
SBIN,2025-05-05,"State Bank of India, Kotak Mahindra Bank shares fall on soft earnings - Business Standard",-0.9648175239562988
SBIN,2017-03-24,"UCO Bank Share Price Today, UCO Bank Stock Price Live NSE/BSE Updates - The Economic Times",-0.9363100528717041
SBIN,2026-01-13,"SBI stock hits new high, outperforms market, gains 3% in 3 days; here's why - Business Standard",0.5451964735984802
SBIN,2025-08-08,"SBI Q1 results: Net profit rises 12.5% to ₹19,160 crore on treasury gains - Business Standard",0.9456598162651062
SBIN,2026-02-09,IPO-Bound NSE Says Traders Seeking Reprieve on India Securities Transaction Tax Hike - Bloomberg.com,-0.6851693987846375
SBIN,2024-11-11,SBI share price muted today after Q2; brokerages maintain target price - Business Standard,-0.4435405433177948
SBIN,2017-03-24,"IDBI Bank Share Price Today, IDBI Bank Stock Price Live NSE/BSE Updates - The Economic Times",-0.9383941888809204
SBIN,2025-04-25,SBI Cards or SBI Life: Which stock should you buy post Q4 results? - Business Standard,-0.9466610550880432
SBIN,2018-09-14,SBI SECURITIES LIMITED - The Economic Times,-0.9320944547653198
SBIN,2025-07-17,SBI stock hits highest level in CY-2025 on QIP plan; more upside ahead? - Business Standard,0.8383129835128784
SBIN,2017-03-24,"South Indian Bnk Share Price Today, South Indian Bnk Stock Price Live NSE/BSE Updates - The Economic Times",-0.9373339414596558
SBIN,2017-03-24,"Dhanlaxmi Bank Share Price Today, Dhanlaxmi Bank Stock Price Live NSE/BSE Updates - The Economic Times",-0.9384142756462097
SBIN,2017-03-24,"Bank of Maharashtra Share Price Today, Bank of Maharashtra Stock Price Live NSE/BSE Updates - The Economic Times",-0.9353113174438477
SBIN,2025-11-04,"SBI Q2FY26 results: Profit up 6.4% at ₹21,504 crore, NII rises 3.3% - Business Standard",0.9461329579353333
SBIN,2018-03-12,"Bandhan Bank Share Price Today, Bandhan Bank Stock Price Live NSE/BSE Updates - The Economic Times",-0.9387176632881165
SBIN,2017-03-24,"Union Bank India Share Price Today, Union Bank India Stock Price Live NSE/BSE Updates - The Economic Times",-0.9381354451179504
SBIN,2022-08-29,"Tamilnad Mercantile Share Price Today, Tamilnad Mercantile Stock Price Live NSE/BSE Updates - The Economic Times",-0.9394567012786865
SBIN,2025-02-07,Breakdown stock: SBI can tank 16% if this level is broken. Details here - Business Standard,-0.9180667400360107
SBIN,2017-03-31,UCO Bank - The Economic Times,-0.9194758534431458
SBIN,2025-05-05,"SBI share price drops 2% post Q4 results; check stock analysis, outlook - Business Standard",-0.9436474442481995
SBIN,2026-01-02,"Earnings revival to boost Indian equities in CY26; SBI, Infy top MOFSL bets - Business Standard",0.9347437024116516
SBIN,2017-03-23,"YES Bank Share Price Today, YES Bank Stock Price Live NSE/BSE Updates - The Economic Times",-0.9369140267372131
SBIN,2017-03-23,"Axis Bank Share Price Today, Axis Bank Stock Price Live NSE/BSE Updates - The Economic Times",-0.9381366968154907
SBIN,2024-09-06,"Goldman Sachs downgrades SBI to 'Sell', slashes target price; share slips - Business Standard",-0.9550824761390686
SBIN,2025-10-27,Should you bet on SBI Cards and Payment post its Q2? Analysts weigh - Business Standard,-0.9226840734481812
SBIN,2017-03-24,"Indian Bank Share Price Today, Indian Bank Stock Price Live NSE/BSE Updates - The Economic Times",-0.9358223676681519
SBIN,2026-04-04,Bandhan Bank reports higher collection efficiency - The Economic Times,0.8808469176292419
SBIN,2026-03-30,Federal Bank Ltd. - The Economic Times,-0.919239342212677
SBIN,2017-03-24,"Hindalco Share Price Today, Hindalco Stock Price Live NSE/BSE Updates - The Economic Times",-0.9372109770774841
SBIN,2025-10-10,"Nifty PSU Bank index rallies 2%, SBI stock nears record high; here's why - Business Standard",0.6034462451934814
SBIN,2017-10-15,SBI Mutual Fund - The Economic Times,-0.9254019856452942
SBIN,2025-02-04,"Preview: Will SBI Q3 profit rise or fall? Provisions hold key, say analysts - Business Standard",-0.8498413562774658
SBIN,2025-07-29,"SBI Cards has limited levers to drive earnings, faces growth stagnation - BFSI News",-0.4793604910373688
SBIN,2026-02-07,"SBI Q3FY26 result: Profit jumps 13.06% to ₹21,317 cr, income at ₹1.85 trn - Business Standard",0.9233320355415344
SBIN,2024-08-05,"Why SBI stock fell 5% after Q1 result? Buy, sell, hold? Check strategy here - Business Standard",-0.7271104454994202
SBIN,2025-02-25,SBI stares at earnings slowdown for two years as RoE and RoA set to drop - BFSI News,-0.9558162689208984
