ticker,date,headline,sentiment_score
SIEMENS,2026-03-06,Watch Missed & Unattended experts sessions videos on the ET Markets Recorded - The Economic Times,-0.9175974726676941
SIEMENS,2026-03-07,"Transmission and powergen demand lift capital goods; Siemens Energy, KOEL in focus - The Economic Times",-0.8747896552085876
SIEMENS,2026-03-06,ETMarket LIVE Stream Video: Watch Siemens Limited LIVE Stream Videos on THE ETMarkets LIVE - The Economic Times,-0.9453524947166443
SIEMENS,2026-03-06,Siemens - Positive Breakout: These 13 stocks cross above their 200 DMAs - The Economic Times,0.7732622623443604
SIEMENS,2026-03-05,Siemens - Negative Breakout: These 7 stocks cross below their 200 DMAs - The Economic Times,-0.9086694121360779
SIEMENS,2026-03-07,"Siemens sees AI-driven shift in workforce mix, India to have smaller tech teams work on value creation for... - Moneycontrol.com",-0.7479750514030457
SIEMENS,2026-03-09,Siemens expects AI demand to revive India’s private sector capex - Moneycontrol.com,0.8619126677513123
SIEMENS,2026-03-07,"India made major progress toward its goal of training 85,000 semiconductor engineers - The Economic Times",0.9339049458503723
SIEMENS,2026-03-09,"The Biggest Problem in Space Isn’t Rockets, It’s Something We Haven’t Built Yet - The Economic Times",-0.9047338366508484
SIEMENS,2026-03-03,GCCs brace for near-term hit as war clouds gather over Gulf biz - The Economic Times,-0.791741132736206
SIEMENS,2026-03-07,Iran's president defies US demands while apologizing for strikes on neighbors - The Economic Times,-0.8480626344680786
SIEMENS,2026-03-07,Vedanta Group aims to boost women representation to 35% - The Economic Times,0.9256697297096252
SIEMENS,2026-03-05,"Get it Strait, Hormuz to create ripples for undersea cables too - The Economic Times",-0.8359861969947815
SIEMENS,2026-03-05,West Asia conflict disrupts India’s gems and jewellery trade; diamond shipments halted - The Economic Times,-0.9528712630271912
SIEMENS,2026-03-07,India asks ports to ease charges as West Asia conflict hits shipments - The Economic Times,-0.5602665543556213
SIEMENS,2026-03-07,"Qatar says missile attack intercepted, threat in Doha eliminated - The Economic Times",-0.7810488939285278
SIEMENS,2026-03-05,"West Asia conflict: Indian carriers operate limited flights, cancel 281 - The Economic Times",-0.7391505837440491
SIEMENS,2026-03-05,India’s underwater strike capability faces gap: Indigenous nuclear-attack submarine likely only by 2036 - The Economic Times,-0.8449714779853821
SIEMENS,2026-03-05,Motown rings in best-ever February on new and affordable models - The Economic Times,0.49939456582069397
SIEMENS,2026-03-05,India & China must-win markets on rising middle-class households: Reckitt Chief - The Economic Times,-0.8427301049232483
SIEMENS,2026-03-07,Qatar Airways to operate limited repatriation flights from Doha - The Economic Times,-0.8417788147926331
SIEMENS,2026-03-05,Centre may extend sector & sponsored schemes beyond April 1 amid ongoing review - The Economic Times,-0.9210406541824341
SIEMENS,2026-03-03,"Can the US fight Mideast war 'forever'? Trump says yes, but admits 'not where we want to be' on weapon sto - The Economic Times",-0.8667663335800171
SIEMENS,2026-03-06,EFTA investments begin flowing into India; Iceland pours $30 million into Maharashtra firm - The Economic Times,0.7507435083389282
SIEMENS,2026-03-07,"Russia rains missiles and drones on Ukraine, killing six - The Economic Times",-0.7699031233787537
SIEMENS,2026-03-05,Gulf SWFs may go sovereign with oil revenue set to drop - The Economic Times,-0.9187919497489929
SIEMENS,2026-03-07,Dhurandhar 2 The Revenge OTT release new details: Where to watch Ranveer Singh's upcoming hit sequel after - The Economic Times,-0.9290128350257874
SIEMENS,2026-03-05,"MoSPI to launch new surveys, boost high-frequency economic indicators: Saurabh Garg - The Economic Times",-0.7624339461326599
SIEMENS,2026-03-07,Russian President Vladimir Putin calls for immediate halt to Iran conflict - The Economic Times,-0.8171865344047546
SIEMENS,2026-03-05,Blackstone-backed Bagmane Prime Office REIT appoints Richard Hugh Andrew as CEO - The Economic Times,-0.9124218821525574
SIEMENS,2026-03-07,Govinda breaks silence on wife Sunita’s allegations of cheating against him: ‘Sometimes people appear hone - The Economic Times,-0.5899688005447388
SIEMENS,2026-03-07,T20 World Cup: India eye historic title defence against New Zealand in final - The Economic Times,0.7068375945091248
SIEMENS,2026-03-06,Quote of the day by Madonna: 'Better to live one year as a tiger than a hundred as a sheep' - Lesson on co - The Economic Times,-0.8681427240371704
SIEMENS,2026-03-06,What to know about the Kurds and their potential involvement in the Iran war - The Economic Times,-0.9356557130813599
SIEMENS,2026-03-07,"Dhurandhar 2 trailer: Ranveer Singh turns badshah of Lyari, teams up with Madhavan for revenge. Netizens s - The Economic Times",-0.8843404650688171
SIEMENS,2026-03-06,US House narrowly rejects war powers resolution to halt Trump's attacks on Iran - The Economic Times,-0.638922929763794
SIEMENS,2026-03-07,Iran could be a ‘forever war’ if the Kurds join the fight - The Economic Times,-0.826941728591919
SIEMENS,2026-03-06,"Some Gulf countries frustrated with lack of notice about Iran strikes, defence help: Report - The Economic Times",-0.6568971276283264
SIEMENS,2026-03-06,"Trump vows US role in choosing Tehran’s next leader, cheers Kurdish push into Iran - The Economic Times",-0.805316686630249
SIEMENS,2026-03-06,"Trump fires Kristi Noem as homeland secretary after storm over shootings, spending - The Economic Times",-0.8313650488853455
SIEMENS,2026-03-07,"Azerbaijan foils IRGC-planned attacks on pipeline, embassy, synagogue - The Economic Times",-0.834766685962677
SIEMENS,2021-04-16,Energy News | Top Energy Headlines - Reuters,-0.9238746166229248
SIEMENS,2026-03-08,"Forum Discussion on Market View, Business sectors,Stocks, Commodity, Personal Finance & More - Moneycontrol.com",-0.9462059736251831
SIEMENS,2026-03-09,Mid-cap IT firms corner 58% of 2025 incremental revenue as enterprises widen vendor pool for large deals - Moneycontrol.com,0.5455691814422607
SIEMENS,2026-03-09,Startup hiring to rise 8-15% in FY26 as AI talent demand surges - Moneycontrol.com,0.8322343826293945
SIEMENS,2026-03-06,Vanguard reverse transitions part of Infosys’ largest outsourcing deal - Moneycontrol.com,-0.9409810304641724
SIEMENS,2026-03-08,"Vinod Khosla on value of knowledge: Will farmers, oncologists with same AI expertise get equal pay? - Moneycontrol.com",-0.8292672634124756
SIEMENS,2026-03-08,OpenAI hardware leader resigns after deal with Pentagon - Moneycontrol.com,-0.8489270210266113
SIEMENS,2026-03-06,"In AI push, Karnataka budget proposes Bengaluru robotics, innovation zone at IISc - Moneycontrol.com",-0.9169574975967407
SIEMENS,2026-03-05,Ahead of Market: 10 things that will decide stock market action on Friday - The Economic Times,-0.933992326259613
