ticker,date,headline,sentiment_score
SIEMENS,2026-03-11,Siemens Innovation Day 2026 - The Economic Times,-0.9201725125312805
SIEMENS,2026-03-13,ETMarket LIVE Stream Video: Watch Siemens Limited LIVE Stream Videos on THE ETMarkets LIVE - The Economic Times,-0.9453524947166443
SIEMENS,2026-03-07,"Transmission and powergen demand lift capital goods; Siemens Energy, KOEL in focus - The Economic Times",-0.8747896552085876
SIEMENS,2026-03-13,Lord’s marks historic collaboration with CMET to develop an AI-based breast cancer detection device - The Economic Times,0.8269690871238708
SIEMENS,2026-03-13,HDFC Defence Fund exits this large cap stock that went up by 400% in 5 years - The Economic Times,0.8061690330505371
SIEMENS,2026-03-11,"Sunil Singhania-backed Abakkus Flexi Cap Fund raises stake in HDFC Bank, RIL and 26 other stocks - The Economic Times",-0.8340563178062439
SIEMENS,2026-03-07,"Siemens sees AI-driven shift in workforce mix, India to have smaller tech teams work on value creation for... - Moneycontrol.com",-0.7479750514030457
SIEMENS,2026-03-12,Jupiter Direct 2026: Big Opportunities Coming for These 4 Zodiac Signs - The Economic Times,-0.6746935844421387
SIEMENS,2026-03-11,Gas cylinder shortage explained: Why LPG cylinder prices have increased and will there be any other hike i - The Economic Times,-0.7808215618133545
SIEMENS,2026-03-13,"Bloating, cramps, poor digestion? Nutritionist shares simple foods that may help - The Economic Times",-0.8876230716705322
SIEMENS,2026-03-12,"Oracle prepares for layoffs, sets aside $2.1 billion for restructuring - The Economic Times",-0.8396798372268677
SIEMENS,2026-03-13,Adobe stock price today: Why ADBE stock dropped as CEO Shantanu Narayen steps down after 18 years - The Economic Times,-0.8281627297401428
SIEMENS,2026-03-12,"AI is reshaping lending, and why it’s bad news for traditional banks - The Economic Times",-0.8350759744644165
SIEMENS,2026-03-12,"Techie was hired by Gurgaon company with 33% hike. Two days before joining, he sent an email about his 'pe - The Economic Times",-0.8892791271209717
SIEMENS,2026-03-13,Indigenous alternative to LPG? Central lab looks to scale up DME pilot - The Economic Times,-0.6813538670539856
SIEMENS,2026-03-13,Banks recorded higher credit and deposits growth in the fortnight to February 28 - The Economic Times,0.9400175213813782
SIEMENS,2026-03-09,Tata Power losing nearly INR100 crore a month as Gujarat drags feet on deal - The Economic Times,-0.9422777891159058
SIEMENS,2026-03-13,"Smartphone brand Nothing plans to make India an export hub, begins shipments to US - The Economic Times",0.5543187260627747
SIEMENS,2026-03-13,"Inside Akasa’s big plans, and other exclusives - The Economic Times",-0.9452126026153564
SIEMENS,2026-03-13,"Heineken doubles down on India, eyes 'biggest untapped beer market' - The Economic Times",-0.5713523030281067
SIEMENS,2026-03-13,RBI imposes penalty on Manappuram Finance - The Economic Times,-0.4930354058742523
SIEMENS,2026-03-13,"ETtech Deals Digest: Startups raise $139 million this week, down 59% on-year - The Economic Times",-0.9735959768295288
SIEMENS,2026-03-13,IAEA says it is trying to broker a new nuclear deal between the US and Iran: Reports - The Economic Times,-0.9063095450401306
SIEMENS,2026-03-13,Brazil's ex-president Bolsonaro hospitalised in intensive care - The Economic Times,-0.5185163021087646
SIEMENS,2026-03-13,"Silver price crashes today: Why gold, silver, copper and platinum prices are falling — Silver drops to $83 - The Economic Times",-0.7213812470436096
SIEMENS,2026-03-13,TRAI moots termination charges to tackle spam - The Economic Times,-0.7138910293579102
SIEMENS,2026-03-13,India’s captive and commercial coal output crosses 200 MT so far in FY26 - The Economic Times,0.535907506942749
SIEMENS,2026-03-13,Auto sector races to record February on double-digit sales growth - The Economic Times,0.8440303206443787
SIEMENS,2026-03-13,Quote of the day by Robin Williams: 'No matter what people tell you...' - The Economic Times,-0.9156870245933533
SIEMENS,2026-03-13,"China announces anti-dumping duty on certain rubber imports from India, Japan, Canada - The Economic Times",-0.8271607160568237
SIEMENS,2026-03-13,"India's urea imports from China hit 3-year high, Russian supplies also surge - The Economic Times",0.8499404788017273
SIEMENS,2026-03-13,"No evidence Iran has mined Strait of Hormuz, Pentagon's Hegseth says - The Economic Times",-0.8971222639083862
SIEMENS,2026-03-13,Adobe CEO Shantanu Narayen to step down after 18 years - The Economic Times,-0.8375062346458435
SIEMENS,2026-03-11,"Bring food from home, Infosys advises Pune employees as LPG crisis burns its kitchen - The Economic Times",-0.8348025679588318
SIEMENS,2026-03-12,Consider bringing back revenue mechanism on UPI for sustenance of sector: Parliamentary committee - The Economic Times,-0.9031164646148682
SIEMENS,2026-03-13,India-Gulf flights slowly resume amid turbulence - The Economic Times,-0.5013644099235535
SIEMENS,2026-03-13,Top court to clarify law on sanctions under Lokpal act - The Economic Times,-0.8248411417007446
SIEMENS,2026-03-13,India introduces Bill to provide precise definition of 'transgender' in Lok Sabha - The Economic Times,-0.9087557196617126
SIEMENS,2026-03-13,NARCL to buy Kurukshetra e-way debt - The Economic Times,-0.8755174875259399
SIEMENS,2026-03-13,"Quote of the day by Jamie Dimon, CEO of world's biggest bank: 'If you want to be a winner then...' - The Economic Times",-0.7459604144096375
SIEMENS,2026-03-12,Aurum PropTech sells two commercial towers in Navi Mumbai for Rs 112 crore - The Economic Times,-0.7733668088912964
SIEMENS,2026-03-13,"Lok Sabha Bill redefines transgender, excludes sexual orientation - The Economic Times",-0.9265314340591431
SIEMENS,2026-03-13,Competition for Russian crude oil set to intensify - The Economic Times,-0.7873034477233887
SIEMENS,2026-03-13,"TRAI proposes AI tools to detect & block spam calls, messages - The Economic Times",-0.901605486869812
SIEMENS,2026-03-13,India and World Bank sign $300 million deal for Haryana clean air plan - The Economic Times,0.6715674996376038
SIEMENS,2026-03-13,"Industrial gas supply crunch hits operations at steel plants, says Jindal Stainless MD - The Economic Times",-0.935809850692749
SIEMENS,2026-03-13,"Adobe pays $75 million to settle US lawsuit over termination fees, subscription cancellations - The Economic Times",-0.8040239214897156
SIEMENS,2026-03-13,Hospitality industry bodies welcome govt decision to allocate 20% of average monthly commercial LPG requir - The Economic Times,0.5799015164375305
SIEMENS,2026-03-13,"'Unacceptable', says Macron after French officer is killed in Iraq - The Economic Times",-0.8568904399871826
SIEMENS,2026-03-13,Middle East War: Bodies of 84 Iranian sailors killed off Sri Lanka to be flown home via India - The Economic Times,-0.6381010413169861
