ticker,date,headline,sentiment_score
TATAPOWER,2026-03-24,Tata Power Mundra plant inks supplementary PPA with GUVNL - ET EnergyWorld,-0.9254681468009949
TATAPOWER,2026-03-25,"Tata Power completes SEUPPTCL transmission buildout, boosts evacuation capacity by 4,000 MW - ET EnergyWorld",0.930847704410553
TATAPOWER,2026-03-27,NEW X CEO IS BACK Price (XFLOKI INR) Today - The Economic Times,-0.9066475033760071
TATAPOWER,2026-03-28,LIVE | PM Modi inaugurates Phase I of Noida International Airport at Jewar in Uttar Pradesh - The Economic Times,-0.9090583920478821
TATAPOWER,2026-03-28,Dalal Street Week Ahead: Avoid aggressive long positions; focus on capital preservation - The Economic Times,-0.715239942073822
TATAPOWER,2026-03-28,"Rentomojo files draft prospectus with Sebi for Rs 1,100-1,200 crore IPO - The Economic Times",-0.9431822299957275
TATAPOWER,2026-03-28,Demand and risks for global data centre insurance growing: Swiss Re - The Economic Times,-0.8623917698860168
TATAPOWER,2026-03-28,Cyber threats moving from data theft to physical life risks: Deloitte cyber lead - The Economic Times,-0.9264838695526123
TATAPOWER,2026-03-28,Amit Shah vs Mahua Moitra: TMC launches counterattack on HM after his chargesheet release in Bengal - The Economic Times,-0.8256403207778931
TATAPOWER,2026-03-28,'Answer the question!': Senators torch Soros-funded witness at fiery Minnesota Somali fraud hearing - The Economic Times,-0.8632135391235352
TATAPOWER,2017-03-24,"Tata Power Share Price Today, Tata Power Stock Price Live NSE/BSE Updates - The Economic Times",-0.9378738403320312
TATAPOWER,2026-03-20,"Adani Electricity Mumbai, Tata Power Delhi, Noida Power top PFC's FY25 discom rankings - ET EnergyWorld",-0.8983017206192017
TATAPOWER,2026-02-04,India's Tata Power reports lower quarterly profit as thermal segment softens - reuters.com,-0.9631727933883667
TATAPOWER,2025-05-14,India's Tata Power posts bigger quarterly profit on strong demand - reuters.com,0.9004351496696472
TATAPOWER,2017-08-11,Check out Tata Power Company Ltd's stock price (TATAPOWER-IN) in real time - CNBC,-0.9458605051040649
TATAPOWER,2025-11-11,India's Tata Power posts lower quarterly profit on plant shutdown - reuters.com,-0.9653088450431824
TATAPOWER,2014-03-15,TPWR: Tata Power Co Ltd/The Stock Price Quote - Natl India - Bloomberg - Bloomberg.com,-0.9491876363754272
TATAPOWER,2021-06-19,Tata Power Company Ltd - reuters.com,-0.9397783279418945
TATAPOWER,2025-08-01,India's Tata Power misses quarterly profit view on sluggish power demand - reuters.com,-0.8702573180198669
TATAPOWER,2026-03-23,Tata Power Company Ltd. - The Economic Times,-0.9233332276344299
TATAPOWER,2018-09-14,TATA POWER SOLAR SYSTEMS LIMITED - The Economic Times,-0.9212461113929749
TATAPOWER,2025-03-11,"Tata Power shares jump 3% after Rs 49,000 crore renewable energy deal with Andhra Pradesh - ET EnergyWorld",0.8671213388442993
TATAPOWER,2026-02-26,"Regulatory reforms, smart tech deliver results in power distribution: Tata Power-DDL CEO Dwijadas Basak - ET EnergyWorld",-0.6219803094863892
TATAPOWER,2024-12-06,"India's Tata Power prefers domestic market over lucrative solar exports, CEO says - reuters.com",-0.8536540865898132
TATAPOWER,2017-03-29,The Economic Times - The Economic Times,-0.9159992933273315
TATAPOWER,2022-04-02,Tata Power gets NCLT approval for merger of CGPL into it - legal.economictimes.indiatimes.com,-0.8830280303955078
TATAPOWER,2026-02-04,"India's Tata Power evaluating three sites for nuclear projects, exec says - reuters.com",-0.9006720185279846
TATAPOWER,2024-10-31,"Tata Power net profit rises nearly 8 pc to Rs 1,093 cr in Q2 - ET EnergyWorld",0.9330511093139648
TATAPOWER,2016-10-31,TAATF: Tata Power Co Ltd/The Stock Price Quote - - Bloomberg - Bloomberg.com,-0.9470579028129578
TATAPOWER,2022-06-11,TTPW.NS - reuters.com,-0.9435311555862427
TATAPOWER,2026-03-19,India's Gujarat clears new Tata Power deal to resume long‑term supply - reuters.com,-0.8309645056724548
TATAPOWER,2017-08-14,Tata Power first quarter net profit grows 68 per cent - ET EnergyWorld,0.9238259792327881
TATAPOWER,2026-02-06,Tata Power Mundra plant Loss: ₹800 crore hit due to extended shutdown - ET EnergyWorld,-0.9509453177452087
TATAPOWER,2024-06-22,"World Bank report recognises Tata Power for DER, P2P electricity trading - ET EnergyWorld",-0.746645450592041
TATAPOWER,2025-11-11,Tata Power profit nearly flat at ₹919 crore in Q2 - ET EnergyWorld,-0.9357433915138245
TATAPOWER,2018-09-14,TATA POWER RENEWABLE ENERGY LIMITED - The Economic Times,-0.9205678105354309
TATAPOWER,2017-03-21,World Bank's probe finds IFC investment in Tata Power project breaching norms - ET EnergyWorld,-0.9508246779441833
TATAPOWER,2024-10-30,India's Tata Power misses Q2 profit estimates as cooler weather weighs on demand - reuters.com,-0.9424467086791992
TATAPOWER,2021-08-24,Tata Power Renewables commissions 150-MW solar project at Rajasthan - ET EnergyWorld,-0.8139492273330688
TATAPOWER,2023-08-10,"Tata Power Q1 net profit rises 29 pc to Rs 1,141 cr in June qtr - ET EnergyWorld",0.9168792366981506
TATAPOWER,2025-02-05,"Tata Power’s clean energy capacity to reach 16.7 GW, reports 10% YoY PAT growth - ET EnergyWorld",0.9434145092964172
TATAPOWER,2017-10-17,"Tata power solar - Latest tata power solar , Information & Updates - Energy - ET EnergyWorld",-0.9444882273674011
TATAPOWER,2025-05-15,"Tata Power to invest ₹25,000 cr in FY26; 50% to be allocated for renewables - ET EnergyWorld",-0.8535828590393066
TATAPOWER,2022-04-14,"BlackRock, Mubadala to invest $526 mln in Tata Power's renewable energy unit - reuters.com",-0.9137450456619263
TATAPOWER,2026-02-05,Tata Power awaits regulatory clarity on nuclear plans; exploring land options in three states - ET EnergyWorld,-0.8287869095802307
TATAPOWER,2022-08-19,"Tata Power Renewable raises Rs 2,000 crore by issuing 8.36 crore shares to BlackRock-backed firm - ET EnergyWorld",0.6376992464065552
TATAPOWER,2022-10-14,India's Tata Power says hit by cyber attack - reuters.com,-0.6504473686218262
TATAPOWER,2026-01-27,Tata Power Renewables reaches 10 GW projects execution milestone - ET EnergyWorld,0.7291025519371033
TATAPOWER,2025-03-07,India's Tata Power unit exploring $5.6 billion clean energy investment in Andhra state - reuters.com,-0.8520820736885071
TATAPOWER,2026-03-17,"Tata Power Renewable Energy, Tata Capital launch flexible financing scheme for rooftop solar - ET EnergyWorld",0.7162187695503235
TATAPOWER,2023-09-13,Tata Power Solar and SIDBI collaborate to support MSME solar initiatives - ET EnergyWorld,-0.7488443851470947
TATAPOWER,2021-06-02,Tata Power Solar secures Rs 686 cr orders from NTPC to set up 210 MW projects - ET EnergyWorld,0.7025596499443054
TATAPOWER,2022-10-15,Tata Power cyberattack impacted IT systems; bill payment portal down for a week - ET CISO,-0.9618741273880005
TATAPOWER,2025-10-14,"Tata Motors PV Share Price Today, Tata Motors PV Stock Price Live NSE/BSE Updates - The Economic Times",-0.9381130933761597
TATAPOWER,2021-04-30,Tata Power Mulling $473 Million Renewable Energy Unit IPO - Bloomberg.com,-0.947702944278717
TATAPOWER,2019-02-27,Tata Power Co Ltd/The - Bloomberg.com,-0.9462472796440125
TATAPOWER,2024-01-12,"Tata Power Renewable Energy Limited plans to invest Rs 70,000 crore in Gujarat - ET EnergyWorld",-0.8307507038116455
TATAPOWER,2017-01-04,"Tata power - Latest tata power , Information & Updates - CIO - Indiatimes",-0.9458330869674683
TATAPOWER,2026-03-12,"Gas Shortage, Harsh Summer Lure Bulls to India Power Utilities - Bloomberg.com",-0.9195976257324219
TATAPOWER,2013-07-02,Tata Power falls; Moody's cuts outlook - reuters.com,-0.6094369292259216
TATAPOWER,2025-11-27,"Tata Power plans ₹10,000 cr ingots and wafers plant in Odisha - ET Manufacturing",-0.8724370002746582
TATAPOWER,2024-09-17,Tata Power to invest up to $9 billion to expand renewable energy capacity - reuters.com,0.49968788027763367
TATAPOWER,2025-11-11,"Tata Power plans to set up India's largest solar wafers, ingots making plant - reuters.com",-0.9098722338676453
TATAPOWER,2021-03-03,Tata Power DDL rolls out live peer-to-peer solar energy trading project - ET EnergyWorld,-0.8905029296875
TATAPOWER,2024-09-30,India's Tata Power to invest $14.3 bln in Rajasthan over 10 years - reuters.com,-0.8903541564941406
TATAPOWER,2025-10-02,Tata Power Renewable inks PPA with Mumbai arm for 80 MW hybrid project - ET EnergyWorld,-0.7731919288635254
TATAPOWER,2021-10-22,"Suranjit Mishra, CFO, Tata Power Delhi Distribution - The CFO Wall - ET CFO",-0.9530194997787476
TATAPOWER,2016-09-15,Tata Power completes acquisition of WREPL - ET EnergyWorld,-0.8919652700424194
TATAPOWER,2024-11-08,Tata Power and Noida International Airport sign 25-year agreement for solar and wind energy supply - ET Infra,0.9158092737197876
TATAPOWER,2017-03-24,"Adani Power Share Price Today, Adani Power Stock Price Live NSE/BSE Updates - The Economic Times",-0.9416555166244507
TATAPOWER,2015-04-30,Tata Power commissions 24 MW wind farm at Rojmal in Gujarat - ET EnergyWorld,-0.8856582045555115
TATAPOWER,2025-10-07,"Juniper Green, Tata Power sign PPA for 70-MW firm and dispatchable renewable energy project - ET EnergyWorld",-0.6148268580436707
TATAPOWER,2020-09-04,Tata Power signed PPA with Tata Motors to commission solar carport near Pune - ET Auto,0.8811573386192322
TATAPOWER,2022-09-14,Tata Power Solar to set up 125-MW floating solar project for NHDC - ET EnergyWorld,-0.8011206388473511
TATAPOWER,2017-03-24,"RattanIndia Power Share Price Today, RattanIndia Power Stock Price Live NSE/BSE Updates - The Economic Times",-0.9400081038475037
TATAPOWER,2022-12-02,"Tata Power announces Rs 6,000 crore investment in Odisha - Indiatimes",-0.8364071249961853
TATAPOWER,2018-03-27,Tata Power Delhi launches super-efficient “Gorilla” fans at 40 per cent discount - ET EnergyWorld,-0.7867639064788818
TATAPOWER,2020-02-12,"Tata Consumer Share Price Today, Tata Consumer Stock Price Live NSE/BSE Updates - The Economic Times",-0.933742880821228
TATAPOWER,2025-02-07,Tamil Nadu CM inaugurates Tata Power’s 4.3 GW solar manufacturing unit in Tamil Nadu - ET EnergyWorld,-0.8533433079719543
TATAPOWER,2020-11-10,Tata Power Q2 net up 10 pc to Rs 371 cr - ET EnergyWorld,0.9473652839660645
TATAPOWER,2024-03-07,"Tata Power shifts over 1,000 EV charging points in Mumbai to green energy - ET EnergyWorld",-0.83472740650177
TATAPOWER,2018-03-30,"Tata Power to sell Defence biz to Tata Advanced Systems for Rs 2,230 crore - ET EnergyWorld",-0.900945782661438
TATAPOWER,2025-12-16,"Tata Power to finalise ₹6,500-cr wafer-ingot project by January: CEO Praveer Sinha - ET EnergyWorld",-0.928504467010498
TATAPOWER,2017-03-23,"Tata Elxsi Share Price Today, Tata Elxsi Stock Price Live NSE/BSE Updates - The Economic Times",-0.9397608637809753
TATAPOWER,2022-02-03,Tata Power's Santadyuti Samanta: A technology aficionado & philosopher - Indiatimes,-0.8991269469261169
TATAPOWER,2025-03-12,Powering the future: Tata power’s digital transformation journey - Indiatimes,-0.8879668116569519
TATAPOWER,2021-03-30,Tata Power to develop 60 MW solar project for Gujarat Urja Vikas Nigam - ET EnergyWorld,-0.7893659472465515
TATAPOWER,2023-03-25,"Tata Power CHRO on Talent strategy, D&I achievements and L&D initiatives - ETHRWorld.com",-0.9336018562316895
TATAPOWER,2024-10-29,"Tata Power Renewables, IndusInd Bank join hands to offer solar financing for MSEs - ET EnergyWorld",0.6836586594581604
TATAPOWER,2021-12-09,Data Patterns (India) Ltd. - The Economic Times,-0.9229016900062561
TATAPOWER,2022-02-21,Power giants to scope offshore wind projects in India's untapped market - CNBC,-0.8210335373878479
TATAPOWER,2026-03-27,About Tata Power Company Ltd (TTPW.BO) - reuters.com,-0.9428561329841614
TATAPOWER,2017-03-24,"Torrent Power Share Price Today, Torrent Power Stock Price Live NSE/BSE Updates - The Economic Times",-0.9393419027328491
TATAPOWER,2018-02-27,"Ajay Kapoor, CFO, Tata Power Delhi Distribution Limited - The CFO Wall - ET CFO",-0.9513753056526184
TATAPOWER,2023-12-14,Tata Power's TPRMG recognized for clean energy initiative in rural India by World Economic Forum - ET EnergyWorld,0.8882991075515747
TATAPOWER,2022-07-04,Tata Power DDL rebrands itself ‘Towards a Greener Tomorrow’ - ET BrandEquity,-0.6914820671081543
TATAPOWER,2026-02-14,This Valentine’s Day Tata Power celebrates a new kind of Lifelong relationship - ET BrandEquity,-0.521761953830719
TATAPOWER,2025-07-18,Tata Power Renewable signs first battery storage pact with NHPC for Kerala project - ET EnergyWorld,0.7383931279182434
TATAPOWER,2021-07-13,Ceat ties up with Tata Power to set up captive solar plant for Mumbai facility - ET EnergyWorld,0.7013174295425415
