ticker,date,headline,sentiment_score
TATAPOWER,2026-03-08,"Stocks to Watch Today: RITES, GNFC, IRB Infra, Tata Power, Dr Reddys Labs, Max Estates, Meesho, Kwality... - Moneycontrol.com",-0.9408603310585022
TATAPOWER,2026-03-09,"Stocks in news: Kwality Walls, AU Small Finance Bank, YES Bank, PB Fintech, Tata Power - The Economic Times",-0.9263875484466553
TATAPOWER,2026-03-09,"Sensex crashes 2,400 points as oil tops $118 amid West Asia war; ₹12 lakh crore wiped out - The Economic Times",-0.8195447325706482
TATAPOWER,2026-03-09,Coal India gearing up for breakout after 15 months of consolidation: Shivangi Sarda - The Economic Times,-0.784685492515564
TATAPOWER,2026-03-09,Watch Missed & Unattended experts sessions videos on the ET Markets Recorded - The Economic Times,-0.9175974726676941
TATAPOWER,2026-03-09,"Kartik Kannan's post on Ahmedabad vs Bengaluru nightlife sparks debate, says I wish India's IT capital has - The Economic Times",-0.7995712757110596
TATAPOWER,2026-03-09,India's finished steel exports jump 36.6% in April-February - The Economic Times,0.8486505150794983
TATAPOWER,2026-03-09,"Why are US stock market index futures down today and Nasdaq, Dow Jones and S&P 500 in red again? Wall Stre - The Economic Times",-0.7823305130004883
TATAPOWER,2026-03-08,From small-town India to the robotics frontier: Two founders and a deep-tech dream - The Economic Times,-0.8671857118606567
TATAPOWER,2026-03-09,"‘I can be replaced’: Employee was always the first to arrive and last to leave. One day he was laid off, c - The Economic Times",-0.7220767140388489
TATAPOWER,2026-03-09,Asia’s ultra-rich having second thoughts on Dubai as war rages - The Economic Times,-0.7672765254974365
TATAPOWER,2026-03-09,Income-Tax Department probes restaurants for hidden sales - The Economic Times,-0.6123479008674622
TATAPOWER,2026-03-09,"Easebuzz in talks to raise Rs 300 crore, valuation may cross Rs 2,000 crore - The Economic Times",-0.6779552698135376
TATAPOWER,2026-03-09,"Rajya Sabha polls: BJP appoints central observers in Bihar, Haryana, Odisha - The Economic Times",-0.9238853454589844
TATAPOWER,2026-03-09,"Capitalmind Flexi Cap Fund reduce stake in HDFC Bank, ICICI Bank, and Bharti Airtel in February - The Economic Times",-0.9029160141944885
TATAPOWER,2026-03-09,"Progcap enables Rs 10,000 cr of credit to women entrepreneurs under collateral-free loan prog - The Economic Times",-0.7397842407226562
TATAPOWER,2026-03-09,Bengaluru-based Hical Technologies to supply components for Rafale fighter aircraft - The Economic Times,-0.8841425776481628
TATAPOWER,2026-03-09,"Georgian Bay rescue: 23 fishermen airlifted after ice floe drifts two kilometres from shore, leaving some - The Economic Times",-0.9035367965698242
TATAPOWER,2026-03-09,QClaw AI: What is Tencent’s ‘Little Lobster’ tool and will you be able to access it with WeChat and QQ - The Economic Times,-0.8860282301902771
TATAPOWER,2026-03-09,"Realme unveils NARZO Power 5G with a first-ever comic strip reveal; check features, price and more - The Economic Times",-0.8976910710334778
TATAPOWER,2026-03-09,Indian mission in Houston commemorates 150 years of 'Vande Mataram' - The Economic Times,-0.8151986002922058
TATAPOWER,2026-03-09,"US urged India to buy Russian oil already at sea to ease supply fears, Energy Secretary says - The Economic Times",0.5635402798652649
TATAPOWER,2026-03-09,"Redbrick Offices signs 0.4 million sq ft lease at AP4 Tech Park, marks one of Pune’s largest office deals - The Economic Times",0.6839166283607483
TATAPOWER,2026-03-09,Cars24's India used-cars CEO Himanshu Ratnoo quits amid company’s IPO plans - The Economic Times,-0.8521537184715271
TATAPOWER,2026-03-09,What is the Japanese Cheesecake trend? Viral TikTok trend and protein-maxxing buzz leave supermarket shelves empty in Australia - The Economic Times,-0.7038975954055786
TATAPOWER,2026-03-09,Place audit orders in public domain to boost trust: CIC to NFRA - The Economic Times,-0.9000536203384399
TATAPOWER,2026-03-09,Employee hits ‘Reply All’ email option to expose boss’s WFH double standards and the office suddenly goes - The Economic Times,-0.5839061141014099
TATAPOWER,2026-03-09,Flipkart brings back Nishant Verman to aid IPO push - The Economic Times,-0.8147744536399841
TATAPOWER,2026-03-09,'Injustice has been done to Opposition': IUML MP to back no-confidence motion against LS Speaker Om Birla - The Economic Times,-0.8753065466880798
TATAPOWER,2026-03-09,The Gen AI Hackathon that has India's tech community talking - The Economic Times,-0.901412308216095
TATAPOWER,2026-03-09,Embassy East Business Park moves Karnataka High Court seeking quashing of ECIR proceedings - The Economic Times,-0.5604366064071655
TATAPOWER,2026-03-09,"Mega Mumbai homes: Raymond Realty signs Rs 3,000 cr joint venture - The Economic Times",-0.6644122004508972
TATAPOWER,2026-03-09,10-year performance tracker of factor-based investment strategies: Quality vs Alpha; which stood first in - The Economic Times,0.8718745708465576
TATAPOWER,2026-03-09,"68% of mutual fund redemptions via Instant Access Facility are below Rs 5,000: Zerodha Mutual Fund - The Economic Times",-0.825487494468689
TATAPOWER,2026-03-09,Paras Defence bags Rs 80.28 crore DRDO order for high-precision air defence optical system - The Economic Times,0.7019405961036682
TATAPOWER,2026-03-09,"Puravankara enters joint development project on Hennur Road, Bengaluru, target GDV of over Rs 1,300 cr - The Economic Times",-0.5529891848564148
TATAPOWER,2026-03-09,Air India plane crash probe report will be out 'very soon': Aviation minister Naidu - The Economic Times,-0.9124804735183716
TATAPOWER,2026-03-09,IndiGo Delhi-Manchester flight returns due to last minute airspace restriction; airline warns Middle East - The Economic Times,-0.8991926908493042
TATAPOWER,2026-03-09,"Tech Mahindra denies rumours of major layoffs, says no proposal under consideration - The Economic Times",-0.6824621558189392
TATAPOWER,2026-03-09,Kerala minister Ganesh Kumar caught in a 'very bad' bedroom scandal by wife Bindhu Menon; alleges cheating - The Economic Times,-0.8896931409835815
TATAPOWER,2026-03-09,"India 2nd largest importer of arms in 2021–25, accounted for 8.2% of global arms receipts, think tank says - The Economic Times",-0.884490430355072
TATAPOWER,2026-03-09,Gold and silver ETFs fall up to 4% as rising crude fuels inflation worries. What should investors do? - The Economic Times,-0.8462880849838257
TATAPOWER,2026-03-09,Quote of the day by Albert Einstein: “Only a life lived for others is...' - The Economic Times,-0.913043200969696
TATAPOWER,2026-03-09,Quote of the day by David Brinkley: ‘A successful man is one who can lay a firm foundation with the bricks - The Economic Times,-0.5851926207542419
TATAPOWER,2026-03-09,Daylight saving time begins in the US; clocks advance one hour until November - The Economic Times,-0.9314767718315125
TATAPOWER,2026-03-09,India’s food economy holds huge potential but value addition remains a challenge: ITPO chief - The Economic Times,-0.7978050112724304
TATAPOWER,2026-03-09,"As US oil nears $120 a barrel, is a recession now a reality? Here’s what experts warned - The Economic Times",-0.7705367207527161
TATAPOWER,2026-03-09,India strongly positioned as the next global platform for consumer technology: Nothing co-founder - The Economic Times,-0.5438275337219238
TATAPOWER,2026-03-09,"GAIL seeks LNG cargo for March delivery, say industry sources - The Economic Times",-0.9164406061172485
TATAPOWER,2026-03-09,"BJP, Congress, CPI-M urge EC to hold Bengal polls in one or two phases; raise concern over 60 lakh voter c - The Economic Times",-0.8666411638259888
