ticker,date,headline,sentiment_score
TMCV,2016-06-02,Avoid aggressive long positions; focus on capital preservation - The Economic Times,-0.6575537919998169
TMCV,2026-03-28,Dalal Street Week Ahead: Avoid aggressive long positions; focus on capital preservation - The Economic Times,-0.715239942073822
TMCV,2026-03-28,West Bengal CEO flags off poll tram ahead of Assembly race - The Economic Times,-0.6202471256256104
TMCV,2026-03-23,Evaluate hiking equity exposure over the next few weeks: Prashant Jain - Business Standard,-0.9316959977149963
TMCV,2026-03-23,"Bharti Airtel, Aurobindo Pharma are top stock picks for today; here's why - Business Standard",-0.8920801877975464
TMCV,2026-03-23,"Asian shares slide, US yields hit highs as war escalates in West Asia - Business Standard",-0.9301377534866333
TMCV,2026-03-22,Mkts brace for more turbulence as Iran war shows no signs of de-escalation - Business Standard,-0.4441533088684082
TMCV,2026-03-23,"Buffett Indicator vs Nifty P/E: Analysts warn risk against mid, smallcaps - Business Standard",-0.6948562860488892
TMCV,2026-03-22,"West Asia war, crude oil prices likely to steer stock markets this week - Business Standard",-0.8223477005958557
TMCV,2026-03-23,Oil turmoil: OMCs raise industrial diesel rate; ATF hike likely from April - Business Standard,0.7394904494285583
TMCV,2026-03-22,Ready to supply more than 20% ethanol blends amid rising oil prices: AIDA - Business Standard,0.7481046319007874
TMCV,2026-03-23,Petronet LNG drops 8%; Nomura flags cash flow risk from LNG disruption - Business Standard,-0.9725707173347473
TMCV,2026-03-23,IDBI Bank shares fall 7% as govt mulls OFS route to pare stake - Business Standard,-0.9638746976852417
TMCV,2026-03-23,"Dividend, bonus issue: PFC, 4 others to remain in focus; do you own any? - Business Standard",-0.9407361149787903
TMCV,2026-03-22,Willing and raring to go for a new term: HDFC Bank's Sashidhar Jagdishan - Business Standard,-0.8023112416267395
TMCV,2026-03-23,"HDFC Bank, ICICI Bank, Bajaj Fin among 13 Nifty 50 stocks hit 52-week lows - Business Standard",-0.9391475915908813
TMCV,2026-03-22,"West Asia crisis: PM Modi takes stock of fuel, power, fertiliser supply - Business Standard",-0.9361211657524109
TMCV,2026-03-23,HDFC Bank mcap falls below ₹12 trn; down 10% in 3 days post Atanu's exit - Business Standard,-0.9752903580665588
TMCV,2026-03-23,"Antique reaffirms 'Buy' on Kirloskar Pneumatic, sees 25% upside; here's why - Business Standard",-0.7423375844955444
TMCV,2026-03-23,"Innovision lists 10% discount on BSE, NSE; hits lower circuit post-debut - Business Standard",0.8599594831466675
TMCV,2017-03-23,"Bajaj Finance Share Price Today, Bajaj Finance Stock Price Live NSE/BSE Updates - The Economic Times",-0.9387547373771667
TMCV,2018-03-09,"HAL Share Price Today, HAL Stock Price Live NSE/BSE Updates - The Economic Times",-0.9387754201889038
TMCV,2025-12-08,Tata Motors Commercial Vehicles - bsmedia.business-standard.com,-0.9497696757316589
TMCV,2026-03-23,Disruptions from West Asia war threaten to derail India's growth momentum - Business Standard,-0.9554218649864197
TMCV,2026-01-29,TMCV IN Equity 29Jan26 - bsmedia.business-standard.com,-0.947827160358429
TMCV,2026-01-04,TMCV IN 04Jan26 - bsmedia.business-standard.com,-0.9477358460426331
TMCV,2025-11-12,"Tata Motors CV Share Price Today, Tata Motors CV Stock Price Live NSE/BSE Updates - The Economic Times",-0.9391772150993347
TMCV,2026-01-29,Tata Motors| BUY - bsmedia.business-standard.com,-0.9476304054260254
TMCV,2025-11-26,Check out Tata Motors Ltd's stock price (TMCV-IN) in real time - CNBC,-0.9453728199005127
TMCV,2025-11-12,TMCV: Tata Motors Ltd /new Stock Price Quote - Natl India - Bloomberg - Bloomberg.com,-0.947119414806366
TMCV,2021-12-13,"Tata Motors (CV) Q3 Results: Cons PAT plunges 48% YoY to Rs 705 crore, but revenue jumps 16% - The Economic Times",0.518969714641571
TMCV,2026-01-30,TMCV IN 30Jan26 - bsmedia.business-standard.com,-0.9478324055671692
TMCV,2026-03-15,TMCV.PK - | Stock Price & Latest News - reuters.com,-0.9278483390808105
TMCV,2026-03-22,"Trump touted big tax refunds, but rising gas prices may level gains - Business Standard",-0.7177003026008606
TMCV,2025-10-14,"Tata Motors PV Share Price Today, Tata Motors PV Stock Price Live NSE/BSE Updates - The Economic Times",-0.9381130933761597
TMCV,2026-03-27,About Temecula Valley Bancorp Inc (TMCV.PK) - reuters.com,-0.9376898407936096
TMCV,2026-01-22,Nomura initiates TMCV with 'Buy' as India truck cycle shows early revival - Business Standard,0.862558126449585
TMCV,2025-12-22,"Nomura initiates coverage on Tata Motors CV with ‘Buy’ call, flags MHCV upcycle - ET Auto",-0.7495949864387512
TMCV,2026-01-16,"ICICI Direct backs Tata Motors CV on strong margins, market leadership - Business Standard",0.8564360737800598
TMCV,2026-01-28,"Tata Motors Q3 Preview: Profit, revenue and key factors to watch in Dec qtr - Business Standard",-0.9297100305557251
TMCV,2025-12-09,Ambit starts coverage on Tata Motors CV with 19% upside target; here's why - Business Standard,-0.9153018593788147
TMCV,2025-12-22,"Tata Motors CV set for growth, says Nomura; starts coverage with 'Buy' - Business Standard",0.7436941862106323
TMCV,2017-05-30,"NRC Ltd. Share Price Today, NRC Ltd. Stock Price Live NSE/BSE Updates - The Economic Times",-0.9369713664054871
TMCV,2025-11-12,Tata Motors Share Price - Business Standard,-0.939382016658783
TMCV,2017-07-19,"Tata Teleservices Share Price Today, Tata Teleservices Stock Price Live NSE/BSE Updates - The Economic Times",-0.9387964606285095
TMCV,2025-09-03,"Urban Company Share Price Today, Urban Company Stock Price Live NSE/BSE Updates - The Economic Times",-0.9387657642364502
TMCV,2025-11-06,"Tata Motors demerger impact: Changes in F&O lot size, OI, Strikes explained - Business Standard",-0.9186384677886963
TMCV,2017-07-10,"Take Solutions Share Price Today, Take Solutions Stock Price Live NSE/BSE Updates - The Economic Times",-0.9402981996536255
TMCV,2019-09-25,"Goblin India Share Price Today, Goblin India Stock Price Live NSE/BSE Updates - The Economic Times",-0.9349644780158997
TMCV,2021-12-09,"Data Patterns (India) Share Price Today, Data Patterns (India) Stock Price Live NSE/BSE Updates - The Economic Times",-0.9295271635055542
TMCV,2025-11-12,Tata Motors CV shares to list on November 12 after demerger - Business Standard,-0.9160019755363464
TMCV,2025-11-12,Tata Motors Q2 preview: Here's what to expect from the auto giant - Business Standard,-0.9274155497550964
TMCV,2026-03-25,"Solid Stone Share Price Today, Solid Stone Stock Price Live NSE/BSE Updates - The Economic Times",-0.9365289807319641
TMCV,2026-03-24,"Lead Financial Share Price Today, Lead Financial Stock Price Live NSE/BSE Updates - The Economic Times",-0.9411856532096863
TMCV,2017-07-08,"SCI Share Price Today, SCI Stock Price Live NSE/BSE Updates - The Economic Times",-0.9393677115440369
TMCV,2017-03-24,"Firstsource Share Price Today, Firstsource Stock Price Live NSE/BSE Updates - The Economic Times",-0.9408887028694153
TMCV,2017-03-24,"Adani Power Share Price Today, Adani Power Stock Price Live NSE/BSE Updates - The Economic Times",-0.9416555166244507
TMCV,2017-03-30,"CG Power & Ind. Share Price Today, CG Power & Ind. Stock Price Live NSE/BSE Updates - The Economic Times",-0.9406072497367859
TMCV,2023-07-07,"Kaka Industries Share Price Today, Kaka Industries Stock Price Live NSE/BSE Updates - The Economic Times",-0.9406745433807373
TMCV,2017-04-02,"Vani Commercials Share Price Today, Vani Commercials Stock Price Live NSE/BSE Updates - The Economic Times",-0.9380780458450317
TMCV,2017-04-21,"Cranex Ltd Share Price Today, Cranex Ltd Stock Price Live NSE/BSE Updates - The Economic Times",-0.9369615316390991
TMCV,2026-03-23,"K-Lifestyle Ind Share Price Today, K-Lifestyle Ind Stock Price Live NSE/BSE Updates - The Economic Times",-0.9416481852531433
TMCV,2026-03-25,"Hipolin Ltd Share Price Today, Hipolin Ltd Stock Price Live NSE/BSE Updates - The Economic Times",-0.9376355409622192
TMCV,2017-03-24,"Praj Ind. Share Price Today, Praj Ind. Stock Price Live NSE/BSE Updates - The Economic Times",-0.9393404722213745
TMCV,2018-03-06,"Bharat Dynamics Share Price Today, Bharat Dynamics Stock Price Live NSE/BSE Updates - The Economic Times",-0.9388870000839233
TMCV,2017-04-04,"Dynemic Product Share Price Today, Dynemic Product Stock Price Live NSE/BSE Updates - The Economic Times",-0.9396445155143738
TMCV,2024-03-21,"Radiowalla Network Ltd. Share Price Today, Radiowalla Network Ltd. Stock Price Live NSE/BSE Updates - The Economic Times",-0.940575361251831
TMCV,2017-07-19,"Ahluwalia Contracts Share Price Today, Ahluwalia Contracts Stock Price Live NSE/BSE Updates - The Economic Times",-0.936850368976593
TMCV,2018-11-15,"IMEC Services Share Price Today, IMEC Services Stock Price Live NSE/BSE Updates - The Economic Times",-0.9371736645698547
TMCV,2024-08-14,"Quest Softech Share Price Today, Quest Softech Stock Price Live NSE/BSE Updates - The Economic Times",-0.9398630857467651
TMCV,2017-03-24,"Baba Arts Share Price Today, Baba Arts Stock Price Live NSE/BSE Updates - The Economic Times",-0.9413772821426392
TMCV,2017-04-11,"Source Natural Share Price Today, Source Natural Stock Price Live NSE/BSE Updates - The Economic Times",-0.9404415488243103
TMCV,2020-10-15,"Balu Forge Ind Share Price Today, Balu Forge Ind Stock Price Live NSE/BSE Updates - The Economic Times",-0.9410286545753479
TMCV,2024-12-06,"Vishal Mega Mart Share Price Today, Vishal Mega Mart Stock Price Live NSE/BSE Updates - The Economic Times",-0.938698410987854
TMCV,2017-04-24,"Odyssey Tech Share Price Today, Odyssey Tech Stock Price Live NSE/BSE Updates - The Economic Times",-0.9413039684295654
TMCV,2023-06-08,"Bizotic Commercial Share Price Today, Bizotic Commercial Stock Price Live NSE/BSE Updates - The Economic Times",-0.9394762516021729
TMCV,2017-03-24,"Zydus Wellness Share Price Today, Zydus Wellness Stock Price Live NSE/BSE Updates - The Economic Times",-0.9421843886375427
TMCV,2023-12-13,"Happy Forgings Share Price Today, Happy Forgings Stock Price Live NSE/BSE Updates - The Economic Times",-0.9344726800918579
TMCV,2024-05-31,"Sattrix Information Share Price Today, Sattrix Information Stock Price Live NSE/BSE Updates - The Economic Times",-0.9419357180595398
TMCV,2022-05-05,"Delhivery Share Price Today, Delhivery Stock Price Live NSE/BSE Updates - The Economic Times",-0.935002863407135
TMCV,2026-03-25,"TCM Ltd Share Price Today, TCM Ltd Stock Price Live NSE/BSE Updates - The Economic Times",-0.9349967837333679
TMCV,2023-09-22,"E Factor Experiences Share Price Today, E Factor Experiences Stock Price Live NSE/BSE Updates - The Economic Times",-0.9348142743110657
TMCV,2025-01-30,"VirtualSoft Sys Share Price Today, VirtualSoft Sys Stock Price Live NSE/BSE Updates - The Economic Times",-0.9409103393554688
TMCV,2017-03-31,"Kuber Udyog Share Price Today, Kuber Udyog Stock Price Live NSE/BSE Updates - The Economic Times",-0.9397726655006409
TMCV,2025-12-18,"Sylph Tech Share Price Today, Sylph Tech Stock Price Live NSE/BSE Updates - The Economic Times",-0.937916100025177
TMCV,2017-03-29,"Sellwin Traders Ltd. Share Price Today, Sellwin Traders Ltd. Stock Price Live NSE/BSE Updates - The Economic Times",-0.9380464553833008
TMCV,2017-03-23,"LIC Housing Share Price Today, LIC Housing Stock Price Live NSE/BSE Updates - The Economic Times",-0.9372599720954895
TMCV,2025-01-22,"H.M. Electro Mech L Share Price Today, H.M. Electro Mech L Stock Price Live NSE/BSE Updates - The Economic Times",-0.9397009611129761
TMCV,2017-03-24,"Sonata Software Share Price Today, Sonata Software Stock Price Live NSE/BSE Updates - The Economic Times",-0.9405145049095154
TMCV,2024-02-28,"R K Swamy Share Price Today, R K Swamy Stock Price Live NSE/BSE Updates - The Economic Times",-0.9375417828559875
TMCV,2017-03-31,"Mauria Udyog Share Price Today, Mauria Udyog Stock Price Live NSE/BSE Updates - The Economic Times",-0.9391490817070007
TMCV,2017-03-24,"V2 Retail Ltd Share Price Today, V2 Retail Ltd Stock Price Live NSE/BSE Updates - The Economic Times",-0.9392397999763489
TMCV,2017-03-24,"Mirza Intnl Share Price Today, Mirza Intnl Stock Price Live NSE/BSE Updates - The Economic Times",-0.9388389587402344
TMCV,2017-04-04,"Haldyn Glass Share Price Today, Haldyn Glass Stock Price Live NSE/BSE Updates - The Economic Times",-0.9388847947120667
TMCV,2025-07-07,"Smartworks Coworking Share Price Today, Smartworks Coworking Stock Price Live NSE/BSE Updates - The Economic Times",-0.9394723773002625
TMCV,2017-04-04,"Gujarat Toolroom Share Price Today, Gujarat Toolroom Stock Price Live NSE/BSE Updates - The Economic Times",-0.9360223412513733
TMCV,2017-03-29,"Vaswani Ind Share Price Today, Vaswani Ind Stock Price Live NSE/BSE Updates - The Economic Times",-0.9403547048568726
TMCV,2022-05-19,"Aether Industries Share Price Today, Aether Industries Stock Price Live NSE/BSE Updates - The Economic Times",-0.9414852261543274
