ticker,date,headline,sentiment_score
VBL,2026-03-30,Varun Beverages - bsmedia.business-standard.com,-0.9505180716514587
VBL,2026-03-31,"Si Reporter/undefined - Read all News, Stories, Videos and Photos from Si Reporter/undefined - Business Standard",-0.9515248537063599
VBL,2025-10-29,VBL IN EQUITY 29Oct25 RU - bsmedia.business-standard.com,-0.9463242292404175
VBL,2021-09-07,VBL IN EQUITY 04Sep21 IC - bsmedia.business-standard.com,-0.9482098817825317
VBL,2017-03-24,"Varun Beverages Share Price Today, Varun Beverages Stock Price Live NSE/BSE Updates - The Economic Times",-0.9400414824485779
VBL,2021-01-11,"Varun Beverages Q1 results: Net profit rises 69% YoY to Rs 429 crore, stock split announced. - The Economic Times",0.889362096786499
VBL,2016-11-10,VBL: Varun Beverages Ltd Stock Price Quote - Natl India - Bloomberg - Bloomberg.com,-0.9482797384262085
VBL,2025-12-21,Varun Beverages| BUY - bsmedia.business-standard.com,-0.9512889981269836
VBL,2017-08-05,Check out 's stock price (VBL-IN) in real time - CNBC,-0.9456310272216797
VBL,2026-04-02,Varun Beverages Ltd. - The Economic Times,-0.9220315217971802
VBL,2021-06-02,Stock Research Report for Varun Beverages Ltd - The Economic Times,-0.9284799098968506
VBL,2026-04-02,Varun Beverages announces record date for Rs 0.50 final dividend; shares in focus - The Economic Times,-0.8601281642913818
VBL,2025-01-03,Varun Beverages to invest Rs 412 cr in South African subsidiary - ET Retail,-0.8944038152694702
VBL,2019-04-19,India's per-capita soft drink consumption to be almost double to 84 bottles a year by 2021: VBL - ET Retail,-0.5350942015647888
VBL,2023-03-14,"Indian soft drink market expected to see significant growth, says PepsiCo bottler Varun Beverages - ET BrandEquity",0.9493466019630432
VBL,2018-05-31,"Varun Beverages : Latest News Headlines, Videos and Photo Galleries on Varun Beverages - Business Standard",-0.9443526268005371
VBL,2025-02-11,Varun Beverages Dec qtr profit up 36% - ET BrandEquity,0.943091869354248
VBL,2019-09-30,Untitled - bsmedia.business-standard.com,-0.947187066078186
VBL,2023-03-12,"Indian soft drink market expected to see significant growth, says PepsiCo bottler Varun Beverages - ET Retail",0.9504241347312927
VBL,2025-06-19,"Varun Beverages slips 5%, stock tanks 30% thus far in CY25; here's why - Business Standard",-0.7209824919700623
VBL,2025-05-20,Varun Beverages to acquire 50% stake of Sri Lankan visi-cooler maker - ET BrandEquity,-0.8955135941505432
VBL,2022-06-22,Varun Beverages' Jaipuria settles case with Sebi after paying Rs 56 lakh - Business Standard,-0.6794546246528625
VBL,2024-04-14,Varun Beverages starts commercial production of carbonated drinks at Gorakhpur facility - ET Retail,-0.9098880290985107
VBL,2024-09-12,Varun Beverages shares rise over 4% ahead of stock split record date - Business Standard,0.8454955816268921
VBL,2024-03-28,Varun Beverages completes acquisition of South African bottler BevCo - ET BrandEquity,0.5735397338867188
VBL,2024-10-09,"Varun Beverages to raise Rs 7,500 cr through QIP to fund expansion plans - Business Standard",-0.5950506329536438
VBL,2017-01-05,VARUN BEVERAGES - ET Retail,-0.9486773014068604
VBL,2024-09-12,"Varun Beverages rallies 6%, nears record high; trades ex-date for 2:5 split - Business Standard",0.8830629587173462
VBL,2025-12-23,"Stocks to buy today: Shriram Finance, Varun Beverages; check target price - Business Standard",-0.9459947943687439
VBL,2026-02-04,Varun Beverages shares drop 3% as analysts flag competition as key risk - Business Standard,-0.970943808555603
VBL,2025-07-30,"Varun Beverages Q2 results: Profit up 5% to ₹1,325.4 cr, revenue down 2.32% - Business Standard",-0.9402124285697937
VBL,2025-07-30,Varun Beverages shares rise 10% in 2 days post Q2 results; upside left? - Business Standard,0.8402843475341797
VBL,2019-01-14,"Varun beverages ltd - Latest varun beverages ltd , Information & Updates - Marketing & Advertising - ET BrandEquity",-0.9503018260002136
VBL,2025-01-02,Varun Beverages announces Rs 412 cr investment in South African subsidiary - Business Standard,-0.8851087689399719
VBL,2026-03-24,The Economic Times - The Economic Times,-0.9159992933273315
VBL,2026-02-17,"Britannia sees 'Darvas Box'; VBL, Marico show reversal signs, says analyst - Business Standard",0.6533337831497192
VBL,2025-08-15,Varun Beverages' growth hinges on recovery; outlook stays positive - Business Standard,0.9057778716087341
VBL,2024-12-11,Varun Beverages' growth strategy could prove beneficial for investors - Business Standard,0.9178574681282043
VBL,2026-02-03,"Varun Beverages slips into red, stock down 6% from day's high post Q4 nos - Business Standard",-0.9700263142585754
VBL,2025-12-23,"Varun Beverages to acquire South African beverage firm Twizza at enterprise value of Rs 1,118.7cr - ET BrandEquity",-0.9185317754745483
VBL,2025-07-21,"Varun Beverages Ltd Quarterly Results, 01 Apr 2026 - NSE 401.80, BSE 402.50 - Business Standard",-0.9443981647491455
VBL,2025-03-31,"Fizz is back in Varun Beverages stock as launches, summer boost outlook - Business Standard",0.8069491386413574
VBL,2025-10-29,Varun Beverages up 10% as Q3 PAT zooms 19%; announces pact with Carlsberg - Business Standard,0.9496358036994934
VBL,2024-10-22,Varun Beverages share price gains post Q3 results; profit jumps 22% - Business Standard,0.938929557800293
VBL,2017-10-19,VARUN BEVERAGES LTD - ET Retail,-0.9491698145866394
VBL,2025-10-29,Varun Beverages forays into alco-bev sector with Carlsberg tie-up in Africa - Business Standard,-0.6956815123558044
VBL,2023-01-16,"jefferies buy call on varun beverages: Latest News & Videos, Photos about jefferies buy call on varun beverages - The Economic Times",-0.9367345571517944
VBL,2025-04-04,"VBL, ICICI Bank: 5 stocks to buy and keep in your portfolio this April - Business Standard",-0.92526775598526
VBL,2025-03-10,"PepsiCo to double India revenue in 5 yrs, invest in capacity building in key market - ET Hospitality",0.9016438126564026
VBL,2025-12-22,Why Varun Beverages' Twizza acquisition could be a game changer in Africa - Business Standard,-0.894379198551178
VBL,2026-04-02,VARB.M3 - Reuters,-0.9343190789222717
VBL,2025-10-30,Varun Beverages to distribute 'Carlsberg' in Africa: Analysts decode impact - Business Standard,-0.8828909993171692
VBL,2025-10-03,Beaten-down stocks Part 10: Correction in Varun Beverages opens entry way - Business Standard,0.5235654711723328
VBL,2022-06-22,Varun Beverages' Jaipuria settles insider trading case with Sebi; pays Rs 56 lakh - ET Retail,-0.8762546181678772
VBL,2026-03-18,Varun Beverages to acquire South African firm Crickley Dairy - ET Retail,-0.9213318824768066
VBL,2025-06-06,"Trent, NTPC, JSW Energy, VBL among 7 top stock ideas by Axis Securities - Business Standard",-0.8427550196647644
VBL,2023-10-07,"India a priority market for Costa Coffee, to add around 50 stores every year: Global CEO Philippe Schaillee - ET Retail",-0.5531695485115051
VBL,2025-04-30,"Varun Beverages posts 33% rise in Q1CY25 PAT, announces dividend; details - Business Standard",-0.7184246778488159
VBL,2025-05-26,"Chhattisgarh in talks with Medanta Hospital, Varun Beverages for investment - Business Standard",-0.5445793271064758
VBL,2025-02-11,"Varun Beverages down 6%, at 52-wk low after Q4: Should you buy, sell, hold? - Business Standard",-0.951568067073822
VBL,2025-07-29,Varun Beverages shares rise 3% after Q1 earnings; results breakdown here - Business Standard,-0.7257312536239624
VBL,2025-02-20,"ITC trades below this monthly avg after 4 years, VBL first-time; what next? - Business Standard",-0.8120662569999695
VBL,2025-03-10,"PepsiCo to double India revenue in 5 yrs, invest in capacity building in key market - ET Retail",0.9000596404075623
VBL,2017-03-24,"Vaibhav Global Share Price Today, Vaibhav Global Stock Price Live NSE/BSE Updates - The Economic Times",-0.9374317526817322
VBL,2017-03-23,"KNR Constructions Share Price Today, KNR Constructions Stock Price Live NSE/BSE Updates - The Economic Times",-0.9372602105140686
VBL,2024-11-19,"HBL Power Share Price Today, HBL Power Stock Price Live NSE/BSE Updates - The Economic Times",-0.9395076036453247
VBL,2025-07-29,Pepsico Bottler Varun Beverages appoints Pankaj Madan as CFO - ET CFO,-0.9324154257774353
VBL,2023-09-15,"JSW Infrastructure Share Price Today, JSW Infrastructure Stock Price Live NSE/BSE Updates - The Economic Times",-0.9391947984695435
VBL,2026-02-03,Varun Beverages to acquire minor stake in SPV for captive consumption of solar power - Business Standard,-0.911217212677002
VBL,2025-01-03,Soft Drink Players Uncork Big Expansion Plans - ET Manufacturing,0.6679556965827942
VBL,2017-04-10,"Diamond Power Share Price Today, Diamond Power Stock Price Live NSE/BSE Updates - The Economic Times",-0.9386599659919739
VBL,2024-02-08,"Vibhor Steel Tubes Share Price Today, Vibhor Steel Tubes Stock Price Live NSE/BSE Updates - The Economic Times",-0.9388026595115662
VBL,2026-02-03,"Varun Beverages posts quarterly profit rise on higher volumes, lower costs - Business Standard",0.9586220383644104
VBL,2025-08-26,German Court Goes Against UK Restructuring in Berlin Project - Bloomberg.com,-0.5977202653884888
VBL,2025-03-10,"PepsiCo to double India revenue in 5 yrs, invest in capacity building in key market - ET BrandEquity",0.9032760262489319
VBL,2025-07-29,Wcorp VRRUR - bsmedia.business-standard.com,-0.9514147639274597
VBL,2025-10-29,VRRUH BEVERAGES LimiCED © - bsmedia.business-standard.com,-0.9505901336669922
VBL,2026-03-19,"Stock Alert: HDFC Bank, Infosys, Vedanta, Varun Beverages, TVS Motor Company, NHPC - Business Standard",-0.950035810470581
VBL,2023-01-18,Bloomberg Billionaires Index - Ravi Jaipuria - Bloomberg.com,-0.9410166144371033
VBL,2025-02-25,Varun Beverages extends deadline for acquisition of SBC Beverages to Mar 31 - Business Standard,-0.8979741930961609
VBL,2026-02-26,Soft drink’s Jio moment? RIL’s Campa tests Coke-Pepsi duopoly of 30 years - ET BrandEquity,-0.8556625247001648
VBL,2017-12-29,"Bevco - Latest bevco , Information & Updates - Retail - ET Retail",-0.9512754082679749
VBL,2026-04-02,Hindustan Unilever Ltd. - The Economic Times,-0.9213678240776062
VBL,2016-11-11,BZ/H: Benz Mining Corp Stock Price Quote - - Bloomberg - Bloomberg.com,-0.9463517665863037
VBL,2017-11-19,"pepsi: Latest News & Videos, Photos about pepsi - The Economic Times",-0.9381428360939026
VBL,2018-03-30,PepsiCo India repositions Tropicana; Katrina Kaif to endorse brand - ET BrandEquity,-0.6265243887901306
VBL,2025-04-30,News & Stories by Snehal Mergu - ET BrandEquity,-0.9372303485870361
VBL,2017-03-30,"Power Grid Target Share Price, Power Grid Share Price Forecast - The Economic Times",-0.9362338781356812
VBL,2025-03-05,AWLTD IN EQUITY 05Mar25 CU - bsmedia.business-standard.com,-0.9462642669677734
VBL,2025-07-05,Devyani International Limited - bsmedia.business-standard.com,-0.9524049758911133
VBL,2025-10-31,ITC IN Equity 30Oct25 RU - bsmedia.business-standard.com,-0.9467412829399109
VBL,2026-03-09,"Well positioned for strong recovery this year, says Varun Beverages - Business Standard",0.9462820887565613
VBL,2025-01-16,"Societe Generale plans partial return to gold trading, sources say - Reuters",-0.7990885376930237
VBL,2024-11-26,HUVR IN Equity 26Nov24 CU - bsmedia.business-standard.com,-0.9462213516235352
VBL,2025-10-14,"Indian regulator open to Emirates NBD purchasing a stake in RBL Bank, sources say - Reuters",-0.9282748103141785
VBL,2021-06-28,PARAS PETROFILS LIMITED - bsmedia.business-standard.com,-0.9493658542633057
