ticker,date,headline,sentiment_score
VEDL,2026-01-30,"Vedanta shares snap 6-day gains, fall 8% despite strong Q3 results on global decline in metal prices - Moneycontrol",-0.9690133333206177
VEDL,2026-01-29,"Dabur Q3 Results Highlights: Net profit rises 7% to Rs 560 crore, revenue up 6% - Moneycontrol",0.9501078724861145
VEDL,2026-01-30,"F&O Quote - Live FNO BSE/NSE Quote, Nifty Quotes, Indian Stock Market BSE/NSE Price Increase, Chart, Open Interest Analysis & more by Moneycontrol.com - Moneycontrol",-0.9344049096107483
VEDL,2026-01-29,"Closing Bell: Markets climb for 3rd day in a row; Sensex up 222 pts, Nifty reclaims 25,400 - Moneycontrol",0.894343912601471
VEDL,2026-02-02,"Closing Bell: Market recovers from Budget blues; Sensex jumps 910 pts, Nifty near 25,100 - Moneycontrol",0.8960077166557312
VEDL,2010-04-08,Join Live: Market Expert Decodes Today’s Biggest Stock Questions - Moneycontrol,-0.9196506142616272
VEDL,2026-01-29,Hannah Joseph Hospital Ltd. - Moneycontrol,-0.9438875317573547
VEDL,2026-01-29,Kasturi Metal Composite Ltd. - Moneycontrol,-0.9470990896224976
VEDL,2026-01-29,Shayona Engineering Ltd. - Moneycontrol,-0.9487332105636597
VEDL,2026-01-28,Shadowfax Technologies Ltd. - Moneycontrol,-0.9525080323219299
VEDL,2026-01-28,KRM Ayurveda Ltd. - Moneycontrol,-0.9277756810188293
VEDL,2026-02-03,"F&O Quote - Live FNO BSE/NSE Quote, Nifty Quotes, Indian Stock Market BSE/NSE Price Increase, Chart, Open Interest Analysis & more by Moneycontrol.com - Moneycontrol",-0.9344049096107483
VEDL,2026-02-03,"F&O Quote - Live FNO BSE/NSE Quote, Nifty Quotes, Indian Stock Market BSE/NSE Price Increase, Chart, Open Interest Analysis & more by Moneycontrol.com - Moneycontrol",-0.9344049096107483
VEDL,2026-02-01,"Union Budget 2026 Highlights: STT bombshell rattles market - Sensex, NIFTY nosedive over 2%, worst fall in 7 years - Moneycontrol",-0.911132276058197
VEDL,2026-01-31,"Union Budget 2026 expectations: Tax relief, capex push, fiscal discipline in focus - Moneycontrol",0.7719800472259521
VEDL,2026-02-02,Neutral Vedanta; target of Rs 810: Motilal Oswal - Moneycontrol,-0.8898788690567017
VEDL,2026-01-30,"Bank of Baroda Q3 Results Highlights: Net profit rises 4.5% to Rs 5,055 crore - Moneycontrol",0.9448550939559937
VEDL,2026-01-28,Highlights | IND vs NZ 4th T20I scorecard: New Zealand win by 50 runs as India bundle out for 165 - Moneycontrol,-0.6429353952407837
VEDL,2026-02-03,India US Trade Deal Latest News and Top Headlines - Moneycontrol,-0.9098312854766846
VEDL,2026-02-03,"India-US Trade Deal News Live: US Agricultural Secretary thanks Trump for India-US trade deal, says it will help in 'pumping cash into rural America' - Moneycontrol",0.8861615061759949
VEDL,2026-01-30,"Budget 2026 Expectations Live: Markets brace for high-stakes Budget amid rupee pressure, FPI exits - Moneycontrol",0.45462310314178467
VEDL,2026-02-01,"Gold Silver Rate Highlights: Gold on MCX at Rs 1.43 lakh per 10 grams, Silver at around Rs 2.66 lakh per kilogram - Moneycontrol",-0.8831952810287476
VEDL,2026-01-28,"L&T Q3 Results Highlights: Net profit falls 4% to Rs 3,215 crore, revenue up 10% - Moneycontrol",-0.7949973940849304
VEDL,2026-02-03,"Gold Silver Rate Today: Gold, silver rebound; prices claw back after historic sell-off - Moneycontrol",0.8884252309799194
VEDL,2026-01-31,Markets rise 1% despite volatility ahead of Budget; rupee hits new low - Moneycontrol,0.90261310338974
VEDL,2026-02-02,"Grammys 2026: Sabrina Carpenter, Tyla and others dazzle on the red carpet - Moneycontrol",-0.8951365947723389
VEDL,2026-02-02,Best looks from Grammy 2026: From Lady Gaga's feathered mermaid dress to Sabrina Carpenter's white V - Moneycontrol,-0.9125098586082458
VEDL,2026-02-03,Top 10 European countries with the fewest tourists - Moneycontrol,-0.8216991424560547
VEDL,2026-02-01,"Income Tax Budget 2026 Updates: No change in tax slabs; buybacks taxed, TCS cut, ITR revision window extended - Moneycontrol",0.40848520398139954
VEDL,2026-01-29,"Economic Survey 2026 highlights: Trade no longer reciprocal, markets no longer neutral, says CEA - Moneycontrol",-0.8840482831001282
VEDL,2026-01-28,"Top 10 cities with the highest cost of living right now, revealed - Moneycontrol",-0.8939599990844727
VEDL,2026-02-02,10 most surreal beaches in the world you need to see - Moneycontrol,-0.9067182540893555
VEDL,2026-02-03,Dhurandhar 2: All the key details fans need to know - Moneycontrol,-0.9433927536010742
VEDL,2026-01-31,"From Spider-Man: Brand New Day to Avengers: Doomsday, upcoming Marvel movies and series - Moneycontrol",-0.9471926689147949
VEDL,2026-01-30,"Vedanta shares slide 8% after Q3 results. Should you buy, sell or hold? - The Economic Times",-0.6361496448516846
VEDL,2026-02-03,Happy Birthday Waheeda Rehman: A look at the veteran actress' iconic roles - Moneycontrol,-0.8845463991165161
VEDL,2026-02-02,"Nirmala Sitharaman Interview highlights: FM links rupee strength to economy, says gold demand driven by global uncertainty - Moneycontrol",-0.8445196747779846
VEDL,2026-02-01,From Rohit Shetty to Sidhu Moosewala: celebs who experienced gunfire incidents - Moneycontrol,-0.5828666090965271
VEDL,2026-01-28,"Parliament budget session 2026 live: President Murmu addresses joint assembly, highlights India’s progress and 150 years of Vande Mataram - Moneycontrol",-0.5970874428749084
VEDL,2026-02-03,Moneycontrol Pro Financial Times | Articles from Financial Times - Moneycontrol,-0.9274685382843018
VEDL,2026-02-03,"Dhurandhar 2 revenge cast: Ranveer Singh's dual role, Yami Gautam's cameo, who’s in and missing, det - Moneycontrol",-0.9002091288566589
VEDL,2026-01-29,US Fed Meeting Highlights: US Fed holds interest rates steady; Powell says policy can ease once tariff pressures recede - Moneycontrol,0.45673614740371704
VEDL,2018-01-13,Crompton Greaves Consumer Electrical Ltd. - Moneycontrol,-0.9464160799980164
VEDL,2011-01-21,Voltas Ltd. - Moneycontrol,-0.9443987607955933
VEDL,2011-07-20,LIC Housing Finance Ltd. - Moneycontrol,-0.9527907371520996
VEDL,2021-02-25,Railtel Corporation of India Ltd. - Moneycontrol,-0.9375916123390198
VEDL,2024-11-22,Nuvama Wealth Management Ltd. - Moneycontrol,-0.9502610564231873
VEDL,2011-02-06,KEI Industries Ltd. - Moneycontrol,-0.9481549859046936
VEDL,2018-01-19,Pondy Oxides & Chemicals Ltd. - Moneycontrol,-0.9492278099060059
VEDL,2019-04-17,Vaibhav Global Ltd. - Moneycontrol,-0.9491379261016846
