ticker,date,headline,sentiment_score
VEDL,2026-03-09,"Forum Discussion on Market View, Business sectors,Stocks, Commodity, Personal Finance & More - Moneycontrol.com",-0.9462059736251831
VEDL,2018-01-05,"vedanta Forum Discussion on Market View, Business sectors,Stocks, Commodity, Personal Finance & More - Moneycontrol.com",-0.9449130296707153
VEDL,2025-07-20,"Viceroy alleges Vedanta Semiconductor is a Rs 2,500-cr sham; co says baseless - The Economic Times",-0.5274039506912231
VEDL,2025-07-09,Short-Seller Viceroy's report triggers fall in Vedanta stock - The Economic Times,-0.9512749314308167
VEDL,2025-07-09,"Baseless and malicious: Vedanta slams Viceroy report, says claims ‘meant to discredit’ the group - The Economic Times",-0.6706469655036926
VEDL,2024-10-10,"Vedanta board meeting stands cancelled, stock down 2% - The Economic Times",-0.9480066299438477
VEDL,2025-12-18,Buy Vedanta; target of Rs 625: Emkay Global Financial - Moneycontrol.com,-0.9387017488479614
VEDL,2025-09-10,"Vedanta’s Rs 17,000 crore bid for Jaiprakash Associates flagged as credit negative - The Economic Times",-0.9286059141159058
VEDL,2025-12-02,Vedanta may use ESL Steel's proposed fundraising for parent company's debt: Viceroy Research - The Economic Times,-0.9236989617347717
VEDL,2020-08-04,VEDL 30Mar2026 - Moneycontrol.com,-0.9389151930809021
VEDL,2025-02-25,"Hindalco, Nalco, Vedanta other metal stocks fall for 2nd day after 5-session rise; what should investors... - Moneycontrol.com",-0.9428531527519226
VEDL,2025-12-16,"Vedanta shares jump 4%, hit 52-week high after NCLT approves demerger plan - The Economic Times",0.8671137094497681
VEDL,2025-06-10,"Vedanta Resources eyes investment grade rating, plans to cut debt to USD 3 bn by FY27 - The Economic Times",0.38285472989082336
VEDL,2025-10-01,Vedanta demerger date moved to March 2026 pending government approval - The Economic Times,-0.9271530508995056
VEDL,2021-12-23,"Vedanta | Dividends > Mining & Minerals > Dividends declared by Vedanta - BSE: 500295, NSE: VEDL - Moneycontrol.com",-0.9333615899085999
VEDL,2025-07-09,"Vedanta shares decline over 3% as Viceroy Research shorts parent's debt, says 'resembles a Ponzi scheme' - Moneycontrol.com",-0.9671117067337036
VEDL,2018-02-18,Vedanta Ltd. - Moneycontrol.com,-0.9481729865074158
VEDL,2025-10-14,"Vedanta’s Rs 17,000 crore acquisition of Jaiprakash Associates gets CCI nod - The Economic Times",0.6365520358085632
VEDL,2024-09-11,Demerger of Vedanta likely by end of FY25: Top official - The Economic Times,-0.9414812326431274
VEDL,2018-06-15,"Vedanta > Listing Details > Mining & Minerals > Listing Details of Vedanta - BSE: 500295, NSE: VEDL - Moneycontrol.com",-0.9485458135604858
VEDL,2025-09-30,Buy Vedanta; target of Rs 525: Emkay Global Financial - Moneycontrol.com,-0.9397239089012146
VEDL,2026-01-30,"Vedanta shares snap 6-day gains, fall 8% despite strong Q3 results on global decline in metal prices - Moneycontrol.com",-0.970167875289917
VEDL,2025-07-19,"Vedanta Semiconductors a ‘sham’ commodities trading operation, says Viceroy Research - The Economic Times",-0.7659342885017395
VEDL,2025-09-08,Buy Vedanta; target of Rs 530: ICICI Direct - Moneycontrol.com,-0.9392583966255188
VEDL,2026-01-07,'Darkest day of my life': Mining mogul Anil Agarwal's son Agnivesh passes away at 49 - The Economic Times,-0.5835626721382141
VEDL,2018-06-15,"Vedanta > Company History > Mining & Minerals > Company History of Vedanta - BSE: 500295, NSE: VEDL - Moneycontrol.com",-0.9446253776550293
VEDL,2024-11-12,"Vedanta | Splits > Mining & Minerals > Dividends declared by Vedanta - BSE: 500295, NSE: VEDL - Moneycontrol.com",-0.8789914846420288
VEDL,2018-01-13,"Registered Address Contact Details, Management - Moneycontrol.com",-0.9482476115226746
VEDL,2025-05-29,"Vedanta gets NCLAT relief on demerger plan, shares edge up - The Economic Times",0.9117589592933655
VEDL,2024-11-13,"Vedanta | Board Meetings > Mining & Minerals > Board Meetings of Vedanta - BSE: 500295, NSE: VEDL - Moneycontrol.com",-0.9426270723342896
VEDL,2024-10-07,Buy Vedanta; target of Rs 600: ICICI Securities - Moneycontrol.com,-0.943256139755249
VEDL,2018-03-24,"Vedanta Balance Sheet, Vedanta Financial Statement & Accounts - Moneycontrol.com",-0.9433440566062927
VEDL,2026-01-21,"Vedanta grants ₹2,500 crore stock options over 5 years - The Economic Times",-0.883922278881073
VEDL,2025-11-28,"Vedanta back in debt market, seeks Rs 2k cr via metals arm - The Economic Times",-0.8432067632675171
VEDL,2024-11-19,"Vedanta | AGM/EGM > Mining & Minerals > Meetings of Vedanta - BSE: 500295, NSE: VEDL - Moneycontrol.com",-0.9458910226821899
VEDL,2018-01-13,"Vedanta Profit & Loss account, Vedanta Financial Statement & Accounts - Moneycontrol.com",-0.8731463551521301
VEDL,2026-01-30,"Hind Zinc, Vedanta, other metal stocks fall up to 12%; metal index tumbles 5%: Here's why - Moneycontrol.com",-0.9372382760047913
VEDL,2025-07-07,Vedanta Resources Releases Encumbrance on 56.38% of Vedanta Ltd Shares - Moneycontrol.com,-0.945773720741272
VEDL,2024-11-11,"Vedanta Announcements/Notices: Latest Sotck/Share Market Notices/Announcements on Vedanta, Vedanta Stock Split,Bonus, Rights, Re-Structuring, Dividends, Board Meetings, Quarterly Results, Record Date, Ex-Date, Book Closure on BSE/NSE - Moneycontrol.com",-0.910232663154602
VEDL,2025-09-30,VEDL IN Equity 29Sep25 - images.moneycontrol.com,-0.9446334838867188
VEDL,2025-06-18,"Vedanta Declares ₹7/Share Interim Dividend for FY26, Fixes Record Date for Shareholder Eligibility - Moneycontrol.com",-0.9237586259841919
VEDL,2025-07-13,Vedanta's donations to BJP nearly quadruples to Rs 97 cr in FY25: Annual Report - The Economic Times,-0.8522918224334717
VEDL,2011-07-25,"Vedanta > Company History > Mining & Minerals > Company History of Vedanta - BSE: 500295, NSE: VEDL - Moneycontrol.com",-0.9446253776550293
VEDL,2025-08-18,Vedanta board to consider second interim dividend on Aug 21. Check record date - The Economic Times,-0.9416580200195312
VEDL,2025-09-04,Vedanta Shares' Encumbrance Fully Released After USD 100 Million Repayment - Moneycontrol.com,-0.9475594162940979
VEDL,2025-11-03,Vedanta shares jump over 3% today after mixed Q2 results; CLSA says 'buy' -- check target price - Moneycontrol.com,0.708782970905304
VEDL,2025-05-07,Neutral Vedanta; target of Rs 470: Motilal Oswal - Moneycontrol.com,-0.9414379000663757
VEDL,2020-07-23,Vedanta Daily Technical Analysis | Stochastic RSI indicators - Moneycontrol.com,-0.9296970367431641
VEDL,2025-05-29,"Vedanta, Tata Steel, other metal stocks tumble up to 3% as US-China tariff talks 'a bit stalled' - Moneycontrol.com",-0.9509178400039673
VEDL,2018-10-21,"Vedanta Registered Address Contact Details, Vedanta Management - Moneycontrol.com",-0.9484465718269348
