ticker,date,headline,sentiment_score
ZYDUSLIFE,2026-04-01,Zydus Life served Rs 1.42 crore tax demand notice - ET Pharma,-0.927089273929596
ZYDUSLIFE,2025-02-05,India's Zydus Life beats profit view on strong US demand - Reuters,0.46607452630996704
ZYDUSLIFE,2025-05-20,India's Zydus Life reports higher quarterly profit on new drug launches in US - Reuters,0.9406424760818481
ZYDUSLIFE,2025-08-12,Indian drugmaker Zydus Life's first-quarter profit beats estimates on new US drug launches - Reuters,-0.46164369583129883
ZYDUSLIFE,2022-03-08,Zydus Lifesciences Ltd. - economictimes.indiatimes.com,-0.942828893661499
ZYDUSLIFE,2026-02-09,India's Zydus Life posts surprise profit rise on strong North American sales - Reuters,0.9438185095787048
ZYDUSLIFE,2022-02-28,"Cadila Healthcare Share Price Today, Cadila Healthcare Stock Price Live NSE/BSE Updates - economictimes.indiatimes.com",-0.9410772323608398
ZYDUSLIFE,2024-08-28,"Jefferies upgrades Zydus Life to 'Buy' on strong US pipeline potential, stock up 4% - ET Pharma",0.952499508857727
ZYDUSLIFE,2026-02-12,India's Zydus Life agrees $120 million settlement with Astellas over bladder drug - Reuters,0.8421609997749329
ZYDUSLIFE,2022-06-13,ZYDU.NS - Reuters,-0.9278071522712708
ZYDUSLIFE,2024-11-11,India's Zydus Life posts Q2 profit rise on steady US demand - Reuters,0.9378416538238525
ZYDUSLIFE,2015-04-06,CDLYY: Zydus Lifesciences Ltd Stock Price Quote - - Bloomberg - bloomberg.com,-0.9458593130111694
ZYDUSLIFE,2023-05-11,"Health News | Latest Healthcare Sector & Healthcare Industry news, Information and Updates - ET HealthWorld",-0.9393323659896851
ZYDUSLIFE,2024-05-31,"Zydus lifesciences - Latest zydus lifesciences , Information & Updates - Pharma - ET Pharma",-0.9478772878646851
ZYDUSLIFE,2022-06-09,ZYDS.NS - Reuters,-0.9309841990470886
ZYDUSLIFE,2022-03-09,Zydus Lifesciences Ltd - Reuters,-0.9459133148193359
ZYDUSLIFE,2023-02-02,Alembic Pharmaceuticals Ltd - Reuters,-0.9457384347915649
ZYDUSLIFE,2024-06-17,"Bristol myers squibb - Latest bristol myers squibb , Information & Updates - Pharma - ET Pharma",-0.9487612247467041
ZYDUSLIFE,2024-08-09,India's Zydus Lifesciences Q1 profit beats estimates on strong US demand - Reuters,0.8294971585273743
ZYDUSLIFE,2021-04-29,India's Zydus Cadila plans to seek emergency use nod for its Covid vaccine in May - CNBC,-0.8600125312805176
ZYDUSLIFE,2024-06-23,News From ETPharma - ET Pharma,-0.9355039596557617
ZYDUSLIFE,2022-06-07,About Astellas Pharma Inc (4503.T) - Reuters,-0.9433355927467346
ZYDUSLIFE,2023-05-17,Zydus Wellness Ltd - Reuters,-0.9433119297027588
ZYDUSLIFE,2017-03-24,Can Fin Homes Ltd. - economictimes.indiatimes.com,-0.936782717704773
ZYDUSLIFE,2025-11-07,Zydus eyes M&A push for US Specialty business with ₹5000-Cr QIP - ET Pharma,0.779839813709259
ZYDUSLIFE,2025-05-11,Indian pharma stocks fall as Trump moves to cut U.S. drug prices - Reuters,-0.960753321647644
ZYDUSLIFE,2026-03-26,(CIPL.NS) | Stock Price & Latest News - Reuters,-0.9132390022277832
ZYDUSLIFE,2021-06-29,Cipla Ltd - Reuters,-0.9430217146873474
ZYDUSLIFE,2008-07-04,Cadila sets share swap ratio for consumer unit demerger - Reuters,-0.884351372718811
ZYDUSLIFE,2022-06-06,About Lupin Ltd (LUPN.NS) - Reuters,-0.9466680288314819
ZYDUSLIFE,2017-07-27,Jet Airways (India) Ltd. - economictimes.indiatimes.com,-0.9399195313453674
ZYDUSLIFE,2025-11-07,India's Lupin posts surge in quarterly profit on strong respiratory drugs demand - Reuters,0.9371543526649475
ZYDUSLIFE,2024-06-03,Pharma Industry - ET Pharma,-0.9382467269897461
ZYDUSLIFE,2026-03-21,Dosage forms define semaglutide generics price war in India - ET Pharma,-0.8979080319404602
ZYDUSLIFE,2025-11-05,"MSCI to add Paytm, 3 other Indian stocks to flagship global index - Reuters",-0.8860588669776917
ZYDUSLIFE,2026-03-21,"Zydus launches semaglutide generic in reusable pen, monthly cost near ₹2,200 - ET Pharma",-0.837033748626709
ZYDUSLIFE,2026-03-17,"India's Zydus, Lupin sign deal to co‑market Semaglutide injections - Reuters",0.5414362549781799
ZYDUSLIFE,2021-10-27,Pankaj Patel - economictimes.indiatimes.com,-0.9342116713523865
ZYDUSLIFE,2021-06-16,Dr Reddy's Laboratories Ltd - Reuters,-0.9435654282569885
ZYDUSLIFE,2025-11-03,India's Gland Pharma posts higher quarterly profit on Cenexi boost - Reuters,0.941598117351532
ZYDUSLIFE,2026-01-23,"Indian drugmakers get regulatory nod to sell generic Wegovy, heating obesity‑drug race - Reuters",-0.5521793961524963
ZYDUSLIFE,2024-07-31,"Zydus, Roche legal conflict underscores need for affordable breast cancer treatments in India - ET HealthWorld",-0.46130239963531494
ZYDUSLIFE,2026-02-25,Zydus to launch generic semaglutide injections in India after patent expiry in March - Reuters,-0.6141670346260071
ZYDUSLIFE,2025-03-11,India's Zydus Lifesciences to buy 86% stake in French medical devices maker - Reuters,-0.8709929585456848
ZYDUSLIFE,2026-02-26,Zydus set for Day 1 launch of semaglutide generic with reusable multi-dose pen - ET Pharma,-0.8008626103401184
ZYDUSLIFE,2026-03-17,Lupin to co-market Zydus’ semaglutide generic in India - ET Pharma,-0.497027188539505
ZYDUSLIFE,2021-07-01,Cadila Healthcare Ltd - Reuters,-0.9429819583892822
ZYDUSLIFE,2024-02-27,Zydus aims to launch first new drug in US by early 2026 - Reuters,-0.7898286581039429
ZYDUSLIFE,2026-03-16,Zydus to launch AI-based glucose monitors - ET HealthWorld,-0.8487805724143982
ZYDUSLIFE,2025-08-12,"Zydus to launch market-specific dosage variants of Semaglutide, MD says - ET Pharma",-0.634753406047821
ZYDUSLIFE,2017-08-16,Zydus Cadila gets USFDA nod for blood pressure drug - ET HealthWorld,0.7576497197151184
ZYDUSLIFE,2025-07-20,Page 2 - Pharma News | Pharma Sector News | Pharma News India - ET Pharma,-0.9511497616767883
ZYDUSLIFE,2023-02-02,"India's Zydus Lifesciences beats Q3 profit view on strong India, U.S. sales - Reuters",0.675421416759491
