ticker,date,headline,sentiment_score
GAIL,2026-03-02,"Stocks in news: Adani Ports, Fino Payments Bank, GAIL, BEL, SpiceJet - The Economic Times",-0.943822979927063
GAIL,2026-03-01,Deepak Gupta takes over as GAIL chairman - The Economic Times,-0.9362012147903442
GAIL,2026-02-28,"GAIL to invest Rs 1,736 crore in wind power project in Maharashtra - The Economic Times",-0.8360155820846558
GAIL,2026-03-02,Laurus Labs eyes fresh rally as stock respects 20-DEMA support: Shivangi Sarda - The Economic Times,-0.5407780408859253
GAIL,2026-03-02,Laurus Labs eyes fresh rally as stock respects 20-DEMA support: Shivangi Sarda - The Economic Times,-0.5407780408859253
GAIL,2026-03-03,"Iran-Israel War: India reduces gas supply to industries after Qatar outage, sources say - The Economic Times",-0.9558892846107483
GAIL,2026-03-03,"Can Israel-Iran war help silver hit a new record high past $121 and gold over $5,595? - The Economic Times",-0.7708081007003784
GAIL,2026-03-02,GIFT Nifty down 50 points; here's the trading setup for today's session - The Economic Times,-0.5993837714195251
GAIL,2026-03-03,UIDAI rolls out student biometric update in one lakh plus schools - The Economic Times,-0.9142351150512695
GAIL,2026-03-02,Mobilise App shares to debut on NSE SME today. GMP indicates positive listing - The Economic Times,-0.5910507440567017
GAIL,2026-03-03,"No issue with Futures segment, but concerns around short-dated Options: Sebi chief - The Economic Times",-0.8732007145881653
GAIL,2026-03-02,Accord Transformer and Switchgear shares to debut today. Here's what GMP indicates - The Economic Times,-0.9207766056060791
GAIL,2026-03-02,Kiaasa Retail to list on BSE SME today. GMP indicates flattish debut - The Economic Times,-0.701011061668396
GAIL,2026-03-02,Shree Ram Twistex IPO to list today. GMP signals cautious debut despite strong subscription - The Economic Times,-0.5679059624671936
GAIL,2026-03-01,Iran conflict: India boosts LPG production as Strait of Hormuz disruptions hit supplies - The Economic Times,0.9117172956466675
GAIL,2026-03-03,"Ola announces 2-day Holi offer for Roadster bikes and scooters: Check special price, benefits - The Economic Times",-0.7878958582878113
GAIL,2026-03-02,Iran-Israel war: Over 30 listed Indian companies face Middle East exposure risk. Are you holding these sto - The Economic Times,-0.8505785465240479
GAIL,2026-03-02,"Mutual consent vs contested divorce in India: Process, costs, time duration and legal requirements compare - The Economic Times",-0.9302226305007935
GAIL,2026-03-03,"Qatar declares force majeure, gas supplies to Indian industry cut amid Iranian strikes - The Economic Times",-0.9350705742835999
GAIL,2026-03-03,Sustaining and Strengthening Economic Growth | PM Modi Post-Budget Webinar | LIVE - The Economic Times,-0.8603382110595703
GAIL,2026-03-01,"Oil jumps 10%, could touch $100 per barrel - The Economic Times",0.7951980829238892
GAIL,2026-03-01,"Conflict closes Dubai, Abu Dhabi stock markets to Tuesday: Regulator - The Economic Times",-0.8642796277999878
GAIL,2026-03-03,Iran Crisis: Stranded Indians return as few Dubai flights takeoff; IndiGo restores Jeddah service - The Economic Times,-0.7544466853141785
GAIL,2026-03-01,Stock Radar: Laurus Labs stock showing signs of recovery after falling from January 2026 highs – time to b - The Economic Times,-0.6778982877731323
GAIL,2026-03-03,'Israel was determined to act with or without US': Mike Johnson on Operation Epic Fury - The Economic Times,-0.824866533279419
GAIL,2026-03-03,‘Plan for emerging risks due to Iran crisis’: Chandrasekaran says Tata will diversify sourcing - The Economic Times,-0.601128101348877
GAIL,2026-03-03,'Peace does not need to be fragile': Melania Trump chairs UNSC meeting amid Iran strikes - The Economic Times,-0.887109637260437
GAIL,2026-03-02,"Can US stock market crash? Dow futures fall over 600 points, gold rises as experts warn of higher ‘tail ri - The Economic Times",-0.676641583442688
GAIL,2026-03-02,"5 stocks with consistent score improvement and upside potential of up to 26% in 1 year, according to analy - The Economic Times",0.953661322593689
GAIL,2026-03-03,"Two Trades for Today: An electronics manufacturer for a 6.9% gain, a mid-cap auto ancillary stock for rise - The Economic Times",0.8267166614532471
GAIL,2026-03-03,"Congress targets Modi over Iran response, invokes Indira Gandhi’s 1982 non-alignment remark - The Economic Times",-0.8543294668197632
GAIL,2026-03-03,LIVE | 'Was Alex Pretti a domestic terrorist?': Noem under fire in Senate over Minneapolis shooting - The Economic Times,-0.49319490790367126
GAIL,2026-03-02,"Stock Market holidays in March 2026: NSE, BSE to remain shut on 3 days this month; check list - The Economic Times",-0.784381091594696
GAIL,2026-03-03,"‘No law allows regime change by bombing’: Abdullah condemns Iran attack, appeals for peace in J&K - The Economic Times",-0.8559489846229553
GAIL,2026-03-02,Raytheon stock rises 4% - what's fueling the move? - The Economic Times,-0.7470608949661255
GAIL,2026-03-02,"Jefferies calls Israel-Iran conflict a buying opportunity; warns Hormuz, crude shock risks for India - The Economic Times",-0.5962120890617371
GAIL,2026-03-03,"Being tactical not an option, but a necessity: Prescription for war and volatility; 7 pharma stocks with u - The Economic Times",-0.8670589327812195
GAIL,2026-03-03,'Depart Now!': US urges Americans to leave over 12 Middle East countries amid Israel-Iran war - The Economic Times,-0.7063590288162231
GAIL,2026-03-03,Israel–Iran Conflict Threatens Global Energy via Strait of Hormuz - The Economic Times,-0.8209619522094727
GAIL,2026-03-02,XOM stock today jumps as oil price spikes on US-Iran tensions – here's what investors need to know about E - The Economic Times,-0.9083057641983032
GAIL,2026-03-02,"Why are US stock market index futures down and Dow Jones, S&P 500 and Nasdaq in red today? Wall Street fut - The Economic Times",-0.75118488073349
GAIL,2026-03-03,"After a brutal Monday crash, Trump says Iran war may last four weeks. How will the stock market react on W - The Economic Times",-0.9082142114639282
GAIL,2026-03-03,"India's oil contingency plan in pipeline amid Iran disruptions: Export curbs, more Russian crude, LPG rati - The Economic Times",-0.7490561604499817
GAIL,2026-03-03,"US embassy in Riyadh hit by drone attack, says Saudi state media; no injuries reported - The Economic Times",-0.8313090205192566
GAIL,2026-03-03,US Stock Market | Dollar reasserts dominance as investors seek shelter from oil surge - The Economic Times,-0.5237680673599243
GAIL,2026-03-03,Gulf War to Operation Sindoor: What India's stock market reactions to past geopolitical risks reveal amid - The Economic Times,-0.9048861861228943
GAIL,2026-03-03,"Why are US stock market index futures down today and S&P 500, Dow Jones and Nasdaq in red? Wall Street fut - The Economic Times",-0.7627183198928833
GAIL,2026-03-03,ChatGPT uninstalls surge 295% in US after OpenAI’s AI deal with Pentagon - The Economic Times,0.9139012098312378
GAIL,2026-03-03,Global Markets | Japanese stocks plummet as Mideast conflict widens - The Economic Times,-0.9450610876083374
GAIL,2026-03-03,No casualties on Indian ships in Gulf; 3 Indians killed on foreign vessels - The Economic Times,-0.8931422233581543
