ticker,date,headline,sentiment_score
GRASIM,2024-02-05,Price Updates: Grasim Industries' Share Price Drops Over 2% as Percentage Change Stands at -2.03% - The Economic Times,-0.9656038284301758
GRASIM,2023-12-27,Grasim Industries Stocks Live Updates: Grasim Industries Closes at Rs 2069.55 with -2.3% Weekly Return - The Economic Times,-0.6529232859611511
GRASIM,2024-03-20,"Grasim Industries Share Price Live Updates: Grasim Industries Closes at Rs 2,173.80, Records 1.33% Decrea - The Economic Times",-0.7691460251808167
GRASIM,2024-04-09,Grasim Industries Share Price Today Live Updates: Grasim Industries Closes at Rs 2280.80 with 1.93% Gain - The Economic Times,-0.4676353335380554
GRASIM,2024-03-11,Grasim Industries Share Price Live Updates: Grasim Industries Closes at Rs 2228.1 with -0.29% 1-Week Retu - The Economic Times,-0.5595149397850037
GRASIM,2023-11-17,"Grasim Industries Share Price Live Updates: Grasim Industries Sees 1.73% Increase in Current Price, EMA3 - The Economic Times",0.8965219259262085
GRASIM,2023-11-28,Grasim Industries Share Price Today Live Updates: Grasim Industries Closes at Rs 1949.4 with 123 Units Tr - The Economic Times,-0.9295817613601685
GRASIM,2023-11-23,Grasim Industries Share Price Live Updates: Grasim Industries Closes at Rs 1974.1 with a Volume of 136 Un - The Economic Times,-0.9073265790939331
GRASIM,2024-06-04,"Moving Averages Updates: Grasim Industries Slips Below 100-Day SMA as Price Hits Rs 2211.05, Registers -6. - The Economic Times",-0.9517260789871216
GRASIM,2024-02-16,Grasim Industries Share Price Live Updates: Grasim Industries Reports Strong 5-Year Returns of 198.55% wi - The Economic Times,0.917992889881134
GRASIM,2024-01-24,Grasim Industries Stocks Live Updates: Grasim Industries Closes at Rs 2049.6 with 102 Shares Traded and a - The Economic Times,-0.9374632835388184
GRASIM,2024-03-14,"Grasim Industries Stocks Live Updates: Grasim Industries Sees 1.71% Increase in Price Today, 5-Year Retur - The Economic Times",0.9392452836036682
GRASIM,2024-02-28,"Grasim Industries Share Price Today Live Updates: Grasim Industries Sees Minor Decline in Price, but Show - The Economic Times",-0.8777992725372314
GRASIM,2026-03-02,Can India’s paint giants protect margins as crude oil prices rise amid Iran tensions? - Moneycontrol.com,-0.8179057836532593
GRASIM,2026-02-24,"F&O Quote - Live FNO BSE/NSE Quote, Nifty Quotes, Indian Stock Market BSE/NSE Price Increase, Chart, Open Interest Analysis & more by Moneycontrol.com - Moneycontrol.com",-0.9385393857955933
GRASIM,2026-02-24,UNIONBANK 30Mar2026 - Moneycontrol.com,-0.9391406178474426
GRASIM,2026-03-02,"F&O Quote - Live FNO BSE/NSE Quote, Nifty Quotes, Indian Stock Market BSE/NSE Price Increase, Chart, Open Interest Analysis & more by Moneycontrol.com - Moneycontrol.com",-0.9385393857955933
GRASIM,2022-07-11,ITC Ltd. - Moneycontrol.com,-0.9482333660125732
GRASIM,2024-05-23,"Grasim Industries Share Price Live Updates: Grasim Industries Sees Minor Decline in Price Today, But 6-Mo - The Economic Times",-0.891084611415863
GRASIM,2025-11-06,India's Grasim falls most in over 3 years as paints chief exit stokes growth worries - Reuters,-0.9151415824890137
GRASIM,2018-01-06,"grasim Forum Discussion on Market View, Business sectors,Stocks, Commodity, Personal Finance & More - Moneycontrol.com",-0.945868194103241
GRASIM,2026-03-02,GRASIM.LU - | Stock Price & Latest News - Reuters,-0.9218444228172302
GRASIM,2022-06-06,(GRAS.NS) | Stock Price & Latest News - Reuters,-0.9111191034317017
GRASIM,2025-11-05,Grasim’s consolidated profit up 76%; paints business CEO resigns - The Economic Times,-0.7204399704933167
GRASIM,2010-01-07,"Grasim shareholders, creditors approve demerger proposal - The Economic Times",-0.9289860129356384
GRASIM,2009-10-04,Grasim spins off cement biz into 100% subsidiary - The Economic Times,-0.9100608825683594
GRASIM,2022-06-16,Grasim appoints Pavan Jain as new Chief Financial Officer - The Economic Times,-0.9166659116744995
GRASIM,2009-10-02,Grasim to sell cement biz to UltraTech - The Economic Times,-0.9250138998031616
GRASIM,2019-03-23,HC gives relief to Grasim industries of Aditya Birla in the dividend tax case - The Economic Times,0.6223887801170349
GRASIM,2024-02-16,Grasim Industries Share Price Live Updates: Grasim Industries Sees Steady Growth with 0.73% Increase and - The Economic Times,0.9392777681350708
GRASIM,2024-03-26,Grasim Industries Stocks Live Updates: Grasim Industries Closes at Rs 2223.55 with 1-Month Return of 1.02 - The Economic Times,-0.4443108141422272
GRASIM,2026-01-16,Grasim names Sachin Sahay as new Birla Opus CEO - The Economic Times,-0.9320898056030273
GRASIM,2025-08-26,Grasim's market capitalisation near Rs 2 lakh crore: Kumar Mangalam Birla - The Economic Times,-0.9081506729125977
GRASIM,2016-01-04,Aditya Birla Chemicals merged with Grasim Industries - The Economic Times,-0.9384933114051819
GRASIM,2019-03-16,"Grasim gets Rs 5,872 cr tax demand on its mega merger - The Economic Times",-0.5082493424415588
GRASIM,2020-08-13,Grasim Industries' VSF business switch focus to exports markets in June quarter - The Economic Times,-0.8722990155220032
GRASIM,2012-07-06,"Aditya Birla Group companies, Grasim Industries and Thai Rayon Public buys canadian pulp maker - The Economic Times",-0.9034806489944458
GRASIM,2016-08-12,AB Nuvo-Grasim merger to create a company worth Rs 60k-cr - The Economic Times,-0.8560099601745605
GRASIM,2018-02-15,"Grasim earmarks Rs 3,500 crore to boost VSF capacity - The Economic Times",0.8609482645988464
GRASIM,2024-02-09,"Breakouts Updates: Grasim Industries Breaks Resistance Level, Trades Above R2 at Rs 2154.95 - The Economic Times",0.5074764490127563
GRASIM,2025-08-11,"Indian shares gain ahead of US-Russia talks; SBI, Tata Motors rise post earnings - Reuters",0.906703531742096
GRASIM,2023-06-18,"Lubrizol to invest $150m in India, partner Grasim - The Economic Times",-0.7759954929351807
GRASIM,2024-01-09,"Grasim Industries Share Price Live Updates: Grasim Industries Sees 0.76% Increase in Price Today, 1-Day R - The Economic Times",0.9265547394752502
GRASIM,2020-03-16,CCI imposes Rs 302 cr penalty on Grasim Industries - The Economic Times,-0.6191525459289551
GRASIM,2026-02-24,"CapitalNumbers Info Yearly results, Financial Summary - The Economic Times",-0.9212249517440796
GRASIM,2015-02-12,Aditya Birla Chemicals to merge with Grasim Industries - The Economic Times,-0.9360188841819763
GRASIM,2023-09-14,"Grasim eyes paint business entry in Q4 to step up market share fight for Berger, others - The Economic Times",-0.6816784739494324
GRASIM,2024-12-17,ET Awards for Corporate Excellence: Grasim Industries wins Economic Times Conscious Corporate Award - The Economic Times,0.8595675826072693
GRASIM,2023-02-06,Grasim inducts promoter Kumar Mangalam Birla's next-generation members into its board - The Economic Times,-0.8677952885627747
GRASIM,2025-09-14,"Oriental Carbon Balance Sheets, Financial Statements - The Economic Times",-0.929688572883606
