ticker,date,headline,sentiment_score
TECHM,2016-05-26,Tech News | Today's Latest Technology News - Reuters,-0.9235796332359314
TECHM,2024-01-12,"Moving Averages Updates: Tech Mahindra Stock Price Breaks Above 20-Day Moving Average, Registers 3.01% Gai - The Economic Times",0.6531661748886108
TECHM,2026-02-25,IT stock crash wipes out Rs 1.2 lakh crore for LIC & mutual funds in bloodbath not seen since 2008 - The Economic Times,-0.9474403262138367
TECHM,2024-04-01,Tech Mahindra Stocks Live Updates: Tech Mahindra Sees 0.6% Increase in Stock Price with Trading Volume of - The Economic Times,0.947017252445221
TECHM,2026-02-24,Nifty IT’s 21% February crash is worst since the 2008 global financial crisis. More pain or perfect time t - The Economic Times,-0.6563698649406433
TECHM,2026-02-27,Narayana Murthy calms fears over AI; says past tech disruptions added more jobs - The Economic Times,0.482910692691803
TECHM,2026-02-24,Ahead of Market: 10 things that will decide stock market action on Wednesday - The Economic Times,-0.9330490231513977
TECHM,2026-02-28,Anthropic hack puts IT stock pack on slide row in February; Nifty IT's 19% fall worst since 2008 crisis - The Economic Times,-0.9569411277770996
TECHM,2026-02-24,Nifty IT Index heads for worst February in 23 years amid AI disruption concerns - Moneycontrol.com,-0.9349903464317322
TECHM,2026-02-25,Anthropic's 'misanthropic' moment for Indian IT! Claude parent valuation tops entire IT pack on Dalal Stre - The Economic Times,-0.6732271909713745
TECHM,2026-02-24,"Explained: How IBM’s 13% plunge on Anthropic’s COBOL disruption fears sparked bloodbath in TCS, Infosys, W - The Economic Times",-0.9217885136604309
TECHM,2026-03-02,"Anthropic CEO calls supply chain risk designation 'retaliatory and punitive’, signals legal challenge - The Economic Times",-0.8549509048461914
TECHM,2026-02-24,"Taking Stock: Amid expiry day sell-off, Nifty slips below 25,450 as IT stocks plunge - Moneycontrol.com",-0.866161584854126
TECHM,2026-03-02,"From OpenAI to Nvidia, firms channel billions into AI infrastructure as demand booms - The Economic Times",-0.8963202238082886
TECHM,2026-02-25,"Sensex up 600 pts, Nifty reclaims 25,600: Positive global cues among key factors behind market rebound - Moneycontrol.com",0.5876692533493042
TECHM,2026-03-02,US Supreme Court declines to hear dispute over copyrights for AI-generated material - The Economic Times,-0.8366474509239197
TECHM,2026-03-02,What to know before asking an AI chatbot for health advice - The Economic Times,-0.9300366640090942
TECHM,2026-02-26,"Infosys, Persistent, other IT stocks rise up to 3% after tech rally following strong Nvidia earnings - The Economic Times",0.9281235337257385
TECHM,2026-02-26,"IT stocks extend rebound for second day; Infosys, TCS, HCL Tech gain 2-4% as sector stabilises after... - Moneycontrol.com",0.8100125193595886
TECHM,2026-02-26,"Sensex falls 500 pts from day's high, Nifty near 25,400: Weak global cues among key factors behind market... - Moneycontrol.com",-0.9532361626625061
TECHM,2026-03-02,"US uses Anthropic AI, B-2 bombers and suicide drones in Iran strikes - The Economic Times",-0.9148334264755249
TECHM,2026-03-02,"Indian shares tumble as Middle East war dents investor confidence, raises economic risks - Reuters",-0.9305343627929688
TECHM,2026-03-02,Musk’s xAI to buy back $3 billion of debt early in run-up to IPO - The Economic Times,-0.8457086682319641
TECHM,2026-03-02,"Tata Steel to invest Rs 11,000 cr in Jharkhand; aims to ramp-up advanced grade steel production - The Economic Times",0.809890627861023
TECHM,2026-02-24,"AI structurally changing IT biz mix, Jefferies warns of managed services shrinkage ahead - The Economic Times",-0.9508455991744995
TECHM,2026-02-27,"Infosys, TCS, other IT stocks rise up to 3% as Wall Street's AI rally loses steam - The Economic Times",-0.4832136332988739
TECHM,2026-02-24,"Infosys, TCS & other IT stocks slump up to 8%; buy the dip or brace for more AI-led selloff? - The Economic Times",-0.9549011588096619
TECHM,2026-02-26,‘Death of Software?’ Anand Mahindra calls AI doom ‘Greatly Exaggerated’ amid IT stock crash - The Economic Times,-0.5530852675437927
TECHM,2026-02-26,Frightful February for IT stocks: How Anthropic’s 6 AI tools sparked a multi-billion dollar meltdown in 4 - The Economic Times,-0.49967262148857117
TECHM,2026-02-27,"Sensex plunges over 500 pts; Nifty below 25,350 as FMCG, bank stocks drag - The Economic Times",-0.9280905723571777
TECHM,2026-02-25,"TCS can offer Rs 35 dividend, share buyback soon, says CLSA after Rs 3,593 target price - The Economic Times",-0.922494113445282
TECHM,2026-02-24,"IT fall impact: LIC's investment in IT stocks declines by Rs 42,500 crore in two months - Moneycontrol.com",-0.9699440598487854
TECHM,2026-02-24,"F&O Quote - Live FNO BSE/NSE Quote, Nifty Quotes, Indian Stock Market BSE/NSE Price Increase, Chart, Open Interest Analysis & more by Moneycontrol.com - Moneycontrol.com",-0.9385393857955933
TECHM,2026-02-24,ET AI Conclave and Awards is set to redefine India’s AI leadership moment - The Economic Times,-0.7511479258537292
TECHM,2026-02-26,"Markets settle flat after early gains amid mixed global cues; pharma, auto stocks rise - Moneycontrol.com",-0.605030357837677
TECHM,2026-03-02,Iran-Israel war: QatarEnergy halts LNG production after drone strikes on key facilities - The Economic Times,-0.9345111846923828
TECHM,2026-03-02,Debaroti Adhikary - The Economic Times,-0.9083478450775146
TECHM,2026-03-02,India’s current account deficit widens to $13.2 billion in Q3 FY26 - The Economic Times,0.5193598866462708
TECHM,2026-03-02,Asian countries most at risk from oil & gas supply disruptions in Strait of Hormuz: Research group - The Economic Times,-0.5074496269226074
TECHM,2026-03-02,Why this small Indian village is India’s role model and Anand Mahindra’s Monday Motivation - The Economic Times,-0.8882201910018921
TECHM,2026-03-02,Iran-Israel war: India in touch with Oman as search continues for missing crew members - The Economic Times,-0.8822538256645203
TECHM,2026-03-02,"'Be careful in India,’ they warned her. But one stranger's kindness moved her to tears. Watch video here - The Economic Times",-0.9010125398635864
TECHM,2026-03-02,Oil prices surge as Strait of Hormuz tanker disruptions rattle global supply - The Economic Times,-0.926211416721344
TECHM,2026-03-02,"Indian govt assures fuel availability, affordability amid Iran-Israel tensions - The Economic Times",0.8969331979751587
TECHM,2026-02-24,Final 48 Hours: ET AI Conclave and Awards is the most important Indian AI leadership summit this year - The Economic Times,-0.9165993332862854
TECHM,2026-03-01,Indian equities see light at the end of the tunnel - Reuters,-0.7078390717506409
TECHM,2026-03-02,"Market dips are buying opportunities, focus on emerging trends: Ramesh Damani - The Economic Times",-0.8658415675163269
TECHM,2026-02-25,"Rs 3 lakh crore added! 5 key factors behind 700-point Sensex surge, Nifty above 25,600 - The Economic Times",-0.8067842125892639
TECHM,2026-03-03,"GLP-1 boom, infra buying opportunity, and why gold is for traders: Ramesh Damani’s big market calls - The Economic Times",-0.8819796442985535
TECHM,2026-02-27,"Infosys ADRs tumble 5%, Wipro slips over 3% as Wall Street rattled by inflation data and AI fears - The Economic Times",-0.955655038356781
